KEY,Portuguese
CONVERSATION_6222,Ainda não definimos. Nos disseram que descobriríamos o nosso destino durante o caminho...
CONVERSATION_6223,Então que tal irem à Montanha de Ogria?
CONVERSATION_6224,Ogria... Está se referindo ao território dos orcs?
CONVERSATION_6224_1,"Perdemos contato há muito tempo mas, os orcs são seres valentes que ajudaram o Rei Kyle contra os demônios."
CONVERSATION_6224_2,"Após a queda de Angmund, o Grande Chefe dos orcs, Aeatola, separou o poder da Espada Sagrada comigo. "
CONVERSATION_6224_3,Dizem que a guarda desse poder tem passado de geração a geração aos líderes da tribo dos orcs.
CONVERSATION_6224_4,Hum... O que vocês acham?
CONVERSATION_6224_5,Não sabemos muito sobre a Espada Sagrada. Não seria uma má ideia ir até lá. 
CONVERSATION_6224_6,"Eu concordo. Se o poder da Espada Sagrada estiver lá, não há motivo para não ir."
CONVERSATION_6224_7,"E se o poder da Espada Sagrada realmente estiver lá, com certeza aquela bruxa vai aparecer."
CONVERSATION_6224_8,Também acho bom irmos até lá.
CONVERSATION_6224_9,"Acreditar numa possibilidade, mesmo que pequena, também é uma solução."
CONVERSATION_6224_10,E pelo bem de Kasel... precisamos recuperar o poder da Espada Sagrada o quanto antes.
CONVERSATION_6224_11,Então estamos todos de acordo.
CONVERSATION_6224_12,Está bem. Então vamos para Ogria.
CONVERSATION_6224_13,Que decisão rápida.
CONVERSATION_6224_14,Mas vocês passaram por tantas adversidades até agora. Que tal descansarem uma noite aqui? 
CONVERSATION_6224_15,"(Pois é... Apesar de não parecer, todos devem estar bastante cansados.)"
CONVERSATION_6224_16,"Está bem, princesa. Recebemos com gratidão tamanha gentileza."
CONVERSATION_6224_17,"Então devo me apressar nos preparativos. Esta noite, gostaria de oferecer um banquete especial a vocês."
CONVERSATION_6224_18,Que a bênção de Elidora esteja convosco.
CS_CH3_Main_1_001,"Finalmente, um orc."
CS_CH3_Main_1_002,"Sou Kasel, dos humanos de Orvelia."
CS_CH3_Main_1_003,"Desejo pedir uma audiência com o governante de Ogria, o Grande Chefe dos Orcs."
CS_CH3_Main_1_004,"Humanos maus, cruéis, querendo se encontrar com Grande Chefe?!"
CS_CH3_Main_1_005,"Hm, esse comitê de boas-vindas está um pouco..."
CS_CH3_Main_1_006,Eles parecem bem hostis...
CS_CH3_Main_1_007,"Em nome do Grande Chefe, punam esses humanos vis!!"
CS_CH3_Main_1_008,"Cuidado, eles estão vindo!"
CS_CH3_Main_2_001,"Desde a invasão dos demônios, tenho certeza de que os orcs e os humanos não eram inimigos..."
CS_CH3_Main_2_002,Eles até mesmo nos chamaram de cruéis e vis. Fizemos algo errado?
CS_CH3_Main_2_003,"Bem, os Orvelianos não são os únicos humanos no mundo."
CS_CH3_Main_2_004,Há também organizações como os Máscaras Sorridentes aqui e ali.
CS_CH3_Main_2_005,"Se eu me lembro corretamente, há também um império humano bem longe daqui."
CS_CH3_Main_2_006,Que tipo de humanos deixaram os orcs tão irritados?
CS_CH3_Main_2_007,Eu espero podermos resolver logo esse mal-entendido.
CS_CH3_Main_3_001,"Espere, aquilo é.."
CS_CH3_Main_3_002,De novo não...
CS_CH3_Main_3_003,É um golem!
CS_CH3_Main_3_004,Suspiro... agora vem o trauma...
CS_CH3_Main_3_005,A Cleo gosta de golems tanto como gosta de visgos?
CS_CH3_Main_3_006,Eu presumo que Roi tinha de limpar tudo quando Cleo tentava fazer um golem...
CS_CH3_Main_3_007,Limpar o quê?!
CS_CH3_Main_3_008,"Oh, não comece de novo esse fiasco..."
CS_CH3_Main_3_009,Você se lembra? Você reuniu alguns pedregulhos dizendo que ia construir um Golem de estimação.
CS_CH3_Main_3_010,"Então você lançou a mágica errada, fazendo com que pedras em chamas voassem por todo o lugar."
CS_CH3_Main_3_011,"Eu estou dizendo a você, Roi, se você continuar perdendo o sono por coisas insignificantes, nunca terá uma namorada."
CS_CH3_Main_3_012,"Então, no fim, ele não conseguiu fazer o golem?"
CS_CH3_Main_3_013,"Você também, Kasel! Você nunca será popular se não medir as suas palavras!"
CS_CH3_Main_3_014,"De qualquer forma, agora farei com que aquele golem seja meu, custe o que custar!"
CS_CH3_Main_3_015,"Agora, traga-me aquele fofinho, Roi."
CS_CH3_Main_3_016,Recuso-me.
CS_CH3_Main_3_017,A nossa prioridade é derrotar aquele golem e achar um orc razoável o mais rápido possível.
CS_CH3_Main_3_018,"Roi, seu grande idiota! Humpf!"
CS_CH3_Main_4_001,"Roi, seu burro, por que você fez aquele golem virar pó?"
CS_CH3_Main_4_002,"Golems não são fáceis de cortar, realmente."
CS_CH3_Main_4_003,"Cleo, você ouviu falar de Golems perambulando por Ogria anteriormente?"
CS_CH3_Main_4_004,"Eh? Na verdade, pensando a respeito, eu nunca ouvi falar de algum orc controlando golems antes."
CS_CH3_Main_4_005,Considerando que orcs e humanos não interagiram nos últimos séculos...
CS_CH3_Main_4_006,"Talvez, nesse meio tempo, eles aprenderam a lidar com golems?"
CS_CH3_Main_4_007,"Humpf, não tem como um orc burro ter capacidade de fazer um golem. Até mesmo uma arquimaga como eu não conseguiu fazer um!"
CS_CH3_Main_4_008,Bem uma arquimaga como você não conseguiu fazer nem um único visgo...
CS_CH3_Main_4_009,Roi!!!
CS_CH3_Main_4_010,Hahahaha...
CS_CH3_Main_4_011,Pare de rir!!
CS_CH3_Main_5_001,Hum? Goblins em Ogria?
CS_CH3_Main_5_002,"Golems e, agora, goblins também..."
CS_CH3_Main_5_003,Parece que nossas informações sobre Ogria não estavam completas.
CS_CH3_Main_5_004,Ach! Humanos! Fujam!
CS_CH3_Main_5_005,"Ach! Correr de humanos, orcs matar nós!"
CS_CH3_Main_5_006,Orcs fortes! Humanos fracos!
CS_CH3_Main_5_007,Kek! Que fazer??
CS_CH3_Main_5_008,"Que fazer?! Lutar humanos, ach!"
CS_CH3_Main_5_009,Quêêê! Seus idiotas... vou ensinar a vocês quão poderosa pode ser uma arquimaga!!
CS_CH3_Main_5_010,Esse não é o ponto...
CS_CH3_Main_6_001,"Cleo, isso passou um pouco dos limites."
CS_CH3_Main_6_002,"Pelo que parece, eles nos atacaram apenas porque os orcs os ameaçaram..."
CS_CH3_Main_6_003,"Humpf, pare de defender os goblins."
CS_CH3_Main_6_004,Fique do meu lado só uma vez...
CS_CH3_Main_6_005,Suspiro... eu não posso lidar com isso.
CS_CH3_Main_6_006,"Eles nos atacaram primeiro, Frey, não pudemos fazer nada se quiséssemos."
CS_CH3_Main_6_007,Eu não estava tentando exatamente defender os goblins...
CS_CH3_Main_6_008,"Desculpe-me por falar assim, Cleo."
CS_CH3_Main_6_009,"Não faça isso de novo, está certo...?"
CS_CH3_Main_6_010,Sim. Vou ficar do seu lado de agora em diante.
CS_CH3_Main_6_011,"Ainda, eu acho que nós devemos achar o motivo de os goblins terem nos atacado."
CS_CH3_Main_6_012,Concordo.
CS_CH3_Main_6_013,"Em primeiro lugar, estou confuso sobre o motivo de os goblins estarem em Ogria..."
CS_CH3_Main_6_014,sem falar por que os orcs estão fazendo com que eles nos ataquem.
CS_CH3_Main_6_015,Devemos fazer essas perguntas aos próximos goblins que encontrarmos?
CS_CH3_Main_6_016,Sim... eu acho que devemos capturar alguns de novo.
CS_CH3_Main_7_001,"Olha, amiguinhos goblins!"
CS_CH3_Main_7_002,Ach! Humano!
CS_CH3_Main_7_003,"Não tenham medo, não queremos lutar contra vocês."
CS_CH3_Main_7_004,"Ach, Ordem Lua... salve-nos!"
CS_CH3_Main_7_005,"Truques! Orc dizer não acreditar humanos, ach!"
CS_CH3_Main_7_006,Crool...ebil? Ruim qualquer jeito!
CS_CH3_Main_7_007,"Só 'Ele' salvar Goblins, ach!"
CS_CH3_Main_7_008,"Hmm... parando para pensar, não sabemos ainda quem é esse 'Ele', que Himmulus e Balalaika mencionaram."
CS_CH3_Main_7_009,Eu imagino se é a mesma pessoa...
CS_CH3_Main_7_010,"Bem, eu acho que primeiro precisamos bater um pouco nesses idiotas."
CS_CH3_Main_7_011,"Certo, Frey?"
CS_CH3_Main_7_012,*Suspiro*... eu acho que sim.
CS_CH3_Main_8_001,Ach! Ajuda!
CS_CH3_Main_8_002,"Acalmem-se, não queremos machucar vocês."
CS_CH3_Main_8_003,"Vocês nos atacaram primeiro, e nós só revidamos."
CS_CH3_Main_8_004,Ach! Orc nos enganar!
CS_CH3_Main_8_005,"Humanos legais, Ordem Lua!"
CS_CH3_Main_8_006,Obrigado.
CS_CH3_Main_8_007,"Se puderem, poderiam nos dizer por que nos atacaram?"
CS_CH3_Main_8_008,"Nós, goblins, exilados das Planícies dos Reis, ach."
CS_CH3_Main_8_009,"Trabalhar para Orcs, ter comida."
CS_CH3_Main_8_010,"Agora Orcs dizer matar humanos, ou eles matarem goblins!"
CS_CH3_Main_8_011,Por que os orcs mandaram vocês matarem os humanos?
CS_CH3_Main_8_012,Ach! Não saber!
CS_CH3_Main_8_013,Por que vocês foram exilados das Planícies dos Reis?
CS_CH3_Main_8_014,Erk... Bodakka... Bodakka exilar a gente!
CS_CH3_Main_8_015,Ach! Ele dizer não precisar de goblin fraco!
CS_CH3_Main_8_016,"Goblins fracos? Com este tipo de armamento, Bodakka parece insignificante, se comparado a isso."
CS_CH3_Main_8_017,"Armas, 'Ele' nos dar!"
CS_CH3_Main_8_018,Ele' libertar Goblins de Orc!
CS_CH3_Main_8_019,Quem é 'Ele'?
CS_CH3_Main_8_020,"Desculpe, ach... não poder dizer. Nós segredo... eh..."
CS_CH3_Main_8_021,Residência?
CS_CH3_Main_8_022,Resistência?
CS_CH3_Main_8_023,"Sim, Resistência! De qualquer forma, é segredo. Não posso dizer."
CS_CH3_Main_8_024,"Bem, acho que é isso. Vamos tentar descobrir o resto de outra forma."
CS_CH3_Main_8_025,Obrigado por nos contar o que sabe.
CS_CH3_Main_8_026,Ach... outros goblins ainda atacar vocês.
CS_CH3_Main_8_027,Perdão! Vá com calma...
CS_CH3_Main_9_001,Em frente!
CS_CH3_Main_9_002,"Yay, vamos!!!"
CS_CH3_Main_9_003,Vamos!!!
CS_CH3_Main_9_004,Controlar o Golem! 'Ele' gênio!!
CS_CH3_Main_9_005,.......
CS_CH3_Main_9_006,Cleo. Cleo?
CS_CH3_Main_9_007,"Bem, bem, parece que ela está chocada em ver goblins controlando golems."
CS_CH3_Main_9_008,Eles conseguiram o que ela não conseguiu.
CS_CH3_Main_9_009,Roiiiiiiii!!!!!
CS_CH3_Main_9_010,Ach! Humano!
CS_CH3_Main_9_011,Achi! Espionar nós! Orcs fazer humanos espionar nós!
CS_CH3_Main_9_012,Não somos espiões...
CS_CH3_Main_9_013,Não que eles vão entender isso antes de nós batermos neles.
CS_CH3_Main_9_014,"Podem vir, seus goblins idiotas!"
CS_CH3_Main_9_015,Vou fazê-los pagar por ter me humilhado.
CS_CH3_Main_10_001,"Fufufu, fácil demais!!"
CS_CH3_Main_10_002,"Cleo, você está com a respiração pesada."
CS_CH3_Main_10_003,"Humpf, não estou nada cansada."
CS_CH3_Main_10_004,"Ela está mesmo louca. Afinal, aqueles 'goblins idiotas' ganharam dela ao controlar um golem."
CS_CH3_Main_10_005,"Não é verdade, Roi burro!!!"
CS_CH3_Main_11_001,Kyak!! Parar! Humano eu amigo!
CS_CH3_Main_11_002,Lakrak?
CS_CH3_Main_11_003,"Espere, é você...?!"
CS_CH3_Main_11_004,...
CS_CH3_Main_11_005,Bruxa velha! Eu estava esperando você!
CS_CH3_Main_11_006,Eu quero perguntar uma coisa sobre o velho amigo que você mencionou antes...
CS_CH3_Main_11_007,"Fufu, você é uma moça teimosa."
CS_CH3_Main_11_008,"Se você me ajudar, direi tudo o que quer ouvir."
CS_CH3_Main_11_009,Quê?! Você está me dizendo que ajude os demônios?!
CS_CH3_Main_11_010,"Fufu, não entre em pânico. Não estou pedindo muito."
CS_CH3_Main_11_011,Lakrak. Parece que você no mesmo lado que o dela.
CS_CH3_Main_11_012,Você se aliou aos Demônios?
CS_CH3_Main_11_013,Ack? Esta mulher demônio?
CS_CH3_Main_11_014,Então... você vai mesmo desistir agora? Goblin Branco.
CS_CH3_Main_11_015,....
CS_CH3_Main_11_016,"Demônio ou não, não importar!! Ach!"
CS_CH3_Main_11_017,Ela ajuda a fazer arma forte!!
CS_CH3_Main_11_018,"Ahh.. Lua, minha Deusa..."
CS_CH3_Main_11_019,Imploro que salve das garras da escuridão a alma desse pobre goblin...
CS_CH3_Main_11_020,Sua sacerdotisa boba. Lua não salvará ninguém.
CS_CH3_Main_11_021,"Reze o quanto quiser, mas ela nunca responderá."
CS_CH3_Main_11_022,Essa deusa maldita...
CS_CH3_Main_11_023,Quê? Como se atreve...
CS_CH3_Main_11_024,"Não, a espada sagrada é prova suficiente."
CS_CH3_Main_11_025,"É um presente da deusa, que porta seu desejo de impedir que os demônios destruam o mundo, como você fez há muito tempo."
CS_CH3_Main_11_026,Fufufu...
CS_CH3_Main_11_027,Hahahahahaha!
CS_CH3_Main_11_028,Um presente? Essa coisa?
CS_CH3_Main_11_029,"Acredite no que quiser. Sinceramente... sim, de todo o coração."
CS_CH3_Main_11_030,"Somente então você entrará em desespero, amaldiçoando Lua e a espada sagrada."
CS_CH3_Main_11_031,"Eu quero mesmo testemunhar a sua carinha bonita se retorcer em horror e desespero, manchada de lágrimas."
CS_CH3_Main_11_032,Quê?! De que você está falando?
CS_CH3_Main_11_033,Fufufu...
CS_CH3_Main_11_034,Vamos nos encontrar de novo. Criança de Arlette.
CS_CH3_Main_11_035,Espere! Bruxa!
CS_CH3_Main_11_036,Arlette... ela me chamou de criança de Arlette.
CS_CH3_Main_11_037,"Roi, esse é...! Minha mãe se chama Arlette..!"
CS_CH3_Main_12_001,Hah... Lakrak.
CS_CH3_Main_12_002,"Depois de você aparecer com aquela bruxa, Maria, tudo ficou uma bagunça."
CS_CH3_Main_12_003,Você escolheu se aliar aos Demônios?
CS_CH3_Main_12_004,"Aliado de Demônios? Ach, não!"
CS_CH3_Main_12_005,Eu não conhecer mulher Demônio!
CS_CH3_Main_12_006,"Na verdade, eu não acho que ela seja um demônio..."
CS_CH3_Main_12_007,Eu sei que ela é humana. Mas ela está no lado dos Demônios?
CS_CH3_Main_12_008,Isso não é da sua conta.
CS_CH3_Main_12_009,O que importa é que aquela bruxa é perigosa para nós.
CS_CH3_Main_12_010,"E, Lakrak, precisamos saber por que você estava aqui com ela."
CS_CH3_Main_12_011,"Ach! Eu viajar, fazer arma poderosa!"
CS_CH3_Main_12_012,Eu encontrar ela aqui!
CS_CH3_Main_12_013,"Ela dizer me ajudar fazer arma poderosa, ach!"
CS_CH3_Main_12_014,"Só ciência, arma impossível! Arma Mágica!"
CS_CH3_Main_12_015,"Ela ajudar, quem controla golem fazer!"
CS_CH3_Main_12_016,Eu sabia!
CS_CH3_Main_12_017,Eu sabia que um goblin não poderia criar um golem por conta própria.
CS_CH3_Main_12_018,"Você parece aliviada, Cleo."
CS_CH3_Main_12_019,É claro! Apesar de ter me surpreendido um pouco no início.
CS_CH3_Main_12_020,A mulher disse o nome da minha mãe em voz alta e desapareceu.
CS_CH3_Main_12_021,Por que motivo ela...?
CS_CH3_Main_12_022,"Ach, arma poderosa livre, não!"
CS_CH3_Main_12_023,"Goblin salvar de orc, recompensa!"
CS_CH3_Main_12_024,*Suspiro*... então o 'Ele' sobre o qual os goblins estavam gritando era...
CS_CH3_Main_12_025,Eu nunca esperava que fosse Lakrak.
CS_CH3_Main_12_026,"Então, chato, ach! Comandar multidão goblins idiotas, bah!"
CS_CH3_Main_12_027,Mas por que Maria está ajudando os goblins?
CS_CH3_Main_12_028,Kyak! Não saber! Não ser importante!
CS_CH3_Main_12_029,Eu me concentrar arma poderosa!
CS_CH3_Main_12_030,Ela disse que nos encontraríamos de novo... então pergunte a ela.
CS_CH3_Main_12_031,Essa não é a única pergunta que devo fazer a ela.
CS_CH3_Main_12_032,Ela deve saber algo sobre a minha mãe também...
CS_CH3_Main_12_033,Também... que ela quis dizer sobre eu amaldiçoar Lua...
CS_CH3_Main_12_034,...
CS_CH3_Main_13_001,Lakrak virá conosco?
CS_CH3_Main_13_002,"Testar Canhão de Mão Personalizado Lakrak MK-3, alvo orc! Sim!"
CS_CH3_Main_13_003,Você não pode testar as coisas sozinho?
CS_CH3_Main_13_004,Ugh... isso...
CS_CH3_Main_13_005,Situação de testes com aliados!
CS_CH3_Main_13_006,"Ach, testar eficiência quando lutar juntos!!"
CS_CH3_Main_13_007,"Sim, sim, que seja."
CS_CH3_Main_14_001,"Há um mal-entendido, Throne. Escute-me..."
CS_CH3_Main_14_002,Eu tenho escutado você palavra por palavra.
CS_CH3_Main_14_003,Isso é um disparate e uma besteira.
CS_CH3_Main_14_004,Não é verdade.
CS_CH3_Main_14_005,Parece que os orcs têm alguns problemas próprios.
CS_CH3_Main_14_006,Oh... você deve ser...
CS_CH3_Main_14_007,O sucessor da espada sagrada!
CS_CH3_Main_14_008,"Espere, como você..."
CS_CH3_Main_14_009,"Olhe, Throne. Aqui está o sucessor da espada sagrada, que eu mencionei antes."
CS_CH3_Main_14_010,"Uma espada sagrada? Pss... agora qual é a utilidade dela, afinal?"
CS_CH3_Main_14_011,Throne. O aparecimento da espada sagrada significa que o mundo está em perigo.
CS_CH3_Main_14_012,Os orcs já estão em crise.
CS_CH3_Main_14_013,Por causa daqueles humanos!
CS_CH3_Main_14_014,Não fazemos ideia do que você está falando...
CS_CH3_Main_14_015,"Saia, Kaulah! Ou vou cortar você em pedacinhos se não sair."
CS_CH3_Main_14_016,...
CS_CH3_Main_14_017,"Ah... perdoe-me, Throne."
CS_CH3_Main_15_001,Kaulah!!!
CS_CH3_Main_15_002,Seu... seu traidor...
CS_CH3_Main_15_003,Como você pode estar no lado deles... esses traiçoeiros...
CS_CH3_Main_15_004,"Lamento profundamente, Throne."
CS_CH3_Main_15_005,Seu... nossos irmão não deixarão isso assim.
CS_CH3_Main_15_006,Eles vão ir atrás de você... até o fim do mundo... Kaulah...
CS_CH3_Main_15_007,Você irá pagar pela... sua traição...
CS_CH3_Main_15_008,...
CS_CH3_Main_15_009,Trono... Trono!!
CS_CH3_Main_15_010,"Lamento. Eu não poderia escolher diferente, perdoe-me..."
CS_CH3_Main_15_011,Que Lua o abençoe.
CS_CH3_Main_15_012,"Lamento que você teve de passar por tudo isso por causa de mim... e, acima de tudo, por você ter sido marcado como um traidor."
CS_CH3_Main_15_013,Como você sabia que Kasel era o sucessor da espada sagrada?
CS_CH3_Main_15_014,Ele se chama Kasel?
CS_CH3_Main_15_015,Eu tive um sonho profético dele empunhando a espada sagrada.
CS_CH3_Main_15_016,Um sonho profético?!
CS_CH3_Main_15_017,Eu já ouvi falar disso antes.
CS_CH3_Main_15_018,Alguns dos grandes orcs xamãs podem ver o futuro por meio de sonhos proféticos.
CS_CH3_Main_15_019,Você disse que os orcs estavam em perigo por causa dos humanos. Que diabos está acontecendo?
CS_CH3_Main_15_020,"Recentemente, alguns dos meus irmãos desapareceram..."
CS_CH3_Main_15_021,e havia um rumor...
CS_CH3_Main_15_022,de que os humanos estavam nos escravizando.
CS_CH3_Main_15_023,Inacreditável!
CS_CH3_Main_15_024,Humanos escravizando orcs?! Isso é uma grande bobagem!
CS_CH3_Main_15_025,Nunca ouvimos nem vimos isso!!
CS_CH3_Main_15_026,Eu sei. Acredito em você.
CS_CH3_Main_15_027,Mas os outros orcs acreditam que é verdade.
CS_CH3_Main_15_028,O Grande Chefe Sieg está excepcionalmente bravo e tem ódio de humanos.
CS_CH3_Main_15_029,Sieg? Ele é o Grande Chefe agora?
CS_CH3_Main_15_030,E Garuk?
CS_CH3_Main_15_031,Garuk confiava nos humanos.
CS_CH3_Main_15_032,Então Sieg o desafiou para um duelo e o matou para se tornar o próximo Grande Chefe.
CS_CH3_Main_15_033,Isso não é... traição?
CS_CH3_Main_15_034,Algumas vezes os orcs escolhem seus líderes dessa forma.
CS_CH3_Main_15_035,Isso é bem bárbaro.
CS_CH3_Main_15_036,"Era, na verdade, uma tradição em desuso."
CS_CH3_Main_15_037,"Contudo, conforme o ódio contra os humanos cresceu,"
CS_CH3_Main_15_038,"Sieg tem o apoio de muitos da minha espécie, que acreditavam que deveríamos reagir contra os humanos."
CS_CH3_Main_15_039,Então ele usou o duelo como um modo de demostrar que iria reviver as antigas tradições.
CS_CH3_Main_15_040,"Qual é a possibilidade de humanos estarem, de fato, escravizando orcs?"
CS_CH3_Main_15_041,"Possivelmente, talvez, aquele império."
CS_CH3_Main_15_042,O Império de Vespian?
CS_CH3_Main_15_043,"Não, não faria qualquer sentido."
CS_CH3_Main_15_044,Eles não têm razão para vir tão longe por causa de meros escravos. O seu território longe demais.
CS_CH3_Main_15_045,Hmm... entendo.
CS_CH3_Main_15_046,Devemos ir encontrar o Grande Chefe para resolver esse mal-entendido.
CS_CH3_Main_15_047,"Primeiro, devemos encontrar o meu aprendiz, Dain. Ele será capaz de nos ajudar."
CS_CH3_Main_16_001,Você sabe sobre o poder dividido da espada sagrada?
CS_CH3_Main_16_002,"Sim. Nosso lendário Grande Chefe, Aeatola,"
CS_CH3_Main_16_003,o herói orc que ajudou Kyle naquela vez pôs o poder num talismã.
CS_CH3_Main_16_004,"Desde então, o talismã passou de geração a geração de Grandes Chefes."
CS_CH3_Main_16_005,Então agora deve estar com Sieg.
CS_CH3_Main_16_006,Correto.
CS_CH3_Main_16_007,*Suspiro*... que problema.
CS_CH3_Main_17_001,Poderemos encontrar Dain ao norte daqui.
CS_CH3_Main_17_002,Espero que nenhum mal caia sobre ele por minha causa...
CS_CH3_Main_17_003,"Deusa Lua, imploro que proteja Dain, o aprendiz de Kaulah."
CS_CH3_Main_17_004,Devemos nos apressar antes que algo ruim aconteça.
CS_CH3_Main_18_001,Mestre! Você está bem?
CS_CH3_Main_18_002,"Oh, Dain. Graças aos céus. Estava preocupado com você."
CS_CH3_Main_18_003,E eu ainda me preocupo com você até hoje.
CS_CH3_Main_18_004,Por que você está com humanos nesses tempos perigosos.
CS_CH3_Main_18_005,Lamento... Kaulah foi marcado como um traidor por nossa causa.
CS_CH3_Main_18_006,"Eu tenho um assunto privado para discutir com o meu mestre. Vocês, convidados, poderiam esperar aqui um pouco?"
CS_CH3_Main_18_007,É claro que sim.
CS_CH3_Main_18_008,O que houve?
CS_CH3_Main_18_009,Uma armadilha?!
CS_CH3_Main_18_010,"Que está acontecendo, Dain?!"
CS_CH3_Main_18_011,"Devo me livrar desses humanos, mestre. Desculpe-me."
CS_CH3_Main_18_012,É o único jeito de manter você vivo.
CS_CH3_Main_18_013,Seu cego tolo... a escuridão está tentando engolir todas as partes deste mundo.
CS_CH3_Main_18_014,A segurança dos orcs não é a única coisa em jogo!!
CS_CH3_Main_18_015,Nós vamos cair!!
CS_CH3_Main_18_016,Kasel: Frey!!
CS_CH3_Main_18_017,Frey: Kyaaaaaa!
CS_CH3_Main_18_018,"Kasel: Não, Lua, por favor..."
CS_CH3_Main_18_019,"Kasel: Proteja Frey... Ppor favor!!\nSe alguém tiver de morrer, imploro que seja eu... e não Frey!!"
CS_CH3_Main_18_020,Cleo: Frey!!!
CS_CH3_Main_18_021,Roi: Guh...
CS_CH3_Main_18_022,Cleo: Não... irei desistir!!!
CS_CH3_Main_18_023,"Roi: dê-me a sua mão, Kasel!!!"
CS_CH3_Main_18_024,"Roi: Peguei você!! Para cima, agora, Cleo!"
CS_CH3_Main_18_025,"Cleo: Certo, deixe-me mostrar o que é velocidade!!!"
CS_CH3_Main_18_026,Cleo: Meu cajado é o cajado que atravessa os céus!!!
CS_CH3_Main_18_027,"Roi: Ugh... nós os salvamos, agora você pode ir mais devagar..."
CS_CH3_Main_19_001,Quais são os planos?
CS_CH3_Main_19_002,Foram ordens do Grande Chefe Sieg. Ele disse que mataria você se não nos livrássemos dos humanos.
CS_CH3_Main_19_003,Absurdo... você está tentado condenar o mundo à escuridão por minha causa?!
CS_CH3_Main_19_004,É por isso que... nós viemos salvar o mundo da escuridão!
CS_CH3_Main_19_005,Oh... você está vivo.
CS_CH3_Main_19_006,Grk... você não deveria estar vivo!!!
CS_CH3_Main_19_007,Morra!!!
CS_CH3_Main_19_008,"Pare!! Pare, Dain!!"
CS_CH3_Main_19_009,Lamento- Kaulah. Temos de nos defender...
CS_CH3_Main_20_001,Kugh... eles são fortes...
CS_CH3_Main_20_002,"Paremos agora, Dain. Essas pessoas podem fazer Sieg voltar à razão."
CS_CH3_Main_20_003,Isso... parecer ser possível...
CS_CH3_Main_20_004,Por que você fez isso?!
CS_CH3_Main_20_005,"Humpf, Orcs são tão ingênuos."
CS_CH3_Main_20_006,"Bem, essa é a causa de toda esta bagunça, de qualquer modo."
CS_CH3_Main_20_007,Maria!! Por quê...
CS_CH3_Main_20_008,"Não só os orcs, mas todos vocês também são tão ingênuos."
CS_CH3_Main_20_009,Vocês realmente acreditam que são capazes de persuadi-lo?
CS_CH3_Main_20_010,Deveríamos ao menos tentar!
CS_CH3_Main_20_011,Então vocês morrerão tentando.
CS_CH3_Main_20_012,"Não posso deixar que morram, ao menos ainda não."
CS_CH3_Main_20_013,E por que isso?
CS_CH3_Main_20_014,"Hmm, você não se lembra?"
CS_CH3_Main_20_015,Eu disse que veria você numa situação particular.
CS_CH3_Main_20_016,E o que diz sobre nós amaldiçoarmos Lua?
CS_CH3_Main_20_017,"Sim, eu queria perguntar o que realmente quis dizer com aquilo,"
CS_CH3_Main_20_018,"Fufufu, você terá de descobrir por conta própria."
CS_CH3_Main_20_019,Há tantas histórias para contar a você.
CS_CH3_Main_20_020,"Certo, conte-me sobre minha mãe, Arlette..."
CS_CH3_Main_20_021,"Fufufu, Arlette... eu nunca disse que Arlette era sua mãe..."
CS_CH3_Main_20_022,Quê?
CS_CH3_Main_20_023,"Pensando melhor, nós quatro não sabemos quem são nossos pais."
CS_CH3_Main_20_024,"Você conhece algum dos nossos pais, exceto o de Cleo?"
CS_CH3_Main_20_025,"Fufu, sem pressa. Relaxem."
CS_CH3_Main_20_026,Hoje eu vim contar a vocês uma outra história.
CS_CH3_Main_20_027,Uma história sobre quem iniciou o ódio dos Orcs pelos humanos.
CS_CH3_Main_20_028,Eu imagino se vocês o conhecem... um certo Malduk.
CS_CH3_Main_20_029,Malduk..!!
CS_CH3_Main_20_030,O Estrategista de Angmund...? Esse Malduk?
CS_CH3_Main_20_031,Sim. Ele tem transformado orcs em mortos-vivos faz algum tempo.
CS_CH3_Main_20_032,"Então, ele mentiu aos Orcs, inclusive a Sieg, que os humanos eram os culpados pelos orcs desaparecidos."
CS_CH3_Main_20_033,Que loucura...
CS_CH3_Main_20_034,Por que você está nos dizendo tudo isso?
CS_CH3_Main_20_035,Você não é aliada dos Demônios?
CS_CH3_Main_20_036,"Eu não gostava aquele idiota de ossos, pra começo de conversa."
CS_CH3_Main_20_037,"Então... o motivo pelo qual você estava tentando fazer que Goblins confrontassem Orcs, junto com Lakrak..."
CS_CH3_Main_20_038,"Sim, Malduk se aproveitou dos Orcs."
CS_CH3_Main_20_039,"E eu me aproveitei dos Goblins, considerando que eles têm uma rixa com os orcs."
CS_CH3_Main_20_040,"Afora Malduk, você é realmente maligna."
CS_CH3_Main_20_041,"Os dois lados sustentarão perdas terríveis quando se chocarem,"
CS_CH3_Main_20_042,e o ódio entre eles só irá aumentar!
CS_CH3_Main_20_043,"E? Como parte do exército Demoníaco, eu considero uma vitória se vocês, idiotas, brigarem."
CS_CH3_Main_20_044,Quê?!
CS_CH3_Main_20_045,Droga... uma tentativa de romper a aliança entre as raças deste mundo...
CS_CH3_Main_20_046,Temos de relatar isso a Orvelia.
CS_CH3_Main_20_047,"Fufufu, os Orvelianos não farão nada a respeito."
CS_CH3_Main_20_048,"A família real e os aristocratas vão se entocar em seus pequenos palácios pensando em sobreviver, mesmo se tiverem de pôr de lado todo o resto."
