KEY,Japanese
CH7_Main_4_021,フロストジャイアントの寿命って、確か人間の10倍ぐらいはあるはずよ。\nだからタルカス王は、まだ生きてるかもしれない。
CH7_Main_4_022,友達だったムスクロー王が死んでから攻め入ったってことは、\nタルカス王も一応の義理は果たしたってことなのかしらね？
CH7_Main_4_023,そんなわけがあるか！
CH7_Main_4_024,俺なりに調べてみて、そして分かったんだ。
CH7_Main_4_025,最終的に蛮族の国を滅ぼしたのはタルカスだってな。
CH7_Main_4_026,俺たちは帰る国さえ失ったっていうのに、\nハーピーもドライアドも襲いかかってくる。\nまるで蛮族すべてを滅ぼそうとするみたいにな。
CH7_Main_4_027,どうしてそこまでひどいことを......。
CH7_Main_4_028,さあな。すべては国を離れてる間に起こったことだ。\n何が起きたか知りたいのは俺のほうだよ。
CH7_Main_4_029,けど蛮族の生き残りは俺のことを憎んでる。
CH7_Main_4_030,そりゃそうだよな。蛮族の戦士だったくせに10年も姿を消して、\n一番大事な時になんの役にも立たなかったんだから......。
CH7_Main_4_031,参ったな......。\n俺たちは蛮族の王に会うためにここまで来たんだが......。
CH7_Main_4_032,そういうことなら、手伝わせてくれ。\nさっき助けてもらった恩を返したいからな。
CH7_Main_5_001,蛮族の国へ着くことができれば、\n聖剣の力の最後の１つを取り戻せると思ったのに......。
CH7_Main_5_002,まさか国そのものがなくなってるとはな。
CH7_Main_5_003,さて、これからどうすればいいのか......。
CH7_Main_5_004,――カーセル。
CH7_Main_5_005,蛮族の国にあるという聖剣の力を見つけた後は、どうするつもりなの？
CH7_Main_5_006,エリドラの森で言っていたでしょう？\n聖剣がすべての力を取り戻したら世界樹へ戻して、\n後のことは次の使い手に任せるって。
CH7_Main_5_007,でも、まだオグリアで見つけた力も聖剣へは戻していないし......。
CH7_Main_5_008,それはまた、その時に考えるさ。
CH7_Main_5_009,今はもっと考えなくちゃいけないことがある。
CH7_Main_5_010,例えば国を失った蛮族の王はまだ生きているのか？　とか\n生きているならどこに隠れているのか？　とかな。
CH7_Main_5_011,そうね。カーセルの言う通りだわ。\nまずは蛮族の王を捜し出して、聖剣の力を返してもらわなきゃ。
CH7_Main_5_012,――オルベルリアの貴族たちは俺の命を狙っている。
CH7_Main_5_013,そんな連中がいる限り、\n聖剣を手に入れる前の生活に戻ることはできないんだろうな......。
CH7_Main_6_001,へえ、こんな寒いところにもドライアドがいるのね。
CH7_Main_6_002,あのドライアドは闇に呑み込まれてはいないようですね。
CH7_Main_6_003,それはそうだが......。
CH7_Main_6_004,人間だぞ。蛮族かな？
CH7_Main_6_005,分からんが、人間には違いない。
CH7_Main_6_006,さっきも言ったろ？
CH7_Main_6_007,ヴィントラント雪山に住むすべての種族が、人間を敵視してるって。
CH7_Main_6_008,えぇ～。優しくて穏やかなことにかけては定評のある\nドライアドまで蛮族の敵に回ってるわけ！？
CH7_Main_6_009,アンタたち、いったい何やらかしたのよ。
CH7_Main_6_010,ガウさんはその当時、国にはいなかったそうですから。
CH7_Main_6_011,でもどうして人間がここまで憎まれているのか、\nその理由ぐらいは知りたいな。
CH7_Main_6_012,あの......１つだけ教えてください。\nあなたがたはどうして人間と敵対しているのですか？
CH7_Main_6_013,今更何を言う......！
CH7_Main_6_014,100年前、魔族をこの世界に呼び込んだのは人間だ。
CH7_Main_6_015,そして今再び、蛮族は魔族と手を組んだ！\n人間こそ、この世界を蝕む病魔そのものだ！
CH7_Main_6_016,蛮族が魔族と手を組んだって......。
CH7_Main_6_017,そんなことはありえない......何かの誤解だ！
CH7_Main_6_018,この後に及んで言い訳とは見苦しい！　失せろ！
CH7_Main_7_001,ああもう！　何よ！
CH7_Main_7_002,蛮族が本当に魔族と組んだかどうかは知らないけど......。
CH7_Main_7_003,でもハーピーだってオークだってダークエルフだって、\n闇の力を受け入れて自分の欲望や願望を果たそうとしてたわよ！？
CH7_Main_7_004,いや、待ってくれ！　蛮族が魔族と手を組んだだって！？\nそんなはずはない！
CH7_Main_7_005,どうしてそう言い切れるのよ。アンタ、しばらく国を離れてたんでしょ？
CH7_Main_7_006,蛮族の誰かが魔族と組み、それを知った他の種族たちは\n魔族同様、蛮族を共通の敵として認識した。
CH7_Main_7_007,そう考えれば、アンタたちの一族が根絶やしにされようとしている\n現状にも納得が行くってもんだわ。
CH7_Main_7_008,......でもすべては推測でしかない。
CH7_Main_7_009,俺の知る蛮族は、魔族なんかと組むような連中じゃないんだ。\n誤解を解いて、仲間たちを救わないと......！
CH7_Main_7_010,いずれにせよ、俺たちにはもっと情報が必要だ。
CH7_Main_7_011,真実を見極めるためにはな。そうだろ、クレオ？
CH7_Main_7_012,そうね。私も少し冷静にならなきゃ。\nいきなり襲われて、ちょっと頭に血が上っちゃったみたい。
CH7_Main_7_013,しかし苦労してヴィントラント雪山まで来たと思ったらこの仕打ちか。\n先が思いやられるな。
CH7_Main_7_014,事故とは言え、闇の世界へのポータルを開けてしまったのが\n人間だというのは事実ですからね。
CH7_Main_7_015,もっとも、今となってはそれが本当に\n事故だったのかどうかも疑わしいところですけど......。
CH7_Main_8_001,フロストジャイアントだ！
CH7_Main_8_002,あの男は......ガウか！
CH7_Main_8_003,姿を見ないから死んだかと思ったが、生きていたとはな！
CH7_Main_8_004,ほう、顔を見ただけでガウと分かるとはな。
CH7_Main_8_005,結構有名じゃないか。
CH7_Main_8_006,国を守れなかった男の名が知れ渡っていても虚しいだけだ。
CH7_Main_8_007,やつは危険だ。なんとしても始末しろ！
CH7_Main_9_001,んっ？　そこにいるのはロディナか？
CH7_Main_9_002,おや、こんなところで会うなんて偶然ですね。\nこれも何かの縁ということで、ちょっと助けてくれませんか？
CH7_Main_9_003,どうしたんだ？
CH7_Main_9_004,フロストジャイアントたちが私の家を襲ってるんです。
CH7_Main_9_005,どうしてそうなったかについては、後でゆっくり。\nまずはあいつらを片付けましょう。
CH7_Main_10_001,助けてくれて、ありがとうございました。
CH7_Main_10_002,この近くにあなたの家があるんですね。
CH7_Main_10_003,そうなのです。
CH7_Main_10_004,じゃあ助けたお礼に一晩泊めてもらえないかしら？\nさすがにこんな雪山で野宿ってわけにはいかないから。
CH7_Main_10_005,それはいいのですが......この中にカーセルという人はいますか？
CH7_Main_10_006,カーセルは俺だが、どうして名前を知ってるんだ？
CH7_Main_10_007,そんなこと、どうでもいいじゃないですか。
CH7_Main_10_008,行きましょう。あなたを待っている人がいるのです。
CH7_Main_11_001,ここは......。
CH7_Main_11_002,もしかして封印された氷の洞窟？
CH7_Main_11_003,ええ、そうです。
CH7_Main_11_004,あなた、ここに住んでるの？
CH7_Main_11_005,一応。
CH7_Main_11_006,ここは1000年もの長きに渡り、魔法で封印されてたはず。
CH7_Main_11_007,あなたがここに住んでるって言うなら、その封印は解かれたってこと？
CH7_Main_11_008,そういうことです。
CH7_Main_11_009,そんな大事なこと、しれっと言わないでくれる！？
CH7_Main_11_010,そもそも魔法で封印されたこの場所を、\n魔法師でもないあなたが解放するってどういうこと！？
CH7_Main_11_011,誤解のないよう言っておきますが、封印を解いたのは私ではありません。
CH7_Main_11_012,......俺のことを待っている人がいると言っていたな？
CH7_Main_11_013,それはもしかして......。
CH7_Main_11_014,ええ。その人物こそ、この洞窟の主です。
CH7_Main_12_001,はぁ......またか。
CH7_Main_12_002,ちょ、ちょっと待って！
CH7_Main_12_003,どうして魔族がここにいるの！？
CH7_Main_12_004,氷の洞窟には凍死して、そのまま放置された死体がたくさんあったんです。
CH7_Main_12_005,それがアンデッドになっただけ。
CH7_Main_12_006,闇の力はこの洞窟の中まで流れ込んできて、\n止めることができなかったんです。
CH7_Main_12_007,しかしどうして、こんなところにまで闇の力が......。
CH7_Main_12_008,......あなたは蛮族の人でしょう？　知らないんですか？
CH7_Main_12_009,蛮族の王が魔族のマルドゥクと契約したことを。
CH7_Main_12_010,なっ......なんだと！？　でたらめを言うな！！
CH7_Main_12_011,でたらめなものですか。
CH7_Main_12_012,何しろこの辺りで起きた出来事を、監視するのが私の任務なのですから。
CH7_Main_12_013,そんな......馬鹿な......。
CH7_Main_12_014,......頼む、ロディナ。俺がいない間\n蛮族の国に何が起きたのか、詳しく教えてくれねえか？
CH7_Main_12_015,構いませんが、それは後回しです。
CH7_Main_12_016,まずはあのアンデッドたちを、安らかに眠らせてやりましょう。
CH7_Main_13_001,さて......蛮族の国に何が起きたのか、\nすべてを知る覚悟はできていますか？
CH7_Main_13_002,......おう。
CH7_Main_13_003,国を離れていたと言っていましたが、どれぐらいです？
CH7_Main_13_004,10年ってとこだ。
CH7_Main_13_005,それなら何も知らなくても不思議じゃありませんね。
CH7_Main_13_006,私が任務を受け、この地へやってきたのは３年ほど前のことです。
CH7_Main_13_007,その時点ですでに、蛮族の国は荒廃が進んでいました。
CH7_Main_13_008,フロストジャイアントとの長きに渡る戦争で、\n蛮族の多くは難民となっていた。
CH7_Main_13_009,そして難民となった蛮族たちは、\nハーピーやドライアドから略奪を繰り返していました。
CH7_Main_13_010,それで......あいつらは蛮族を憎んでいたんだな......。
CH7_Main_13_011,いえ、それが理由ではないのです。\n略奪の被害に遭った種族の中でも、蛮族掃討に加わったのはごく一部だけ。
CH7_Main_13_012,けれどその一部が加わっただけでも、蛮族には十分な脅威だったのですね。
CH7_Main_13_013,最終的に蛮族の国は滅亡の一歩手前まで追い詰められてしまった。
CH7_Main_13_014,そんな時――マルドゥクが蛮族の王と面会したのです。
CH7_Main_13_015,はぁ......。ホント、アイツが出てくるとロクなことにはならないわね。
CH7_Main_13_016,滅亡寸前の王につけこんで、マルドゥクは\n死んだ蛮族たちをアンデッドとして蘇らせた。そんなとこでしょ。
CH7_Main_13_017,クレオ、ここにはガウさんもいるのですから......。
CH7_Main_13_018,いいんだ、気にしないでくれ......。
CH7_Main_13_019,......王がマルドゥクの手を借りたことで、\nヴィントラント雪山には、アンデッドがうろつくようになったんだな。
CH7_Main_13_020,追い詰められていたとは言え、\n王の下した決断は最悪のものだと言えるでしょう。
CH7_Main_13_021,だろうな。
CH7_Main_13_022,そんなことをすりゃあ、どんな種族だって蛮族を見限るはずだ。
CH7_Main_13_023,だが......もし俺が国を離れてなかったら......\nこんなひどいことにはならなかったかもしれねえ......。
CH7_Main_13_024,ガウさん、あなたにはあなたの進むべき道があったのです。
CH7_Main_13_025,だからどうか、そんなふうに自分のことを責めないでください。
CH7_Main_14_001,やめるんだ！
CH7_Main_14_002,あの声は......パベル！
CH7_Main_14_003,いったい何が......！
CH7_Main_14_004,パベル！　何があったんですか！？
CH7_Main_14_005,くっ......タルカス......なぜだ......。
CH7_Main_14_006,カイルがあんなことになったのは、あの女が......アルレッテがいたからだ。
CH7_Main_14_007,じゃあ、氷の中にいるのがアルレッテ......！？
CH7_Main_14_008,待っていてください、パベル。私がすぐにあいつを......！
CH7_Main_14_009,ハッ、手遅れだ。さあ目を覚ませ、アルレッテ。\nお前の罪を精算する時が来た。
CH7_Main_14_010,......。
CH7_Main_14_011,母さん......！？
CH7_Main_14_012,あれがカーセルのお母さん？　でもアンデッドよ！？
CH7_Main_14_013,タルカス！
CH7_Main_14_014,おのれ......！
CH7_Main_14_015,王、パベルとの戦いで力を使った今、連戦は避けるべきです！
CH7_Main_14_016,ここは逃げましょう！
CH7_Main_14_017,......仕方ない。今日はここまでだ。\nパベルも――ガウ、お前も見逃してやる。
CH7_Main_14_018,そうはさせん！！
CH7_Main_14_019,......。
CH7_Main_14_020,母さん......どうしてこんな姿に......。
CH7_Main_14_021,やめろ、カーセル！　そこにいるのはお前の母親じゃない！　アンデッドだ！！
CH7_Main_14_022,カーセル、危ない！！
CH7_Main_14_023,フレイ！
CH7_Main_14_024,......。
CH7_Main_14_025,ああ、よかった......カーセル......無事なのね......。
CH7_Main_14_026,フレイ......どうして......！？
CH7_Main_14_027,だって......あなたには世界を救う使命があるんだもの......。
CH7_Main_14_028,......。
CH7_Main_14_029,フレイ......フレイ！！
CH7_Main_14_030,そんな......嘘でしょ......。
CH7_Main_14_031,クレオ、泣いてる暇はないぞ。\nアルレッテの次の狙いは俺たちらしい。
CH7_Main_14_032,フレイ、ねえ、返事をして......。
CH7_Main_14_033,くそっ！　こうなりゃ手段は選んでられないか！
CH7_Main_14_034,はぁっ――！
CH7_Main_14_035,お前ら、しっかりしろ！
CH7_Main_14_036,まただ......また俺のせいで......。
CH7_Main_14_037,フレイまで......死なせてしまった......。
CH7_Main_14_038,どうして俺なんだ......。
CH7_Main_14_039,俺は聖剣の力なんて欲しくなかったのに......！
CH7_Main_14_040,フレイ......俺はもう駄目だ......。
CH7_Main_14_041,きみなしでは、もう何もできない......！
CH7_Main_14_042,カーセル――。
CH7_Main_14_043,フレイ！？
CH7_Main_14_044,そんなこと言わないで。私たち、ここまで頑張って来たじゃない。
CH7_Main_14_045,確かに私たちの周りでは、たくさんの命が失われた。\n救えた命も多かったけど、救えなかった命も多かったわ......。
CH7_Main_14_046,それでも私たちは戦うしかなかった。
CH7_Main_14_047,世界を救うためには犠牲も出るものなんだ、なんて言いたくはないわ。\nでも戦わなければ、より大きな悲劇が起きていた......。
CH7_Main_14_048,あなたが望んだことではない以上、それはとても悲しいことだけど......\n世界の運命は、私たちの手の中にあるの。
CH7_Main_14_049,でも......もうどうすることもできない......。
CH7_Main_14_050,きみがいない世界で、俺に何をしろと言うんだ？
CH7_Main_14_051,悲しまないで。私だって旅の中で、多くの命を奪ってきた。\nそして今度は私が奪われる番だった。たったそれだけのことなの。
CH7_Main_14_052,カーセル......。
CH7_Main_14_053,私の使命はあなたを闇から守ること。
CH7_Main_14_054,だから私がいなくなったくらいで、絶望しないで。
CH7_Main_14_055,お願い、カーセル。
CH7_Main_14_056,私の使命を果たさせて。――立ち上がって、戦うの。
CH7_Main_14_057,フレイ......。
CH7_Main_14_058,分かったよ......。他の誰のためでもない。\nきみのために――俺はもう一度立ち上がろう。
CH7_Main_14_059,ありがとう。
CH7_Main_14_060,本当にありがとう、カーセル。
CH7_Main_14_061,これは......！
CH7_Main_14_062,フレイ......？
CH7_Main_14_063,何が......起きてるんだ......！？
CH7_Main_14_064,カー......セル......？
CH7_Main_14_065,私......生きてるの......？
CH7_Main_14_066,聞きたいのは俺のほうだ......。
CH7_Main_14_067,フレイ......きみは生きてるんだな？　夢じゃないんだな！？
CH7_Main_14_068,ええ......たぶん。
CH7_Main_14_069,フレイ～！！！！
CH7_Main_15_001,もう消えたみたいだけど、さっきの翼はなんだったんだ？
CH7_Main_15_002,翼？
CH7_Main_15_003,まるで天使みたいな姿だったけど......。
CH7_Main_15_004,でも天使の翼を隠せるなんて、聞いたことないわね......。
CH7_Main_15_005,カーセル、大丈夫？
CH7_Main_15_006,ああ、心配いらないさ。
CH7_Main_15_007,それよりも、きみが無事でよかった......本当に。
CH7_Main_15_008,ええ。
CH7_Main_15_009,さて、ここに長居は無用だな。
CH7_Main_15_010,パベルだったか？　彼ならきっと母さんのことも知ってるはずだ。
CH7_Main_15_011,早く助け出して、話を聞かないと――！
CH7_Main_16_001,ロディナ！　パベルは無事か！？
CH7_Main_16_002,助けはしましたが、まだ油断はできません。
CH7_Main_16_003,ガウさんはどこに？
CH7_Main_16_004,タルカスを追って行きました。
CH7_Main_16_005,よし。ならここにいるフロストジャイアントは俺たちで倒すぞ！
CH7_Main_17_001,よし、これでだいたい片付いたな。
CH7_Main_17_002,パベル、ケガはないか？
CH7_Main_17_003,君がカーセルか......。アルレッテはどうした......？
CH7_Main_17_004,俺が殺した。そうするしかなかったんでな。
CH7_Main_17_005,......そうか。
CH7_Main_17_006,教えてくれ、パベル。\n母さんは......どうしてアンデッドなんかになったんだ？
CH7_Main_17_007,魔物に殺されたから、だね。
CH7_Main_17_008,今から十数年前――私が君の村に着いた時にはもう、\n彼女は魔族の手にかかり、アンデッドとなっていたんだ。
CH7_Main_17_009,あなたは......母さんの知り合いなのか？
CH7_Main_17_010,100年前、君の母親を氷の中に封印したのが私さ。
CH7_Main_17_011,その時、彼女のお腹にはもう君がいたはずだ。
CH7_Main_17_012,100年前......？　ちょっと待ってくれ、つまりそれは......。
CH7_Main_17_013,君はもう、自分がどんな血筋を\n受け継いでいるのか知っているんだろう？
CH7_Main_17_014,えっ？　何？　どういうこと？
CH7_Main_17_015,......俺はカイル王の血を引いている。
CH7_Main_17_016,たぶん遠い子孫なんだろうって思ってきたけど、\nどうやらそうじゃなかったみたいだな。
CH7_Main_17_017,お母様がカーセルを身ごもったのが\n100年前の出来事だとすれば......。
CH7_Main_17_018,......俺はカイル王の息子かもしれない......。
CH7_Main_17_019,どうなんだ、パベル。
CH7_Main_17_020,間違いなく、君はカイルの息子だよ。
CH7_Main_17_021,じゃあ......どうしてあなたは母さんを氷に閉じ込めたんだ？
CH7_Main_17_022,母さんが何か罪を犯したのか？
CH7_Main_17_023,いや、そうじゃない。
CH7_Main_17_024,彼女は人生に悲観して......自ら死を選ぼうとしていたんだ。
CH7_Main_17_025,私には彼女を眠らせ、ほんのつかの間\n現実を忘れさせてやることぐらいしか、できなかったんだ......。
CH7_Main_17_026,それで100年も......。
CH7_Main_17_027,いや、そもそも母さんはなぜ死のうとしてたんだ？
CH7_Main_17_028,アルレッテとカイルが出会ったのは旅の途中のことだ。\nだがカイルが彼女の村に長く留まることは不可能だった。
CH7_Main_17_029,カイルが魔王討伐という自らの使命を果たすべくアルレッテのもとを\n去る時にはもう、彼女のお腹には君が宿っていた。
CH7_Main_17_030,そしてそれは魔族の知るところとなり、\nやつらはアルレッテの村を襲い、住人を皆殺しにしたんだ。
CH7_Main_17_031,おそらくはアルレッテと、そしてカイルの血を引く君を殺すために。
CH7_Main_17_032,母さんは......どうやって魔族の襲撃を逃れたんだ？
CH7_Main_17_033,もともとアルレッテには婚約者がいてね。
CH7_Main_17_034,だけどアルレッテがカイルと出会ったことが\nきっかけとなって婚約者は村から去って行った。
CH7_Main_17_035,けれどカイルがアルレッテを残して旅立ったことを知り、\n婚約者は彼女を守るために村へ戻り――そして魔族に襲われて死んだ。
CH7_Main_17_036,すべてを失った彼女は、カイルを憎み、自分を憎み......死を望んだ。
CH7_Main_17_037,こんなことを言うのは気が引けるけど、\n当時の彼女は君のことさえも憎んでいたようだった。
CH7_Main_17_038,これが......100年前に起きた出来事さ。
CH7_Main_17_039,カイル王は......アルレッテさんを愛してはいなかったんですか？
CH7_Main_17_040,さあね。人の心の中までは見通せないから。
CH7_Main_17_041,私が語れるのはただ、この目で見たことだけ。
CH7_Main_17_042,だから私が話せるのもここまでだ。
CH7_Main_17_043,それでも......話を聞かせてくれてありがとう。\nずいぶんといろんなことがあったようだけど......。
CH7_Main_17_044,俺が一緒に暮らしていた父さんは？　あの人は......。
CH7_Main_17_045,彼は君の父親ではない。単なる保護者だよ。
CH7_Main_17_046,あのね、ちょっと確認させてくれる？\nあなたって人間に見えるけど100年以上生きてるってこと？
CH7_Main_17_047,その件については、また後で説明するよ。
CH7_Main_18_001,ふむ......聖剣はまだ本来の力を取り戻していないようだね。\n３つの力を集めていないのかい？
CH7_Main_18_002,まだ１つしか戻せていないんだ。
CH7_Main_18_003,ローレインの持っていた力だろう。彼女から聞いている。\nエアトラ―オークたちが持っている力はどうしたんだい？
CH7_Main_18_004,見つけはしたんだが、今、聖剣に戻すのは危険だと判断したんだ。
CH7_Main_18_005,俺はまだ、聖剣を完璧に操れるわけじゃないから。
CH7_Main_18_006,なるほど。それなら力が必要になったら言ってくれ。
CH7_Main_18_007,私の預かっている力を聖剣に戻そう。
CH7_Main_18_008,でも聖剣の力は、蛮族の王が持っているんじゃないんですか？
CH7_Main_18_009,かつて蛮族の王であった、ムスクローが私に預けたんだ。
CH7_Main_18_010,彼は自分が死んだ後、\n遠からずして蛮族の国が滅びることを知っていたからね。
CH7_Main_18_011,ムスクロー様…
CH7_Main_18_012,君自身の力で聖剣を制御できるようになったら、\nいつでも力を戻してあげよう。
CH7_Main_18_013,聖剣も今のままでは本来の力を発揮できないからね。
CH7_Main_18_014,それなんだが......聖剣の力に頼らず、\n魔族の進攻を食い止めることはできないのか？
CH7_Main_18_015,その質問は意味がない。
CH7_Main_18_016,聖剣なくして立ち向かえるものなら、\n魔族はここまでの脅威たり得なかっただろう。
CH7_Main_18_017,......それもそうか。
CH7_Main_18_018,結局世界を救うには、聖剣が必要ってことなんだな......。
CH7_Main_18_019,聖剣の力を制御できないことを恐れている、\n君の判断は実に賢明だ。
CH7_Main_18_020,しかしだからと言って、ずっとそのままというわけにもいかない。\nいつかは聖剣と向き合わないとね。
CH7_Main_19_001,さすがだな、ガウ。\n聞きしに勝るその武勇、殺すには惜しまれるほどだ！
