KEY,Thai
DRAGONRAIDHARD_COMMON_LOADING_TIP_1,อัพเกรดอุปกรณ์ผ่านมนตรา!\nม้วนหนังสือมนตรานั้นสามารถใช้ได้ที่โรงตีเหล็ก
DRAGONRAIDHARD_COMMON_LOADING_TIP_2,สามารถรับออปชั่นแตกต่างออกไปขึ้นอยู่กับม้วนหนังสือมนตรา
DRAGONRAIDHARD_COMMON_LOADING_TIP_3,เคลียร์ภารกิจเรดทุกสัปดาห์เพื่อรับม้วนหนังสือมนตราระดับตำนาน!
REDDRAGONRAIDHARD_COMMON_LOADING_TIP_1,Temeraire จะบล็อคความเสียหายกายภาพในโหมดยาก
REDDRAGONRAIDHARD_COMMON_LOADING_TIP_2,หากได้รับความเสียหายจากลมหายใจเพลิง\nจะต้องลบล้างคำสาปแห่งเปลวเพลิงผ่านการโจมตี
BLUEDRAGONRAIDHARD_COMMON_LOADING_TIP_1,Scalaxia จะทำให้ศัตรูอยู่สถานะแช่แข็งบ่อยมากขึ้นเมื่ออยู่ในโหมดยาก\nลองใช้การต้านทานดูสิ!
BLUEDRAGONRAIDHARD_COMMON_LOADING_TIP_2,ทำลายเสาน้ำแข็ง! หากผ่านไป 20 วินาทีเสาน้ำแข็งจะระเบิดและสร้างความเสียหายอย่างมาก
GREENDRAGONRAIDHARD_COMMON_LOADING_TIP_1,พิษของ Zyrrkinoth จะถูกลบล้างหาก HP เต็ม
GREENDRAGONRAIDHARD_COMMON_LOADING_TIP_2,Zyrrkinoth มีความต้านทานคริติคอลแข็งแกร่งในโหมดยาก\nจะต้องทำให้อัตราคริติคอลสูงขึ้นกว่าเดิม!
BLACKDRAGONRAIDHARD_COMMON_LOADING_TIP_1,Armarta จะลดความเสียหายที่ได้รับจากวีรบุรุษในระยะไกลลงอย่างมาก\nลองใช้วีรบุรุษในระยะใกล้ดูสิ!
BLACKDRAGONRAIDHARD_COMMON_LOADING_TIP_2,หาก Armarta เพิ่มพลังกายุจะทำให้ได้รับดีบัฟรุนแรง\nต้องลบล้างเอฟเฟคบวกเพื่อขัดขวางการก่อพายุให้ได้
WORLDBOSS_COMMON_LOADING_TIP_1,คริสตัลแห่งพลังนั้นสามารถแลกเปลี่ยนเป็นวัตถุโบราณที่แข็งแกร่งได้ที่ Loman NPC
WORLDBOSS_COMMON_LOADING_TIP_2,บอสโลกจะเปลี่ยนไปทุกวันจันทร์\nลองท้าทายบอสใหม่ดูสิ!
WORLDBOSS_COMMON_LOADING_TIP_3,บอสโลกเป็นการแข่งขันร่วมกับผู้เล่นทั่วโลก!
WORLDBOSS_MOUNTAIN_FORTRESS_LOADING_TIP_1,การโจมตีที่สร้างความเสียหายเวทจะมีผลอย่างมากกับ Mountain Fortress
WORLDBOSS_MOUNTAIN_FORTRESS_LOADING_TIP_2,เมื่อ Mountain Fortress ล้มลง ความเสียหายที่ได้รับจะเพิ่มขึ้นอย่างมาก ลองโจมตีดู!
WORLDBOSS_MOUNTAIN_FORTRESS_LOADING_TIP_3,เมื่ออยู่ในโหมดต้านทาน ต้องระวังสกิลหิมะถล่ม
WORLDBOSS_MOUNTAIN_FORTRESS_LOADING_STORY_1,ว่ากันว่าตอนที่ Mountain Fortress ถูกสร้าง รูปลักษณ์ของมันเป็นเพียงแค่หิน
WORLDBOSS_MOUNTAIN_FORTRESS_LOADING_STORY_2,สิ่งที่ปลุก Mountain Fortress คือการที่ปีศาจรุกรานสาธารณรัฐ Gray เมื่อครั้งแรก
WORLDBOSS_MOUNTAIN_FORTRESS_LOADING_STORY_3,Theo ได้เปลี่ยนเส้นทางชีวิตไปจากการที่ Mountain Fortress โจมตีสาธารณรัฐ Gray\nMountain Fortress ที่ถูกปลุกยังคงวนเวียนอยู่บริเวณภูเขารวมไปถึงพื้นที่อาณาจักรสิ่งประดิษฐ์เวท
WORLDBOSS_MOUNTAIN_FORTRESS_LOADING_STORY_4,เพื่อที่จะต้านทานเผ่าปีศาจ Mountain Fortress ก็ถูกปลุกขึ้นในสาธารณรัฐ Gray\nแต่ผลสุดท้ายสาธารณรัฐ Gray ก็กลับล่มสลายเพราะ Mountain Fortress
WORLDBOSS_PROTIANUS_LOADING_TIP_1,การโจมตีที่สร้างความเสียหายกายภาพจะมีผลอย่างมากกับ Protianus
WORLDBOSS_PROTIANUS_LOADING_TIP_2,หากต้องการหนีออกจากคุกวารี จะต้องสร้างความเสียหายกายภาพให้ได้มากที่สุดอย่างรวดเร็ว
WORLDBOSS_PROTIANUS_LOADING_TIP_3,เมื่อ Protianus ล้มลง ความเสียหายที่ได้รับจะเพิ่มขึ้นอย่างมาก ลองโจมตีดู!
WORLDBOSS_PROTIANUS_LOADING_STORY_1,หากต้องการความตื่นเต้นในการเล่นเซิร์ฟ\nการขอให้ Protianus ช่วยก็เป็นอีกวิธีที่ดี
WORLDBOSS_PROTIANUS_LOADING_STORY_2,ราชาแห่งแอตแลนติส ผู้เป็นอมตะที่ร่างสร้างจากน้ำ\nว่ากันว่าจะทำให้เกิดพายุและโจมตีผู้ที่ทำลายอาณาจักรตนเอง
WORLDBOSS_XANADUS_LOADING_TIP_1,Xanadus ใช้ใจกลางโลกันตร์ในการต่อสู้
WORLDBOSS_XANADUS_LOADING_TIP_2,เมื่อ Xanadus ใช้สกิลฝันร้ายจากอเวจีจะเกิดระเบิดและสร้างความเสียหายรุนแรง
WORLDBOSS_XANADUS_LOADING_TIP_3,หากไม่ทำให้อัตราการรักษาของ Xanadus ลดลง มันจะแข็งแกร่งขึ้นเรื่อยๆ\nลองใช้เอฟเฟคการลดอัตราการรักษาดูสิ
WORLDBOSS_XANADUS_LOADING_STORY_1,ที่จริงแล้ว Xanadus สามารถพูดได้\nแต่เราแค่ไม่เข้าใจเท่านั้น
WORLDBOSS_XANADUS_LOADING_STORY_2,Xanadus ในอดีตกาลเคยเป็นเทพธิดาที่ได้รับความเคารพแห่งอาณาจักรใต้ดินที่หายไปจากประวัติศาสตร์
WORLDBOSS_XANADUS_LOADING_STORY_3,ในฐานะ 'เทพธิดา' เธอมีหน้าที่อยู่หนึ่งอย่างคือ\nการรับฟังและอวยพรบรรดาผู้ศรัทธาที่เข้ามาฝ่าฟันบททดสอบ
TREASUREHOUSE_LOADING_TIP_1,ผู้รับใช้ยกกระเป๋าแห่งทองจะได้รับความเสียหาย 1 หน่วยโดยไม่สนใจพลังโจมตีของวีรบุรุษ\nลองใช้วีรบุรุษที่โจมตีได้อย่างรวดเร็ว
TREASUREHOUSE_LOADING_TIP_2,ทรัพย์สินการเข้าคลังสมบัติ 'ทองคำแท่งแห่งราชินีทองคำ'\nสามารถสร้างจาก 'ผงทองคำแห่งราชินีทองคำ' ซึ่งได้รับจากการใช้สเตมิน่า
LABYRINTH_COMMON_LOADING_TIP_1,เขาวงกตหลวงใต้ดินจะถูกรีเซ็ตทุกวันที่ 16 ของทุกเดือน อย่าลืมท้าทายดูล่ะ!
LABYRINTH_COMMON_LOADING_TIP_2,เอฟเฟคพิเศษของเขาวงกตหลวงใต้ดินจะต่างกันออกไปทุกการรีเซ็ต
LABYRINTH_KNIGHT_LOADING_TIP_1,ในเขาวงกตแห่งการป้องกัน อัศวินสามารถรับเอฟเฟคเพิ่ม HP ได้\nเพราะงั้นอย่าลืมใช้อัศวินล่ะ!
LABYRINTH_KNIGHT_LOADING_TIP_2,ยิ่ง HP สูงจะยิ่งได้เปรียบในเขาวงกตแห่งการป้องกัน
LABYRINTH_KNIGHT_LOADING_TIP_3,หากพันธมิตรถูกขับไล่ ลองใช้สกิลหลายรอบเพื่อทำการช่วยเหลือ!
LABYRINTH_WARRIOR_LOADING_TIP_1,เขาวงกตแห่งการบุกทะลวง นักรบสามารถรับเอฟเฟคเพิ่มความเสียหายได้\nเพราะงั้นอย่าลืมใช้นักรบล่ะ!
LABYRINTH_WARRIOR_LOADING_TIP_2,ลดเกจสถานะผิดปกติเพื่อทำลายศัตรูในคราเดียว
LABYRINTH_ASSASSIN_LOADING_TIP_1,เขาวงกตแห่งการซุ่มโจมตี มือลอบสังหารสามารถรับเอฟเฟคเพิ่มความเร็วโจมตีได้\nเพราะงั้นอย่าลืมใช้มือลอบสังหารล่ะ!
LABYRINTH_ASSASSIN_LOADING_TIP_2,ต้องรีบจัดการก็อบลินที่ถือระเบิด!
LABYRINTH_ARCHER_LOADING_TIP_1,เขาวงกตแห่งการเล็งเป้า นักธนูสามารถรับเอฟเฟคเพิ่มเจาะเกราะได้\nเพราะงั้นอย่าลืมใช้นักธนูล่ะ!
LABYRINTH_ARCHER_LOADING_TIP_2,เขาวงกตแห่งการเล็งเป้า เอฟเฟคลบที่ได้รับจะถูกสะสม\nระวังอย่าให้เอฟเฟคลบถูกสะสมล่ะ!
LABYRINTH_ARCHER_LOADING_TIP_3,หาก El Rosed ทำการเรียกเอลฟ์มืดจะต้องจัดการให้ไวที่สุด
LABYRINTH_MECHANIC_LOADING_TIP_1,เขาวงกตแห่งการทะลุทะลวง ช่างกลสามารถรับเอฟเฟคเพิ่มความเสียหายคริติคอลได้\nเพราะงั้นอย่าลืมใช้ช่างกลล่ะ!
LABYRINTH_MECHANIC_LOADING_TIP_2,หากได้รับความเสียหายหลายครั้ง ศัตรูจะได้รับเอฟเฟคสะท้อนความเสียหาย\nโจมตีศัตรูให้ได้จำนวนมากที่สุด!
LABYRINTH_WIZARD_LOADING_TIP_1,เขาวงกตแห่งการระเบิด จอมเวทสามารถรับเอฟเฟคการฟื้นฟู MP ได้อย่างรวดเร็ว\nเพราะงั้นอย่าลืมใช้จอมเวทล่ะ!
LABYRINTH_WIZARD_LOADING_TIP_2,ไข่แมงมุมจะเรียกแมงมุมจำนวนมากมาอย่างต่อเนื่อง\nลองสร้างความเสียหายเป็นวงกว้างดูสิ!
LABYRINTH_PRIEST_LOADING_TIP_1,เขาวงกตแห่งการรักษา นักบวชสามารถรับเอฟเฟคเพิ่มอัตราการรักษาได้\nเพราะงั้นอย่าลืมใช้นักบวชล่ะ!
LABYRINTH_PRIEST_LOADING_TIP_2,หากเมฆพิษที่เห็ด FlaFla เรียกมาก่อตัวขึ้น จะสร้างความเสียหายรุนแรงแก่พันธมิตรและศัตรู
SUBSTORY_COMMON_LOADING_TIP_1,หากเคลียร์เนื้อเรื่องย่อยจะมีคอสตูมเฉพาะที่สามารถซื้อได้
SUBSTORY_COMMON_LOADING_TIP_2,รางวัลจากการเคลียร์เนื้อเรื่องย่อยคือชิ้นส่วนความทรงจำซึ่งสามารถสร้างตั๋วสุ่มสมบัติเฉพาะได้
CHALLENGERAID_URKAK_LOADING_STORY_1,Urkak ราชาโหดร้ายของเหล่าก็อบลินที่อาศัยอยู่ในใต้ดิน\nเพราะกลายพันธุ์จึงทำให้มีร่างใหญ่ราวกับยักษ์
CHALLENGERAID_SATRIA_LOADING_STORY_1,Satria พี่สาวของราชินีฮาร์ปี้ Balalaika\nเป็นราชินีองค์ก่อนและยังเป็นฮาร์ปี้ตนแรกที่รับพลังแห่งความมืด
CHALLENGERAID_KERBEREN_LOADING_STORY_1,แม้จะเป็น Sieg ก็ยังจัดการได้ยาก หากเจอ Kerberen จงหนีไปซะ
CHALLENGERAID_OBRIGARD_LOADING_STORY_1,ไม่ได้อยู่ในรูปร่างมนุษย์หรือมอนสเตอร์แต่เป็นโครงกระดูกยักษ์สยดสยอง\nเป็นผีดิบแปลกประหลาดที่ถูกสร้างมาจากกระดูกมอนสเตอร์ หนอนยักษ์ ยักษ์ โทรลล์ ออร์ค
CHALLENGERAID_SITHRAEL_LOADING_STORY_1,อดีตองครักษ์ของ Timorel กษัตริย์แห่งเอลฟ์มืด นักเวทดาบผู้ยิ่งใหญ่ที่สุด Sithrael\nในฐานะหัวหน้าตระกูลที่ดูแลราชวงศ์จากรุ่นสู่รุ่น เชี่ยวชาญเวทมนตร์แสงจันทร์และการต่อสู้ด้วยดาบ
CHALLENGERAID_GARROW_LOADING_STORY_1,Garrow ภูมิใจในร่างกายที่ใหญ่กว่ามนุษย์กิ้งก่าทั่วไป\nจงระวังความคล่องแคล่วและคุณสมบัติของเขาให้ดี
CHALLENGERAID_THORPE_LOADING_STORY_1,Thorpe แม่ทัพยักษ์น้ำแข็งผู้เป็นมือขวาของราชา Tarkas\nเป็นผู้ที่มีความน่าเชื่อถือและความสามารถถึงขนาดว่าได้รับเชิญให้เป็นราชาคนถัดไป
CHALLENGERAID_KALLAX_LOADING_STORY_1,Kallax ในอดีตเคยเป็นนักรบดราโกนิค ผู้เป็นมือขวาของผู้บัญชาการดราโกนิคในสงครามปีศาจ\nเป็นผู้ที่ชื่นชอบการไล่ล่าและกลืนกินวิญญาณของมังกรจำนวนมาก จนถูกกล่าวขานว่าปีศาจอำมหิต
CHALLENGERAID_KALLAX_LOADING_STORY_2,Kallax เป็นหนึ่งในดราโกนิคจำนวนน้อยที่มักจะไล่ล่าและกลืนกินมังกร
CHALLENGERAID_URKAK_LOADING_TIP_1,เนื่องจากลูกสมุนของ Urkak จะโจมตีเป้าหมายที่มีสัญลักษณ์ก่อน\nจึงต้องปกป้องพันธมิตรและกำจัดลูกสมุนด้วยการโจมตีเป็นบริเวณกว้างอย่างรวดเร็ว
CHALLENGERAID_SATRIA_LOADING_TIP_1,สถานะ 'ความว่องไวของฮาร์ปี้' ของ Satria จะทำให้ทุกความเสียหายไม่เป็นผล\nลองใช้วีรบุรุษที่โจมตีรวดเร็วและโจมตีหลายครั้งดู
CHALLENGERAID_KERBEREN_LOADING_TIP_1,ทุกครั้งที่ Kerberen ใช้สกิล จะรวบรวม 'ความโกรธของนักล่าสังหาร' ไว้ที่ตัวเอง\nเมื่อรวบรวมครบ 5 ครั้ง จะทำให้แข็งแกร่งขึ้นและทำลายพลังของวีรบุรุษที่มีสถานะผิดปกติแข็งแกร่ง
CHALLENGERAID_OBRIGARD_LOADING_TIP_1,Obrigard จะเรียกหัวกะโหลกปีศาจที่ต้านทานกายภาพหรือต้านทานเวท\nลองท้าทายด้วยปาร์ตี้ที่ประกอบไปด้วยทั้งกายภาพ/เวทดู
CHALLENGERAID_SITHRAEL_LOADING_TIP_1,Sithrael มีเอฟเฟคลดความเสียหายรุนแรงเพราะ 'การคุ้มครองแห่งแสงจันทร์' แต่\nเมื่อเป้าหมายใช้สกิล จะอ่อนแอลงเป็นระยะเวลาสั้นๆ\nลองใช้วีรบุรุษที่ใช้สกิลบ่อยๆดูสิ
CHALLENGERAID_GARROW_LOADING_TIP_1,'การบุกแบบสายฟ้าแลบอย่างไร้ความปราณี' ของ Garrow สร้างความเสียหายมากในบริเวณใกล้\nจะฟื้นฟู HP ของตนเองอย่างมากเทียบกับความเสียหาย\nลองใช้วีรบุรุษที่มีเอฟเฟคลดอัตราการรักษาและวีรบุรุษที่ต่อสู้ในระยะไกลดู
CHALLENGERAID_THORPE_LOADING_TIP_1,Thorpe มีสกิลแช่แข็งอยู่จำนวนมาก\nเมื่อใช้ 'หิมะแห่งความวินาศ' หากเกราะป้องกันไม่ถูกทำลายจะทำให้เกิดความเสียหายอย่างมาก\nใช้วีรบุรุษที่ลบล้างเอฟเฟคลบและวีรบุรุษที่สามารถรับความเสียหายอย่างมากในเวลาสั้นๆ
CHALLENGERAID_KALLAX_LOADING_TIP_1,หากอยู่ในสถานะ 'ลูกไฟมหาภัย' เพราะ Kallax จะสร้างความเสียหายต่อเนื่องถาวร\nต้องฟื้นฟู MP และลบล้างอย่างรวดเร็ว\nลองใช้วีรบุรุษที่สามารถฟื้นฟู  MP ให้กับพันธมิตรดูสิ
CHALLENGERAID_KALLAX_LOADING_TIP_2,Kallax จะสร้าง 'สัญลักษณ์แห่งดราโกนิค' อย่างสุ่มแก่ตนเองหรือศัตรู\nหากไม่สามารถลบล้างสัญลักษณ์ได้ Kallax จะแข็งแกร่งขึ้นหรือศัตรูจะได้รับความเสียหายคริติคอล\nลองใช้วีรบุรุษที่ลบล้างเอฟเฟคบวกของศัตรูและลบเอฟเฟคลบของพันธมิตรดู
GUILDCONQUEST_TYRFAS_LOADING_TIP_1,บล็อคสายตาของ Tyrfas ด้วยการสร้างความเสียหายเวทหลายครั้ง!
GUILDCONQUEST_TYRFAS_LOADING_STORY_1,เพราะ Tyrfas เป็นเต่าเลยว่าเดินช้างั้นหรอ\nใช่ เข้าใจถูกแล้ว
GUILDCONQUEST_TYRFAS_LOADING_STORY_2,Tyrfas อสูรศักดิ์สิทธิ์แห่งโลกนิรันดร์ซึ่งเป็นแผ่นดินแห่งแรกที่กำเนิดขึ้น
GUILDCONQUEST_TYRFAS_LOADING_STORY_3,Tyrfas ในฐานะสัตว์มหัศจรรย์ผู้ควบคุมชีวิตและชะตากรรม\nช่วยชี้นำชีวิตของทุกสรรพสิ่งบนโลก
GUILDCONQUEST_TYRFAS_LOADING_STORY_4,พลังสำคัญอย่างหนึ่งของ Tyrfas\nคือการช่วยให้สิ่งมีชีวิตเผชิญกับความตายในขณะที่ความบริสุทธิ์ของดวงวิญญาณยังถูกรักษาไว้
GUILDCONQUEST_TYRFAS_LOADING_STORY_5,Tyrfas ดูดซับพลังงานชั่วร้ายมากเกินไป ในที่สุดก็เกิดความหายนะ\nร่างกายที่สูญเสียความสงบภายในก็ถูกแช่แข็งเย็นยะเยือกกลายเป็นร่างที่เห็นในปัจจุบัน
GUILDCONQUEST_LAKREIL_LOADING_TIP_1,ก่อนที่ Lakreil จะโยนบูมเมอแรงสร้างความเสียหายคริติคอล ต้องป้องกันด้วยอัตราการหลบหลีกสูง
GUILDCONQUEST_LAKREIL_LOADING_STORY_1,ถ้าบูมเมอแรงที่ Lakreil โยนออกไปไม่กลับคืนมาก็คงน่าสลด
GUILDCONQUEST_LAKREIL_LOADING_STORY_2,Lakreil เป็นนักรบมนุษย์กิ้งก่าน่าสงสารที่เสียสติจากการทดลองของ Malduk
GUILDCONQUEST_LAKREIL_LOADING_STORY_3,Lakreil ถูก Malduk จับมาทดลองเพื่อเพิ่มโทสะ\nและความโทสะนั้นก็มีผลต่อ Malduk เสมอมา
GUILDCONQUEST_LAKREIL_LOADING_STORY_4,ถึง Malduk จะคอยควบคุม  Lakreil แต่ก็ไม่ง่ายนัก\nผลสุดท้ายก็เลยปล่อยปละละเลย
GUILDCONQUEST_VELKAZAR_LOADING_TIP_1,ต้องกำจัดโลงศพแห่งการลงทัณฑ์อย่างรวดเร็วเพื่อต้านทานกองไฟแห่งนรก
GUILDCONQUEST_VELKAZAR_LOADING_TIP_2,ต้องรีบช่วยพันธมิตรที่ตกอยู่ในเขตนรกไฟ!
GUILDCONQUEST_VELKAZAR_LOADING_STORY_1,Velkazar คิดว่าอุณหภูมิของลาวาเหมาะกับการอบอุ่นร่างกายตน
GUILDCONQUEST_VELKAZAR_LOADING_STORY_2,เป็นปีศาจโบราณตนนึงที่มีอายุมากที่สุด\nเป็นชื่อที่แม้ปีศาจระดับสูงยังต้องเกรงกลัว
GUILDCONQUEST_VELKAZAR_LOADING_STORY_3,Velkazar จะกลืนกินวิญญาณของผู้ที่ต่อต้านตนเอง\nเป็นปีศาจผู้ยิ่งใหญ่ที่ชั่วร้ายที่สุดผู้ชื่นชอบการเผาไหม้ตลอดกาลและการทรมาน
GUILDCONQUEST_VELKAZAR_LOADING_STORY_4,ตามคำบอกเล่าจากคัมภีร์โบราณ Velkazar เคยปรากฏตัวมาแล้วหนึ่งครั้งในอาณาจักรโลก
