KEY,Vietnamese
E_C19_Dec_Pavel01_01,...
E_C19_Dec_Pavel01_02,"Cái này... là thật chứ, dường như muôn vàn cảm xúc đan xen với nhau."
E_C19_Dec_Pavel01_03,Vừa vô vọng nhưng không bao giờ muốn buông bỏ...
E_C19_Dec_Pavel01_04,Cái cảm giác mơ hồ thế này... như thể cứ quanh quẩn trong đầu.
E_C19_Dec_Pavel01_05,"(Đây, thân xác Arlette chắc sẽ ngủ yên vĩnh viễn trong lòng đất lạnh.)"
E_C19_Dec_Pavel01_06,(Chỉ có thi thể lạnh lẽo không nhúc nhích... sẽ thay thế chỗ trống của cô ấy.)
E_C19_Dec_Pavel01_07,(Nhưng...)
E_C19_Dec_Pavel01_08,Lạnh thật...
E_C19_Dec_Pavel01_09,Đã nghĩ là vĩnh viễn không có việc gì chạm đến được mình như khí lạnh của nơi này...
E_C19_Dec_Pavel01_10,Cái giá lạnh khắc nghiệt thấu tận xương tủy cứ len lỏi khắp cơ thể mình...
E_C19_Dec_Pavel01_11,Khi mở mắt ra là mùa đông thứ chín mươi đang đến.
E_C19_Dec_Pavel01_12,Và... Và hôm nay là mùa đông thứ một trăm rồi.
E_C19_Dec_Pavel01_13,... Hóa ra là vậy.
E_C19_Dec_Pavel01_14,Cái bộ dạng đó thừa biết là có thể chết nhưng vẫn chĩa ngọn giáo vào tôi...
E_C19_Dec_Pavel01_15,"Trong khoảng thời gian trôi qua không hứa hẹn gì, dù có ăn mòn tâm trí nhưng không thể nào rũ bỏ được..."
E_C19_Dec_Pavel01_16,Thật là lạnh lùng đến xé lòng.
E_C19_Dec_Pavel01_17,Nhưng nỗi nhớ mà người đàn ông đó cảm nhận...
E_C19_Dec_Pavel01_18,Nó tồn tại khác biệt hẳn với nỗi nhớ mà tôi cảm thấy bây giờ.
E_C19_Dec_Pavel01_19,"Và với sự khác biệt đó,"
E_C19_Dec_Pavel01_20,mức độ nỗi đau phải chịu đựng quả cũng khác nhau đúng không...
E_C19_Dec_Pavel01_21,(Cảm xúc muốn gặp người trân quý đang sống ở đâu đó...)
E_C19_Dec_Pavel01_22,(Cái cảm xúc rời đi đưa tiễn người mà không thể nào gặp lại...)
E_C19_Dec_Pavel01_23,Tôi lo cho cậu quá.
E_C19_Dec_Pavel01_24,Giờ ở cùng nhau thế này nhưng...
E_C19_Dec_Pavel01_25,Nếu chúng tôi rời đi... cậu sẽ lại chỉ còn một mình đúng không?
E_C19_Dec_Pavel01_26,(Đúng vậy... Tôi nhớ ra rồi.)
E_C19_Dec_Pavel01_27,(Cô xuất hiện cùng với những người sống sót của đất nước diệt vong nào đó mang hình hài tiều tụy.)
E_C19_Dec_Pavel01_28,(Nhưng cô khác với những con người khác.)
E_C19_Dec_Pavel01_29,(Tôi coi cô là vật trở ngại và định đuổi đi... Cô thì bao giờ cũng đối xử mềm mỏng.)
E_C19_Dec_Pavel01_30,(Thật ra thì cũng từng phiền hà và bực bội nhưng...)
E_C19_Dec_Pavel01_31,(Dù vậy tôi đã nghĩ là không sao vì có khoảng thời gian cùng cô trò chuyện.)
E_C19_Dec_Pavel01_32,Ngẫm ra thế này thì tôi nhớ ra rồi.
E_C19_Dec_Pavel01_33,"Hôm nay trong bánh có gì, và yêu thích Kyle từ bao giờ..."
E_C19_Dec_Pavel01_34,"Hơn nữa khi còn bé, Kyle đã dẫn cô và Maria đi đâu đó chơi..."
E_C19_Dec_Pavel01_35,Giờ nhìn lại thì nó cũng chỉ là những câu chuyện cực kỳ riêng tư.
E_C19_Dec_Pavel01_36,(Nhưng nghe câu chuyện của cô ấy... kỳ lạ là lại không thấy chán.)
E_C19_Dec_Pavel01_37,"Này, Pavel..."
E_C19_Dec_Pavel01_38,Lúc nào đó... người mà hiểu cho cậu...
E_C19_Dec_Pavel01_39,Lúc nãy là gì vậy nhỉ? Dường như là ký ức rất quan trọng...
E_C19_Dec_Pavel01_40,... Không có ai cả ư?
E_C19_Dec_Pavel01_41,Lewisia hình như vẫn chưa có tin tức gì...
E_C19_Dec_Pavel01_42,Còn Rodina thì...
E_C19_Dec_Pavel01_43,Hehe! May thật vì có thể tìm ra nhanh hơn dự đoán!
E_C19_Dec_Pavel01_44,Mong là Pavel sẽ thích nó!
E_C19_Dec_Pavel01_45,Rodina.
E_C19_Dec_Pavel01_46,Pavel đã đến trước rồi ư! May quá. Cũng vừa lúc đưa cho ngài...
E_C19_Dec_Pavel01_47,Pavel?
E_C19_Dec_Pavel01_48,... Ngày bão tuyết lớn như hôm nay thì tốt hơn là nên về sớm.
E_C19_Dec_Pavel01_49,"Pavel, liệu bây giờ đang lo lắng cho tôi đấy à?"
E_C19_Dec_Pavel01_50,"Vì tôi có chút việc cần làm ở ngôi làng nên mới trễ, đừng quá lo lắng nhé."
E_C19_Dec_Pavel01_51,Và hơn nữa là có thứ muốn tặng ngài.
E_C19_Dec_Pavel01_52,Thứ muốn tặng?
E_C19_Dec_Pavel01_53,"Chúc mừng sinh nhật, Pavel! Tôi đã đặc biệt chuẩn bị cho ngài bởi dạo này trông ngài im ắng quá."
E_C19_Dec_Pavel01_54,Sinh nhật...?
E_C19_Dec_Pavel01_55,Cách đây không lâu không phải Pavel đã kể tôi nghe sao?
E_C19_Dec_Pavel01_56,Nói là nhớ có nhận quà của ai đó cỡ tầm chừng này.
E_C19_Dec_Pavel01_57,Nói vậy không có nghĩa là hôm nay là sinh nhật ngài ư?
E_C19_Dec_Pavel01_58,Ơ... Chả lẽ tôi nhầm lẫn gì rồi ư?
E_C19_Dec_Pavel01_59,Một lúc nào đó dù không có tôi...
E_C19_Dec_Pavel01_60,Giá như xuất hiện người có thể hiểu cho cậu được thì hay quá.
E_C19_Dec_Pavel01_61,"Sẽ vì cậu mà nổi giận, rồi có lúc lại tặng quà..."
E_C19_Dec_Pavel01_62,Ước gì có người như vậy cạnh cậu tốt biết mấy.
E_C19_Dec_Pavel01_63,(Hóa ra là vậy... Lúc đó Arlette... rõ ràng đã nói với mình như vậy.)
E_C19_Dec_Pavel01_64,(Người hiểu mình... và đồng hành với mình...)
E_C19_Dec_Pavel01_65,Pavel...?
E_C19_Dec_Pavel01_66,Tôi sẽ sử dụng tốt nó mà.
E_C19_Dec_Rodina01_01,......
E_C19_Dec_Rodina01_02,Lâu quá nhỉ Rodina. Có lệnh phái đi đến nơi nhận nhiệm vụ mới ngay ngày sinh nhật nên vất vả nhiều nhỉ.
E_C19_Dec_Rodina01_03,Trung sĩ Rodina Klein! Xin ra mắt đội phó đội hiệp sĩ hộ vệ!
E_C19_Dec_Rodina01_04,Đã bảo là ở chỗ riêng tư thì không cần cứng nhắc như thế.
E_C19_Dec_Rodina01_05,"Vậy thì... lâu rồi mới gặp, anh Fluss."
E_C19_Dec_Rodina01_06,Ừa. Mục đích là quà sinh nhật? Hay là vì nhiệm vụ đảm nhận lần này đấy?
E_C19_Dec_Rodina01_07,"À, thì là, quà thì không phải. Em vì nhiệm vụ mà tìm đến gặp."
E_C19_Dec_Rodina01_08,Đầu tiên rõ ràng nghe là nhiệm vụ hộ vệ.
E_C19_Dec_Rodina01_09,Nhưng rồi sau khi đồng ý và nghe câu chuyện chi tiết thì cái này...
E_C19_Dec_Rodina01_10,Trên thực tế là nhiệm vụ canh giữ chứ gì.
E_C19_Dec_Rodina01_11,......
E_C19_Dec_Rodina01_12,"Em canh giữ... Xin lỗi, em có biết nhân vật mà mình đảm nhận hộ vệ là nhân vật nào không?"
E_C19_Dec_Rodina01_13,Vâng. Em nghe nói là phù thủy vĩ đại đến mức đế quốc phải trực tiếp đứng ra canh giữ.
E_C19_Dec_Rodina01_14,Ừa. Không có nhân vật nào có thể thắng khi ở trong tầm ngắm của anh ta. Ít ra là ở đế quốc hiện tại.
E_C19_Dec_Rodina01_15,Vì thế mới ra lệnh cho em đó.
E_C19_Dec_Rodina01_16,Bởi vì nếu là em – tay bắn tỉa hàng đầu của đất nước này thì có thể bắn tỉa thoải mái dù ở ngoài tầm ngắm của phép thuật.
E_C19_Dec_Rodina01_17,......
E_C19_Dec_Rodina01_18,Có lẽ vấn đề là em đã cầm lấy súng trường để bảo vệ mọi người rồi chứ?
E_C19_Dec_Rodina01_19,Nếu là cái đó thì không cần phải lo lắng.
E_C19_Dec_Rodina01_20,Chỉ cần hành động như quân nhân thường làm là được.
E_C19_Dec_Rodina01_21,Ra là... thế à? Em biết rồi. Vậy thì em sẽ cố hết sức với nhiệm vụ đã nhận.
E_C19_Dec_Rodina01_22,Xa... hơn mình nghĩ... và cũng lạnh... hơn mình nghĩ!
E_C19_Dec_Rodina01_23,Nếu phù thủy rồng băng sống ở nơi như thế này...
E_C19_Dec_Rodina01_24,......
E_C19_Dec_Rodina01_25,......Hình như là người đó...
E_C19_Dec_Rodina01_26,"Xin chào, tôi là trung sĩ Rodina Klein được đế quốc phái đến."
E_C19_Dec_Rodina01_27,Ngài là Pavel đúng không ạ?
E_C19_Dec_Rodina01_28,......Đúng vậy.
E_C19_Dec_Rodina01_29,Nhiệm vụ hộ vệ lần này do tôi đảm nhận. Mong ngài giúp đỡ cho!
E_C19_Dec_Rodina01_30,Không cần hộ vệ nhưng... Thôi được rồi.
E_C19_Dec_Rodina01_31,Ta ghét nhất là ồn ào nên mong để ý chỉ điều đó thôi.
E_C19_Dec_Rodina01_32,"Vâng, tôi biết rồi ạ!"
E_C19_Dec_Rodina01_33,Nhiệm vụ lần này có vẻ khó khăn đây...
E_C19_Dec_Rodina01_34,Mình có thể thân thiết được với người đó không...?
E_C19_Dec_Rodina01_35,Rodina! Có đó không?
E_C19_Dec_Rodina01_36,"Xin chào, cô Yanne! Mời vào ạ."
E_C19_Dec_Rodina01_37,Lần này có việc gì thế ạ?
E_C19_Dec_Rodina01_38,Ta nhận được lời nhờ vả của một vị cao quý của đế quốc.
E_C19_Dec_Rodina01_39,Nhờ chuyển quà sinh nhật cho cháu.
E_C19_Dec_Rodina01_40,Một vị cao quý tặng quà sinh nhật cho cháu ư? Liệu có phải...
E_C19_Dec_Rodina01_41,Ờ...
E_C19_Dec_Rodina01_42,Cho cháu tất cả chừng này ư...?
E_C19_Dec_Rodina01_43,À. Tuy những thứ này toàn bộ không phải người đó gửi...
E_C19_Dec_Rodina01_44,Đây. Có thư này.
E_C19_Dec_Rodina01_45,Quả nhiên là anh Fluss.
E_C19_Dec_Rodina01_46,......Lần này cũng viết đầy những lời lẽ rùng mình gửi đi...
E_C19_Dec_Rodina01_47,Và đây là... gia đình gửi cho.
E_C19_Dec_Rodina01_48,Hết chừng đó à? Nhiều quá đi mất! Ta xem một chút được chứ?
E_C19_Dec_Rodina01_49,A... Hóa ra Rodina là con gái út của một đại gia đình. Hèn gì nhiều thế này!
E_C19_Dec_Rodina01_50,"Uhm, thật ra ta cũng có thứ cho cháu."
E_C19_Dec_Rodina01_51,Cô Yanne nói cho cháu à?
E_C19_Dec_Rodina01_52,Xin lỗi vì nó chẳng đáng gì. Vì ta chuẩn bị vội quá. Chúc mừng sinh nhật.
E_C19_Dec_Rodina01_53,Không đâu ạ. Thật sự cám ơn cô!
E_C19_Dec_Rodina01_54,"Ôi, chưa gì đã đầy ắp quà rồi ư. Lẽ nào tiệc sinh nhật đã kết thúc rồi hả?"
E_C19_Dec_Rodina01_55,Lewisia? Mời vào ạ. Nhưng cô biết sinh nhật tôi mà đến à?
E_C19_Dec_Rodina01_56,Có người hỏi tôi quà sinh nhật thường nên tặng gì. Thế là tự nhiên tôi biết được.
E_C19_Dec_Rodina01_57,"Nào, chúc mừng sinh nhật, Rodina."
E_C19_Dec_Rodina01_58,Ơ... ừa... Quà của công chúa...
E_C19_Dec_Rodina01_59,Nhờ cô mà Pavel vui vẻ hơn trước.
E_C19_Dec_Rodina01_60,Cám ơn vì đã làm những điều mà bạn cũ như chúng tôi cũng không thể làm được.
E_C19_Dec_Rodina01_61,Quá... quá lời rồi ạ. Thành thật cám ơn cô.
E_C19_Dec_Rodina01_62,...Ồn ào quá.
E_C19_Dec_Rodina01_63,"Ặc, Pavel. Ồn lắm đúng không ạ?"
E_C19_Dec_Rodina01_64,Không sao. ...Chúc mừng sinh nhật nhé!
E_C19_Dec_Rodina01_65,Hử? Tôi đã hết lòng cho lời khuyên. Thế mà anh lờ đi và chọn theo ý mình sao?
E_C19_Dec_Rodina01_66,...Tôi cũng tham khảo rồi. Chỉ là cái này có vẻ hợp với Rodina hơn.
E_C19_Dec_Rodina01_67,Hừmm!
E_C19_Dec_Rodina01_68,......Trước đây......
E_C19_Dec_Rodina01_69,Tôi... thất lễ rồi ạ.
E_C19_Dec_Rodina01_70,Gì đây ta?
E_C19_Dec_Rodina01_71,"Đó là, hôm nay sinh nhật của tôi."
E_C19_Dec_Rodina01_72,...Thì sao?
E_C19_Dec_Rodina01_73,"Gia đình có gói cho bánh kem, ngài cùng ăn chứ ạ?"
E_C19_Dec_Rodina01_74,Không cần đâu.
E_C19_Dec_Rodina01_75,Tôi... biết rồi...
E_C19_Dec_Rodina01_76,Ngài Pavel. Ngài có nghe tôi nói không ạ?
E_C19_Dec_Rodina01_77,Có chuyện gì?
E_C19_Dec_Rodina01_78,Hôm nay là sinh nhật tôi nên có nhận được bánh kem.
E_C19_Dec_Rodina01_79,Ngài có muốn cùng ăn không ạ?
E_C19_Dec_Rodina01_80,...Ta từ chối.
E_C19_Dec_Rodina01_81,Tôi biết rồi...
E_C19_Dec_Rodina01_82,"Dù tôi có mở lời nhưng ngài cũng không có phản ứng, cũng hầu như không trả lời câu hỏi."
E_C19_Dec_Rodina01_83,Nhưng bắt đầu chịu nghe mình nói từng chút một.
E_C19_Dec_Rodina01_84,Sau này chắc sẽ trả lời mình thôi.
E_C19_Dec_Rodina01_85,Thật sự là từng chút một nhưng... Pavel đã thay đổi rất nhiều.
E_C19_Dec_Rodina01_86,Lewisia nói chuyện ngài ấy có thân thiện hơn nếu ý đó là cái này thì...
E_C19_Dec_Rodina01_87,Và nếu nghĩ là nỗ lực của mình góp thêm sức mạnh cho hình dáng này thì...
E_C19_Dec_Rodina01_88,Đây cũng như là món quà sinh nhật tốt nhất rồi.
E_C19_Dec_Rodina01_89,...Lần này có vẻ như sẽ cũng nhau ăn...
E_C19_Dec_Viska01_01,"Khỉ thật, ở đây không có lấy một ác quỷ mạnh nào à?"
E_C19_Dec_Viska01_02,"Dạo này liên tục mất công vô ích... Ư ư, bực quá."
E_C19_Dec_Viska01_03,...Nhân tiện về làng để giải tỏa tâm trạng cũng phải ăn thỏa thuê món gì đó ngon ngon.
E_C19_Dec_Viska01_04,...
E_C19_Dec_Viska01_05,"Hôm nay thật là lạ. Cũng không muốn ăn gì, mà tự dưng lại buồn buồn vô cớ nữa."
E_C19_Dec_Viska01_06,...Hôm nay là ngày gì nhỉ? Giờ thậm chí còn không thèm nghĩ đến việc ăn ác quỷ nữa.
E_C19_Dec_Viska01_07,Chú phục vụ ơi! Đợi một lát!
E_C19_Dec_Viska01_08,Cho tôi hỏi cái này xíu. Hôm này là ngày mấy tháng mấy vậy?
E_C19_Dec_Viska01_09,...
E_C19_Dec_Viska01_10,Này. Con người.
E_C19_Dec_Viska01_11,"Bảo là dậy đi mà, con người."
E_C19_Dec_Viska01_12,Này! Vi!
E_C19_Dec_Viska01_13,...Hử? Gì cơ?
E_C19_Dec_Viska01_14,"Haizz, thật là!"
E_C19_Dec_Viska01_15,Sao cứ mỗi năm cứ ngày này là lại bộ dạng này chứ?
E_C19_Dec_Viska01_16,A... xin lỗi...
E_C19_Dec_Viska01_17,Đã bảo là cảm xúc của con người thế này thật khó chịu mà.
E_C19_Dec_Viska01_18,"Này, dù hôm nay ngôi làng của cậu có cháy mất,"
E_C19_Dec_Viska01_19,"Người mà cậu quen sẽ chết hết,"
E_C19_Dec_Viska01_20,"dù là ngày thân thể cậu vỡ thành từng mảnh vụn,"
E_C19_Dec_Viska01_21,thì giờ cậu vẫn còn sống mà.
E_C19_Dec_Viska01_22,"Giờ chắc cũng có sức mạnh đủ để phục thù,"
E_C19_Dec_Viska01_23,vấn đề là gì kia chứ?
E_C19_Dec_Viska01_24,...
E_C19_Dec_Viska01_25,"Này! Này, con người!"
E_C19_Dec_Viska01_26,"Khỉ gió, Thật là! Bảo tôi phải làm sao bây giờ!!"
E_C19_Dec_Viska01_27,"Ể? Gì cơ, là gã chân cua đây mà."
E_C19_Dec_Viska01_28,Hử? Là người quen chăng.
E_C19_Dec_Viska01_29,"Con người... là gì ta, là gã giống với tôi."
E_C19_Dec_Viska01_30,Trước đây tôi cũng có nói rồi đúng không? Là cái gã đã gặp ở núi lửa.
E_C19_Dec_Viska01_31,Dù gì thì riêng hôm nay nét mặt có gì đó vô cùng bực bội nhỉ?
E_C19_Dec_Viska01_32,"Này, chân cua!"
E_C19_Dec_Viska01_33,Y như rằng hôm nay cũng nốc no nê nhỉ.
E_C19_Dec_Viska01_34,"Với cái bụng con người bé tí kia mà làm thế nào ăn được như vậy, thật là..."
E_C19_Dec_Viska01_35,"Hử? Gì cơ, tên ngốc nghếch."
E_C19_Dec_Viska01_36,Hôm nay tâm trạng ta khá là tệ nên đừng có mà gây chuyện.
E_C19_Dec_Viska01_37,...Có chuyện gì vậy?
E_C19_Dec_Viska01_38,Trông dáng vẻ dữ dằn gấp mười lần so với thường ngày.
E_C19_Dec_Viska01_39,...
E_C19_Dec_Viska01_40,"Gì là gì chứ, cái gã vật chủ con người khiến ta bực mình chứ gì."
E_C19_Dec_Viska01_41,"Cứ tham luyến vào những thứ vô ích đã đánh mất, rồi buồn khổ, khóc lóc..."
E_C19_Dec_Viska01_42,Haizz... Con người là...
E_C19_Dec_Viska01_43,Này tên ngốc à.
E_C19_Dec_Viska01_44,Nhìn sơ là biết cái này là ngươi sai rồi.
E_C19_Dec_Viska01_45,Ta thì sao!
E_C19_Dec_Viska01_46,Nhìn sơ qua là biết một việc không có ý nghĩa gì rồi!
E_C19_Dec_Viska01_47,Vô ích vì việc đã qua -
E_C19_Dec_Viska01_48,Làm cái việc không có ý nghĩa gọi là nhập hồn giao ước mà giờ đến đây nói cái gì vậy?
E_C19_Dec_Viska01_49,Nghe chuyện Epis thì đa phần nhập hồn đều là ép buộc mà?
E_C19_Dec_Viska01_50,...Đó là những gã đáng thương lúc nào cũng hợm hĩnh nên ta định làm gương -
E_C19_Dec_Viska01_51,"Khỉ gió, việc riêng của ngươi thì ta không cần phải biết!"
E_C19_Dec_Viska01_52,Ta tuy không phải là chuyên gia về việc này nhưng
E_C19_Dec_Viska01_53,"nếu là như ngươi thì ta cũng bực bội và nổi giận,"
E_C19_Dec_Viska01_54,nếu không có cách giải tỏa cơn bực đó thì tâm trạng sẽ thế nào hả?
E_C19_Dec_Viska01_55,...Hừ.
E_C19_Dec_Viska01_56,Nếu nói là biết rồi thì tự lo mà xử lý đi.
E_C19_Dec_Viska01_57,"Haizz, cái gã tham ăn như đồ ngốc..."
E_C19_Dec_Viska01_58,"...Khỉ gió, chết tiệt!"
E_C19_Dec_Viska01_59,"Tên ngốc, nếu lần sau có gặp thì ta không để yên đâu..."
E_C19_Dec_Viska01_60,"Này! Nói chuyện một chút đi, con người!"
E_C19_Dec_Viska01_61,...
E_C19_Dec_Viska01_62,"A, thế thì..."
E_C19_Dec_Viska01_63,"Uhm... Ừ... Khỉ thật, không biết đâu."
E_C19_Dec_Viska01_64,"Nếu đã không thích như thế thì,"
E_C19_Dec_Viska01_65,hôm nay thế chủ động sẽ giao cho nhà ngươi.
E_C19_Dec_Viska01_66,Cứ tùy ý mà làm. Ta sẽ không can thiệp đâu.
E_C19_Dec_Viska01_67,Đi về quê mà xem phần đất mồ mả của gia đình hay gì đó.
E_C19_Dec_Viska01_68,Nếu là theo giao ước thì vốn dĩ không phải là tới lượt của ngươi nên hãy có suy nghĩ biết ơn đi.
E_C19_Dec_Viska01_69,(Lầm bà lầm bầm...)
E_C19_Dec_Viska01_70,...
E_C19_Dec_Viska01_71,Quê hương...
E_C19_Dec_Viska01_72,Mẹ... Cha...
E_C19_Dec_Viska01_73,"...Cám ơn, Viska..."
E_C19_Dec_Chase01_1,Ngày sinh nhật đáng lý phải vui vẻ thế mà trông công chúa buồn quá.
E_C19_Dec_Chase01_2,Vì thế mà tôi sẽ tặng cái này.
E_C19_Dec_Chase01_3,Công chúa phải cười thì mọi người mới cười được.
E_C19_Dec_Chase01_4,Hoa. May là nó vẫn còn tươi.
E_C19_Dec_Chase01_5,Ra là thế. Sinh nhật đã qua khá lâu rồi...
E_C19_Dec_Chase01_6,"Anh bao giờ cũng bảo vệ ta, còn tặng quà nữa chứ."
E_C19_Dec_Chase01_7,Nhưng ta thì lại không có gì cho anh cả. Thật là xấu hổ nhưng...
E_C19_Dec_Chase01_8,Không phải thế đâu. Công chúa đã đặt tên cho tôi mà.
E_C19_Dec_Chase01_9,Nhiệm vụ cũng giao rồi. ...Cũng tha thứ cho cái ngày mà định thủ tiêu công chúa.
E_C19_Dec_Chase01_10,Công chúa đã cho tôi mọi thứ. Tôi đã nhận rất nhiều rồi.
E_C19_Dec_Chase01_11,...Hihi. Thật vui vì anh nói vậy.
E_C19_Dec_Chase01_12,"Dù thế nhưng câu chuyện đã đến đây,"
E_C19_Dec_Chase01_13,hãy nghĩ thử xem liệu có muốn nhận thứ gì chăng.
E_C19_Dec_Chase01_14,"Kỳ nghỉ, lương hoặc cái gì khác..."
E_C19_Dec_Chase01_15,Nếu là thứ ta có thể cho thì ta sẽ làm ngay.
E_C19_Dec_Chase01_16,Dĩ nhiên đó là câu chuyện sau khi lộ trình này kết thúc.
E_C19_Dec_Chase01_17,...Khó đấy. Giống như bài toán mà Demia giao cho vậy.
E_C19_Dec_Chase01_18,Hihihi. Hãy suy nghĩ cho kỹ vào.
E_C19_Dec_Chase01_19,Thứ mà tôi muốn nhận...
E_C19_Dec_Chase01_20,Thứ mà cần đối với tôi... Thứ muốn sở hữu...
E_C19_Dec_Chase01_21,À ừm......
E_C19_Dec_Chase01_22,"Ôi trời, rốt cuộc là đã đi đâu thế?"
E_C19_Dec_Chase01_23,Nếu trễ quá thì lại bị đội trưởng mắng đấy...
E_C19_Dec_Chase01_24,Tìm ra rồi! Chase!
E_C19_Dec_Chase01_25,Ơ kìa... Chase?
E_C19_Dec_Chase01_26,Cứ đứng thế mà ngủ à?
E_C19_Dec_Chase01_27,Chase!
E_C19_Dec_Chase01_28,...Clause.
E_C19_Dec_Chase01_29,Nếu ngủ ở nơi thế này sẽ cảm lạnh đấy.
E_C19_Dec_Chase01_30,Hay lại bị đội trưởng mắng nên thấy buồn à?
E_C19_Dec_Chase01_31,Không phải. Chỉ đang suy nghĩ một chút...
E_C19_Dec_Chase01_32,...Muộn lắm rồi...
E_C19_Dec_Chase01_33,Muộn ư?
E_C19_Dec_Chase01_34,Công chúa nói là hãy suy nghĩ về thứ mà mình muốn có.
E_C19_Dec_Chase01_35,Nhưng khó quá... Cứ suy nghĩ mãi thế là một ngày trôi qua đi mất.
E_C19_Dec_Chase01_36,Haha. Thật là một bài toán khó mà.
E_C19_Dec_Chase01_37,(Hừm... Lẽ nào công chúa muốn báo đáp món quà sinh nhật?)
E_C19_Dec_Chase01_38,Nếu không nghĩ ra thứ muốn sở hữu thì...
E_C19_Dec_Chase01_39,Thứ mà bản thân mình thích thì sao nào?
E_C19_Dec_Chase01_40,Hay là món mà bản thân thích ăn!
E_C19_Dec_Chase01_41,...Thứ mà mình yêu thích...
E_C19_Dec_Chase01_42,có đấy.
E_C19_Dec_Chase01_43,Ô! Vậy thì cho công chúa biết thứ đấy...
E_C19_Dec_Chase01_44,Tên của tôi. Tôi thích tên của mình.
E_C19_Dec_Chase01_45,...Ơ?
E_C19_Dec_Chase01_46,Tôi cũng thích giáp vai mà Demia tặng.
E_C19_Dec_Chase01_47,Thích cả khăn tay công chúa tặng.
E_C19_Dec_Chase01_48,"Tuần tra, hộ vệ, Clause, Loman, Demia, công chúa..."
E_C19_Dec_Chase01_49,Tôi thích tất cả.
E_C19_Dec_Chase01_50,...Tuy Demia có chút đáng sợ.
E_C19_Dec_Chase01_51,Hahahaha. Nếu đội trưởng nổi giận thì chắc chắn đáng sợ rồi.
E_C19_Dec_Chase01_52,"Uhm, tìm ra câu trả lời rồi. Giờ tôi đi gặp công chúa đây."
E_C19_Dec_Chase01_53,Công chúa đang đợi. Tôi sẽ quay về trước khi muộn.
E_C19_Dec_Chase01_54,Ơ? Đợi đã!
E_C19_Dec_Chase01_55,Haha... Thật là...
E_C19_Dec_Chase01_56,Không sao chứ? Dù cứ thế này.
E_C19_Dec_Chase01_57,Nếu nghe được công chúa chắc cũng cảm thấy vui đấy.
E_C19_Dec_Chase01_58,Bảo là suy nghĩ đi thế mà rốt cuộc lại đi đâu rồi chứ...
E_C19_Dec_Chase01_59,Đã phái Clause đi rìm rồi nên chắc sớm quay về thôi ạ.
E_C19_Dec_Chase01_60,...Nếu lỡ như muộn quá hoặc có chuyện gì với Clause thì...
E_C19_Dec_Chase01_61,Chắc không có chuyện đó đây nên hãy yên tâm.
E_C19_Dec_Chase01_62,Cô cũng không biết ư. Việc giờ anh ta không còn nguy hiểm nữa.
E_C19_Dec_Chase01_63,Nhưng mà...
E_C19_Dec_Chase01_64,Mà nhìn lại thì cũng đến lúc ăn tối rồi. Phải chuẩn bị thức ăn mới được.
E_C19_Dec_Chase01_65,Để tôi làm cho ạ.
E_C19_Dec_Chase01_66,Vì không thể đợi đến khi họ về được.
E_C19_Dec_Chase01_67,Vậy đi. Nhờ cô nhé.
E_C19_Dec_Chase01_68,Công chúa!!
E_C19_Dec_Chase01_69,Chase. Rốt cuộc đã đi đâu...
E_C19_Dec_Chase01_70,Thứ mà tôi thích. Đã tìm ra rồi.
E_C19_Dec_Chase01_71,Hả? Thích...
E_C19_Dec_Chase01_72,...Được thôi. Nói thử xem. Cái gì hay nhất đây?
E_C19_Dec_Chase01_73,Rất rất là nhiều luôn.
E_C19_Dec_Chase01_74,Tôi thích cái tên của mình.
E_C19_Dec_Chase01_75,...Gì cơ?
E_C19_Dec_Chase01_76,Tên của tôi. Tuần tra. Công chúa. Demia. Clause. Loman.
E_C19_Dec_Chase01_77,Khăn tay công chúa cho. Đi dạo cùng công chúa. Hộ vệ của công chúa...
E_C19_Dec_Chase01_78,"Thôi, thôi nào..."
E_C19_Dec_Chase01_79,...Để suy nghĩ ra những thứ này mà mất thời gian lâu đến thế sao?
E_C19_Dec_Chase01_80,Clause đã giúp tôi đấy. Sau hồi suy nghĩ kỹ thì đã nhận ra được những thứ này.
E_C19_Dec_Chase01_81,...Hihi...
E_C19_Dec_Chase01_82,Hihihihi.
E_C19_Dec_Chase01_83,Công chúa?
E_C19_Dec_Chase01_84,...Tôi nói gì sai sao?
E_C19_Dec_Chase01_85,Không. Không phải đâu.
E_C19_Dec_Chase01_86,Cám ơn. Vì đã nói cho ta nghe những điều đó.
E_C19_Dec_Chase01_87,Để xem nào... Vì anh đã suy nghĩ kỹ rồi nên ta sẽ báo đáp theo như anh nói.
E_C19_Dec_Chase01_88,Tên của anh... Những thứ anh thích...
E_C19_Dec_Chase01_89,Chase. Sau này tên của anh là Chase.
E_C19_Dec_Chase01_90,......Chase...
E_C19_Dec_Chase01_91,Tên của tôi...
E_C19_Dec_Chase01_92,Nếu không nhớ bất kỳ điều gì thì
E_C19_Dec_Chase01_93,ta sẽ liều ban cho anh mục đích của cuộc sống.
E_C19_Dec_Chase01_94,Sau này hãy sống vì ta.
E_C19_Dec_Chase01_95,...Thế đi... Điều đó chắc là được.
E_C19_Dec_Chase01_96,Đó là...?
E_C19_Dec_Chase01_97,"Nhận lấy cái tên và sống cuộc sống mới,"
E_C19_Dec_Chase01_98,chắc cũng có ngày kỷ niệm những điều này.
E_C19_Dec_Chase01_99,Hãy quyết định hôm nay là sinh nhật của anh. Anh thấy thế nào?
E_C19_Dec_Chase01_100,...Sinh nhật...
E_C19_Dec_Chase01_101,Công chúa lại ban thêm quà nữa...
E_C19_Dec_Chase01_102,Tôi thích lắm. Rất là hài lòng.
E_C19_Dec_Chase01_103,Nếu là của công chúa ban thì cái gì cũng thích hết nhưng
E_C19_Dec_Chase01_104,cái này cũng thích như được đặt tên.
E_C19_Dec_Chase01_105,May là anh thích.
E_C19_Dec_Chase01_106,Vậy thì phải làm tiệc sinh nhật tuy có hơi muộn rồi.
E_C19_Dec_Chase01_107,Chắc phải bảo Demia chuẩn bị thêm thức ăn.
E_C19_Dec_Chase01_108,Tôi là Chase.
