KEY,"Thai"
E_C19_Jun_Fluss01_01,"หนาวจัง! ทำไมต้องมาที่ภูเขาหิมะแต่เช้าตรู่แบบนี้!"
E_C19_Jun_Fluss01_02,"หืม! Rodina!?"
E_C19_Jun_Fluss01_03,"อรุณสวัสดิ์ Mitra ไม่เจอกันนานเลยนะ"
E_C19_Jun_Fluss01_04,"ได้ข่าวว่าเจ้าเลิกทำงานแล้ว ไม่นึกเลยว่าจะเจอเจ้าที่นี่"
E_C19_Jun_Fluss01_05,"อืม ข้าก็ไม่นึกว่าจะเจอเจ้านอกการแข่งขันยิงปืนของจักรวรรดิ"
E_C19_Jun_Fluss01_06,"เจ้ามาที่นี่ทำไมกัน"
E_C19_Jun_Fluss01_07,"วันนี้ข้ามาช่วย Fluss"
E_C19_Jun_Fluss01_08,"หา เจ้าด้วยเหรอ"
E_C19_Jun_Fluss01_09,"แย่แล้ว ข้าสายแล้วล่ะ เจ้าสองคนมาถึงแล้ว รอให้อีกคนมาถึงก่อน"
E_C19_Jun_Fluss01_10,"นี่มันเรื่องอะไรกัน ข้ามาที่นี่ตามคำสั่งของชายชรา แต่กลับไม่รู้รายละเอียดอะไรเพิ่มเลย.."
E_C19_Jun_Fluss01_11,"รออีกสักพัก นั่นไงนางมาแล้ว!"
E_C19_Jun_Fluss01_12,"ขอโทษ! Luna มาสายใช่ไหม"
E_C19_Jun_Fluss01_13,"(น่ารักจังเลย!)"
E_C19_Jun_Fluss01_14,"ไม่นะ เด็กคนนี้เป็นอะไรกัน นี่เรากำลังจะทำอะไรกัน"
E_C19_Jun_Fluss01_15,"พวกเจ้าทุกคนจะต้องช่วยข้าทำสิ่งนี้!"
E_C19_Jun_Fluss01_16,"เราจะตามหาดอกกุหลาบที่ไม่มีวันหลับไหลซึ่งเติบโตบนภูเขาหิมะลูกนี้เท่านั้น"
E_C19_Jun_Fluss01_17,"Luna เจ้าจำกลิ่นดอกกุหลาบแล้วขุดหิมะหาได้ไหม"
E_C19_Jun_Fluss01_18,"เอาล่ะ Luna จงดมกลิ่นกุหลาบในหิมะ โอ้ ข้าก็ได้กลิ่นเหมือนกัน"
E_C19_Jun_Fluss01_19,"ดูเหมือนว่าเจ้าจะตั้งใจให้เด็กนั่นหาเจอ แล้วเรียกเรามาที่นี่ทำไม"
E_C19_Jun_Fluss01_20,"มันไม่ง่ายอย่างนั้นหรอก เดี๋ยวเจ้าก็จะได้รู้ เตรียมตัวให้พร้อมเถอะ"
E_C19_Jun_Fluss01_21,"????"
E_C19_Jun_Fluss01_22,"นี่ ดอกกุหลาบอยู่นี่! อ๊ากกกก! ไปไกลๆ นะเจ้าปีศาจ!"
E_C19_Jun_Fluss01_23,"ไปกันเถอะ เร็วเข้า!"
E_C19_Jun_Fluss01_24,"บ้าจริง! เจ้าเป็นอะไรไหม"
E_C19_Jun_Fluss01_25,"นั่นมันตัวอะไรน่ะ"
E_C19_Jun_Fluss01_26,"ข้าขอเรียกว่าเป็นเหมือนผู้พิทักษ์ดอกกุหลาบที่ไม่หลับใหลนะ"
E_C19_Jun_Fluss01_27,"เราต้องพิชิตศัตรูตัวนี้ให้ได้ก่อนจึงจะครอบครองดอกกุหลาบได้ แสดงฝีมือให้ข้าเห็นหน่อย"
E_C19_Jun_Fluss01_28,"เราต้องลำบากขนาดนี้เพื่อดอกไม้นี่เหรอ"
E_C19_Jun_Fluss01_29,"เจ้านี่หยาบคายจริงๆ ที่ดูหมิ่นดอกกุหลาบที่ไม่มีวันสูญสิ้นความงามแม้จะถูกเด็ดไปแล้วก็ตาม"
E_C19_Jun_Fluss01_30,"ข้าจะ... ทำตามคำสั่ง"
E_C19_Jun_Fluss01_31,"ข้าน่าจะรู้ว่าจะมีปัญหาตอนชายชราบอกให้ข้ามา... บ้าจริง นี่มันยุ่งยากชัดๆ"
E_C19_Jun_Fluss01_32,"Luna จะร่วมต่อสู้ด้วย!"
E_C19_Jun_Fluss01_33,"อืม พวกเขาสู้เก่งที่สุดในจักรวรรดิแล้ว"
E_C19_Jun_Fluss01_34,"ไปเด็ดกุหลาบดอกต่อไปกันเถอะ!"
E_C19_Jun_Fluss01_35,"ตอนเย็นในวันเดียวกันนั้น"
E_C19_Jun_Fluss01_36,"ข้าไม่รู้หรอกว่าเจ้าเป็นใคร"
E_C19_Jun_Fluss01_37,"ข้ารู้จักเจ้าในนามท่านหญิงแสนดีจากเรื่องเล่าของปู่ข้า..."
E_C19_Jun_Fluss01_38,"การเสียสละของเจ้าช่วยให้ข้ากับครอบครัวรอดพ้นจนถึงวันนี้"
E_C19_Jun_Fluss01_39,"ถึงข้าอาจไม่มีโอกาสได้พบท่าน"
E_C19_Jun_Fluss01_40,"แต่ข้าชื่นชมและเทิดทูนท่านสุดหัวใจ"
E_C19_Jun_Fluss01_41,"มาฉลองวันเกิดของข้าร่วมกันเถอะ ท่านหญิงผู้เป็นนิรันดร์..."
E_C19_Jun_Shea01_01,"นี่คือวันดี Mr. Schute!"
E_C19_Jun_Shea01_02,"ใช่แล้ว Shea! ถึงเวลาแล้วล่ะวันนี้ ข้ากังวลจัง เจ้าพร้อมหรือยัง"
E_C19_Jun_Shea01_03,"พร้อมสิ! ข้าสัญญากับ Mr. Schute ไว้ปีที่แล้ว!"
E_C19_Jun_Shea01_04,"ข้าจะร้องเพลงที่จัตุรัสนี้ในวันเกิดปีที่ 16"
E_C19_Jun_Shea01_05,"ใช่แล้ว F# คือแบบนี้ แล้ว G ก็..."
E_C19_Jun_Shea01_06,"โอ๊ย หูข้า! ฮ่ะฮ่ะ ดูนิ้วเจ้าสิสั่นไปหมด! อย่ากังวลเลย ร้องตามที่ซ้อมมานั่นแหละ"
E_C19_Jun_Shea01_07,"แต่ข้าตัวสั่นไปหมดเมื่อต้องยืนต่อหน้าฝูงชน"
E_C19_Jun_Shea01_08,"ใจเย็นสิ Shea เรายังมีเวลาเหลืออยู่ มาซ้อมกันอีกนิดมา"
E_C19_Jun_Shea01_09,"ได้ ไปหาที่เงียบๆ กัน"
E_C19_Jun_Shea01_10,"ข้าจะร้องอะไรก็ได้!"
E_C19_Jun_Shea01_11,"*ฟิ้ว* *พั่บ* *พั่บ*... *ฟิ้ว*"
E_C19_Jun_Shea01_12,"มีคนกำลังมา!"
E_C19_Jun_Shea01_13,"ข้าได้ยิน...เสียงเพลงจากสวรรค์..."
E_C19_Jun_Shea01_14,"ที่นี่วังเวงพิกล คงไม่มีใครมาใช่ไหม Mr. Schute"
E_C19_Jun_Shea01_15,"อืม ข้าสัมผัสได้ถึงพลังปีศาจอันรุนแรง แต่ดีที่เจ้าจะได้ฝึกความกล้าหาญ เริ่มซ้อมกันเถอะ!"
E_C19_Jun_Shea01_16,"มาเริ่มกัน!"
E_C19_Jun_Shea01_17,"*ตึก* *ตึก*"
E_C19_Jun_Shea01_18,"อะไรน่ะ! มีคนมาจริงๆ นะ!"
E_C19_Jun_Shea01_19,"ข้าเกลียดผีที่สุด! ไม่มีทาง!"
E_C19_Jun_Shea01_20,"ตอนนี้... นั่นคือเพลงกล่อมนอนของแม่ข้า"
E_C19_Jun_Shea01_21,"*แค่ก* Shea! เราอยู่ที่ไหนกัน นั่นมันพายุทรายใช่ไหม"
E_C19_Jun_Shea01_22,"ข้าขอโทษ Mr. Schute ข้ากำลังหาที่ปลอดคนแต่ดันมาอยู่ที่นี่เฉย"
E_C19_Jun_Shea01_23,"มาซ้อมครั้งสุดท้ายแล้วกลับไปที่จัตุรัสกันเถอะ!"
E_C19_Jun_Shea01_24,"*ตึก* *พั่บ* *พั่บ* ย๊ากกก!"
E_C19_Jun_Shea01_25,"อ๊ากก! มะ...มังกร"
E_C19_Jun_Shea01_26,"อย่ากลัวเลย! ข้าแค่อยากรู้ว่าเพลงอะไรเฉยๆ เดี๋ยวสิ!"
E_C19_Jun_Shea01_27,"เกิดอะไรขึ้น...? นี่มันกลางคืนแล้วนะ!"
E_C19_Jun_Shea01_28,"ไม่เห็นมีใครเลย Mr. Schute ข้าอยากจะ... *ฮึกๆ* เล่นดนตรีให้ผู้คนฟัง..."
E_C19_Jun_Shea01_29,"ข้าควรจะเลิกร้องเพลงซะ ข้าคงเป็นนักร้องไม่ได้"
E_C19_Jun_Shea01_30,"ไม่มีนักร้องคนไหนขี้อายเท่าข้าเลย... ไม่มีเลย"
E_C19_Jun_Shea01_31,"Shea..."
E_C19_Jun_Shea01_32,"อย่าพูดแบบนั้น!"
E_C19_Jun_Shea01_33,"ไม่มีนักร้องบนสวรรค์คนไหนที่เสียงเหมือนเจ้า"
E_C19_Jun_Shea01_34,"ใช่แล้ว! เพลงของเจ้า...ทำให้ข้านึกถึงเพลงกล่อมนอนที่แม่ชอบร้องให้ฟัง"
E_C19_Jun_Shea01_35,"ข้าจำไม่ได้แล้วว่ารู้สึกสงบแบบนี้ครั้งสุดท้ายเมื่อไหร่ ข้ารู้สึกซาบซึ้งมากหลังจากได้ยินบทเพลงของเจ้า"
E_C19_Jun_Shea01_36,"นี่ อย่าคิดเลิกร้องเพลงเชียวนะ"
E_C19_Jun_Shea01_37,"เพลงของเจ้าน่ะเพราะที่สุด! เอ่อ แต่ Laias ร้องเพราะกว่านะ"
E_C19_Jun_Shea01_38,"ขอบคุณนะทุกคน..."
E_C19_Jun_Shea01_39,"แล้วพวกเจ้าเป็นใคร"
E_C19_Jun_Shea01_40,"(... เทวดา ปีศาจ แล้วก็มังกร แม้แต่จักรพรรดิยังเรียกทุกคนมารวมตัวกันแบบนี้ไม่ได้นะ Shea)"
E_C19_Jun_Shea01_41,"(ตอนนี้มีคนมาเป็นแฟนคลับเราเพิ่มอีก 3 คนแล้ว! ฮี่ฮี่)"
E_C19_Jun_Nicky01_01,"วันนี้นี่!"
E_C19_Jun_Nicky01_02,"ข้าควรเก็บกวาดไหม"
E_C19_Jun_Nicky01_03,"ขอบคุณที่มาร่วมกิจกรรมที่มีขึ้นแค่ปีละหนในวันนี้"
E_C19_Jun_Nicky01_04,"สุภาพบุรุษและสุภาพสตรี ยินดีต้อนรับสู่การแข่งขันต่อสู้หลบหลีก!"
E_C19_Jun_Nicky01_05,"ข้าขอแนะนำไวกิ้งแสนสวย แชมเปี้ยนของปีที่แล้ว!"
E_C19_Jun_Nicky01_06,"น่าสมเพช ไปให้พ้นเจ้าพวกโง่!"
E_C19_Jun_Nicky01_07,"อ๊ากกก! กระทืบมัน!"
E_C19_Jun_Nicky01_08,"แล้วก็ผู้ท้าทาย!"
E_C19_Jun_Nicky01_09,"ข้าขอท้านาง"
E_C19_Jun_Nicky01_10,"นางชนะ...รองอันดับหนึ่งเมื่อ 2 ปีที่แล้ว!"
E_C19_Jun_Nicky01_11,"นี่คือเจ้าสาวแห่งฤดูใบไม้ผลิ!"
E_C19_Jun_Nicky01_12,"ข้ารอคอยเวลานี้มานานแล้ว! Nic... เอ่อข้าหมายถึงไวกิ้งแสนสวย"
E_C19_Jun_Nicky01_13,"... อย่าทำให้ข้าเบื่อล่ะ"
E_C19_Jun_Nicky01_14,"เอ่อ... ข้าจะซ้อมให้หนักกว่าเดิม..."
E_C19_Jun_Nicky01_15,"ใช้ได้นี่ แต่เจ้าคงต้องใช้เวลาเกินร้อยปีกว่าจะเอาชนะข้าได้"
E_C19_Jun_Nicky01_16,"ชัยชนะเป็นของไวกิ้งแสนสวย"
E_C19_Jun_Nicky01_17,"มีผู้ท้าทายคนอื่นอีกไหม"
E_C19_Jun_Nicky01_18,"ข้าจะสู้กับแชมเปี้ยนเอง"
E_C19_Jun_Nicky01_19,"โอ้โห! ชาวทะเลนอกรีตผู้งดงามจะมาเป็นผู้ท้าทายคนใหม่! ขอต้อนรับโจรสลัดผมบลอนด์!"
E_C19_Jun_Nicky01_20,"ถ้าเจ้ารักชีวิตก็ยอมแพ้ซะ ข้าจะตวัดดาบเชือดเจ้าอย่างไร้ความปราณี"
E_C19_Jun_Nicky01_21,"หึ! ช่างมั่นใจเสียเหลือเกินนะ"
E_C19_Jun_Nicky01_22,"มาดูกันว่าเจ้าจะรอดได้นานแค่ไหน!"
E_C19_Jun_Nicky01_23,"อ่อก... ข้ายอมแพ้"
E_C19_Jun_Nicky01_24,"ฮ่าฮ่า... เจ้าก็เก่งอยู่นะโจรสลัดผมบลอนด์"
E_C19_Jun_Nicky01_25,"แชมเปี้ยนของเราคือไวกิ้งแสนสวย! ไม่มีใครต้านทานนางได้"
E_C19_Jun_Nicky01_26,"เอาล่ะ ได้เวลาสำหรับกิจกรรมหลักแล้ว!"
E_C19_Jun_Nicky01_27,"ผู้ริเริ่มการแข่งขันต่อสู้หลบหลีก!"
E_C19_Jun_Nicky01_28,"แชมเปี้ยนเก่าและผู้หลงใหลใบแมวผู้ชนะรองอันดับหนึ่งปีที่แล้ว!"
E_C19_Jun_Nicky01_29,"วะฮ่ะฮ่ะ ไม่เจอกันนานเลยนะทุกคน!"
E_C19_Jun_Nicky01_30,"เจ้าเป็นไงบ้าง Nicky"
E_C19_Jun_Nicky01_31,"หุบปากนะนังแมวโง่! ข้าชื่อว่าไวกิ้งผู้สง่างาม!"
E_C19_Jun_Nicky01_32,"เอ้อจริง! เราไม่ควรเรียกชื่อจริงกันสินะ!"
E_C19_Jun_Nicky01_33,"ช่างเถอะ! มาสู้กันเลยแชมเปี้ยน!"
E_C19_Jun_Nicky01_34,"อ่าฮะ ข้าก็อยากสู้เต็มแก่แล้ว"
E_C19_Jun_Nicky01_35,"อ๊าก ให้ตายสิ!"
E_C19_Jun_Nicky01_36,"ฮ่ะฺฮ่ะ! Nicky เจ้าเก่งมากนะ แต่ครั้งนี้ข้าชนะ!"
E_C19_Jun_Nicky01_37,"หึ อย่าเรียกชื่อจริงข้า! เจ้าแมว!"
E_C19_Jun_Nicky01_38,"นี่คือแชมเปี้ยนใหม่ของเรา!"
E_C19_Jun_Nicky01_39,"แชมเปี้ยนปีนี้คือผู้หลงใหลใบแมว!"
E_C19_Jun_Nicky01_40,"ว้ากกกกก!"
E_C19_Jun_Nicky01_41,"ฮ่าฮ่าฮ่า ขอบคุณนะทุกคน สนุกมากเลย"
E_C19_Jun_Nicky01_42,"ไวกิ้งแสนสวย! ข้าหวังว่าจะได้เจอเจ้าอีกในปีหน้า!"
E_C19_Jun_Nicky01_43,"ฮ่าฮ่า เจ้าแมวโง่ ไปลับกรงเล็บให้คมเถอะ"
E_C19_Jun_Nicky01_44,"ปีหน้าข้าจะต้องเป็นแชมเปี้ยน อย่าลืมเสียล่ะ!"
E_C19_Jun_Yanne01_01,"ยินดีต้อนรับ! เร่เข้ามา!"
E_C19_Jun_Yanne01_02,"เมนูพิเศษของเรามีให้ลิ้มลองวันนี้วันเดียว!"
E_C19_Jun_Yanne01_03,"รถขายอาหารของนักล่ามังกร!"
E_C19_Jun_Yanne01_04,"รถขายอาหาร เขาขายอะไรกัน"
E_C19_Jun_Yanne01_05,"อาหารทุกจานทำจากวัตถุดิบหายากที่ข้าเตรียมมา!"
E_C19_Jun_Yanne01_06,"อาหารรสเลิศที่ปรุงอย่างพิถีพิถัน มีจำหน่ายเฉพาะวันนี้เท่านั้น!"
E_C19_Jun_Yanne01_07,"เราจะบริจาครายได้ทั้งหมดให้บ้านเด็กกำพร้าของชาวบาบาเรี่ยน มาชิมอาหารเลิศรสกัน"
E_C19_Jun_Yanne01_08,"ไปลองกันไหม"
E_C19_Jun_Yanne01_09,"โอ้โห! กลิ่นหอมจัง นี่อะไรน่ะ"
E_C19_Jun_Yanne01_10,"อาหารจานนี้พิสดารดีแท้ เหมือนพุดดิ้งสีดำเลย"
E_C19_Jun_Yanne01_11,"พุดดิ้งที่ทำจากโลหิตของสุนัขปีศาจรมควันด้วยผงพริก"
E_C19_Jun_Yanne01_12,"ละ เลือดเหรอ"
E_C19_Jun_Yanne01_13,"ราคาเท่าไหร่ล่ะ เอามาให้หมดเลย เดี๋ยวนี้! มาสิ!"
E_C19_Jun_Yanne01_14,"ได้ เอาไป!"
E_C19_Jun_Yanne01_15,"ฮ่าฮ่า ข้าคงไม่ต้องออกล่าอีกสักพัก!"
E_C19_Jun_Yanne01_16,"ปกติแล้วเรามีอาหารเหลือเต็มเลย แต่ครั้งนี้ขายหมดแฮะ ฮ่าฮ่า"
E_C19_Jun_Yanne01_17,"กลิ่นน่าซึมเศร้านี่มัน กาแฟนี่นา!"
E_C19_Jun_Yanne01_18,"กาแฟคุณภาพดีที่สุดในจักรวรรดิ ผู้เขมือบดอกบัว! เจ้ามาอยู่นี่ได้ไง"
E_C19_Jun_Yanne01_19,"โอ๊ะโอ นั่นทำจากเมล็ดกาแฟที่สไลม์ในหนองน้ำแห่ง Gargoss กลืนลงไปใช่ไหม"
E_C19_Jun_Yanne01_20,"มีคนขอให้ข้าไปล่าสไลม์ไปเมื่อไม่นานมานี้ ข้าเลยหามาได้มาก"
E_C19_Jun_Yanne01_21,"ไม่นึกเลยว่าจะดังขนาดนี้"
E_C19_Jun_Yanne01_22,"กาแฟหายากนี่ประเมินค่าไม่ได้ แต่ที่นี่ขายถูกมาก!"
E_C19_Jun_Yanne01_23,"ข้าได้มาแบบแทบจะไม่ต้องทำอะไร ถ้าเจ้าสนใจ ซื้อไปเท่าไหร่ก็ได้!"
E_C19_Jun_Yanne01_24,"ขอบคุณ ข้าจะซื้อให้มากที่สุด"
E_C19_Jun_Yanne01_25,"ฮี่! วันนี้ขายดิบขายดีนะ"
E_C19_Jun_Yanne01_26,"ข้าซื้อของขวัญให้เด็กๆ ในบ้านเด็กกำพร้าได้ด้วยนะ"
E_C19_Jun_Yanne01_27,"*ฟุด* *ฟิด* กลิ่นน่าอร่อยนั่น..."
E_C19_Jun_Yanne01_28,"ยินดีต้อนรับ! อาหารโปรดของเจ้าคืออะไรล่ะ"
E_C19_Jun_Yanne01_29,"เนื้อสัตว์นี่! อร่อยมาก!"
E_C19_Jun_Yanne01_30,"นี่ จ่ายเงินก่อนสิเจ้า เนื้อมังกรหัวรุนแรงนี่ไม่ได้ให้ฟรีนะ!"
E_C19_Jun_Yanne01_31,"เงินเหรอ คืออะไรน่ะ คนชอบขอให้ข้าจ่ายเงินอยู่เรื่อยหลังจากที่ข้ามาถึงที่นี่"
E_C19_Jun_Yanne01_32,"ที่บ้านเกิดข้าแค่ล่าก็ได้ของกินแล้ว"
E_C19_Jun_Yanne01_33,"เจ้าเป็นคนต่างชาติเหรอ"
E_C19_Jun_Yanne01_34,"ฟังนะ ถ้าเจ้าอยากกินอาหาร ก็ต้องจ่ายเพื่อซื้อมา"
E_C19_Jun_Yanne01_35,"ถ้าอย่างนั้น...ข้าก็กินเนื้อนี่ไม่ได้เหรอ"
E_C19_Jun_Yanne01_36,"ข้าไม่ได้กินอะไรเลยตั้งแต่เมื่อวานนี้..."
E_C19_Jun_Yanne01_37,"ง่ำ..."
E_C19_Jun_Yanne01_38,"อ๊ากกก! ไม่รู้สิ"
E_C19_Jun_Yanne01_39,"ข้าแค่อยากช่วยเด็กๆ..."
E_C19_Jun_Yanne01_40,"ข้าจะให้เจ้ากินฟรีแค่วันนี้เท่านั้น เพราะมันเป็นวันเกิดข้า"
E_C19_Jun_Yanne01_41,"ขอบใจนะ! ขอบใจมาก! ข้าชอบกินเนื้อมาก!"
E_C19_Jun_Yanne01_42,"ช่างเป็นคนดีจริงๆ ที่ให้เนื้อข้า! อร่อยมากเลย! สุขสันต์วันเกิด!"
E_C19_Jun_Yanne01_43,"เอาล่ะ! ขอบคุณที่อวยพรวันเกิดข้านะ"
E_C19_Jun_Yanne01_44,"สุขสันต์วันเกิด Yanne!"
E_C19_Jun_Yanne01_45,"วันนี้ลูกค้าเยอะเหรอ"
E_C19_Jun_Yanne01_46,"เอ๋"
E_C19_Jun_Yanne01_47,"เจ้าจะกินมากแค่ไหนล่ะ"
E_C19_June_Ezekiel_01,"ตื่นได้แล้วลูก! วันนี้เป็นวันเกิดนะ"
E_C19_June_Ezekiel_02,"เดี๋ยวจะทำ 'สิ่งนั้น' ให้กิน รีบตื่นและ..."
E_C19_June_Ezekiel_03,"!!"
E_C19_June_Ezekiel_04,"... วันนี้ข้าคงต้องทำ 'สิ่งนั้น'"
E_C19_June_Ezekiel_05,"สิ่งนั้น' มันคืออะไร"
E_C19_June_Ezekiel_06,"เครมบรูเล่"
E_C19_June_Ezekiel_07,"อะไรนะ"
E_C19_June_Ezekiel_08,"เครมบรูเล่"
E_C19_June_Ezekiel_09,"ทำของหวานที่นี่อ่ะนะ"
E_C19_June_Ezekiel_10,"ข้าสามารถหาอะไรที่คล้ายๆ นมสดในทะเลทรายนี่ได้ และเราก็มีเตาเผาไว้ใช้แทนเครื่องอบ"
E_C19_June_Ezekiel_11,"แต่ปัญหาก็คือน้ำตาลกับไข่"
E_C19_June_Ezekiel_12,"(นี่เจ้าจะทำจริงๆ ใช่ไหม...)"
E_C19_June_Ezekiel_13,"ข้าจะไปถามพวกคนที่เราเจอในทะเลทราย"
E_C19_June_Ezekiel_14,"โอเค"
E_C19_June_Ezekiel_15,"โอ้ ท่าน Theo ไม่เจอกันตั้งนาน ขอบคุณที่ช่วยเหลือเราเมื่อคราวก่อนนะ"
E_C19_June_Ezekiel_16,"ข้าเพียงแค่ทำในสิ่งที่ต้องทำเท่านั้นเอง"
E_C19_June_Ezekiel_17,"ถึงยังงั้น พวกเราก็ขอขอบคุณ แล้ววันนี้ท่านมีธุระอะไรถึงเดินทางมาที่นี่ล่ะ"
E_C19_June_Ezekiel_18,"เอ่อ... เรื่องนั้น..."
E_C19_June_Ezekiel_19,"ข้าอยากทำอาหารซักอย่างนึง ก็เลยมาขอวัตถุดิบบางอย่าง..."
E_C19_June_Ezekiel_20,"ข้าเดาว่าพวกท่านต้องการเครื่องครัว ว่าแต่อยากได้สิ่งใดหรือ"
E_C19_June_Ezekiel_21,"ข้าอยากได้น้ำตาล นมสด และก็ไข่ วานิลลานิดหน่อย และถ้าได้เตาอบด้วยก็คงจะดี"
E_C19_June_Ezekiel_22,"เดี๋ยวข้าหาให้"
