KEY,Portuguese
CONVERSATION_TU_256_1,Pare! Aqui é uma área restrita.
CONVERSATION_TU_256_2,É necessário permissão para entrar aqui!
CONVERSATION_TU_256_3,Meu nome é Kasel e sou um escudeiro.
CONVERSATION_TU_256,Este lugar está uma confusão... O que houve?
CONVERSATION_TU_257,Parece que você ainda não ouviu a notícia. Um cofre antigo foi descoberto no subsolo.
CONVERSATION_TU_257_1,"Especula-se que seja da antiga Família Real. Uma equipe de análise foi enviada mas,"
CONVERSATION_TU_257_2,uma aparição inesperada de monstros está causando problemas.
CONVERSATION_TU_258,"Monstros no reino, não posso acreditar..."
CONVERSATION_TU_259,"Exceto os escudeiros, a maioria dos cavaleiros foi enviada para conter os monstros."
CONVERSATION_TU_260,Todas as atividades da Ordem dos Cavaleiros estão suspensas até que a situação fique sob controle.
CONVERSATION_TU_261,"Kasel, não é melhor voltarmos?"
CONVERSATION_TU_262,Não deve ser fácil realizar qualquer trabalho de cavalaria nesta situação.
CONVERSATION_TU_263,Hmm...
CONVERSATION_TU_264,"Apesar de ser um mero escudeiro, quero contribuir como se fosse um cavaleiro."
CONVERSATION_TU_265,Tem alguma coisa que eu possa fazer?
CONVERSATION_TU_266,Estávamos recrutando pessoas com habilidades para conter os monstros.
CONVERSATION_TU_266_1,"Quanto mais voluntários participarem, mais rápido a Ordem dos Cavaleiros voltará ao normal."
CONVERSATION_TU_266_2,"Além disso, o imperador disse que dará uma boa recompensa caso os monstros sejam contidos."
CONVERSATION_TU_266_3,"Portanto, sugiro que você também participe."
CONVERSATION_TU_267,Deixe-me ver… Uhu! Faltam apenas 7 anos para acabar o meu turno!
CONVERSATION_TU_268,"Uau, tem uma torre antiga neste lugar. Que estranho."
CONVERSATION_TU_269,"O quê? Humanos?! Vocês são humanos, certo?"
CONVERSATION_TU_270,Não acredito que estou vendo humanos que tanto ouvi falar em histórias.
CONVERSATION_TU_271,"Há quanto tempo, Dosarta."
CONVERSATION_TU_272,"Selene, minha irmã! Como estou feliz em te ver!"
CONVERSATION_TU_273,Mas quem são essas pessoas que estão ao seu lado…?
CONVERSATION_TU_274,"Dosarta, cumprimente-os. Estes são o Guerreiro da Espada Sagrada e seus companheiros."
CONVERSATION_TU_275,"Guerreiro da... Espada? É sério, Selene?"
CONVERSATION_TU_276,Uau! Nunca imaginei que encontraria uma pessoa tão importante aqui!
CONVERSATION_TU_277,"Hahahaha... Imagina, não sou tão importante assim."
CONVERSATION_TU_278,"Um minuto... Dosarta chamou a princesa Selene de irmã, então ela também...?"
CONVERSATION_TU_279,"Sim, Dosarta é minha irmã mais nova."
CONVERSATION_TU_280,"Este lugar, a Torre do Desafio, é uma área protegida pela família real dos elfos."
CONVERSATION_TU_281,Os filhos da família real dos elfos se revezam a cada 20 anos para vigiar a Torre do Desafio.
CONVERSATION_TU_282,20 anos...?
CONVERSATION_TU_283,"Não se assuste. Para os elfos, 20 anos seriam como 2 anos para os humanos."
CONVERSATION_TU_284,"Mas Selene, o Guerreiro da Espada Sagrada veio até aqui porque..."
CONVERSATION_TU_285,Sim. Quer dizer que está na hora de abrir a Torre do Desafio.
CONVERSATION_TU_286,Então… eles virão regularmente à torre? Agora não ficarei mais entediada!
CONVERSATION_TU_287,"Ei, vocês duas. Me desculpe por interromper a conversa, mas será que vocês poderiam nos explicar sobre a Torre do Desafio?"
CONVERSATION_TU_288,Porque é a primeira vez que escuto sobre a existência de uma torre tão alta na Floresta de Elidora.
CONVERSATION_TU_289,"A Torre do Desafio existe há muito tempo, mesmo antes da história passar a ser escrita."
CONVERSATION_TU_290,"Nossa família real dos elfos vem pesquisando sobre a torre por muitos anos,"
CONVERSATION_TU_291,mas ainda não conseguimos desvendar quando e por que ela foi construída.
CONVERSATION_TU_292,"Mas enquanto investigávamos a torre, encontramos fragmentos de artefatos antigos."
CONVERSATION_TU_293,Conseguimos juntar os fragmentos e recuperar a forma do objeto.
CONVERSATION_TU_294,"E ainda descobrimos que esses artefatos, além de serem especiais, possuem um grande poder "
CONVERSATION_TU_295,Especiais e... poderosos?
CONVERSATION_TU_296,"Como o Guerreiro da Espada Sagrada está aqui, vou contar toda a história."
CONVERSATION_TU_297,"Há um século, Kyle, o rei de Orvelia, estava à procura de uma força poderosa para enfrentar os demônios."
CONVERSATION_TU_298,Então o rei escutou os rumores sobre este lugar e começou a subir a torre.
CONVERSATION_TU_299,Dentro da torre existem monstros terríveis por todos os andares.
CONVERSATION_TU_300,"Dizem que são criaturas que sentem a diferença de energia no ambiente,"
CONVERSATION_TU_301,"e para ter acesso aos fragmentos dos artefatos, é necessário passar pelas criaturas."
CONVERSATION_TU_302,Energia diferente no ambiente...? Então eles são monstros do além?
CONVERSATION_TU_303,Ainda não sabemos os detalhes. São apenas hipóteses dos cientistas que estudaram a torre.
CONVERSATION_TU_304,"Bom, de qualquer maneira, o rei Kyle conseguiu juntar todos os fragmentos espalhados dos artefatos,"
CONVERSATION_TU_305,"e com a ajuda da família real dos elfos, conseguiu restaurar os artefatos."
CONVERSATION_TU_306,"Depois disso, todos os seres vivos de Elidora passaram a admirar o rei Kyle por ter enfrentado sozinho as criaturas das trevas."
CONVERSATION_TU_307,"E em homenagem ao espírito desafiador do rei, este local passou a ser chamado de 'Torre do Desafio'."
CONVERSATION_TU_308,Que história incrível.
CONVERSATION_TU_309,"Sim, mas as criaturas das trevas deste lugar continuam fortes e implacáveis."
CONVERSATION_TU_310,"A notícia do heroísmo do rei Kyle espalhou-se rapidamente e diversos aventureiros apareceram,"
CONVERSATION_TU_311,"mas infelizmente todos eles falharam. No pior dos casos, o desafiante perdeu a própria vida."
CONVERSATION_TU_312,"Por isso nós, da família real dos elfos, estamos até hoje vigiando esse local para não deixar ninguém entrar na torre."
CONVERSATION_TU_313,"Porém, agora que, juntamente com a ameaça dos demônios, a Espada Sagrada Aea se revelou,"
CONVERSATION_TU_314,nossa missão é abrir as portas da torre e fornecer ao guerreiro a oportunidade de recuperar os artefatos.
CONVERSATION_TU_315,"Espero que este lugar ofereça uma boa oportunidade para refinar ainda mais as suas habilidades, guerreiro."
CONVERSATION_TU_316,"Kyle, o Rei de Orvelia, disse que precisava de uma força poderosa para enfrentar os demônios."
CONVERSATION_TU_317,"Assim, entrou na torre e"
CONVERSATION_TU_318,enfrentou os seres que haviam perdido a sanidade e gritavam 'meu precioso'.
CONVERSATION_TU_319,"De lá, retirou os fragmentos dos artefatos e depois os restaurou."
CONVERSATION_TU_320,Parece que o Rei Kyle não foi amaldiçoado.
CONVERSATION_TU_321,Alguns fragmentos que o Rei Kyle trouxe não puderam ser recuperados e foram enviados para análise.
CONVERSATION_TU_322,"Descobriram que os artefatos, uma vez quebrados, não continham mais a maldição."
CONVERSATION_TU_323,Quer dizer que a maldição não se manifesta mesmo depois do artefato ser restaurado.
CONVERSATION_TU_324,"Melhor dizer que a maldição se manifesta apenas dentro da torre, e se o artefato estiver inteiro."
CONVERSATION_TU_325,"Apesar de ainda não haver um estudo conclusivo, agora parece não haver mais artefatos inteiros."
CONVERSATION_TU_326,"E como ainda há muitos mortos-vivos com a maldição do 'meu precioso',"
CONVERSATION_TU_327,fechamos as portas da torre e passamos a vigiá-la.
CONVERSATION_TU_328,"Mas agora que a Espada Sagrada reapareceu, evidenciando que o mundo está em perigo,"
CONVERSATION_TU_329,os guerreiros devem abrir as portas da torre e iniciar o desafio.
CONVERSATION_CHPT01,Capítulo 1: O Início da Jornada
CONVERSATION_1,"700 EC, Reino de Orvelia, Planícies do Rei"
CONVERSATION_SILENCE,...
CONVERSATION_SURPRISE,!!!
CONVERSATION_FLINCH,...!
CONVERSATION_INTRO_51,"Há cerca de um século, um mago abriu o Portão do Demônio"
CONVERSATION_INTRO_52,por onde saíram demônios que invadiram todo o continente.
CONVERSATION_INTRO_53,"Angmund, o Senhor das Trevas e líder dos demônios"
CONVERSATION_INTRO_54,"proclamou-se soberano rei do mundo,"
CONVERSATION_INTRO_55,"enchendo-o de sangue, lágrimas e clamores."
CONVERSATION_INTRO_56,"Em meio ao desespero, um destemido grupo de humanos avançou em direção à fortaleza de Angmund."
CONVERSATION_INTRO_57,"Esses humanos eram Kyle, o Rei de Orvelia, e seus companheiros."
CONVERSATION_INTRO_58,Uma batalha truculenta se estendeu em frente à fortaleza de Angmund.
CONVERSATION_INTRO_59,"Enquanto seus companheiros lutavam com todas as forças contra a Legião das Trevas, "
CONVERSATION_INTRO_60,"Kyle entrou sozinho no castelo do Senhor das Trevas,"
CONVERSATION_INTRO_61,"fincando, por fim, a Espada Sagrada Aea no seu coração."
CONVERSATION_INTRO_62,"No lugar, não restou nada além da espada."
CONVERSATION_INTRO_63,Nenhum traço do Rei Kyle ou de Angmund foi encontrado.
CONVERSATION_INTRO_64,"Sem o seu líder, os demônios logo perderam as forças"
CONVERSATION_INTRO_65,e os residentes da terra acabaram vitoriosos na guerra.
CONVERSATION_INTRO_66,"Mas com o passar do tempo, quando as feridas da guerra começavam a se curar"
CONVERSATION_INTRO_67,uma escuridão nunca vista começou a envolver a Espada Sagrada Aea.
CONVERSATION_INTRO_68,"Assim, os heróis que haviam lutado ao lado do rei Kyle"
CONVERSATION_INTRO_69,"selaram a espada na Árvore do Mundo abençoada por Lua, a Deusa da Luz."
CONVERSATION_INTRO_70,desejando proteção contra a escuridão para todo o sempre.
CONVERSATION_INTRO_71,Um século depois que o Portão do Demônio fora aberto
CONVERSATION_INTRO_72,"não se encontram mais vestígios da guerra no reino dos humanos, Orvelia."
CONVERSATION_INTRO_73,"Muitos ainda acreditam que a paz continuará por longos anos,"
CONVERSATION_INTRO_74,mas a escuridão começou a circundar a Árvore do Mundo.
CONVERSATION_INTRO_75,"Iris, a Sumo Sacerdotisa da Ordem da Lua,"
CONVERSATION_INTRO_76,"percebeu que o espírito de Angmund não havia se extinguido,"
CONVERSATION_INTRO_77,"mas que estava reaparecendo, mesmo que ainda fracamente."
CONVERSATION_INTRO_78,"Assim, o Reino de Orvelia decide expedir suas tropas para uma investigação."
CONVERSATION_5000,Faltava só mais um pouco para me tornar um cavaleiro. Por que justo agora...?
CONVERSATION_5001,Hahaha! Está frustrado por não fazer parte da expedição?
CONVERSATION_5002,"Esse é o Kasel que conheço! Ainda é um escudeiro, mas já é tão valente!"
CONVERSATION_5003,Não estou frustrado. Quero ir junto porque estou é preocupado.
CONVERSATION_5004,Dizem que esta é a maior expedição desde a guerra contra a Legião das Trevas.
CONVERSATION_5005,Hahaha! Um escudeiro preocupado com a expedição da Ordem dos Cavaleiros.
CONVERSATION_5006,Os cavaleiros ficarão ofendidos se ouvirem isso. Vai acabar levando outra bronca.
CONVERSATION_5007,Não me importo em levar broncas. Será que não tem mesmo como eu ir junto?
CONVERSATION_5008,"Kasel, como eu já te disse,"
CONVERSATION_5009,é seu dever proteger o povo de Orvel durante a nossa ausência.
CONVERSATION_5010,Não há função mais nobre a um escudeiro do que proteger seu povo e sua nação. Não se esqueça disso.
CONVERSATION_5011,Certo. E um escudeiro deve confiar na expedição e cumprir seu dever aqui.
CONVERSATION_5012,"Agora, erga os ombros, Kasel. Em breve, será um cavaleiro pleno."
CONVERSATION_5013,"Um dia, certamente, seus feitos serão importantes para nossa terra natal,"
CONVERSATION_5014,e estarei lá com você.
CONVERSATION_5015,Nem parece você falando assim tão sério. Está me dando um mau pressentimento.
CONVERSATION_5016,Bem... Digamos que às vezes sei falar frases inspiradoras. Hahaha!
CONVERSATION_5017,Haha. Não foi tão inspiradora assim.
CONVERSATION_5018,Muito bem! Continue com esse sorriso até eu voltar. Cumprirei a missão e logo estarei de volta.
CONVERSATION_5019,Pela honra dos Cavaleiros Reais de Orvelia!
CONVERSATION_5020,"Está bem, confiarei em você e no seu retorno em segurança!"
CONVERSATION_2302,28 dias depois...
CONVERSATION_5021,Não há notícias da expedição até agora.
CONVERSATION_5022,"Dizem por aí que o objetivo da expedição não era investigar,"
CONVERSATION_5023,e sim lutar contra os demônios que reapareceram.
CONVERSATION_5024,"Não posso mais ficar assim parado, apenas esperando."
CONVERSATION_5025,Se realmente são demônios...
CONVERSATION_5026,preciso ir.
CONVERSATION_5027,Não posso deixar Clause em apuros!
CONVERSATION_5028,A expedição foi rumo ao sul e depois ao leste.
CONVERSATION_5029,Certamente encontrarei Clause se eu for nessa direção.
CONVERSATION_5030,"Kasel, aonde você vai?"
CONVERSATION_5031,Hein? F-Frey... Você não deveria estar no templo?
CONVERSATION_5032,Estou de folga a partir de hoje.
CONVERSATION_5033,"Se estiver partindo à procura de Clause, irei com você."
CONVERSATION_5034,Como você sabia que...?
CONVERSATION_5035,É que eu faria o mesmo se eu empunhasse uma espada.
CONVERSATION_5036,O que você está dizendo?! É perigoso para uma aprendiz de sacerdotes deixar o castelo!
CONVERSATION_5037,Não há notícias nem dos cavaleiros... Não sabemos o que se passa lá fora.
CONVERSATION_5038,"Ai ai, Kasel... O que você sabe sobre os sacerdotes?"
CONVERSATION_5039,"Claro que é perigoso para um sacerdote se aventurar sozinho, "
CONVERSATION_5040,"mas é igualmente perigoso para um indivíduo, que nem cavaleiro ainda é, sair por aí sem um sacerdote!"
CONVERSATION_5041,Mas...
CONVERSATION_5042,"Você não tem o direito de dizer não, Kasel."
CONVERSATION_5043,Você não é o único que está preocupado com o Clause.
CONVERSATION_5044,"E se, ainda por cima, você também não voltar..."
CONVERSATION_5045,...
CONVERSATION_5046,"Está bem, venha comigo."
CONVERSATION_5047,"Mas com a condição de que ficará sempre perto de mim,"
CONVERSATION_5048,pois não sabemos que tipo de perigo nos espera lá fora.
CONVERSATION_5049,"Frey, deves deixar o templo hoje."
CONVERSATION_5050,"Sumo Sacerdotisa, o que a senhora quer dizer com isso? Fiz algo de errado?"
CONVERSATION_5051,Não é isso. É que tens uma missão.
CONVERSATION_5052,"Aonde o coração te direcionar, Lua guiará o caminho. "
CONVERSATION_5053,"Meu coração apenas deseja servir Lua, a Deusa da Luz."
CONVERSATION_5054,Tenho conhecimento da tua profunda fé. E também ciência da tua grande preocupação...
CONVERSATION_5055,Sumo Sacerdotisa...
CONVERSATION_5056,Deixa o templo e vai à entrada da capital. Lá encontrarás o caminho.
CONVERSATION_5058,"Lua te guiará pelo caminho, mas ele será repleto de adversidades."
CONVERSATION_5059,Que Lua ilumine o teu caminho contra as forças sombrias.
CONVERSATION_5060,Adversidades? Clause está passando por muitas delas...
CONVERSATION_5061,"Você será capaz de encontrá-lo na entrada da capital, fora do templo."
CONVERSATION_5062,Você deve ajudá-lo para que ele não sucumba à escuridão.
CONVERSATION_5063,Um caminho cheio de adversidades...
CONVERSATION_5064,serei capaz de seguir o caminho da justiça?
CONVERSATION_5065,O que será que está acontecendo lá fora...?
CONVERSATION_5066,"Frey, vai ficar aí parada? Vamos!"
CONVERSATION_5067,"Espere, Kasel! Estou indo!"
CONVERSATION_5068,"Deusa Lua, que esteja sempre conosco, iluminando o nosso caminho."
CONVERSATION_5069,e que nos guie iluminando nosso caminho.
CONVERSATION_5070,Já passamos metade do dia caminhando... Será que está tudo bem com a expedição?
CONVERSATION_5071,"Não se preocupe, Kasel. Iremos encontrá-los logo."
CONVERSATION_2356,"Vai embora, Roi!"
CONVERSATION_2357,*Suspiro*
CONVERSATION_2358,"Ai ai, Cleo... Por favor... A Torre está de cabeça para baixo por causa de você."
CONVERSATION_2359,As pessoas da Torre estão preocupadas com você.
CONVERSATION_2360,Ah! Mas que coisa!!
CONVERSATION_2361,"Eu sei como você se sente, mas eu também não tenho escolha."
CONVERSATION_2362,eu também tenho um dever a cumprir.
CONVERSATION_2363,Pense em como ele deve estar preocupado com você...
CONVERSATION_2364,Cale-se! Cale-se! Cale-se! Vai embora! Já disse para ir embora!
CONVERSATION_2367,Hã? Psiu! Senhor cavaleiro!
CONVERSATION_2368,"Parece que ela está lhe chamando, Kasel."
CONVERSATION_2369,Hmm? Me chamando?
CONVERSATION_2370,"Me ajude, por favor! Tem um p-pervertido!!"
CONVERSATION_2371,"Ai ai, Cleo..."
CONVERSATION_2372,"Kasel, devemos protegê-la contra o pervertido!"
CONVERSATION_2373,Raios! Já vou avisando que é tudo um grande engano!
CONVERSATION_2374,"Estamos só resolvendo algumas coisas, há um mal-entendido aqui."
CONVERSATION_2375,Eu só...
CONVERSATION_2376,Ahhh! Socorro!
CONVERSATION_2377,"Não sei quem você é, mas não chegue perto desta moça!"
CONVERSATION_2378,Afaste-se da senhorita!
CONVERSATION_2380,Ai ai... Mas que coisa...
CONVERSATION_2381,"Olhem em volta, vocês três."
CONVERSATION_2382,Lobos? Quando apareceram?
CONVERSATION_2383,Essa cena toda que você fez deve tê-los atraído.
CONVERSATION_2384,"Bom, agora não temos escolha."
CONVERSATION_2385,"Pervertido ou não, temos de lidar com isso primeiro."
CONVERSATION_2386,Não tem outro jeito... Vamos resolver isto primeiro!
CONVERSATION_2387,Ah! Esses cachorrinhos não sabem o momento certo para interromper uma conversa!
CONVERSATION_2388,Esses cãezinhos não conseguem perceber o clima aqui!
CONVERSATION_2389,Tomem cuidado!
CONVERSATION_2390,Acabamos com todos eles?
CONVERSATION_2392,Acho que ainda é cedo para cantar vitória.
CONVERSATION_2393,Ah! Tem mais vindo!
CONVERSATION_2394,Parece que o maior é o líder deles.
CONVERSATION_2395,Parece que ele é o líder da alcateia.
CONVERSATION_5595,"Então, matá-lo dispersará o restante?"
CONVERSATION_5596,Acho que sim.
CONVERSATION_5597,Quem diria? Uma alcateia perto do vilarejo...
CONVERSATION_5598,Muitos guardas foram arrastados para a expedição.
CONVERSATION_5599,"Vamos acabar com eles. Tome cuidado, Frey."
CONVERSATION_5072,Ufa... Ainda bem que saímos ilesos.
CONVERSATION_5073,Se não fosse aquele cavaleiro estaríamos em apuros. 
CONVERSATION_5074,Mas não muda o fato dele ser um pervertido.
CONVERSATION_5075,"Olhe, senhorita. Não é assim que se trata uma pessoa perfeitamente normal como eu. "
CONVERSATION_2406,"Assim como já expliquei, minha missão é levar a Cleo para casa."
CONVERSATION_2407,"Não sou, Cleo?"
CONVERSATION_2408,Não caiam nas mentiras desse pervertido!
CONVERSATION_2409,"Cleo... Já chega, né?"
CONVERSATION_2410,Você quer me ver lutando com eles só por causa da sua teimosia?
CONVERSATION_2411,Chega.
CONVERSATION_2412,"Vamos voltar, Cleo."
CONVERSATION_2413,... Não volto mesmo assim! Já tomei a minha decisão!
CONVERSATION_2414,Deixei isso bem claro!
CONVERSATION_2415,Agora não estou brincando.
CONVERSATION_2416,Eu...!
CONVERSATION_2417,"Ah... Sim, entendo que você queira encontrar pistas, mas..."
CONVERSATION_2418,Você tem evidências para achar...
CONVERSATION_2419,Com licença?
CONVERSATION_2420,Com licença... Não queremos nos intrometer e... já percebemos que você não é um pervertido.
CONVERSATION_2421,"Então, se vocês nos dão licença..."
CONVERSATION_2422,Devo-lhe desculpas. Realmente pensei que fosse um pervertido...
CONVERSATION_2423,Não se preocupe. Mais importante do que isso...
CONVERSATION_2424,"Sei que não foi a intenção, mas não é melhor pedir desculpas pelos problemas que você causou?"
CONVERSATION_2425,Hunf!
CONVERSATION_5076,Haha. Você não precisa se desculpar.
CONVERSATION_5077,Desculpe-me se o julguei mal.
CONVERSATION_5078,"Está bem. Seu nome é Cleo, certo?"
CONVERSATION_5079,"Não sei o que procura, mas orarei para que encontre logo."
CONVERSATION_5080,"E, a meu ver, parece que o senhor..."
CONVERSATION_5081,Qual é o seu nome mesmo? 
CONVERSATION_5082,Me chamo Roi.
CONVERSATION_5083,Parece que o senhor Roi está realmente preocupado com você. Que tal não deixá-lo em maus lençóis?
CONVERSATION_2430,Uhhh... Sinto muito! Parece que eu causei muita confusão...
CONVERSATION_2431,Desculpe-me se a coloquei em perigo...
CONVERSATION_2432,Hein? Você sabe pedir desculpas? Essa é nova...
CONVERSATION_2433,Você pediu desculpas?
CONVERSATION_2434,"Mas Roi, não penso em voltar mesmo."
CONVERSATION_2435,"Mesmo que você me arraste de volta, vou sair quantas vezes for necessário!"
CONVERSATION_2436,Porque eu tenho que...
CONVERSATION_2437,"Vou fugir de novo e de novo. Um milhão de vezes, se precisar. Tem algo que devo fazer!"
CONVERSATION_5084,"Cleo, já lhe disse..."
CONVERSATION_5085,"Aonde vocês estão indo? Com base na direção que vocês vieram, acabaram de sair de Orvel, né?"
CONVERSATION_5086,Ainda não terminei de fal...
CONVERSATION_5087,"Ah, claro! E vocês vinham da direção oposta, certo?"
CONVERSATION_5088,Por acaso não se depararam com uma expedição de Orvel?
CONVERSATION_5089,Com licença. Que tal falarmos um de cada vez?
CONVERSATION_5090,Perdão. É que estamos procurando uma expedição que saiu de Orvel.
CONVERSATION_5091,Já faz um mês que não temos notícias...
CONVERSATION_5092,"Hmm... Pensando agora, vimos, sim, rastros de um acampamento."
CONVERSATION_5093,"Sim, meu irmão."
CONVERSATION_5094,Kasel e eu crescemos com ele no mesmo orfanato...
CONVERSATION_5095,Hmm...
CONVERSATION_5096,"Pensando nisso, nós realmente vimos vestígios de um acampamento no caminho."
CONVERSATION_5097,"Ah, eu também vi! Vamos juntos! Eu mostro o caminho."
CONVERSATION_5098,Por que não vêm conosco? Levaremos vocês até lá!
CONVERSATION_5099,Hã? Desde quando você é tão gentil assim?
CONVERSATION_5100,Interessante. É um tipo de afeição que nunca senti na Torre dos Sábios...
CONVERSATION_5101,Vou sugerir a contratação de uma sacerdotisa assim que voltarmos.
CONVERSATION_5102,O que você está murmurando aí sozinho?
CONVERSATION_5103,"Não sei o que você está tramando, mas acho melhor você ir embora."
CONVERSATION_5104,Eu decidi ajudar esses dois.
CONVERSATION_5105,Vou ficar com esses caras. Eles precisam da minha ajuda!
CONVERSATION_5106,Ai ai... Você e sua teimosia...
CONVERSATION_5107,"Camarada, se importaria se eu os acompanhasse?"
CONVERSATION_2466,"Permita-nos acompanhá-los por um tempo, Senhor Cavaleiro."
CONVERSATION_2467,Também tenho meus motivos.
CONVERSATION_2468,Quê? Roi?
CONVERSATION_2469,Não posso ignorar o meu juramento à Torre dos Sábios.
CONVERSATION_5108,Muito obrigado. Retribuirei esse grande favor quando encontrarmos o Clause.
CONVERSATION_5109,"Que sorte temos, Kasel."
CONVERSATION_2472,"Então vou me apresentar formalmente. Eu sou a maga Cleo, da Torre dos Sábios."
CONVERSATION_5110,"Me chamo Cleo, e eu sou uma feiticeira da Torre dos Sábios."
CONVERSATION_2474,Eu...
CONVERSATION_5111,"Sou Roi, o guarda-costas desta menina."
CONVERSATION_2476,O nome é Roi.
CONVERSATION_2477,Meu nome é Kasel e sou um escudeiro de Orvel.
CONVERSATION_2478,"E eu sou Frey, uma aprendiz de sacerdotisa da Ordem da Lua."
CONVERSATION_5112,Vocês são meros... escudeiro e aprendiz?
CONVERSATION_5113,"Que foi, Roi? Está menosprezando os aprendizes?"
CONVERSATION_5114,"Não, pelo contrário. Fiquei surpreso com a habilidade deles."
CONVERSATION_5115,Haha. É mesmo?
CONVERSATION_5116,Aquela sacerdotisa... Tem uma capacidade incrível de acalmar a Cleo. Vai ser muito útil.
CONVERSATION_5117,Seu talento para influenciar pessoas é considerável. Muito útil. Fufufu...
CONVERSATION_5118,Hum? Por que ele está olhando para a Frey com esse sorriso malicioso?
CONVERSATION_5119,"C-Cleo, você tem certeza que ele não é um pervertido?"
CONVERSATION_5120,Besteira.
CONVERSATION_5121,"Hahaha! Eu garanto. O Roi pode ser um babaca de vez em quando, mas pervertido ele não é."
CONVERSATION_5122,Mas... Hmmm... dá para entender o motivo desse sorriso...
CONVERSATION_5123,Não é educado fixar os olhos nas partes do corpo de alguém.
CONVERSATION_5123_GF,Não é educado fixar os olhos numa pessoa dessa maneira.
CONVERSATION_5124,O quê? Seu babaca! Todo esse engano foi por causa do seu sorriso malicioso!
CONVERSATION_5125,Nada disso. Foi porque você me chamou de pervertido no começo.
CONVERSATION_5126,Com licença... Que tal partirmos agora?
CONVERSATION_5127,Temos que encontrá-los o quanto antes.
CONVERSATION_5128,"Ah claro, claro! Vamos partir!"
CONVERSATION_2483,"Uau, o que é aquilo?"
CONVERSATION_2484,"Olha, são visgos! Não são fofos?"
CONVERSATION_2485,Fo...fos?
CONVERSATION_2486,Uma vez tentei domesticar um visgo em casa...
CONVERSATION_2487,mas derreteu até a garrafa onde ele estava.
CONVERSATION_2488,E quem teve que limpar tudo fui eu.
CONVERSATION_2489,"Roi, é por isso que as garotas não gostam de você. É tão mesquinho, lembrando de detalhes irrelevantes."
CONVERSATION_2490,Vocês dois parecem bem íntimos.
CONVERSATION_2491,Como é que é?!
CONVERSATION_5129,Por que ele está examinando aquele visgo com tanto cuidado?
CONVERSATION_5130,Kasel finalmente descobriu quão encantadores visgos podem ser!!
CONVERSATION_5131,As armas cravadas no visgo... estava vendo se elas pertenciam aos nossos cavaleiros ou à outra expedição de Orvel.
CONVERSATION_5132,Felizmente não.
CONVERSATION_5133,"Você percebeu errado o estado de espírito daqui, Cleo."
CONVERSATION_5134,Oh não. Lamento se deixei você envergonhado.
CONVERSATION_5135,"Correto, senhorita Cleo. Kasel só estava um pouco preocupado..."
CONVERSATION_5136,"Está vendo, Roi?"
CONVERSATION_5137,Hah... acho que fui eu agora.
CONVERSATION_5137_0,"Está tudo certo, Sr. Roi. Eu acho que você disse isso sem considerar os sentimentos de Kasel."
