KEY,"Russian"
Sub1_Rephy_1_1_1,"Проводник Синей звезды"
Sub1_Rephy_1_1_2,"У каждого живого существа есть душа."
Sub1_Rephy_1_1_3,"И хотя жизнь конечна,"
Sub1_Rephy_1_1_4,"души не покидают этот мир света."
Sub1_Rephy_1_1_5,"Все они возвращаются к себе домой,"
Sub1_Rephy_1_1_6,"на Синюю звезду."
Sub1_Rephy_1_1_7,"И там, в саду королевы Синей звезды Асифии,"
Sub1_Rephy_1_1_8,"они пребывают в мире и покое."
Sub1_Rephy_1_1_9,"Они ждут, когда Луа призовет их и"
Sub1_Rephy_1_1_10,"отправит обратно в мир света."
Sub1_Rephy_1_1_11,"Конечно, не всем душам удается вернуться."
Sub1_Rephy_1_1_12,"Только чистые души, преодолевшие Мост Звездного Сияния,"
Sub1_Rephy_1_1_13,"попадают на Синюю звезду."
Sub1_Rephy_1_1_14,"Души, заблудившиеся по дороге к Мосту Звездного Сияния,"
Sub1_Rephy_1_1_15,"будут осквернены тьмой."
Sub1_Rephy_1_1_16,"Вот зачем нужны проводники душ."
Sub1_Rephy_1_1_17,"Чтобы души не сбились с пути,"
Sub1_Rephy_1_1_18,"они берут лампы, освещающие Туманные Холмы..."
Sub1_Rephy_1_1_19,"..."
Sub1_Rephy_1_1_20,"Ты меня слушаешь?"
Sub1_Rephy_1_1_21,"Леви... Леви! Леви!"
Sub1_Rephy_1_2_1,"А? Что? Я не спал. Клянусь!"
Sub1_Rephy_1_2_2,"Леви! Ну как же так?! Какой это уже раз по счету?"
Sub1_Rephy_1_2_3,"Я рассказываю тебе о самой главной работе в племени тамии, а ты дрыхнешь..."
Sub1_Rephy_1_2_4,"Что? Нет! Леви внимательно слушал все, что ему рассказывали!"
Sub1_Rephy_1_2_5,"С помощью Светоча богов, который нам дал страж Синей звезды,"
Sub1_Rephy_1_2_6,"мы можем... эм... поджечь Туманные Холмы?"
Sub1_Rephy_1_2_7,"Что ты вообще несешь?"
Sub1_Rephy_1_2_8,"Слушай! Мы освещаем Туманные Холмы ярким светом, словно светом маяка!"
Sub1_Rephy_1_2_9,"Затем мы заставляем Мост Звездного Сияния вновь сверкать, чтобы заблудшие души могли найти путь к Синей звезде..."
Sub1_Rephy_1_2_10,"Х-р-р... Х-р-р..."
Sub1_Rephy_1_2_11,"Опять спишь?.."
Sub1_Rephy_1_2_12,"Ох... И почему перед тем, как отправиться на Синюю звезду, мудрец назначил именно этого нерадивого юнца своим преемником?"
Sub1_Rephy_1_2_13,"За что мне все это?.. Почему я должен возиться с этим мальчишкой?"
Sub1_Rephy_1_2_14,"Хм? *Принюхивается* Что это за запах... Эй! Здесь воняет!"
Sub1_Rephy_1_2_15,"Как ты смеешь? Я мылся всего лишь месяц назад! Это не от меня..."
Sub1_Rephy_1_2_16,"Да нет же... Это, должно быть..."
Sub1_Rephy_1_2_17,"Запах тьмы... Точно, я чувствую жуткий запах!"
Sub1_Rephy_1_2_18,"Это темные души!"
Sub1_Rephy_1_2_19,"Леви! Стой! Одному идти слишком опасно!"
Sub1_Rephy_1_3_1,"Какой невыносимый запах... Все эти темные души – демоны!"
Sub1_Rephy_1_3_2,"Как они посмели заявиться в наш Город Фонарщиков?!"
Sub1_Rephy_1_3_3,"Души леса! Взываю к вашей помощи!"
Sub1_Rephy_1_4_1,"Хи-хи! Теперь вы знаете, на что способен Проводник душ Леви! Правда?"
Sub1_Rephy_1_4_2,"Ты?!"
Sub1_Rephy_1_4_3,"..."
Sub1_Rephy_1_4_4,"Ты из тамианцев... Как ты можешь быть темной душой?!"
Sub1_Rephy_1_4_5,"Души света... давайте все вместе..."
Sub1_Rephy_1_4_6,"отправимся... в темную бездну..."
Sub1_Rephy_1_4_7,"Ни за что! Эй, ты меня слышишь? Очнись!"
Sub1_Rephy_1_4_8,"Сюда! Следуй за светом лампы! Не подходи слишком близко ко тьме!"
Sub1_Rephy_1_5_1,"Что здесь происходит?"
Sub1_Rephy_1_5_2,"Никто не может попасть в Город Фонарщиков в лесу Элидоры без нашего разрешения... Как демоны сюда проникли?"
Sub1_Rephy_1_5_3,"Эта темная душа была нашим соплеменником?"
Sub1_Rephy_1_5_4,"Да..."
Sub1_Rephy_1_5_5,"Мне... не удалось его спасти. Я все говорил, чтобы он вышел из тьмы..."
Sub1_Rephy_1_5_6,"И я зажег Светоч богов... Почему он не сработал?"
Sub1_Rephy_1_5_7,"Вы же говорили, что каждая душа может безопасно пересечь Мост Звездного Сияния, когда мы зажигаем лампу!"
Sub1_Rephy_1_5_8,"Леви... Успокойся. Одного Светоча богов недостаточно."
Sub1_Rephy_1_5_9,"И я говорил, что зажигать лампу нужно на Туманных Холмах, чтобы души снова последовали за светом."
Sub1_Rephy_1_5_10,"Значит... Если я зажгу лампу на каких-то Туманных Холмах..."
Sub1_Rephy_1_5_11,"Все души смогут вернуться к себе домой, на Синюю звезду?"
Sub1_Rephy_1_5_12,"Конечно. Неужто ты меня слушал?"
Sub1_Rephy_1_5_13,"Туманные Холмы – это самое темное место по дороге к Мосту Звездного Сияния."
Sub1_Rephy_1_5_14,"Если душа там заблудится, она оскверняется тьмой, как вот эта душа."
Sub1_Rephy_1_5_15,"Фух. Слава свету."
Sub1_Rephy_1_5_16,"А я уж было подумал, что вся эта история со Светочем богов – очередная сказка."
Sub1_Rephy_1_5_17,"Как ты можешь так думать?! Светоч богов – самое ценное сокровище племени тамии."
Sub1_Rephy_1_5_18,"С его помощью наше племя выполняет божественный долг, возложенный на нас богом-драконом Якобини, стражем Синей звезды!"
Sub1_Rephy_1_5_19,"Мы должны освещать Мост Звездного Сияния этой лампой и указывать душам света путь на Синюю звезду."
Sub1_Rephy_1_5_20,"Теперь понятно. Ух ты, господин Яко, вы действительно так много знаете!"
Sub1_Rephy_1_5_21,"Ох... У меня уже голова разболелась от этих всех разговоров."
Sub1_Rephy_1_5_22,"Я, кстати, немного озадачен... Похоже, тьма может осквернить даже души тамианцев..."
Sub1_Rephy_1_5_23,"Полагаю, Туманные Холмы уже очень близко... Проклятье."
Sub1_Rephy_1_5_24,"Время пришло. Кхе-кхе! Я, вождь племени тамии, приказываю тебе, Проводник душ Леви!"
Sub1_Rephy_1_5_25,"Ага, Леви слушает. Что мне делать?"
Sub1_Rephy_1_5_26,"Приказываю тебе найти местоположение Туманных Холмов и осветить их Светочем богов."
Sub1_Rephy_1_5_27,"Покинь Город Фонарщиков прямо сейчас и отправляйся в путь."
Sub1_Rephy_1_5_28,"Хорошо. Пойду собираться. До скорого!"
Sub1_Rephy_1_5_29,"Погоди! Это не увеселительная прогулка, Леви! Ты еще даже ни разу не был за пределами нашего города!"
Sub1_Rephy_1_5_30,"Сначала я должен рассказать тебе об опасностях внешнего мира."
Sub1_Rephy_1_5_31,"Не следуй за кем попало... Не доверяй незнакомцам. Держи деньги во внутренних карманах..."
Sub1_Rephy_1_5_32,"Ладно... Ладно... Х-р-р..."
Sub1_Rephy_1_5_33,"И держись подальше от Орвела. Там полно злых душ."
Sub1_Rephy_1_5_34,"Мы можем доверять только мудрой Лорейн... Так! Повтори все, что я сказал!"
Sub1_Rephy_1_5_35,"А? Ну это... короче... Мудрец Леви отправляется в поход, чтобы найти Туманные Холмы!"
Sub1_Rephy_1_5_36,"В Орвел... где полно людей, которым мы можем доверять!"
Sub1_Rephy_1_5_37,"Я уже готов идти! До свидания. Еще увидимся!"
Sub1_Rephy_1_5_38,"Что ж, береги себя, Леви. Ты мудрец племени тамии!"
Sub1_Rephy_1_5_39,"А? Стой! Ты сказал «в Орвел»?!"
Sub1_Rephy_1_5_40,"Нет! Тебе нужно идти к мудрой Лорейн!"
Sub1_Rephy_1_5_41,"Уже ушел..."
Sub1_Rephy_1_5_42,"Да направят это неразумное дитя страж Синей звезды... королева... и наши предки."
Sub1_Rephy_2_1_1,"Ух ты! Это Орвел!"
Sub1_Rephy_2_1_2,"Какой он большой! И сколько здесь людей!"
Sub1_Rephy_2_1_3,"И так много душ! Хм? Душ света... темных душ... серых душ..."
Sub1_Rephy_2_1_4,"Поистине столица!"
Sub1_Rephy_2_1_5,"Эй... ты. Я таких существ еще здесь не видел. Что привело тебя в Орвел?"
Sub1_Rephy_2_1_6,"А? Я тамианец. Ты разве не слышал о племени тамии?"
Sub1_Rephy_2_1_7,"Мы проводники душ. Когда ты умрешь, я помогу тебе попасть на Синюю звезду."
Sub1_Rephy_2_1_8,"Что? Ах ты пушистое недоразумение! Смерти моей желаешь?"
Sub1_Rephy_2_1_9,"Лучше следи за своим языком, особенно в такое неспокойное время. Пропуск-то у тебя есть?"
Sub1_Rephy_2_1_10,"Пропуск? Что это? Какая-то еда?"
Sub1_Rephy_2_1_11,"Не знаешь, что такое пропуск? У всех полуживотных должен такой быть. Ты какой-то подозрительный! А ну-ка следуй за мной!"
Sub1_Rephy_2_1_12,"Ну ладно. А нет, стой! Наш вождь сказал, чтобы я не доверял незнакомцам."
Sub1_Rephy_2_1_13,"Счастливо оставаться!"
Sub1_Rephy_2_1_14,"Э-эй! А ну стоять, пушистый!"
Sub1_Rephy_2_1_15,"Ого, рыжий человек с кошачьими ушами! Никогда раньше не видел полуживотных! Ух ты! Какие у этого кота мускулы!"
Sub1_Rephy_2_1_16,"Ой-ой! Как холодно! Вода течет прямо из этих круглых камней! Это что... магия водных фей?"
Sub1_Rephy_2_1_17,"Ха-ха-ха! Орвел – потрясающее место! Хм? А это еще что?"
Sub1_Rephy_2_1_18,"(Шепотом) Смотри... Что это? Полуживотное? Или какой-то новый вид питомца?"
Sub1_Rephy_2_1_19,"(Шепотом) Не знаю. Но... ты только посмотри на его лохматый хвост... Прелесть!"
Sub1_Rephy_2_1_20,"(Шепотом) Ха... Глянь, какой мех у него на ушах. Такой пушистый..."
Sub1_Rephy_2_1_21,"(Шепотом) О! Еще один. Это что... рэдпур в одежде?"
Sub1_Rephy_2_1_22,"Какой милый!"
Sub1_Rephy_2_1_23,"Хм? У меня такое чувство, что мне нужно было сделать что-то очень важное... Точно! У Леви есть важное задание!"
Sub1_Rephy_2_1_24,"Мне нужно поговорить с мудрецом о Туманных Холмах! Мудрец... Как там его звали?"
Sub1_Rephy_2_1_25,"Привет, малыш. Потерялся? Я тебе с радостью помогу."
Sub1_Rephy_2_1_26,"Я не малыш! Меня зовут Леви. Я мудрец из племени тамии!"
Sub1_Rephy_2_1_27,"Ого! Простите, мудрец. Давайте лучше я вам помогу."
Sub1_Rephy_2_1_28,"Кто здесь мудрец? Где мне его найти?"
Sub1_Rephy_2_1_29,"Мудрец? В Орвеле? А, вроде, что-то такое припоминаю..."
Sub1_Rephy_2_1_30,"Слушай, маленький мудрец. Мы тебе, конечно же, поможем найти этого твоего мудреца. Но для начала..."
Sub1_Rephy_2_1_31,"Дай потрогать твой пушистый мех!"
Sub1_Rephy_2_1_32,"Эй, пустите! Не трогайте мой мех! Мне прямо не по себе!"
Sub1_Rephy_2_1_33,"Уберите руки от моего хвоста! Что за наглость!"
Sub1_Rephy_2_1_34,"Отстаньте! Хм? Ты кто?"
Sub1_Rephy_2_1_35,"Прекратите немедленно! Хм? А ты кто, мелкий?"
Sub1_Rephy_2_1_36,"Ты... ты тамианец. Что тамианец делает в Орвеле?"
Sub1_Rephy_2_1_37,"Что? Ты знаешь о племени тамии. Ух ты! Клево! Дай пять!"
Sub1_Rephy_2_1_38,"Конечно, знаю... Но как ты разговариваешь со взрослым? Что это за словечки? Я не один из твоих приятелей, пацан."
Sub1_Rephy_2_1_39,"Боже, вы только посмотрите, как они общаются! Невероятно милое зрелище!"
Sub1_Rephy_2_1_40,"Здесь нельзя оставаться. Лучше поговорим в другом месте, подальше от этих людей."
Sub1_Rephy_2_1_41,"Хм... Конечно, прыжок в пространстве и времени небезопасен... Но что было делать?"
Sub1_Rephy_2_1_42,"Вот ты где, пушистый! Стоять, не двигаться! Что? Ты и приятеля с собой притащил? А ну ни с места, оба!"
Sub1_Rephy_2_1_43,"Эй, пацан... Во что ты тут ввязался?"
Sub1_Rephy_2_1_44,"Я не пацан. Меня зовут Леви. Мудрец Леви."
Sub1_Rephy_2_1_45,"Что ж, Леви, нужно как-то выбираться отсюда и поскорее!"
Sub1_Rephy_2_1_46,"Пусть только прыжок в пространстве и времени сработает!"
Sub1_Rephy_2_1_47,"Что произошло? Куда они подевались? Просто испарились..."
Sub1_Rephy_2_1_48,"Ха-ха-ха... Нужно проследить за этими двумя. На них можно неплохо заработать! Хи-хи!"
Sub1_Rephy_2_2_1,"О-ох!"
Sub1_Rephy_2_2_2,"Как же больно! Хм? Где это мы?"
Sub1_Rephy_2_2_3,"Какой отвратительный запах... Темные души! И немало!"
Sub1_Rephy_2_2_4,"Ох, моя спина. Это же... подземный лабиринт! В какое время мы попали? Сейчас проверю... Кажется, время настоящее."
Sub1_Rephy_2_2_5,"Он сказал использовать прыжок только в крайнем случае, но прыжок работает только в пространстве, а не в пространстве и времени!"
Sub1_Rephy_2_2_6,"(Бормочет) Опять он испытывает на мне свои экспериментальные штуковины. Ты еще поплатишься за это... Никс."
Sub1_Rephy_2_2_7,"Эй! Красный мишка! Куда нам идти?"
Sub1_Rephy_2_2_8,"Я же сказал, не разговаривай со мной, как с одним из своих мелких приятелей. Меня зовут Одди. И я никакой не красный мишка... А, забудь."
Sub1_Rephy_2_2_9,"Эй, Одди! Давай выбираться отсюда! Здесь так много темных душ, мне прямо не по себе!"
Sub1_Rephy_2_2_10,"Леви, сколько тебе лет? Ты в курсе, что к взрослым нужно обращаться на «Вы»?"
Sub1_Rephy_2_2_11,"Мне уже 14!"
Sub1_Rephy_2_2_12,"Уже? Тебе 14 лет, ты еще ребенок, тамианец! А я прожил не одну сотню лет..."
Sub1_Rephy_2_2_13,"Хм... Ладно, какой смысл распинаться перед ребенком. В общем, говори мне «вы» и называй меня господином Одди!"
Sub1_Rephy_2_2_14,"Хорошо, дядя Одди!"
Sub1_Rephy_2_2_15,"Чего? Дядя Одди?"
Sub1_Rephy_2_2_16,"Мне не нравится говорить «господин». Мне нравится говорить «дядя»! Ну что, давай поскорее выбираться отсюда!"
Sub1_Rephy_2_2_17,"Ох... Вперед. Дядя Одди идет следом."
Sub1_Rephy_2_3_1,"Эй, а куда нам идти, чтобы выйти наружу?"
Sub1_Rephy_2_3_2,"Так, дай подумать. Если это Королевский подземный лабиринт, то нам – туда."
Sub1_Rephy_2_3_3,"Я тут был два дня назад, если мы так пойдем, то выйдем наружу. Вроде бы. *Кхе-кхе*"
Sub1_Rephy_2_3_4,"О! Тогда я тебе доверюсь, дядя Одди."
Sub1_Rephy_2_4_1,"Если это Королевский подземный лабиринт, почему здесь так много демонов?"
Sub1_Rephy_2_4_2,"Не стоит задавать такие вопросы беспечно, Леви."
Sub1_Rephy_2_4_3,"Хм, но ребенку простительно этого не знать."
Sub1_Rephy_2_4_4,"Дядя Одди! Ты точно знаешь, куда идти?"
Sub1_Rephy_2_4_5,"К-конечно знаю. Я же сказал, что уже здесь был. Мы пойдем вон туда и выйдем. Наверное..."
Sub1_Rephy_2_4_6,"Хм-м... Не похоже, что мы идем правильной дорогой."
Sub1_Rephy_2_5_1,"Ох... Демоны... Сколько же здесь темных душ. Мы погибнем?"
Sub1_Rephy_2_5_2,"Не говори глупостей! Никто здесь не погибнет! Я плохо ориентируюсь в пространстве, но точно знаю, как отсюда выбраться... Ух."
Sub1_Rephy_2_5_3,"..."
Sub1_Rephy_2_5_4,"..."
Sub1_Rephy_2_5_5,"Не переживай... Прежде, чем умереть, я проведу твою душу на Синюю звезду."
Sub1_Rephy_2_5_6,"Прекрати! Не нужно так легко сдаваться!"
Sub1_Rephy_2_5_7,"А вот и я! Наконец-то ваши молитвы были услышаны! Значит, вы, ребятки, попали в безвыходное положение?"
Sub1_Rephy_2_5_8,"Рекина спешит на помощь. Готова спасти ваши жизни в обмен на приемлемое вознаграждение! Ха-ха!"
Sub1_Rephy_2_5_9,"А? Какое еще вознаграждение? Что ты хочешь?"
Sub1_Rephy_2_5_10,"Ну, скажем... *Шепчет*"
Sub1_Rephy_2_5_11,"Что? Это очень дорого!"
Sub1_Rephy_2_5_12,"Да не переживайте вы. Не возьму я с вас денег, но вы кое-что для меня сделаете."
Sub1_Rephy_2_5_13,"И вы должны будете сделать это во что бы то ни стало! По рукам?"
Sub1_Rephy_2_5_14,"Да, по рукам! Ты поможешь нам расправиться с этими демонами?"
Sub1_Rephy_2_5_15,"Не соглашайся на непонятно что так быстро!"
Sub1_Rephy_2_5_16,"Но... выбора у нас нет. Мы и так на грани жизни и смерти. Ладно, по рукам!"
Sub1_Rephy_2_5_17,"Ура-ура! Отличненько! Теперь вы мои должники!"
Sub1_Rephy_2_5_18,"Что ж, пора нам выбираться из этого лабиринта!"
Sub1_Rephy_2_6_1,"Подходите! Подходите! Такого ядовитого морума вы еще не видели!"
Sub1_Rephy_2_6_2,"Он настолько ядовит, что может отправить мантикору прямиком на Синюю звезду!"
Sub1_Rephy_2_6_3,"Добро пожаловать..."
Sub1_Rephy_2_6_4,"Эй, что за дела? Рекламируй мои товары с душой и страстью. У нас же уговор!"
Sub1_Rephy_2_6_5,"Если вам сегодня не удастся превысить мой ежедневный объем продаж в 5 раз, наша сделка продлится еще на 5 дней! Ха-ха!"
Sub1_Rephy_2_6_6,"Добро пожаловать! Здесь вы найдете любой из известных в мире ядов!"
Sub1_Rephy_2_6_7,"Уж рэдпур в этом разбирается! Заглядывайте к нам!"
Sub1_Rephy_2_6_8,"Ух ты! У тебя отлично получается, дядя Одди!"
Sub1_Rephy_2_6_9,"Леви попробует не отставать! Светоч богов, жги!"
Sub1_Rephy_2_6_10,"Ой, а это не те милахи, которых мы видели на площади?"
Sub1_Rephy_2_6_11,"О! Точно! Видимо, они талисманы этого магазинчика!"
Sub1_Rephy_2_6_12,"Яд? А есть у вас яд, убивающий демонов?"
Sub1_Rephy_2_6_13,"О! Разумеется! Подходите! Пятидесяти первым покупателям – скидка!"
Sub1_Rephy_2_6_14,"Вы также можете в течение 1 минуты гладить талисманов нашего магазина!"
Sub1_Rephy_2_6_15,"Чего?!"
Sub1_Rephy_2_6_16,"Я! И мне! И я! Я здесь с самого открытия!"
Sub1_Rephy_2_6_17,"Хорошо, хорошо. Становитесь в очередь!"
Sub1_Rephy_2_6_18,"..."
Sub1_Rephy_2_6_19,"Умоляю... спасите..."
Sub1_Rephy_2_6_20,"780... 890... 1300... Что ж! Вы сегодня отлично поработали!"
Sub1_Rephy_2_6_21,"Сегодня мой ежедневный оборот увеличился в 10 раз! Ура! Не хотите поработать на меня на полставки?"
Sub1_Rephy_2_6_22,"Ха-ха... Мы еще живы?"
Sub1_Rephy_2_6_23,"Да, дядя Одди, твоя душа еще не отправилась к Мосту Звездного Сияния."
Sub1_Rephy_2_6_24,"Но если не хотите, то ладно! О! А это вам! Ваше вознаграждение!"
Sub1_Rephy_2_6_25,"Мы, люди-лисы, умеем быть благодарными тем, кто нам помог. Сегодня вы помогли мне заработать кучу денег."
Sub1_Rephy_2_6_26,"Хм, пора закрывать магазин. Наши обычные покупатели как раз приходят в это время."
Sub1_Rephy_2_6_27,"Ну, может, мы еще как-нибудь увидимся. И да, если захотите на меня поработать, дайте знать! Пока!"
Sub1_Rephy_2_6_28,"Хм... Она так быстро исчезла, что мне уже кажется, будто работа на нее была всего лишь сном."
Sub1_Rephy_2_6_29,"Так, что тут у нас. Ого! А вознаграждение-то солидное!"
Sub1_Rephy_2_6_30,"..."
Sub1_Rephy_2_6_31,"Хм? Леви, что-то не так?"
