KEY,"Japanese"
E_C19_May_Glenwys01_46,"見栄えのしない庶民料理で…お口に合えばよろしいのですが。"
E_C19_May_Glenwys01_47,"…"
E_C19_May_Lorraine01_01,"森の大賢者よ、偉大なる存在の生誕の日をお祝い申し上げる！"
E_C19_May_Lorraine01_02,"エルフのドルイド、ローレインに祝福と平穏を！"
E_C19_May_Lorraine01_03,"毎年このような身に余るもてなし、私には感謝することしかできない。"
E_C19_May_Lorraine01_04,"身に余るだなんて、ローレイン様は私たちエルフの誇り高き大賢者。"
E_C19_May_Lorraine01_05,"ローレイン様がいらっしゃらなかったらエリドラの森がどうなっていたか、想像すらできません。"
E_C19_May_Lorraine01_06,"ふふ。あまりおだてないでほしい。恥ずかしくなるわ。"
E_C19_May_Lorraine01_07,"なんと…来るのが遅かったか？"
E_C19_May_Lorraine01_08,"まぁ、あなたは…！"
E_C19_May_Lorraine01_09,"ふふふ、これはすまないことになったな。"
E_C19_May_Lorraine01_10,"他でもない、大賢者ドルイドの誕生日に遅刻をしてしまうとは。"
E_C19_May_Lorraine01_11,"何をおっしゃる。オークの族長が祝いに来てくださるとは、ありがたいこと。"
E_C19_May_Lorraine01_12,"私のせいでハーピーの戦士まで一緒に道に迷ってしまうとは…すまんな、ネイラよ。"
E_C19_May_Lorraine01_13,"行き先が同じだから同行しただけ。謝る必要はありません。"
E_C19_May_Lorraine01_14,"エルフの大賢者様。ハーピーの代表として参ったネイラが、お祝いと敬意を表します。"
E_C19_May_Lorraine01_15,"感謝するよ、ネイラ。"
E_C19_May_Lorraine01_16,"これは…今日は、いつもよりずっと賑やかな誕生日パーティーになりそうですね。"
E_C19_May_Lorraine01_17,"うわあああっ！"
E_C19_May_Lorraine01_18,"!?"
E_C19_May_Lorraine01_19,"あいた！"
E_C19_May_Lorraine01_20,"これは、オディ…！そなたがどうしてここに？"
E_C19_May_Lorraine01_21,"あぁ、参った参った…あ、ローレイン？"
E_C19_May_Lorraine01_22,"ふぅ～今度はちゃんと到着したみたいだな！"
E_C19_May_Lorraine01_23,"ニクスのヤツ、時間どおりに到着するようにしてやると言っておいて！"
E_C19_May_Lorraine01_24,"とんでもない物をくれたせいで、私は灯守りの村まで行ってきたんだぞ～！"
E_C19_May_Lorraine01_25,"ま、おかげでタミア族の贈り物をもらってきたが…いやいや、それはどうでもよくてだな！"
E_C19_May_Lorraine01_26,"オホン！誕生日おめでとう、ローレイン！"
E_C19_May_Lorraine01_27,"さ！これはタミア族と私からのプレゼントだ！"
E_C19_May_Lorraine01_28,"怪しいヤツだと思って排除するところだったわ…大賢者の友人だったなんて。"
E_C19_May_Lorraine01_29,"ははは！こんな日でも緊張を解かないとは、さすがはハーピーの勇者。"
E_C19_May_Lorraine01_30,"それよりも、客人はこれで全部か？"
E_C19_May_Lorraine01_31,"ええ…そうみたいですね。"
E_C19_May_Lorraine01_32,"森がこんなに騒々しいのは初めてで、ぎこちないですが…"
E_C19_May_Lorraine01_33,"今日はそういう日ですからね。ふふふ。"
E_C19_May_Lorraine01_34,"では、ローレイン様、ここからは主役の時間ですよ。"
E_C19_May_Lorraine01_35,"大賢者様のお誕生日、おめでとうございます！"
E_C19_May_Lorraine01_36,"みんな…"
E_C19_May_Lorraine01_37,"本当に感謝するよ。今日の皆の気持ち、いつまでも忘れないでいよう。"
E_C19_May_Lorraine01_38,"(今のこの平穏が、いつまでも続くように…)"
