KEY,Thai
LOADING_TEXT_CURRENCY_GOLD,Gold คือค่าเงินพื้นฐานที่คุณได้รับเมื่อเล่นผ่านด่านหรือทำภารกิจต่างๆ
LOADING_TEXT_CURRENCY_GOLD2,ใช้ Gold เพื่อซื้อไอเทม อัพเกรดสกิล\nและใช้ในระบบต่างๆในเกม!
LOADING_TEXT_CURRENCY_GEM,เป็นค่าเงิน Cash ในเกม King's Raid เอาไว้ใช้กับระบบพิเศษ มันสำคัญมาก ใช้อย่างประหยัดหล่ะ!
LOADING_TEXT_CURRENCY_GEM2,ในขณะนี้มีขายอยู่ในร้านค้า Premium แล้ว!
LOADING_TEXT_CURRENCY_GEM3,คุณจะได้รับ Ruby จากกิจกรรมเช็คอิน\nและเมื่อทำภารกิจบางอย่างสำเร็จ!
LOADING_TEXT_CURRENCY_STAMINA,ค่า Stamina จะถูกใช้เมื่อคุณเข้าเล่นในด่านต่างๆ
LOADING_TEXT_CURRENCY_STAMINA2,ค่า Stamina ที่ใช้ไปจะถูกเติมขึ้นมาใหม่\nทีละ1แต้มเมื่อถึงเวลาที่กำหนด
LOADING_TEXT_CURRENCY_STAMINA3,และค่า Stamina สูงสุดจะเพิ่มขึ้นเมื่อทีมของคุณเลเวลสูงขึ้น
LOADING_TEXT_CURRENCY_SWORD,กุญแจสำหรับใช้ต่อสู้กับผู้เล่นคนอื่นในอารีน่า!\nจะถูกเติมโดยอัตโนมัติเมื่อเวลาผ่านไป
LOADING_TITLE_HERO_CONTENT_HEROSETTING,ตั้งปาร์ตี้ยังไง?
LOADING_TEXT_HERO_CONTENT_HEROSETTING,1 ปาร์ตี้มีสามชิกร่วมได้สี่คนซึ่งจำเป็นสำหรับการต่อสู้ ฮีโร่จะถูกแบ่งเป็นทัพหน้าและหลังตามสายอาชีพของฮีโร่นั้นๆ ฮีโร่ที่มีสายอาชีพเดียวกันก็สามารถเข้าร่วมปาร์ตี้เดียวกันได้
LOADING_TITLE_HERO_CONTENT_SKILL,ทักษะของฮีโร่
LOADING_TITLE_HERO_CONTENT_UPGRADESKILL,อัพเกรดสกิล!
LOADING_TEXT_HERO_CONTENT_UPGRADESKILL,สกิลที่เรียนรู้แล้วสามารถอัพเกรดเพื่อเพิ่มอานุภาพได้โดยใช้ Gold และจะอัพเกรดได้สูงสุดตามเลเวลฮีโร่
LOADING_TITLE_HERO_CONTENT_EQUIPMENT,หาอุปกรณ์!
LOADING_TEXT_HERO_CONTENT_EQUIPMENT,"สวมใส่อุปกรณ์ที่เหมาะกับสายอาชีพของฮีโร่. ฮีโร่ของคุณจะแข็งแกร่งขึ้นเมื่อสวมใส่อาวุธ, ชุดเกราะ, อุปกรณ์เสริม และเครื่องประดับ"
LOADING_TITLE_HERO_CONTENT_EQUIPMENTTYPE,ประเภทอุปกรณ์คือ?
LOADING_TEXT_HERO_CONTENT_EQUIPMENTTYPE,"ในเกมนี้มีอาวุธ 6 ชนิดคือดาบใหญ่, หอก, มีด, ธนู, ปืน, คฑา (นักเวทย์และนักบวช ใช้อาวุธร่วมกัน), มีชุดเกราะและอุปกรณ์เสริม 3 ชนิดคือชุดเกราะหนัก, ชุดเกราะเบา, และชุดคลุม"
LOADING_TITLE_HERO_CONTENT_EQUIUPGRADE,อัพเกรดอุปกรณ์!
LOADING_TEXT_HERO_CONTENT_EQUIUPGRADE,ใช้วัตถุดิบเพื่ออัพเกรดอาวุธ โดยอัพเกรดจะมีประสิทธิภาพมากขึ้นเมื่อใช้วัตถุดิบระดับสูงขึ้น
LOADING_TITLE_HERO_CONTENT_RUNETPYE,ชนิดของรูน
LOADING_TEXT_HERO_CONTENT_RUNETPYE,"รูนมี 3 ชนิดคือ: โจมตี, ป้องกัน และ ส่งเสริม "
LOADING_TITLE_HERO_CONTENT_RUNE,เอฟเฟคของรูนแต่ละสี
LOADING_TEXT_HERO_CONTENT_RUNE,"รูนสีแดงสำหรับโจมตี ใช้ได้กับเฉพาะอาวุธ, รูนสีน้ำเงินสำหรับป้องกัน ใช้ได้กับชุดเกราะ, และรูนสีเขียวส่งเสิรม ใช้ได้กับอุปกรณ์เสริม"
LOADING_TITLE_CONTENT_PARTYDUNGEON,ลง Dungeon กับเพื่อน ๆ !
LOADING_TEXT_CONTENT_PARTYDUNGEON,ใน Party Dungeon มีมอนสเตอร์ที่แข็งแกร่งมาก\nสร้างปาร์ตี้กับเพื่อแล้วร่วมท้ายทาย แต่จำไว้ว่าคุณไม่สามารถเข้าร่วม ดันเจี้ยนได้หากไม่มีปาร์ตี้
LOADING_TITLE_CONTENT_HALLOFHEROES,สถานที่สำหรับวิวัฒนาการ
LOADING_TEXT_CONTENT_HALLOFHEROES,"ในวิหารแห่งอัศวินจะประกอบด้วย ห้องแห่งการพิสูจน์, ที่คุณสามารถต่อสู้กับความมืดและได้รับวัตถุดิบเพื่อวิวัฒนาการ และห้องแห่งการชำระล้างที่คุณสามารถชำระล้างวัตถุดิบที่ได้รับมาเพื่อใช้ในการวิวัฒนาการฮีโร่"
LOADING_TITLE_CONTENT_ROOMOFORDEAL,ห้องพิสูจน์ตน
LOADING_TEXT_CONTENT_ROOMOFORDEAL,ห้องแห่งการพิสูจน์คือสถานที่เดียวที่คุณจะสามารถได้รับผนึกแห่งความมืด(Sealed Darkness) ซึ่งใช้ในการวิวัฒนาการฮีโร่
LOADING_TITLE_CONTENT_ROOMOFORDEAL_ENTRY,ห้องพิสูจน์ตน ไขประตูที่ถูกผนึก
LOADING_TEXT_CONTENT_ROOMOFORDEAL_ENTRY,เมื่อเข้าห้องแห่งการพิสูจน์ คุณต้องรวบรวมชิ้นส่วน(Fragment)สามชนิดสำหรับแต่ละอาชีพ. เมื่อคุณสามารถรวบรวมชิ้นส่วนได้เพียงพอแล้วจงใช้มันเปิดประตูผนึกแล้วจัดการกับร่างมืดของตนให้ได้
LOADING_TITLE_CONTENT_ROOMOFPURIFICATION,ห้องแห่งการชำระล้าง
LOADING_TEXT_CONTENT_ROOMOFPURIFICATION,คุณสามารถชำระล้างผนึกแห่งความมืด(Sealed Darkness) ที่ได้มาจากห้องพิสูจน์ตนที่นี่
LOADING_TITLE_CONTENT_ROOMOFPURIFICATION_ENTRY,"ห้องแห่งการชำระล้าง, เงื่อนไขการเข้า"
LOADING_TEXT_CONTENT_ROOMOFPURIFICATION_ENTRY,ฮีโร่ที่ได้รับผนึกแห่งความมืด(Sealed Darkness) จากห้องพิสูจน์ตนจะสามารถเข้าห้องแห่งการชำระล้างได้
LOADING_TITLE_CONTENT_ROOMOFPURIFICATION_OFFERING,เตรียมความพร้อมเพื่อชำระล้าง
LOADING_TEXT_CONTENT_ROOMOFPURIFICATION_OFFERING,คุณต้องใช้ทองเพื่อชำระล้างความมืด เก็บรวบรวมทองให้เพียงพอแล้วเริ่มทำการชำระล้าง
LOADING_TITLE_CONTENT_CITY,เมือง Orvel
LOADING_TEXT_CONTENT_CITY,"เมืองหลวงแห่งอาณาจักร Orvelia, Orvel นำเสนอภูมิประเทศและเรื่องราวหลากหลาย ลองเดินไปรอบเมือบและเผชิญสถานที่ต่างๆเช่น ร้านค้า, ดันเจี้ยนคุกใต้ดิน, อารีน่า และอื่นๆ"
LOADING_TITLE_CONTENT_SHOP,ใช้ร้านค้า!
LOADING_TEXT_CONTENT_SHOP,"มีไอเท็มมากมายขายที่ร้านค้าเช่น อาวุธ, ชุดเกราะ, อุปกรณ์เสริม, หนังสือสกิล รวมถึง ชิ้นส่วนวิวัฒนาการ!"
LOADING_TITLE_CONTENT_SHOP_SOLDOUT,สินค้าหมด?!
LOADING_TEXT_CONTENT_SHOP_SOLDOUT,อะไรนะ? ของหมด? อย่ากังวล  คุณสามารถใช้ Ruby โดยแตะที่ปุ่ม 'Refresh' เพื่อเปลี่ยนรายการสินค้า และรายการสินค้าจะเปลี่ยนใหม่เรื่อยๆทุกๆ 1 ชั้วโมง
LOADING_TITLE_CONTENT_UNDERGROUNDDUNGEON,คุกใต้ดินที่น่าขนลุก
LOADING_TEXT_CONTENT_UNDERGROUNDDUNGEON,"คุกใต้ดินคือดันเจี้ยนที่คุณสามารถต่อสู้กับมอนสเตอร์ได้ทุกวัน. เลเวลของมอนสเตอร์ขึ้นอยู่กับความยากของดันเจี้ยน, ดังนั้นควรเตรียมตัวให้ดีก่อนที่จะเข้าไป"
LOADING_TITLE_CONTENT_UNDERGROUNDDUNGEON_REWARD,ของรางวัลในคุกใต้ดิน
LOADING_TEXT_CONTENT_UNDERGROUNDDUNGEON_REWARD,คุณสามารถรวบรวมหนังสือสกิลโดยการเคลียร์ดันเจี้ยนใต้ดิน
LOADING_TEXT_HERO_INTRO_TITLE1,เทพแห่งนักรบ\nKasel 
LOADING_TEXT_HERO_INTRO_COMMENT1,หลบไปซะ! พวกเราต้องไป!\nไม่อย่างนั้น...คงต้องลอง\nรสชาติของดาบนี่!
LOADING_TEXT_HERO_INTRO_TITLE2,นักบวชศักสิทธ์\nFrey
LOADING_TEXT_HERO_INTRO_COMMENT2,ไม่นะ! ฉันจะคอยสวดมนต์\nขอให้ราชาปีศาจไม่ทำ\nอันตรายต่อพวกเขา!
LOADING_TEXT_HERO_INTRO_TITLE3,นักเวทย์แห่งอเวจี\nCleo
LOADING_TEXT_HERO_INTRO_COMMENT3,หลบไปก่อน Kasel\nฉันจะย่างพวกมันเอง
LOADING_TEXT_HERO_INTRO_TITLE4,มือสังหาร\nRoi
LOADING_TEXT_HERO_INTRO_COMMENT4,ข้าก็แค่มาทำหน้าที่ของข้าเท่านั้น
LOADING_TEXT_HERO_INTRO_TITLE5,บาบาเรียนแห่งดินแดนน้ำแข็ง\nGau
LOADING_TEXT_HERO_INTRO_COMMENT5,พูดจริงงั้นรึ...\nขอข้าทดสอบความสามารถหน่อยละกัน
LOADING_TEXT_HERO_INTRO_TITLE6,ราชาคนแคระ\nPhillop
LOADING_TEXT_HERO_INTRO_TITLE7,มือปืนรับจ้าง\nLakrak
LOADING_TEXT_HERO_INTRO_COMMENT7,เจ้าอยากมีเรื่องใช่ไหม? (คิคิ)\nเจ้าคิดว่าข้าเป็นก็อบลินธรรมดาหรือยังไง....\nมาสิ เข้ามาเลย!
LOADING_TEXT_HERO_INTRO_TITLE8,หมอผีสายฟ้า\nKaulah
LOADING_TEXT_HERO_INTRO_COMMENT8,อ้าค... ข้าจะไม่ยอมตายที่นี่!\nข้าไม่ยอมแพ้เพื่อเผ่าของข้า!\nดวงวิญญาณทั้งหลาย โปรดมอบพลังให้ข้าด้วย!
LOADING_TEXT_HERO_INTRO_TITLE9,ปีศาจเจ้าเสน่ห์\nEpis
LOADING_TEXT_HERO_INTRO_COMMENT9,ฮี่ฮี่...เจ้าดูน่ากินจัง!\nข้าอดใจไม่ไหวที่จะเคี้ยวเจ้าเป็นชิ้นๆแล้ว
LOADING_TEXT_HERO_INTRO_TITLE10,นักธนูแห่งสายลม\nSelene
LOADING_TEXT_HERO_INTRO_COMMENT10,หยิบอาวุธของพวเจ้าขึ้นมา\nพวกเราคือเอลฟ์ที่ปกป้องป่าแห่งนี้\nพวกเราไม่ใช่พวกขี้ขลาดที่จะทำร้ายคนที่ไร้อาวุธ 
LOADING_TEXT_HERO_INTRO_TITLE11,แม่มดตกสวรรค์\nMaria
LOADING_TEXT_HERO_INTRO_TITLE12,ราชินีโจรสลัด\nMiruru
LOADING_TEXT_HERO_INTRO_TITLE13,นักปราชญ์ผู้ยิ่งใหญ่\nLorraine
LOADING_TEXT_HERO_INTRO_TITLE14,บีสท์มาสเตอร์ผู้กล้าหาญ \nมายา
LOADING_TEXT_HERO_INTRO_TITLE15,อัศวินเกราะเหล็ก\nClause
LOADING_TEXT_HERO_INTRO_COMMENT15,ใช่แล้ว Kasel ข้าจะคอยปกป้องเจ้าเอง!
LOADING_TEXT_HERO_INTRO_TITLE16,ผู้นำทางวิญญาณ\nRephy
LOADING_TEXT_HERO_INTRO_TITLE17,นักล่าแห่งเงา\nDimael
LOADING_TEXT_HERO_INTRO_TITLE18,นักรบสายแบ๊ว\nReina
LOADING_TEXT_HERO_INTRO_TITLE19,พ่อมดมังกรน้ำแข็ง\nPavel
LOADING_TEXT_HERO_INTRO_TITLE20,อัศวินแห่งโล่\nDemia
LOADING_TEXT_HERO_INTRO_TITLE21,นักรบวายุ\nNaila
LOADING_TEXT_HERO_INTRO_TITLE22,สไนเปอร์สาว\nRodina
LOADING_TEXT_HERO_INTRO_TITLE23,ปีศาจไฟ\nMorrah
LOADING_TEXT_HERO_INTRO_TITLE24,นักบวชแห่งแสง\nBaudouin
LOADING_TEXT_HERO_INTRO_TITLE25,ซอมบี้สาว\nJane
LOADING_TEXT_HERO_INTRO_TITLE26,เจ้าหญิงสีม่วง\nAisha
LOADING_TEXT_HERO_INTRO_TITLE27,อาลักษณ์อมตะ\nLeo
LOADING_TEXT_HERO_INTRO_TITLE28,ดาบพลิ้วไหว\nFluss
LOADING_TEXT_HERO_INTRO_TITLE29,บุตรแห่งแสงจันทร์\nLuna
LOADING_TEXT_HERO_INTRO_TITLE30,นักบวชศักดิ์สิทธิ์แห่งน้ำ\nLaias
LOADING_TEXT_HERO_INTRO_TITLE31,ลูกธนูบริสุทธิ์\nArch
LOADING_TEXT_HERO_INTRO_TITLE3_TEMPORARILY1,นักเวทย์แห่งอเวจี
LOADING_TEXT_HERO_INTRO_TITLE3_TEMPORARILY2,Cleo
LOADING_TEXT_HERO_INTRO_TITLE32,สายเลือดอันสูงศักดิ์ของเวอร์มิลเลียน\nLewisia
LOADING_TEXT_HERO_INTRO_TITLE33,ดาบทะลุมิติ\nNyx
LOADING_TEXT_HERO_INTRO_TITLE34,นักประดิษฐ์แห่งวังหลวง\nAnnette
LOADING_TEXT_HERO_INTRO_TITLE35,The Silver Battle Wolf\nMitra
LOADING_TEXT_HERO_INTRO_TITLE36,การพิพากษาของ Lua\nRicardo
LOADING_TEXT_HERO_INTRO_TITLE37,เพลงดาบแห่งความเงียบ\nTanya
LOADING_TEXT_HERO_INTRO_TITLE38,เลือดต้องคำสาป\nEzekiel
LOADING_TEXT_HERO_INTRO_TITLE39,สายลมน่าหลงใหล\nCassandra
LOADING_TEXT_HERO_INTRO_TITLE40,อัศวินแห่งความภักดี\nTheo
LOADING_TEXT_HERO_INTRO_TITLE41,แพทย์อันตราย\nMediana
LOADING_TEXT_HERO_INTRO_TITLE42,ช่างนาฬิกาผู้เป็นอมตะ\nOddy
LOADING_TEXT_HERO_INTRO_TITLE43,นักล่าปีศาจ\nViska
LOADING_TEXT_HERO_INTRO_TITLE44,แม่บ้านเหล็กกล้า\nPriscilla
LOADING_TEXT_HERO_INTRO_TITLE45,ผู้พิฆาตมังกร\nYanne
LOADING_TEXT_HERO_INTRO_TITLE46,เจ้าชายแห่งพายุทราย\nZafir
LOADING_TEXT_HERO_INTRO_TITLE47,ช่างตัดเย็บลึกลับ\nYuria
LOADING_TEXT_HERO_INTRO_TITLE48,ผู้ส่งสารร่าเริง\nRehartna
LOADING_TEXT_HERO_INTRO_TITLE49,ผู้คุ้มครองทางเดินแห่งโชคชะตา\nOphelia
LOADING_TEXT_HERO_INTRO_TITLE50,แม่ค้ายาพิษ\nRequina
LOADING_TEXT_HERO_INTRO_TITLE51,ผู้คุ้มครองแห่งดวงอาทิตย์\nAselica
LOADING_TEXT_HERO_INTRO_TITLE52,กระสุนลงทัณฑ์\nCrow
LOADING_TEXT_HERO_INTRO_TITLE53,ภาชนะแห่งคำสาป\n Shamilla
LOADING_TEXT_HERO_INTRO_TITLE54,วิญญาณร้ายน่ารัก\nLavril
LOADING_TEXT_HERO_INTRO_TITLE55,เงามืดแห่งขุมนรก\nSeria
LOADING_TEXT_HERO_INTRO_TITLE56,ความกระหายไร้ที่สิ้นสุด\nErze
LOADING_TEXT_HERO_INTRO_TITLE57,ธิดาแห่งพายุและท้องทะเล\nLilia
LOADING_TEXT_HERO_INTRO_TITLE58,นักเต้นแห่งโอเอซิส\nLaudia
LOADING_TEXT_HERO_INTRO_TITLE59,นักบุญแห่งพร\nLucias
LOADING_TEXT_HERO_INTRO_TITLE60,ผู้สอบสวนแห่งเลือดและเหล็ก\nChrisha
LOADING_TEXT_HERO_INTRO_TITLE61,ออบซิเดียนผู้เย่อหยิ่ง\nNeraxis
LOADING_TEXT_HERO_INTRO_TITLE62,ศรัทธาสีเงิน\nScarlet
LOADING_TEXT_HERO_INTRO_TITLE63,พายุแห่งแสงสีน้ำเงิน\nSonia
LOADING_TEXT_HERO_INTRO_TITLE64,จักพรรดินีแห่งความสว่างสไว\nArtemia
LOADING_TEXT_HERO_INTRO_TITLE65,ผู้รับใช้แสงสีน้ำเงิน\nMirianne
LOADING_TEXT_HERO_INTRO_TITLE66,บทเพลงแห่งความเพ้อฝัน\nShea
LOADING_TEXT_HERO_INTRO_TITLE67,แบบอย่างแห่งสิ่งประดิษฐ์เวทย์โบราณ\nKara
LOADING_TEXT_HERO_INTRO_TITLE68,ดวงตาที่เต็มไปด้วยความมืดมน\nNia
LOADING_TEXT_HERO_INTRO_TITLE69,นักการพนันแห่งมายา\nEsker
LOADING_TEXT_HERO_INTRO_TITLE70,สายลมแดงแห่งความยุติธรรม\nCecilia
LOADING_TEXT_HERO_INTRO_TITLE71,แมวคริสตัลสีแดง\nKirze
LOADING_TEXT_HERO_INTRO_TITLE73,ประเภท. 0\nChase
LOADING_TEXT_HERO_INTRO_TITLE75,นักปราชญ์แห่งทะเลสาบ\nDakaris
LOADING_TEXT_HERO_INTRO_TITLE78,ดาบทำลายล้าง\nBernheim
LOADING_TEXT_HERO_INTRO_TITLE87,โล่แห่งจักรวรรดิ\nGlenwys
LOADING_TEXT_HERO_INTRO_TITLE90,หญิงสาวที่ฝันถึงทรัพย์\nMay
LOADING_TEXT_HERO_INTRO_TITLE91,อสูรแห่งอารีน่า\nGladi
LOADING_TEXT_HERO_INTRO_TITLE92,นัยน์ตาแห่งการหยั่งรู้\nVeronica
LOADING_TEXT_HERO_INTRO_TITLE93,ผู้เฝ้าประตูแห่งความเชื่อใจ\nLoman
LOADING_TEXT_HERO_INTRO_TITLE94,แม่ครัวเอกของฮีโร่\nJuno
LOADING_TEXT_HERO_INTRO_TITLE95,หัวหน้าทหารยามแห่งความอำมหิต\nNicky
LOADING_TEXT_HERO_INTRO_TITLE96,สายลมแห่งความบริสุทธิ์\nDosarta
LOADING_TEXT_HERO_INTRO_TITLE97,ผู้นำการฝึกแห่งปืนใหญ่\nHanus
LOADING_TEXT_HERO_INTRO_TITLE98,ราชาเทพเจ้าอมตะ\nCain
LOADING_TEXT_TIP_1,Stamina จะถูกฟื้นฟูตามช่วงเวลาที่กำหนด
LOADING_TEXT_TIP_2,คุณจะได้รับผลตอบแทนเป็น Ruby เมื่อผ่านด่านในครั้งแรก
LOADING_TEXT_TIP_3,กุญแจสำหรับเปิดคุกใต้ดินมีเพียง 3 ดอกต่อวันเท่านั้น
LOADING_TEXT_TIP_4,"คุณจะได้รับ ทีม EXP จากการซื้อฮีโร่, การอัพเกรดฮีโร่และการเข้าร่วมต่อสู้"
LOADING_TEXT_TIP_5,"อุปกรณ์จะให้ค่าสถานะที่ต่างกันตามระดับซึ่งได้แก่ ปกติ, สูง, หายาก, วีรบุรุษ และตำนาน"
LOADING_TEXT_TIP_6,ยิ่งระดับดาวสูงขึ้นค่าสถานะที่ได้ก็จะมากขึ้นด้วย
LOADING_TEXT_TIP_7,คุณสามารถหาผงเวทมนต์สำหรับเสริมออปชั่นให้อุปกรณ์ได้จากการสลายอุปกรณ์
LOADING_TEXT_TIP_8,"ถ้ามีอุปกรณ์ที่เหมือนกันสองชิ้น, ลองทำการปลุกพลังให้กับมันเพื่อเป็นการเพิ่มระดับของดาว "
LOADING_TEXT_TIP_9,ระดับการอัพเกรดสูงสุดของอุปกรณ์จะถูกจำกัดโดยเกรดของมัน
LOADING_TEXT_TIP_10,ถ้าเจ้าอัพเกรดออปชั่นของอุปกรณ์ ค่าออปชั่นในอุปกรณ์นั้นๆจะเพิ่มขึ้น
LOADING_TEXT_TIP_11,อาวุธโบราณจะสามารถอัพเกรดได้ตามเลเวลของฮีโร่ในปัจจุบัน
LOADING_TEXT_TIP_12,เมื่อเจ้าได้เปิดห้องพิสูจน์ตนแล้ว มันจะยังคงเปิดอยู่อย่างนั้นจนกว่าจะเคลียร์ได้
LOADING_TEXT_TIP_13,วิธีที่ดีที่สุดที่จะทำให้ได้รับหนังสือสกิลคือการเคลียร์คุกใต้ดิน
LOADING_TEXT_TIP_14,กุญแจสำหรับการเปิดท้องพระคลังโบราณมีเพียง 3 ดอกต่อวันเท่านั้น
LOADING_TEXT_TIP_15,คุณสามารถที่จะหาทองได้มากมายจากท้องพระคลังโบราณที่ปราสาท
LOADING_TEXT_TIP_16,คุณสามารถเปลี่ยนตัวเลือกการต่อสู้ได้ในการตั้งค่าเกมในเมนูอื่นๆ
LOADING_TEXT_BROADCAST_WAITING,กำลังเตรียมสตรีม\nกรุณารอสักครู่!
LOADING_TEXT_HERO_CONTENT_LEVELUP,เมื่อคุณเล่นผ่านด่านก็จะได้รับ EXP\nและเลเวลจะเพิ่มขึ้น แต่หากแพ้ในด่าน\nก็จะไม่ได้อะไรเลย ระวังตรงนี้ด้วย
LOADING_TEXT_HERO_CONTENT_SKILL,เหล่าฮีโร่ใน King's Raid สามารถเรียนรู้ได้ 4 สกิล
LOADING_TEXT_HERO_CONTENT_SKILL2,คุณสามารถกดใช้สกิลด้วยค่า MP
LOADING_TEXT_HERO_CONTENT_SKILL4,สกิลติดตัวเป็นสกิลที่มีผลติดตัวผู้ใช้ในระหว่างต่อสู้
LOADING_TEXT_HERO_AWAKENING2,การเปลี่ยนชุดจะช่วยให้ค่าสถานะดีขึ้น!\n โดยจะสามารถวิวัฒนาการได้ถึงระดับ ★5!
LOADING_TEXT_HERO_EQUIP_ENHANCE,"ใช้อุปกรณ์ที่ไม่จำเป็นเป็นวัตถุดิบในการอัพเกรดอุปกรณ์\nโดยอุปกรณ์แต่ละระดับมีค่าอัพเกรดสูงสุดไม่เท่ากัน ปกติ Lv.3 ,ขั้นสูง Lv.5, หายาก Lv.10,\nวีรบุรุษ Lv.15, ตำนาน Lv.20"
