KEY,"Russian"
Sub1_Rephy_2_6_32,"Я... просто хочу выполнить свое первое задание в качестве проводника душ."
Sub1_Rephy_2_6_33,"Но я так и не нашел того мудреца. Вождь сказал, что мне следует искать мудреца в Орвеле, но все, кого я здесь встретил, какие-то странные."
Sub1_Rephy_2_6_34,"Мудрец в Орвеле? Мудрец, хм... Ты имеешь в виду Лорейн?"
Sub1_Rephy_2_6_35,"А! Точно! Лорейн! Кажется, так звали мудреца!"
Sub1_Rephy_2_6_36,"А зачем ты ищешь ее в Орвеле? Тебе нужно идти в лес Элидоры, где живут все эльфы. Ну ты даешь!"
Sub1_Rephy_2_6_37,"Значит, мудрец не в Орвеле? Тогда я отправляюсь в лес Элидоры."
Sub1_Rephy_2_6_38,"А все тамианцы такие же «сообразительные», как ты?"
Sub1_Rephy_2_6_39,"Хм? Не знаю. Но вождь все время говорит, чтобы я не витал в облаках и сосредоточился."
Sub1_Rephy_2_6_40,"Твой вождь... видимо, отличается невероятным терпением."
Sub1_Rephy_2_6_41,"Простите, а этот магазин ядов уже закрыт?"
Sub1_Rephy_2_6_42,"..."
Sub1_Rephy_2_6_43,"Лорейн, ты что здесь делаешь?"
Sub1_Rephy_2_6_44,"О, это Лорейн! Ура! Мудрец в Орвеле! Леви был прав с самого начала!"
Sub1_Rephy_2_6_45,"Одди? Давно не виделись! Как успехи? Я здесь, чтобы прикупить парочку ядов."
Sub1_Rephy_2_6_46,"Яд, который готовит местный алхимик, очень эффективен в борьбе с демонами."
Sub1_Rephy_2_6_47,"Это что... тамианец... рядом с тобой?"
Sub1_Rephy_2_6_48,"Ага! Меня зовут Леви! Я проводник душ!"
Sub1_Rephy_2_6_49,"Значит, ты мудрец, благословенный королевой Синей звезды. А я Лорейн, мудрая эльфийка. Для меня огромная честь встретиться с тобой."
Sub1_Rephy_2_6_50,"Погоди! Этот пацан... действительно настолько велик?"
Sub1_Rephy_2_6_51,"Кхе-кхе! Леви хотел бы спросить, мудрец Лорейн, где находятся Туманные Холмы?"
Sub1_Rephy_2_6_52,"Мне нужно отправиться туда и осветить вот этой лампой путь для заблудших душ!"
Sub1_Rephy_2_6_53,"Туманные Холмы... В нашем королевстве осталось только два подобных места."
Sub1_Rephy_2_6_54,"Одно – на равнинах Галлуа, а второе – на горе Огрии. Но эти места покрыты тьмой без единого проблеска звездного сияния... И там на тебя могут напасть демоны."
Sub1_Rephy_2_6_55,"Не уверена, что на Туманных Холмах сейчас безопасно..."
Sub1_Rephy_2_6_56,"Ничего страшного! Леви пойдет и все сам проверит! А какие Туманные Холмы ближе всего отсюда?"
Sub1_Rephy_2_6_57,"От Орвела? Те, что находятся на равнинах Галлуа."
Sub1_Rephy_2_6_58,"Но как я уже сказала, в этом месте полно темных душ... Там нет душ света, которые могли бы тебе помочь."
Sub1_Rephy_2_6_59,"Леви сильный! Как бы темно там ни было, я наставлю все души на путь истинный с помощью этой лампы."
Sub1_Rephy_2_6_60,"Лорейн... По моему опыту, этого мальца не переубедить."
Sub1_Rephy_2_6_61,"Что ж... Тогда пусть Туманные Холмы беспрепятственно осветятся благословением Синей звезды."
Sub1_Rephy_2_6_62,"Берегись тьмы, проводник душ."
Sub1_Rephy_2_6_63,"Ага! Спасибо! Ну всем пока! Леви пошел!"
Sub1_Rephy_2_6_64,"Вот так просто уходишь? Для полуживотного ты совсем не отличаешься сообразительностью. Хм, иди-ка сюда на секундочку."
Sub1_Rephy_2_6_65,"Ай! Больно же! Дядя Одди, зачем ты выдернул шерсть из моего хвоста?"
Sub1_Rephy_2_6_66,"Погоди! Мне нужна твоя шерсть, чтобы я всегда мог найти тебя с помощью своей магии времени!"
Sub1_Rephy_2_6_67,"Сегодня я зря потратил твое время, вынудив блуждать в том лабиринте."
Sub1_Rephy_2_6_68,"Не люблю быть должным. Я верну тебе то время, которое у тебя отнял."
Sub1_Rephy_2_6_69,"Ух ты! Значит, мы еще увидимся?"
Sub1_Rephy_2_6_70,"Да, Леви. Береги себя. И стоит тебе произнести мое имя, если ты попадешь в беду..."
Sub1_Rephy_2_6_71,"Ага, ну я пошел! Пока, дядя Одди! Пока, мудрец!"
Sub1_Rephy_2_6_72,"Малец... Ты, похоже, все так же воспринимаешь меня, как одного из своих мелких приятелей, да? Ха-ха-ха!"
Sub1_Rephy_2_6_73,"Но... ты разве не мой приятель, дядя Одди?"
Sub1_Rephy_2_6_74,"Ладно. Забудь, что я сказал."
Sub1_Rephy_3_1_1,"*Принюхивается* Как же здесь плохо пахнет... Это место заполнено одними темными душами."
Sub1_Rephy_3_1_2,"Где-то здесь должны быть Туманные Холмы... Но я не могу понять, где именно!"
Sub1_Rephy_3_1_3,"Точно! Спрошу у Светоча богов! Где Туманные Холмы?"
Sub1_Rephy_3_1_4,"Ага! Там! Значит, идем туда!"
Sub1_Rephy_3_1_5,"Э?"
Sub1_Rephy_3_2_1,"Хм? Что за вонь... Леви мылся всего лишь 3 месяца назад... Неужели это от меня?"
Sub1_Rephy_3_2_2,"От Леви... воняет? Нет! Я хорошо пахну!"
Sub1_Rephy_3_2_3,"Так дурно пахнет от... демонов!"
Sub1_Rephy_3_3_1,"Ох... Как же здесь много демонов... У меня скверное предчувствие. Души света, помогите мне!"
Sub1_Rephy_3_3_2,"Никого нет... Здесь нет душ света, которые помогут Леви..."
Sub1_Rephy_3_3_3,"Не может быть! Кто-то же должен появиться!"
Sub1_Rephy_3_3_4,"Кто... Кто звал меня..."
Sub1_Rephy_3_3_5,"А? Ты кто?"
Sub1_Rephy_3_3_6,"Джейн... Грей..."
Sub1_Rephy_3_4_1,"А кто ты? Я... звал душ света."
Sub1_Rephy_3_4_2,"Но... ты пахнешь демоном..."
Sub1_Rephy_3_4_3,"Меня зовут Джейн... Твой голос... Я услышала его у себя в голове..."
Sub1_Rephy_3_4_4,"(Как странно... Я явно чую демонов... но и едва различимый след души света...)"
Sub1_Rephy_3_4_5,"Здесь опасно... Держись позади! Нам нужно расправиться с демонами!"
Sub1_Rephy_3_5_1,"С тобой... все в порядке?"
Sub1_Rephy_3_5_2,"(Непонятно, является ли она душой света или нет... Но она спасла мне жизнь...)"
Sub1_Rephy_3_5_3,"Да! Спасибо за помощь! Меня зовут Леви! Ты слышала о племени тамии?"
Sub1_Rephy_3_5_4,"Племя тамии... Я... многого не знаю..."
Sub1_Rephy_3_5_5,"Я не знаю, что мне нравится. Или есть ли у меня семья... Я ничего не знаю."
Sub1_Rephy_3_5_6,"Эм? Но ты же только что говорила, что тебя зовут Джейн Грей."
Sub1_Rephy_3_5_7,"Какое красивое имя!"
Sub1_Rephy_3_5_8,"Джейн... Правда же, красивое?"
Sub1_Rephy_3_5_9,"Да! Очень! И ты замечательно сражалась! Я никогда не видел никого сильнее Джейн!"
Sub1_Rephy_3_5_10,"Потрясающе!"
Sub1_Rephy_3_5_11,"Теперь я знаю... что Джейн замечательная и потрясающая..."
Sub1_Rephy_3_5_12,"Но... я все же хочу узнать... кто я такая..."
Sub1_Rephy_3_5_13,"Хм... Ты потеряла память?"
Sub1_Rephy_3_5_14,"Если бы твоя душа света была сильнее... Я мог бы тебе помочь."
Sub1_Rephy_3_5_15,"И что ты сделаешь в таком жутком месте одна? У тебя разве нет друзей?"
Sub1_Rephy_3_5_16,"У меня был один друг, но он внезапно пропал... произошло что-то странное..."
Sub1_Rephy_3_5_17,"Мне говорили, что это место... мой дом. Мы пришли сюда вместе в надежде, что память ко мне вернется..."
Sub1_Rephy_3_5_18,"Этот человек не очень хороший! Раз вы пришли сюда вместе, а он бросил тебя здесь одну!"
Sub1_Rephy_3_5_19,"Хм... Это был не человек... Это был демон..."
Sub1_Rephy_3_5_20,"Демон?"
Sub1_Rephy_3_5_21,"(Ох... Теперь я еще больше запутался... Но я чувствую, что у нее душа света.)"
Sub1_Rephy_3_5_22,"(Не могу же я бросить кого-то, кто потерял память, в таком месте... Ладно!)"
Sub1_Rephy_3_5_23,"Джейн! Не хочешь пойти со мной? Леви ищет Туманные Холмы!"
Sub1_Rephy_3_5_24,"Туманные Холмы?.."
Sub1_Rephy_3_5_25,"Да! Там я освещу Мост Звездного Сияния с помощью Светоча богов! Тогда заблудшие души смогут попасть домой."
Sub1_Rephy_3_5_26,"Яркий свет... Джейн нравится свет..."
Sub1_Rephy_3_5_27,"Здорово, тогда пошли!"
Sub1_Rephy_3_6_1,"Светоч богов, где Туманные Холмы?"
Sub1_Rephy_3_6_2,"Нам туда! Поспешим!"
Sub1_Rephy_3_6_3,"Я видела этот свет... свет души... Над сверкающим мостом мерцает синий свет..."
Sub1_Rephy_3_6_4,"Я шла за светом... Но потом кто-то потащил меня вниз... В темное и холодное место..."
Sub1_Rephy_3_6_5,"Тьма и больше никого... Я больше никогда туда не вернусь..."
Sub1_Rephy_3_6_6,"(Она видела Мост Звездного Сияния... Она уже умирала...)"
Sub1_Rephy_3_6_7,"(Кто-то затянул во тьму душу, направляющуюся на Синюю звезду... и воскресил ее...)"
Sub1_Rephy_3_6_8,"Да! Ты больше не окажешься во тьме! Леви осветит твой путь этой лампой!"
Sub1_Rephy_3_6_9,"Ты можешь мне верить! Я великий проводник душ и тамианский мудрец!"
Sub1_Rephy_3_6_10,"Хорошо..."
Sub1_Rephy_3_7_1,"Хм? Что это такое? Похоже на часть огромного здания. А! Я видел такое в Орвеле! Это замок!"
Sub1_Rephy_3_7_2,"В замке живут короли, принцессы и рыцари. Правильно?"
Sub1_Rephy_3_7_3,"Но... здесь одни руины. Видимо, демоны здесь тоже побывали."
Sub1_Rephy_3_7_4,"Я... узнаю это место..."
Sub1_Rephy_3_7_5,"Правда? К тебе возвращается память?"
Sub1_Rephy_3_7_6,"Здесь... было много людей... Они были в красивых нарядах... и танцевали..."
Sub1_Rephy_3_7_7,"И было много света... играла музыка... Вальс, который я так люблю..."
Sub1_Rephy_3_7_8,"Кавалеры приглашали меня на танец... Но я хотела танцевать только с ним."
Sub1_Rephy_3_7_9,"Я все ждала... ждала... Кого же я ждала?.."
Sub1_Rephy_3_7_10,"Джейн..."
Sub1_Rephy_3_7_11,"Не могу вспомнить... кто он..."
Sub1_Rephy_3_7_12,"Зато мы теперь кое-что выяснили!"
Sub1_Rephy_3_7_13,"Тебе, определенно, кто-то нравится!"
Sub1_Rephy_3_7_14,"Кто-то... нравится..."
Sub1_Rephy_3_7_15,"Да! Тот, с кем ты хотела потанцевать!"
Sub1_Rephy_3_7_16,"Это очень важное воспоминание! О человеке, который тебе нравится, Джейн!"
Sub1_Rephy_3_7_17,"Мне... кто-то нравится... Я узнала о себе... хотя бы что-то."
Sub1_Rephy_3_7_18,"Ура! Потрясающе, Джейн!"
Sub1_Rephy_3_7_19,"Да... Спасибо тебе."
Sub1_Rephy_3_8_1,"*Принюхивается* Я чую тень звезды! Видимо, Туманные Холмы уже рядом!"
Sub1_Rephy_3_8_2,"Так... давай остановимся и немного передохнем!"
Sub1_Rephy_3_8_3,"Мы не пойдем дальше?"
Sub1_Rephy_3_8_4,"Нет! Тише едешь, дальше будешь... Так, вроде, говорил вождь? Вроде бы."
Sub1_Rephy_3_8_5,"Путь был неблизким, поэтому сейчас нам нужно отдохнуть."
Sub1_Rephy_3_8_6,"На Синей звезде есть сад отдыха – там живут души."
Sub1_Rephy_3_8_7,"А еще там живет громадный метеоритный дракон, и у него – огромные уши."
Sub1_Rephy_3_8_8,"То, что путь туда скрыт во тьме – неважно. Светоч богов поможет нам пройти его бесстрашно."
Sub1_Rephy_3_8_9,"Что это... было?.."
Sub1_Rephy_3_8_10,"А! Это я сочинил песню. Классно получилось, правда?"
Sub1_Rephy_3_8_11,"Не... совсем. Уши вянут."
Sub1_Rephy_3_8_12,"Ага! Знаю. Из Леви певец так себе! Полное отсутствие музыкального слуха!"
Sub1_Rephy_3_8_13,"Но ничего страшного! Это песня неуязвимости!"
Sub1_Rephy_3_8_14,"Песня неуязвимости?"
Sub1_Rephy_3_8_15,"Говорят, что Леви благословен королевой Синей звезды. По этой причине вождь и другие тамианцы рассчитывают на меня."
Sub1_Rephy_3_8_16,"Наконец-то в Городе Фонарщиков появился проводник душ! Теперь есть кому зажигать Светоч богов!"
Sub1_Rephy_3_8_17,"Но Леви долго не мог всему научиться."
Sub1_Rephy_3_8_18,"Когда вождь меня чему-то учил, я тут же все забывал. И у меня никак не получалось зажечь Светоч богов."
Sub1_Rephy_3_8_19,"Поэтому я боялся. Боялся, что они меня ненавидят."
Sub1_Rephy_3_8_20,"И что в итоге?.."
Sub1_Rephy_3_8_21,"Они меня не возненавидели. Вождь и другие тамианцы верили в меня."
Sub1_Rephy_3_8_22,"Когда я что-то забывал, они учили меня снова и снова. И никогда не расстраивались, когда мне не удавалось зажечь лампу."
Sub1_Rephy_3_8_23,"Поэтому Леви старался как мог!"
Sub1_Rephy_3_8_24,"Я изучал обязанности проводника душ, сочиняя каждый день песни и напевая их."
Sub1_Rephy_3_8_25,"И я сутки напролет пытался уловить движение душ с помощью Светоча богов. И вот однажды он зажегся!"
Sub1_Rephy_3_8_26,"Леви смог стать проводником душ благодаря вере в него других тамианцев."
Sub1_Rephy_3_8_27,"Понимаю... Все дело в вере..."
Sub1_Rephy_3_8_28,"А у меня нет никого... кто бы меня ждал и верил в меня... Я просто Джейн Грей..."
Sub1_Rephy_3_8_29,"Нет! Ты ошибаешься, Джейн! Думаешь, никто в тебя не верит?!"
Sub1_Rephy_3_8_30,"Я, Проводник душ Леви, в тебя верю!"
Sub1_Rephy_3_8_31,"Ты? Но почему?.."
Sub1_Rephy_3_8_32,"Что за вопросы? Мы же с тобой друзья! А друзья верят друг в друга!"
Sub1_Rephy_3_8_33,"Леви и я... Мы друзья... И у меня есть кто-то... кто в меня верит."
Sub1_Rephy_3_8_34,"Да! Да! Я – мудрец Леви, лучший друг Джейн Грей! Ну или лучший после лучшего? А, может, третий в этом списке?"
Sub1_Rephy_3_8_35,"Ха-ха! Да... Ты прав. Леви – лучший друг Джейн Грей."
Sub1_Rephy_3_8_36,"Ура! Я все-таки твой лучший друг! Потрясающе!"
Sub1_Rephy_3_8_37,"Уф... Ох, Джейн... Мне так хочется спать. Я сегодня так много ходил..."
Sub1_Rephy_3_8_38,"Хорошо... Спокойной ночи, Леви."
Sub1_Rephy_3_8_39,"А ты ложись вот здесь у костра. Здесь тепло! Спокойной ночи, Джейн!"
Sub1_Rephy_3_8_40,"Х-р-р..."
Sub1_Rephy_3_8_41,"Кто-то в тебя... верит..."
Sub1_Rephy_3_8_42,"Спасибо тебе... Проводник душ. Мой лучший друг, Леви."
Sub1_Rephy_3_9_1,"Х-р-р... Отпустите! Х-р-р... Не трогайте мой хвост!"
Sub1_Rephy_3_9_2,"А, что?.. Фух. Всего лишь сон."
Sub1_Rephy_3_9_3,"Доброе утро, Джейн! Как спалось?"
Sub1_Rephy_3_9_4,"Джейн... ушла. Мне даже не удалось с ней попрощаться."
Sub1_Rephy_3_9_5,"Нет, нет. Не стоит огорчаться. Мы же друзья!"
Sub1_Rephy_3_9_6,"Когда-нибудь мы обязательно встретимся! А пока Леви нужно идти к Туманным Холмам!"
Sub1_Rephy_4_1_1,"Светоч богов, мы уже на Туманных Холмах?"
Sub1_Rephy_4_1_2,"Но... здесь одни темные души. И они пахнут, как злые мертвецы."
Sub1_Rephy_4_1_3,"Нет, как же так? Здесь же должны быть Туманные Холмы!"
Sub1_Rephy_4_1_4,"Что ж, нужно оглядеться. Лампа! Зажгись!"
Sub1_Rephy_4_1_5,"Туманные Холмы... Уничтожить все..."
Sub1_Rephy_4_1_6,"Души света... Тянем их... во тьму..."
Sub1_Rephy_4_2_1,"Как же здесь много демонов... Силы меня покидают... Души света, помогите мне!"
Sub1_Rephy_4_2_2,"На Туманных Холмах... нет душ света..."
Sub1_Rephy_4_2_3,"Помогите! Вождь! Дядя Одди! Джейн!"
Sub1_Rephy_4_2_4,"Никто не придет... Леви так напуган... и совсем одинешенек."
Sub1_Rephy_4_2_5,"А? Ты звал меня, Леви?"
Sub1_Rephy_4_2_6,"Дядя Одди! Ты пришел! Ух ты! Это дядя Одди!"
Sub1_Rephy_4_2_7,"Ха-ха. Я же говорил, чтобы ты позвал меня, когда тебе будет грозить опасность... Ого, да ты и вправду попал в переплет!"
Sub1_Rephy_4_2_8,"Хорошо! Давай побудем здесь, пока не подтянулась подмога!"
Sub1_Rephy_4_2_9,"Подмога? Мы еще кого-то ждем?"
Sub1_Rephy_4_2_10,"Разумеется. И если этот кое-кто не явится, я буду припоминать ему это всю жизнь."
Sub1_Rephy_4_2_11,"Пойдем, Леви!"
Sub1_Rephy_4_2_12,"Ага! Дядя Одди, Леви готов!"
Sub1_Rephy_4_3_1,"Типичная нежить... Им нет ни конца ни края..."
Sub1_Rephy_4_3_2,"Могу поспорить, им не нравится твой Светоч богов."
Sub1_Rephy_4_3_3,"Почему? Леви нужна эта лампа, чтобы заблудшие души могли попасть на Синюю звезду!"
Sub1_Rephy_4_3_4,"Хм-м... Нежить не может попасть на Синюю звезду, так как она осквернена тьмой."
Sub1_Rephy_4_3_5,"У нее нет другого выбора... Ей остается лишь скитаться вот так во тьме."
Sub1_Rephy_4_3_6,"Не дадим... Не позволим... душам света... попасть на Синюю звезду..."
Sub1_Rephy_4_3_7,"Идите к нам... в темную бездну... и познайте... вечную боль..."
Sub1_Rephy_4_3_8,"..."
Sub1_Rephy_4_3_9,"И когда уже он здесь появится?"
Sub1_Rephy_4_3_10,"Да тут я, тут! Уф. Нужно было побывать во стольких местах."
Sub1_Rephy_4_3_11,"У меня вечно дел по горло, ты же знаешь. Но друга в беде я никогда не брошу!"
Sub1_Rephy_4_3_12,"Ох. Ну раз уж ты нашел время, чтобы здесь появиться, то избавь нас от этой нежити."
Sub1_Rephy_4_3_13,"Да не вопрос!"
Sub1_Rephy_4_4_1,"А ну-ка изыдите в бездну!"
Sub1_Rephy_4_4_2,"Господин! Погодите!"
Sub1_Rephy_4_4_3,"Что такое, пушистик?"
Sub1_Rephy_4_4_4,"Леви! Ты что, назвал его господином? А ты, Никс! У него есть имя, и это не «пушистик»!"
Sub1_Rephy_4_4_5,"Ой, да! Твоя правда... Леви! Что такое?"
Sub1_Rephy_4_4_6,"У меня здесь есть... кое-какое дело."
Sub1_Rephy_4_4_7,"Простите... но я не могу позволить, чтобы оставшиеся тут души света сбились с пути!"
Sub1_Rephy_4_4_8,"Леви будет очень стараться, чтобы заблудшие души не попали в бездну!"
Sub1_Rephy_4_4_9,"Замолчи... Мы все равно... не можем попасть... на Синюю звезду..."
Sub1_Rephy_4_4_10,"Нет! Есть один способ!"
Sub1_Rephy_4_4_11,"Вот, возьмите! Это свет души проводника!"
Sub1_Rephy_4_4_12,"С ним вы сможете найти путь на Синюю звезду даже из бездны."
Sub1_Rephy_4_4_13,"Но разве... это не твоя душа? Леви?"
Sub1_Rephy_4_4_14,"Да! Это свет, созданный из души Леви!"
Sub1_Rephy_4_4_15,"С помощью этого света кто угодно сможет найти путь на Синюю звезду!"
Sub1_Rephy_4_4_16,"Эм... Малец... Не стоит тебе разбрасываться частицами своей души."
Sub1_Rephy_4_4_17,"Все в порядке! Леви сильный! Да и души мне всегда помогают!"
Sub1_Rephy_4_4_18,"Как интересно! Я встречал многих проводников душ, но никто из них не отличался такой самоотверженностью."
Sub1_Rephy_4_4_19,"Интересно тебе? Лучше отговори его от этого безрассудства!"
Sub1_Rephy_4_4_20,"Ничего страшного. С Леви все будет в порядке... Нужно только немного поспать."
Sub1_Rephy_4_4_21,"Нам не нужна... душа какой-то... пушистой зверюшки..."
