KEY,Japanese
E_C19_Dec_Chase01_106,じゃあ、遅くなったが誕生日パーティーをしないとな？
E_C19_Dec_Chase01_107,デミアにもっと料理を用意してもらうよう言っておかないと。
E_C19_Dec_Chase01_108,俺はチェイスだ。
E_C19_Dec_Chase01_109,これから先、何があっても、過去の記憶を取り戻しても、
E_C19_Dec_Chase01_110,俺が好きな人たちと、あの方と…
E_C19_Dec_Chase01_111,いつまでも一緒に、チェイスとして…
E_C19_Dec_Mitra01_1,隊長！これ、落としましたよ！
E_C19_Dec_Mitra01_2,うああっ！！
E_C19_Dec_Mitra01_3,クソッ…血が付いたじゃねぇか！
E_C19_Dec_Mitra01_4,下手に手ぇ付けて汚してんじゃねぇぞ！
E_C19_Dec_Mitra01_5,隊長！隊長！！抑えてください！
E_C19_Dec_Mitra01_6,活動資金の大半が、隊長にやられた連中の治療費で無くなっていくんですから！
E_C19_Dec_Mitra01_7,るせぇっ！どうせくたばるヤツらだろ！1人増えたからって何も変わらねぇ！
E_C19_Dec_Mitra01_8,おい！お前も早く謝れ！
E_C19_Dec_Mitra01_9,す…すみませんでした…！
E_C19_Dec_Mitra01_10,ぶっ殺す！！！！ぶっ殺してやる！！
E_C19_Dec_Mitra01_11,落ち着かれました？
E_C19_Dec_Mitra01_12,ふぅ…
E_C19_Dec_Mitra01_13,そこまで興奮されるなんて…一体何なんですか、それは。
E_C19_Dec_Mitra01_14,…
E_C19_Dec_Mitra01_15,うおっ、さっきのそれスゲェな！？
E_C19_Dec_Mitra01_16,いちいち装填する面倒もないしよ～
E_C19_Dec_Mitra01_17,一気にバババン！！
E_C19_Dec_Mitra01_18,このオンボロ銃は銃弾ばっか呑み込みやがってよ～
E_C19_Dec_Mitra01_19,…
E_C19_Dec_Mitra01_20,い…いや！もちろん！満足してねぇわけじゃ…
E_C19_Dec_Mitra01_21,たまには違うやつもいいかなって思っただけだって！
E_C19_Dec_Mitra01_22,…
E_C19_Dec_Mitra01_23,…
E_C19_Dec_Mitra01_24,ま…姉御に作ってもらうしかねぇか…
E_C19_Dec_Mitra01_25,何だよその反応は！？何だってんだよ！？
E_C19_Dec_Mitra01_26,クロウ？
E_C19_Dec_Mitra01_27,前に頼んでおいたものは完成したか？
E_C19_Dec_Mitra01_28,それなら、とっくに終わってるわ。
E_C19_Dec_Mitra01_29,それにしても…あなたの依頼とは違って、その武器には合わないと思うんだけど…
E_C19_Dec_Mitra01_30,アーキストラにスピードローダーはいらないでしょう？
E_C19_Dec_Mitra01_31,もしかして、アイツの誕生日プレゼント？
E_C19_Dec_Mitra01_32,…
E_C19_Dec_Mitra01_33,なんだかんだ言っても、大切にしてるのね。
E_C19_Dec_Mitra01_34,…ただ手のかかる男なだけだ。
E_C19_Dec_Mitra01_35,はいはい、わかったわよ。
E_C19_Dec_Mitra01_36,死ね！死ね！おら、てめぇもだ！
E_C19_Dec_Mitra01_37,もっと強いやつはいねぇのか！？
E_C19_Dec_Mitra01_38,はははははははッ！！
E_C19_Dec_Mitra01_39,おっ？オラ、どこ行きやがる！
E_C19_Dec_Mitra01_40,てめぇの頭にぶち込む弾がまーだたくさん…
E_C19_Dec_Mitra01_41,クソッ…
E_C19_Dec_Mitra01_42,よし！もう1回始めて…
E_C19_Dec_Mitra01_43,何だぁ？もう逃げちまったのか！？
E_C19_Dec_Mitra01_44,ちくしょう！！
E_C19_Dec_Mitra01_45,追撃者だったのか？
E_C19_Dec_Mitra01_46,まぁな～
E_C19_Dec_Mitra01_47,どいつもこいつもつまらねぇ連中だったから、暇つぶしにもならなかったがよ。
E_C19_Dec_Mitra01_48,もっと装填が楽にできたら、あと15人はぶっ殺せたのに…
E_C19_Dec_Mitra01_49,くそっ。イライラするぜ！
E_C19_Dec_Mitra01_50,やっぱ姉御に何か作ってもらうしかねぇな。
E_C19_Dec_Mitra01_51,あ？爺さ…
E_C19_Dec_Mitra01_52,ぐはっ！！
E_C19_Dec_Mitra01_53,もう、愚痴をこぼすのはやめろ。
E_C19_Dec_Mitra01_54,知るかよ。
E_C19_Dec_Mitra01_55,そのくらいは教えてもらえませんか？
E_C19_Dec_Mitra01_56,てめぇも死にたいのか？
E_C19_Dec_Mitra01_57,申し訳ありません。
E_C19_Dec_Mitra01_58,あ、そういえば、隊長宛ての手紙が届いていました。
E_C19_Dec_Mitra01_59,印章にオオカミのようなマークが入っています。
E_C19_Dec_Mitra01_60,これはまさ…
E_C19_Dec_Mitra01_61,これは…
E_C19_Dec_Mitra01_62,隊長？どんな手紙なのですか？
E_C19_Dec_Mitra01_63,おい！ちょっと行ってくるわ！
E_C19_Dec_Mitra01_64,どこに行かれるんです！？
E_C19_Dec_Mitra01_65,ん？「隊長」に会いにいくんだよ。
E_C19_Dec_Mitra01_66,隊長！？それはどういうことですか！？
E_C19_Dec_Mitra01_67,隊長ーー！！！
E_C19_Dec_Mitra01_68,ああもう、うるせぇな！黙れ！
E_C19_Dec_Naila01_01,ネイラ…残った仲間たちのことを…頼んだよ…
E_C19_Dec_Naila01_02,お姉ちゃん…
E_C19_Dec_Naila01_03,私、風の流れが読めるようになったの！
E_C19_Dec_Naila01_04,お姉ちゃんみたいに、風使いになれるのかな？
E_C19_Dec_Naila01_05,うわああああ、風の術式は私には合わないみたい！
E_C19_Dec_Naila01_06,やっぱり風に乗って飛んでいる時が一番幸せね。
E_C19_Dec_Naila01_07,お姉ちゃんが風使いだからって私まで風使いになる必要はないよね。
E_C19_Dec_Naila01_08,いっそ、戦士になってお姉ちゃんを守ってあげるわ！
E_C19_Dec_Naila01_09,ふふ、あなたなら立派な戦士になれそうね。
E_C19_Dec_Naila01_10,あの時の私はあまりにも弱くて、無力で、
E_C19_Dec_Naila01_11,お姉ちゃんを守れなかった。
E_C19_Dec_Naila01_12,でも！
E_C19_Dec_Naila01_13,お姉ちゃんの願いは、最後まで守ってみせるから。
E_C19_Dec_Naila01_14,ネイラ、ハーピーとしての誇りを持つのですよ。
E_C19_Dec_Naila01_15,まだ…
E_C19_Dec_Naila01_16,今はまだ力が足りない。
E_C19_Dec_Naila01_17,ん？あの方は？
E_C19_Dec_Naila01_18,やはり、山に行っていたんですね。
E_C19_Dec_Naila01_19,みんな、ネイラを探していたんですよ。
E_C19_Dec_Naila01_20,セレネ様が直接お越しになるような、急な用事でしょうか？
E_C19_Dec_Naila01_21,ええ、もちろん。
E_C19_Dec_Naila01_22,今日は、ネイラの誕生日ですからね。
E_C19_Dec_Naila01_23,こ…ここまで大袈裟にやる必要はないと思うんですが…
E_C19_Dec_Naila01_24,ハーピーを統べる代表として、
E_C19_Dec_Naila01_25,他の種族との和合のためにお祝いしてもらうのです。
E_C19_Dec_Naila01_26,恥ずかしがることではありません。
E_C19_Dec_Naila01_27,私はまだまだ未熟です。
E_C19_Dec_Naila01_28,私も、エルフの姫という地位に至らなさを感じています。
E_C19_Dec_Naila01_29,だからこそ、もっと精進することができたと思うのです。
E_C19_Dec_Naila01_30,わかりました。
E_C19_Dec_Naila01_31,それはそうと、私がわざわざネイラを訪ねた理由は、別にあります。
E_C19_Dec_Naila01_32,お受け取りください。\nあなたの風の力になれることを願って、ノトスの魔力を込めたリボンを作ってみました。
E_C19_Dec_Naila01_33,些細なものですから、正式な祝いの席で渡すのもどうかと思いまして、
E_C19_Dec_Naila01_34,先にお渡ししたかったのです。
E_C19_Dec_Naila01_35,あ…ありがとうございます。
E_C19_Dec_Naila01_36,今日いただいた贈り物とお言葉は、決して忘れません。
E_C19_Dec_Naila01_37,今日、受け取ることとなるプレゼントの規模と彼らの誠意のことを思うと、
E_C19_Dec_Naila01_38,こんなささやかなプレゼントは、すぐ忘れてしまうかもしれません。
E_C19_Dec_Naila01_39,い…いえ…そんなことは。
E_C19_Dec_Naila01_40,ふふふ。冗談ですよ。
E_C19_Dec_Naila01_41,ネイラが今日の事を決して忘れないということは、皆がよく知っています。
E_C19_Dec_Naila01_42,さぁ、皆が待っています。急ぎましょう。
E_C19_Dec_Naila01_43,(私に自信を与えてくださるために、こうして先に来てくださったんだ)
E_C19_Dec_Naila01_44,セレネ姫、お願いがあります。
E_C19_Dec_Naila01_45,私はハーピーの代表として、まだ力不足だと感じています。
E_C19_Dec_Naila01_46,私の修行の、手助けをしてくださいませんか？
E_C19_Dec_Naila01_47,ええ、もちろんです。
E_C19_Dec_Naila01_48,(バラライカ女王が呼び起こした風)
E_C19_Dec_Naila01_49,(その風を、私は超えてみせる)
E_C19_Dec_Naila01_50,見守っててね、お姉ちゃん！
