KEY,Russian
E_C19_Oct_Laudia01_01,На той стороне всё закончено.
E_C19_Oct_Laudia01_02,"Здесь тоже. Уфф... Хоть монстров и стало меньше, они все идут и идут."
E_C19_Oct_Laudia01_03,"И это будет продолжаться до тех пор, пока демоны взывают к силе... Придётся потрудиться."
E_C19_Oct_Laudia01_04,"Не волнуйтесь. В конце концов, я лишь делаю то, что должен."
E_C19_Oct_Laudia01_05,"Вроде на этом можно закончить, поэтому Вы можете вернуться обратно."
E_C19_Oct_Laudia01_06,"Сегодня же Ваш день рождения, Лаудия."
E_C19_Oct_Laudia01_07,"Ничего страшного. Ведь я, как и ты, тоже делаю то, что должна."
E_C19_Oct_Laudia01_08,Но...
E_C19_Oct_Laudia01_09,"Все в порядке. К тому же, я хочу кое-куда заглянуть..."
E_C19_Oct_Laudia01_10,Кое-куда?
E_C19_Oct_Laudia01_11,"Да. Место, куда я ходила с самого детства... Ты не против составить мне компанию?"
E_C19_Oct_Laudia01_12,"Видимо, это какое-то особенное место. Тогда, если Вы не против, я бы хотел пойти с Вами."
E_C19_Oct_Laudia01_13,"Вот, значит, что это за место."
E_C19_Oct_Laudia01_14,Как здесь всё хорошо убрано. Здесь проводят какие-то ритуалы?
E_C19_Oct_Laudia01_15,Вовсе нет. Хотя я стараюсь наводить здесь порядок.
E_C19_Oct_Laudia01_16,В детстве это было для меня чем-то вроде секретной базы... Но это долгий разговор.
E_C19_Oct_Laudia01_17,"Если Вам не сложно, расскажите. Я хотел бы послушать."
E_C19_Oct_Laudia01_18,"Так вот, это было, когда я была ещё совсем маленькой..."
E_C19_Oct_Laudia01_19,"Ты ведь тоже слышал о боге-драконе, спящем в Храме Потока?"
E_C19_Oct_Laudia01_20,"Да, в детстве, перед сном мне часто доводилось слушать эту историю."
E_C19_Oct_Laudia01_21,"Так как я была маленькой, я и подумать не могла, что это правда."
E_C19_Oct_Laudia01_22,"Лишь туманно представляла себе и почитала прекрасного бога-дракона, проливающего дождь над пустыней."
E_C19_Oct_Laudia01_23,"И подумала, что необходимо приготовить место, где дракон бы жил, когда проснётся."
E_C19_Oct_Laudia01_24,"Сейчас, если подумать, это было очень по-детски."
E_C19_Oct_Laudia01_25,"Ну, Вы ведь были маленькой. Даже если Лайас услышит это, она, наверное, лишь посмеётся и забудет, не так ли?"
E_C19_Oct_Laudia01_26,"Спасибо. Так вот, поиски подходящего места привели меня сюда."
E_C19_Oct_Laudia01_27,"Думала, вот проснётся дракон, и будем мы вместе играть. С такими мыслями и привела здесь все в порядок."
E_C19_Oct_Laudia01_28,"И уже став немного взрослее, я поняла одну вещь."
E_C19_Oct_Laudia01_29,Какую?
E_C19_Oct_Laudia01_30,Это место слишком мало для бога-дракона.
E_C19_Oct_Laudia01_31,А-ха-ха-ха... Это верно.
E_C19_Oct_Laudia01_32,"Но всё равно, приятно смотреть на цветы, расставленные в ряд, и на чистый пол."
E_C19_Oct_Laudia01_33,"Поэтому, как только выдастся минутка, я стараюсь наводить здесь порядок."
E_C19_Oct_Laudia01_34,"Вот как... Значит, Вы приходите сюда в каждый свой день рождения?"
E_C19_Oct_Laudia01_35,"М? Вовсе нет. Просто в последнее время я часто хожу к Лайас по разным делам, вот и вспомнилось."
E_C19_Oct_Laudia01_36,"И как раз сегодня, в день рождения, у меня появилось время, поэтому я решила заглянуть сюда."
E_C19_Oct_Laudia01_37,"Охо, как хорошо, я вас нашла."
E_C19_Oct_Laudia01_38,Ла... Лайас? Как Вы здесь...
E_C19_Oct_Laudia01_39,"Мне хотелось бы кое-что сказать, поэтому пришла сюда."
E_C19_Oct_Laudia01_40,"Я тогда отойду, не буду беспокоить, а вы продолжайте."
E_C19_Oct_Laudia01_41,"В Аэгине было, значит, подобное место. Ты сама здесь всё обустроила?"
E_C19_Oct_Laudia01_42,"Да, в свободное время приходила сюда и наводила порядок."
E_C19_Oct_Laudia01_43,"Судя по чистой энергии, что витает в воздухе, ты, похоже, уже давно за всем ухаживаешь."
E_C19_Oct_Laudia01_44,"Какое красивое место. Если не против, можно я буду иногда приходить сюда?"
E_C19_Oct_Laudia01_45,Разумеется. Когда Вам только будет удобно.
E_C19_Oct_Laudia01_46,"Спасибо. Так вот, я хотела тебе кое-что сказать."
E_C19_Oct_Laudia01_47,"Да, слушаю."
E_C19_Oct_Laudia01_48,"С днём рождения, Лаудия. Желаю, чтобы благословение Потока всегда было с тобой."
E_C19_Oct_Laudia01_49,"Также, немного отклонюсь от темы,"
E_C19_Oct_Laudia01_50,но ты очень хорошо справилась в битвах с демонами.
E_C19_Oct_Laudia01_51,"К людям снова вернулась радость, и твою заслугу в этом сложно недооценить."
E_C19_Oct_Laudia01_52,"Как хранительница пустыни, я хочу выразить благодарность."
E_C19_Oct_Laudia01_53,Не... не стоит... Спасибо большое.
E_C19_Oct_Laudia01_54,"Извини, что я прервала тебя во время отдыха. В оставшееся время желаю тебе провести прекрасный день."
E_C19_Oct_Laudia01_55,"Нет-нет, я очень счастлива, что Вы пришли сюда, и даже поздравили меня."
E_C19_Oct_Laudia01_56,О чём вы беседовали?
E_C19_Oct_Laudia01_57,"Лайас сказала, что здесь очень красиво... И что хотела бы иногда приходить сюда."
E_C19_Oct_Laudia01_58,"Даже в детстве я и мечтать не могла о том, чтобы бог-дракон меня похвалила."
E_C19_Oct_Laudia01_59,Какие дела...
E_C19_Oct_Laudia01_60,Сама Лайас пришла сюда. Сбылась Ваша мечта детства.
E_C19_Oct_Laudia01_61,"Действительно... Хорошо все-таки, что я не сдалась на полпути и приложила столько усилий."
E_C19_Oct_Clause01_01,"Клаус, брат мой, с днём рождения!!"
E_C19_Oct_Clause01_02,"С днём рождения, Клаус!!"
E_C19_Oct_Clause01_03,Мы лично это сделали. Как тебе?
E_C19_Oct_Clause01_04,"Хи-хи, Кассель неправильно написал."
E_C19_Oct_Clause01_05,"Уф, зачем ты так? Ты же обещала не смеяться надо мной!"
E_C19_Oct_Clause01_06,Ха-ха! Оба мне очень нравятся!
E_C19_Oct_Clause01_07,"Большое спасибо! Как и ожидалось от вас, ребята!!"
E_C19_Oct_Clause01_08,В то время мы могли поздравить его первыми...
E_C19_Oct_Clause01_09,Да...
E_C19_Oct_Clause01_10,"С днём рождения, Клаус!"
E_C19_Oct_Clause01_11,Ты - гордость нашего Орвела! Поздравляем!
E_C19_Oct_Clause01_12,Ха-ха... Спасибо вам большое!!
E_C19_Oct_Clause01_13,"Я буду делать все возможное, чтобы оправдать ваши надежды."
E_C19_Oct_Clause01_14,"Ох-ох, Клаус. Даже в день рождения такой же непоколебимый, как и всегда."
E_C19_Oct_Clause01_15,"Поэтому и такой привлекательный, хи-хи! С днём рождения!"
E_C19_Oct_Clause01_16,"Понемногу становится лучше, не думаешь?"
E_C19_Oct_Clause01_17,"Да, а теперь..."
E_C19_Oct_Clause01_18,Командир! Вас что-то привело сюда?
E_C19_Oct_Clause01_19,"Я пришла тебя проведать. Вижу, у тебя все так же много друзей."
E_C19_Oct_Clause01_20,"Вот собственноручно написанное письмо от принцессы и подарок, держи."
E_C19_Oct_Clause01_21,"С днём рождения, Клаус."
E_C19_Oct_Clause01_22,Прими мои искренние поздравления!
E_C19_Oct_Clause01_23,"Я подготовил похожую на тебя деревянную фигурку, вот, держи."
E_C19_Oct_Clause01_24,"А-ха-ха.. Спасибо, Ломан."
E_C19_Oct_Clause01_25,"Командир, и Вам спасибо. Я потом лично навещу принцессу."
E_C19_Oct_Clause01_26,Хорошо. Принцесса тоже будет очень рада тебя видеть.
E_C19_Oct_Clause01_27,И ещё...
E_C19_Oct_Clause01_28,Я думаю назначить тебя командиром рыцарей начиная с сегодняшнего дня...
E_C19_Oct_Clause01_29,"Ха, ха-ха-ха! Простите, но я, пожалуй, откажусь и в этот раз, командир!"
E_C19_Oct_Clause01_30,"Я хочу помогать людям, будучи на своём нынешнем посту."
E_C19_Oct_Clause01_31,"Именно в этом, я считаю, и заключается моя работа. "
E_C19_Oct_Clause01_32,Эх.... Снова провал...
E_C19_Oct_Clause01_33,"Ого, в этот раз командир..."
E_C19_Oct_Clause01_34,"Я же говорю, Клаус очень популярен."
E_C19_Oct_Clause01_35,Может подождём ещё?...
E_C19_Oct_Clause01_36,"Хорошо, да времени ещё много."
E_C19_Oct_Clause01_37,Клаус... Выглядит счастливым.
E_C19_Oct_Clause01_38,В детстве мы отмечали дни рождения лишь втроём.
E_C19_Oct_Clause01_39,"Тебе что, грустно?"
E_C19_Oct_Clause01_40,Ха-ха... Попался.
E_C19_Oct_Clause01_41,Но все в порядке. Ведь Клаус - мой брат.
E_C19_Oct_Clause01_42,"Хотя мне немного грустно, что мы проводим всё меньше времени вместе."
E_C19_Oct_Clause01_43,Да...
E_C19_Oct_Clause01_44,Ха-ха-ха... В этом году этот день выдался таким же безумным.
E_C19_Oct_Clause01_45,"Но что более важно, я, кажется, не видел ни Касселя, ни Фрэй... Может, они заняты?"
E_C19_Oct_Clause01_46,Кассель лишь недавно стал оруженосцем...
E_C19_Oct_Clause01_47,И Фрэй наверняка очень занята обучением.
E_C19_Oct_Clause01_48,"Они тоже уже выросли. Да, да."
E_C19_Oct_Clause01_49,"А ведь раньше были, по сравнению со мной, такими маленькими..."
E_C19_Oct_Clause01_50,"О, Клаус!"
E_C19_Oct_Clause01_51,Ты один? А где Кассель и Фрэй?
E_C19_Oct_Clause01_52,"Они, кажется, только что тебя искали!"
E_C19_Oct_Clause01_53,Что?
E_C19_Oct_Clause01_54,"Я определённо думала, что вы вместе... Видимо, не заметили друг друга."
E_C19_Oct_Clause01_55,"Быстрее иди, поищи их! Они наверняка ещё ждут тебя."
E_C19_Oct_Clause01_56,Ох!
E_C19_Oct_Clause01_57,Брат!\nКлаус!
E_C19_Oct_Clause01_58,Вы... Вы все это время ждали здесь?!
E_C19_Oct_Clause01_59,"Хи-хи, конечно! Это ведь твой день рождения! Мы подумали, что если подождать, то ты обязательно появишься!"
E_C19_Oct_Clause01_60,Прости... Мы немного опоздали... Ты ведь не обидишься на нас?
E_C19_Oct_Clause01_61,Кассель... Фрэй...
E_C19_Oct_Clause01_62,Конечно нет! День рождения без вас - это не праздник!
E_C19_Oct_Clause01_63,"Ах-ха, Клаус, да ну тебя."
E_C19_Oct_Clause01_64,От всей души поздравляем тебя с днём рождения!!
E_C19_Oct_Clause01_65,.....Без вас праздник был бы неполноценным.
E_C19_Oct_Clause01_66,Поэтому я сейчас пойду к вам.
E_C19_Oct_Clause01_67,Подождите немного.
E_C19_Oct_Neraxis01_01,Вот и наступил это день. Сегодня.
E_C19_Oct_Neraxis01_02,День рождения дурачка!
E_C19_Oct_Neraxis01_03,Ради этого дня я два раза всё обдумала и так старалась... Ха-ха-ха...
E_C19_Oct_Neraxis01_04,Двумя днями ранее.
E_C19_Oct_Neraxis01_05,"Ох, скоро день рождения дурачка... Надоело..."
E_C19_Oct_Neraxis01_06,"Но что ж делать, нужно расплатиться за полученное. Ведь я дракон с принципами!"
E_C19_Oct_Neraxis01_07,"О, сестричка!"
E_C19_Oct_Neraxis01_08,А?
E_C19_Oct_Neraxis01_09,"Лайас, что ты подаришь ду... Ой, я имею ввиду, Нераксису на день рождения?"
E_C19_Oct_Neraxis01_10,"Я? Ну, так как он хочет побыстрее стать сильным..."
E_C19_Oct_Neraxis01_11,"Думаю, стоит подарить что-нибудь полезное для сражений, не так ли?"
E_C19_Oct_Neraxis01_12,Хм...
E_C19_Oct_Neraxis01_13,Ты ещё не определилась? Тебе помочь?
E_C19_Oct_Neraxis01_14,"Не, нет! Я могу сама выбрать!"
E_C19_Oct_Neraxis01_15,"Хорошо. Но если вдруг передумаешь, дай мне знать, ладно?"
E_C19_Oct_Neraxis01_16,Хмм... Все-таки сестричка очень добрая. В моем деле она не поможет...
E_C19_Oct_Neraxis01_17,"Конечно, такой обычный подарок тоже хорош,"
E_C19_Oct_Neraxis01_18,"но если подарить что-то действительно хорошее, настроение испортится..."
E_C19_Oct_Neraxis01_19,"О, придумала! Так и сделаю!"
E_C19_Oct_Neraxis01_20,Днем ранее.
E_C19_Oct_Neraxis01_21,Лаудия.
E_C19_Oct_Neraxis01_22,"О, Лилия, входите, пожалуйста. Что Вас привело сюда?"
E_C19_Oct_Neraxis01_23,У меня есть один вопрос.
E_C19_Oct_Neraxis01_24,"Вопрос? Если я смогу на него ответить, то пожалуйста, задавайте."
E_C19_Oct_Neraxis01_25,"Ты не знаешь, может есть какие-то предметы, которые классно выглядят, но совершенно бесполезны?"
E_C19_Oct_Neraxis01_26,"Классно выглядят, но совершенно бесполезны?"
E_C19_Oct_Neraxis01_27,"Так Вы выбираете подарок для Нераксиса. Классный, но бесполезный..."
E_C19_Oct_Neraxis01_28,"Может, что-то вроде статуи, которую Вы получили на день рождения от короля-бога..."
E_C19_Oct_Neraxis01_29,"В целом, ценная и с виду очень красивая,"
E_C19_Oct_Neraxis01_30,"но для того, кто получил подарок, достаточно бесполезная."
E_C19_Oct_Neraxis01_31,"Очень красивая, но бесполезная для того, кто получил подарок..."
E_C19_Oct_Neraxis01_32,"Оо, спасибо! Хорошая информация!"
E_C19_Oct_Neraxis01_33,И вот наступило сегодня.
E_C19_Oct_Neraxis01_34,...
E_C19_Oct_Neraxis01_35,Что с ним? Чего это у него с утра дня рождения такое лицо.
E_C19_Oct_Neraxis01_36,"Уж не о прежней семье он думает? Может, лучше не давать подарок сейчас?"
E_C19_Oct_Neraxis01_37,"Аааа! О нет, нельзя, чтобы сестричка первой увидела!!"
E_C19_Oct_Neraxis01_38,"С днём рождения, дурачок!"
E_C19_Oct_Neraxis01_39,Уф!
E_C19_Oct_Neraxis01_40,"Что ты делаешь, малявка!"
E_C19_Oct_Neraxis01_41,"Тебя поздравляют, а ты что-то тут разговорился!!"
E_C19_Oct_Neraxis01_42,"В общем, с днём рождения!"
E_C19_Oct_Neraxis01_43,........?!
E_C19_Oct_Neraxis01_44,А... Ага... Спасибо.......?
E_C19_Oct_Neraxis01_45,Эй.
E_C19_Oct_Neraxis01_46,Чего?
E_C19_Oct_Neraxis01_47,Это ещё что?..
E_C19_Oct_Neraxis01_48,"Эх, каменная ты голова, не можешь даже этого понять?"
E_C19_Oct_Neraxis01_49,"Понял, как только увидел! Но я не об этом спрашиваю!"
E_C19_Oct_Neraxis01_50,"Что это ты, ни с того ни с сего, даришь мне украшение в виде цыплёнка?!"
E_C19_Oct_Neraxis01_51,В смысле что? Разве оно не миленькое? К тому же из лимитированного выпуска!
E_C19_Oct_Neraxis01_52,"Доброе утро! С днём рождения, Нераксис."
E_C19_Oct_Neraxis01_53,"О боже, Лилия, неужели ты нашла это?"
E_C19_Oct_Neraxis01_54,Конечно! Я уже не маленькая! Даже я могу это сделать!
E_C19_Oct_Neraxis01_55,Наша Лилия так выросла.... Где же ты его нашла?
E_C19_Oct_Neraxis01_56,Напротив Крепости Орвел есть один антикварный магазин...
E_C19_Oct_Neraxis01_57,......
E_C19_Oct_Neraxis01_58,?..
E_C19_Oct_Neraxis01_59,"Эй, малявка, то есть Лилия, тут изнутри издаётся какой-то звук..."
E_C19_Oct_Neraxis01_60,Ч-что? Те-тебе почудилось!
E_C19_Oct_Neraxis01_61,"Се-сестричка, пойдём накроем стол! Ты же приготовила что-то вкусное?"
E_C19_Oct_Neraxis01_62,Как-то подозрительно... Ты опять что-то задумала?
E_C19_Oct_Neraxis01_63,Эй!!!!!!! Малявка!!!!!!! Что это ещё за!!!!!!!!!
E_C19_Oct_Kasel01_1,Кассель?
E_C19_Oct_Kasel01_2,Кассель!
E_C19_Oct_Kasel01_3,А... Фрэй...
E_C19_Oct_Kasel01_4,О чём ты думаешь?
E_C19_Oct_Kasel01_5,"Я все звала и звала, а ты не откликаешься. Я уже начала беспокоиться."
E_C19_Oct_Kasel01_6,"Ха-ха, да так, ничего особенного."
E_C19_Oct_Kasel01_7,"Может, из-за того, что мы уже почти завершили странствие... Иногда всплывают воспоминания о том, что мы пережили."
E_C19_Oct_Kasel01_8,"Надеюсь, не грустные воспоминания?"
E_C19_Oct_Kasel01_9,"Ха-ха, вовсе нет."
E_C19_Oct_Kasel01_10,"Например, воспоминания о первой встрече с Клео и Роем."
E_C19_Oct_Kasel01_11,"Или о дне, когда мы спасли Нейлу и Селену..."
E_C19_Oct_Kasel01_12,Подобные воспоминания.
E_C19_Oct_Kasel01_13,Вот как.
E_C19_Oct_Kasel01_14,"Действительно, так много всего произошло. Стольких людей мы встретили..."
E_C19_Oct_Kasel01_15,"Кстати, вспоминается и твой день рождения."
E_C19_Oct_Kasel01_16,"Да, ха-ха-ха."
E_C19_Oct_Kasel01_17,"Когда мы только ещё познакомились с Клео и Роем, да?"
E_C19_Oct_Kasel01_18,"Да, верно. В тот день..."
E_C19_Oct_Kasel01_19,День рождения Касселя
E_C19_Oct_Kasel01_20,Ты правда в порядке? Меня любой вариант устроит...
E_C19_Oct_Kasel01_21,"Конечно. Достаточно уже того, что ты так об этом заботишься. "
E_C19_Oct_Kasel01_22,Но...
E_C19_Oct_Kasel01_23,Но сейчас нам в первую очередь нужно завершить наше дело.
E_C19_Oct_Kasel01_24,"Для начала, хотелось бы решить, как быть со Священным мечом."
E_C19_Oct_Kasel01_25,Ладно... Хорошо.
E_C19_Oct_Kasel01_26,(Но именно поэтому я хочу что-нибудь сделать...)
E_C19_Oct_Kasel01_27,"(О, придумала!)"
E_C19_Oct_Kasel01_28,"Ох, время-то уже... Я ненадолго отойду, Фрэй."
E_C19_Oct_Kasel01_29,Сегодня моя очередь идти за дровами.
E_C19_Oct_Kasel01_30,"Хорошо, не задерживайся."
E_C19_Oct_Kasel01_31,"Охо, день рождения Касселя?"
E_C19_Oct_Kasel01_32,Тогда мой подарок уже решён!
E_C19_Oct_Kasel01_33,Как насчёт великого короля слизи? Или огромного прекрасного голема?
E_C19_Oct_Kasel01_34,"Подарок - это не то, что ты сама хочешь получить."
E_C19_Oct_Kasel01_35,"Никто, кроме тебя, не будет рад такому."
E_C19_Oct_Kasel01_36,"Чего, дурак! Я же очень усердно думала над подарком!"
E_C19_Oct_Kasel01_37,"Ха-ха-ха... Ну да, ну да. Похоже на это."
E_C19_Oct_Kasel01_38,Не смейся ты так!
E_C19_Oct_Kasel01_39,"Так... Тебя же Клаус зовут, да? Я понимаю, почему Фрэй тебя позвала..."
E_C19_Oct_Kasel01_40,"Но мы с вами встретились совсем недавно, поэтому не знаем, сможем ли мы чем-то помочь."
E_C19_Oct_Kasel01_41,"Извините, если мы приносим вам неудобства."
E_C19_Oct_Kasel01_42,Просто по этому случаю хотелось бы с вами обоими подружиться...
E_C19_Oct_Kasel01_43,"Кроме того, вы уже знаете ситуацию Касселя..."
E_C19_Oct_Kasel01_44,Поэтому хотелось бы отпраздновать всем вместе и поднять ему настроение.
E_C19_Oct_Kasel01_45,"Хе-хе. То, что ты добавила, ты ведь серьёзно?"
E_C19_Oct_Kasel01_46,"Мда... Не надо это так подчёркивать, просто прими это... Эх."
E_C19_Oct_Kasel01_47,"Ха-ха-ха, а ты зоркая девочка."
E_C19_Oct_Kasel01_48,Но... Я полностью согласен с Фрэй. 
E_C19_Oct_Kasel01_49,"То, что Кассель является хозяином Священного меча,"
E_C19_Oct_Kasel01_50,и что впредь его ждет долгий путь...
E_C19_Oct_Kasel01_51,Об этом знаем только мы.
E_C19_Oct_Kasel01_52,"И я хочу хоть как-нибудь подбодрить Касселя, ведь он несёт такую тяжелую ношу."
E_C19_Oct_Kasel01_53,Я надеюсь на вас. Даже самый маленький подарок подойдет.
E_C19_Oct_Kasel01_54,"Надеюсь, вы отпразднуете день рождения с нами."
E_C19_Oct_Kasel01_55,Клаус...
E_C19_Oct_Kasel01_56,Мм... Раз уж все так серьёзно...
E_C19_Oct_Kasel01_57,...Мм...
E_C19_Oct_Kasel01_58,Хмм... Как насчёт этого?
