KEY,French
CS_CH3_Main_8_024,"Eh bien, tant pis. Nous allons essayer de deviner le reste d'une autre façon."
CS_CH3_Main_8_025,Merci de nous dire ce que vous savez.
CS_CH3_Main_8_026,"Ach... Autres Gobelins, toujours attaquer vous."
CS_CH3_Main_8_027,"Désolé! Vous pas trop durs contre eux, ach..."
CS_CH3_Main_9_001,Chargez!
CS_CH3_Main_9_002,"Ouiii, le Golem fonctionne!!!"
CS_CH3_Main_9_003,Viens!!
CS_CH3_Main_9_004,Contrôler Golem! 'Lui' génie!!
CS_CH3_Main_9_005,.......
CS_CH3_Main_9_006,Cleo. Cleo?
CS_CH3_Main_9_007,"Eh bien, on dirait bien qu'elle est choquée de voir des gobelins contrôler des golems."
CS_CH3_Main_9_008,"Après tout, ils ont réussi là où elle a échoué."
CS_CH3_Main_9_009,Rooooooi !!!!
CS_CH3_Main_9_010,Ach! Humain!
CS_CH3_Main_9_011,Ach! Espionner nous! Orcs font humains espionner nous!
CS_CH3_Main_9_012,Nous ne sommes pas des espions...
CS_CH3_Main_9_013,Ils ne comprendrons pas tant que nous ne les auront pas tabassés.
CS_CH3_Main_9_014,"Apportez-le, bande d'idiots!"
CS_CH3_Main_9_015,"Vous m'humiliez, vous allez me le payer!"
CS_CH3_Main_10_001,"Hehe, trop facile!!"
CS_CH3_Main_10_002,"Cleo, vous y allez un peu fort."
CS_CH3_Main_10_003,"Hmpf, je ne suis même pas fatiguée!"
CS_CH3_Main_10_004,Elle est clairement fachée. Voir ces 'stupides gobelins' faire mieux qu'elle pour contrôler un golem...
CS_CH3_Main_10_005,"Ce n'est pas vrai, stupide Roi !!!"
CS_CH3_Main_11_001,Kyak !! Arrêtez! Moi ami humain!
CS_CH3_Main_11_002,Lakrak?
CS_CH3_Main_11_003,"Attendez, vous êtes...?!"
CS_CH3_Main_11_004,...
CS_CH3_Main_11_005,Sorcière corbeau! Je vous attendais!
CS_CH3_Main_11_006,"Au sujet de l'ancien ami dont vous aviez parlé, je voudrais savoir..."
CS_CH3_Main_11_007,"Pfff, vous êtes têtue."
CS_CH3_Main_11_008,"Si vous m'aidez, je vous dirais ce que vous voulez entendre."
CS_CH3_Main_11_009,Quoi!? Est-ce que vous me parlez d'aider les démons?
CS_CH3_Main_11_010,"Heu, pas de panique. Je n'en demande pas tant."
CS_CH3_Main_11_011,Lakrak. Vous semblez être du même côté qu'elle.
CS_CH3_Main_11_012,Pourquoi êtes-vous allié aux démons?
CS_CH3_Main_11_013,Ack? Cette femme démon?
CS_CH3_Main_11_014,Alors... allez-vous vraiment abandonner maintenant? Gobelin blanc.
CS_CH3_Main_11_015,....
CS_CH3_Main_11_016,"Démon ou pas, peu importe! Ach!"
CS_CH3_Main_11_017,Elle aide pour faire arme forte !!
CS_CH3_Main_11_018,"Ah... Lua, ma Déesse..."
CS_CH3_Main_11_019,"Des golems, et maintenant des gobelins aussi..."
CS_CH3_Main_11_020,Stupide prêtre. Lua ne sauvera personne.
CS_CH3_Main_11_021,"Priez tout ce que vous voulez, elle ne répondra jamais."
CS_CH3_Main_11_022,Cette damnée Déesse...
CS_CH3_Main_11_023,Quoi? Comment osez...
CS_CH3_Main_11_024,"Non, l'Épée Sacrée est une preuve suffisante."
CS_CH3_Main_11_025,"C'est un cadeau de la Déesse, qui porte son souhait d'empêcher les démons de détruire ce monde, comme vous l'avez fait autrefois!"
CS_CH3_Main_11_026,Pfff...
CS_CH3_Main_11_027,Hahahahahaha!
CS_CH3_Main_11_028,Un cadeau? Cette chose?
CS_CH3_Main_11_029,"Croyez ce que vous voulez. Au fond... oui, de tout coeur."
CS_CH3_Main_11_030,"Elle ne vous apportera que désespoir, vous maudirez Lua et son Épée Sacrée."
CS_CH3_Main_11_031,Alors je verrai votre beau visage virer à l'horreur et se remplir de larmes...
CS_CH3_Main_11_032,Quoi!? Qu'est-ce que vous racontez?
CS_CH3_Main_11_033,Hehe...
CS_CH3_Main_11_034,"À la prochaine, enfant d'Arlette."
CS_CH3_Main_11_035,Attendez! Sorcière!
CS_CH3_Main_11_036,Arlette... Elle m'a appelée 'enfant d'Arlette'.
CS_CH3_Main_11_037,"Roi, c'est ça...! Le nom de ma mère est Arlette...!"
CS_CH3_Main_12_001,Ha... Lakrak.
CS_CH3_Main_12_002,"Après vous avoir vu aux côtés de cette sorcière, Maria, tout s'est mal passé."
CS_CH3_Main_12_003,Avez-vous vraiment décidé de faire équipe avec les démons?
CS_CH3_Main_12_004,"Équipe avec démons? Ach, non!"
CS_CH3_Main_12_005,Je pas connaître femme Démon!
CS_CH3_Main_12_006,"Je ne pense pas qu'elle soit un démon, vraiment!"
CS_CH3_Main_12_007,Je sais qu'elle est humaine. Mais est-elle de leur côté?
CS_CH3_Main_12_008,Ce n'est pas notre affaire.
CS_CH3_Main_12_009,"Ce qui importe, c'est que la sorcière soit dangereuse pour nous."
CS_CH3_Main_12_010,"Et Lakrak, nous avons besoin de savoir pourquoi vous étiez avec elle."
CS_CH3_Main_12_011,"Ach! Moi voyage, faire une arme puissante!"
CS_CH3_Main_12_012,Je la rencontre ici!
CS_CH3_Main_12_013,"Elle dit, moi aider à fabriquer arme puissante, ach!"
CS_CH3_Main_12_014,Arme impossible avec technologie! Arme magique!
CS_CH3_Main_12_015,"Elle aide, contrôler golem!"
CS_CH3_Main_12_016,Je le savais!
CS_CH3_Main_12_017,Je savais qu'un gobelin ne pouvait pas créer un contrôleur de golem par lui-même.
CS_CH3_Main_12_018,"Vous avez l'air soulagée, Cleo."
CS_CH3_Main_12_019,"Bien sûr! Bien qu'au début, j'ai été un peu surprise."
CS_CH3_Main_12_020,La femme a dit le nom de ma mère à haute voix et a disparu.
CS_CH3_Main_12_021,Pour quelle raison a-t-elle...?
CS_CH3_Main_12_022,"Ach, arme puissante gratuitement, non!"
CS_CH3_Main_12_023,"Gobelin sauver des orcs, paiement!"
CS_CH3_Main_12_024,*Soupir*... alors le 'Lui' que les gobelins vantaient était...
CS_CH3_Main_12_025,Je ne m'attendais pas à ce que ce soit Lakrak.
CS_CH3_Main_12_026,"Très ennuyeux, ah! Diriger foule de gobelins stupides, bah!"
CS_CH3_Main_12_027,Mais pourquoi Maria aide-t-elle les gobelins?
CS_CH3_Main_12_028,Kyak! Sais pas! Pas important!
CS_CH3_Main_12_029,Je me concentre arme forte!
CS_CH3_Main_12_030,Elle a dit que nous nous reverrions... Vous pourrez lui demander.
CS_CH3_Main_12_031,Ce n'est pas la seule chose que je vais lui demander.
CS_CH3_Main_12_032,Elle doit savoir quelque chose pour ma mère aussi...
CS_CH3_Main_12_033,"Et aussi... ce qu'elle a dit à propos de moi, maudissant Lua..."
CS_CH3_Main_12_034,...
CS_CH3_Main_13_001,Lakrak vient-il avec nous?
CS_CH3_Main_13_002,"Tester canon à main artisanal Lakrak MK-3, sur orc! Oui!"
CS_CH3_Main_13_003,Vous ne pouvez pas tester vos trucs tout seul?
CS_CH3_Main_13_004,Ugh... C'est...
CS_CH3_Main_13_005,Un test situation de groupe!
CS_CH3_Main_13_006,"Ach, tester efficacité lorsque nous battre ensemble!"
CS_CH3_Main_13_007,"Mouais, quoique vous disiez."
CS_CH3_Main_14_001,"C'est un malentendu, Throne. Écoutez-moi..."
CS_CH3_Main_14_002,"Je vous ai écouté, mot après mot."
CS_CH3_Main_14_003,Tout n'est que bêtise.
CS_CH3_Main_14_004,Ce n'est pas vrai.
CS_CH3_Main_14_005,Les orcs semblent aussi avoir leurs problèmes...
CS_CH3_Main_14_006,Oh... Vous devez être...
CS_CH3_Main_14_007,Le successeur de l'Épée Sacrée!
CS_CH3_Main_14_008,"Attendez, comment avez-vous..."
CS_CH3_Main_14_009,"Look, Throne. Voici le successeur de l'Épée Sacrée dont j'avais parlé."
CS_CH3_Main_14_010,"Une Épée Sacrée? Pfff... à quoi ça sert maintenant, de toute façon?"
CS_CH3_Main_14_011,Throne. L'émergence de l'Épée Sacrée signifie que le monde est en danger.
CS_CH3_Main_14_012,Les orcs sont déjà en crise.
CS_CH3_Main_14_013,A cause de ces humains!
CS_CH3_Main_14_014,Nous ne savons pas de quoi vous parlez...
CS_CH3_Main_14_015,"Bougez, Kaulah! Je vais vous tailler en pièces si vous ne le faites pas."
CS_CH3_Main_14_016,...
CS_CH3_Main_14_017,"Ah... pardonnez-moi, Throne."
CS_CH3_Main_15_001,Kaulah!!!
CS_CH3_Main_15_002,Vous... vous traître...
CS_CH3_Main_15_003,Comment pouvez-vous rester de leur côté... ces perfides...
CS_CH3_Main_15_004,"Je suis terriblement désolé, Throne."
CS_CH3_Main_15_005,Vous... nos frères ne laisseront pas faire ça.
CS_CH3_Main_15_006,Ils vous poursuivront... jusqu'au bout du monde... Kaulah....
CS_CH3_Main_15_007,Vous payerez pour... votre trahison...
CS_CH3_Main_15_008,...
CS_CH3_Main_15_009,Throne.. Throne!!
CS_CH3_Main_15_010,"Je suis désolé. Je ne pouvais pas faire autrement, pardonnez-moi..."
CS_CH3_Main_15_011,Que la bénédiction de Lua soit avec vous.
CS_CH3_Main_15_012,"Je suis désolé, vous avez dû traverser tout ça à cause de moi... et par-dessus tout être traité de traître..."
CS_CH3_Main_15_013,Comment saviez-vous que Kasel était le successeur de l'Épée Sacrée?
CS_CH3_Main_15_014,Son nom est Kasel?
CS_CH3_Main_15_015,J'ai eu un rêve prophétique de lui tenant l'Épée Sacrée.
CS_CH3_Main_15_016,Un rêve prophétique?
CS_CH3_Main_15_017,J'ai entendu parler de ces personnes auparavant.
CS_CH3_Main_15_018,Certains chamans orcs supérieurs peuvent voir le futur dans leurs rêves prophétiques.
CS_CH3_Main_15_019,Vous avez dit que les orcs étaient en danger à cause des humains. Que se passe-t-il?
CS_CH3_Main_15_020,"Récemment, certains de mes frères ont disparu..."
CS_CH3_Main_15_021,Et il y avait une rumeur...
CS_CH3_Main_15_022,disant que des humains nous asservissaient.
CS_CH3_Main_15_023,Pas croyable!
CS_CH3_Main_15_024,"Les humains, prenant les orcs comme esclaves !? C'est une absurdité totale!"
CS_CH3_Main_15_025,Nous n'avons jamais vu ou entendu parler de ça!!
CS_CH3_Main_15_026,Je sais. Je vous crois.
CS_CH3_Main_15_027,"Les autres orcs, cependant, croient que c'est vrai."
CS_CH3_Main_15_028,Le Grand Chef Sieg est particulièrement en colère et nourrit une haine contre les humains.
CS_CH3_Main_15_029,Sieg? C'est le Grand Chef actuel?
CS_CH3_Main_15_030,Qu'en est-il de Garuk?
CS_CH3_Main_15_031,Garuk faisait confiance aux humains.
CS_CH3_Main_15_032,Alors Sieg l'a défié en duel et l'a tué pour devenir le nouveau Grand Chef.
CS_CH3_Main_15_033,N'est-ce pas... une trahison?
CS_CH3_Main_15_034,Les orcs choisissent parfois leur chef de cette façon.
CS_CH3_Main_15_035,C'est assez barbare.
CS_CH3_Main_15_036,"Oui. En fait, c'était une tradition oubliée."
CS_CH3_Main_15_037,"Mais, alors que la colère contre les humains augmentait,"
CS_CH3_Main_15_038,Sieg a eu le soutien de beaucoup de mes semblables qui pensaient que nous devions attaquer les humains.
CS_CH3_Main_15_039,Il a ensuite utilisé le duel comme moyen de montrer qu'il était favorable aux anciennes traditions.
CS_CH3_Main_15_040,Quelle est la possibilité que les humains asservissent effectivement les orcs?
CS_CH3_Main_15_041,"Comme, peut-être, cet empire."
CS_CH3_Main_15_042,L'empire Vespian?
CS_CH3_Main_15_043,"Non, ça n'aurait aucun sens."
CS_CH3_Main_15_044,Ils n'ont aucune raison d'aller aussi loin pour de simples esclaves. Leurs terres sont bien trop éloignées.
CS_CH3_Main_15_045,Hmm... je vois.
CS_CH3_Main_15_046,Nous devrions rencontrer le GrandChef pour régler ce malentendu.
CS_CH3_Main_15_047,"Vous devez d'abord rencontrer mon apprenti, Dain. Il pourra vous aider."
CS_CH3_Main_16_001,Connaissez-vous le pouvoir divisé de l'Épée Sacrée?
CS_CH3_Main_16_002,"Oui. Notre légendaire Grand Chef, Aeatola,"
CS_CH3_Main_16_003,"le Héros orc qui avait aidé Kyle à l'époque, a mis le pouvoir dans un talisman."
CS_CH3_Main_16_004,Le talisman a ensuite été transmis à chaque nouveau Grand Chef.
CS_CH3_Main_16_005,Donc Sieg doit l'avoir maintenant.
CS_CH3_Main_16_006,Effectivement.
CS_CH3_Main_16_007,*Soupir*... Quelle galère.
CS_CH3_Main_17_001,"Nous pourrons rencontrer Dain, au nord d'ici."
CS_CH3_Main_17_002,J'espère qu'aucun mal ne lui est arrivé à cause de moi...
CS_CH3_Main_17_003,"Déesse Lua, protégez Dain, l'apprenti de Kaulah."
CS_CH3_Main_17_004,Nous devrions nous dépêcher avant que quelque chose de mauvais ne se produise.
CS_CH3_Main_18_001,Maitre! Est-ce que ça va?
CS_CH3_Main_18_002,"Oh, Dain. Je remercie le ciel. Je m'inquiétais pour vous."
CS_CH3_Main_18_003,"Je suis toujours inquiet pour vous, encore aujourd'hui."
CS_CH3_Main_18_004,Pourquoi êtes-vous avec des humains en ces temps dangereux?
CS_CH3_Main_18_005,Je suis désolé... Kaulah a été accusé d'être un traître à cause de nous.
CS_CH3_Main_18_006,"Je souhaite discuter de quelque chose en privé avec mon maître, pourriez-vous attendre ici un moment?"
CS_CH3_Main_18_007,Bien sûr.
CS_CH3_Main_18_008,"Quoi, qu'est-ce que c'est?"
CS_CH3_Main_18_009,Un piège?!
CS_CH3_Main_18_010,"Qu'est-ce qui se passe, Dain?!"
CS_CH3_Main_18_011,"Je dois me débarrasser des humains, maître. Je suis désolé."
CS_CH3_Main_18_012,C'est la seule façon de vous maintenir en vie.
CS_CH3_Main_18_013,Imbécile aveugle... Les ténèbres essaient d'avaler ce monde.
CS_CH3_Main_18_014,La sécurité des orcs n'est pas la seule chose en jeu!
CS_CH3_Main_18_015,Nous allons tomber!
CS_CH3_Main_18_016,Kasel: Frey!!
CS_CH3_Main_18_017,Frey: Kyaaaaaa!
CS_CH3_Main_18_018,"Kasel: Non, Lua, s'il vous plaît..."
CS_CH3_Main_18_019,"Kasel: Protégez Frey...\nS'il vous plait! Si quelqu'un doit mourir, faites que ce soit moi... pas elle!!"
CS_CH3_Main_18_020,Cleo: Frey!!!
CS_CH3_Main_18_021,Roi: Huh...
CS_CH3_Main_18_022,Cleo: Ne... renoncez pas !!!
CS_CH3_Main_18_023,"Roi: Donnez-moi la main, Kasel !!!"
CS_CH3_Main_18_024,"Roi: Je l'ai!! En haut maintenant, Cleo!"
CS_CH3_Main_18_025,"Cleo: D'accord, laissez-moi vous montrer ce qu'est la vitesse!!!"
CS_CH3_Main_18_026,Cleo: Mon bâton peut traverser le paradis!
CS_CH3_Main_18_027,"Roi: Euh... nous les avons sauvés, vous pouvez ralentir maintenant..."
CS_CH3_Main_19_001,Qu'est-ce que vous mijotez.
CS_CH3_Main_19_002,C'est un ordre du Grand Chef Sieg. Il a dit qu'il vous tuerait si nous n'éliminions pas ces humains.
CS_CH3_Main_19_003,C'est absurde... Vous voulez abandonner le monde aux ténèbres à cause de moi?
CS_CH3_Main_19_004,Voilà pourquoi... nous sommes venus pour sauver le monde des ténèbres!
CS_CH3_Main_19_005,Oh... Vous êtes en vie.
CS_CH3_Main_19_006,Grrr... Vous ne devriez pas être en vie!!!
CS_CH3_Main_19_007,Mourez!!!
CS_CH3_Main_19_008,"Arrêtez!! Dain, Stop!"
CS_CH3_Main_19_009,"Je suis désolé, Kaulah. Nous devons nous défendre..."
CS_CH3_Main_20_001,Ouch... Ils sont forts...
CS_CH3_Main_20_002,"Maintenant arrêtez, Dain. Ces personnes peuvent raisonner Sieg."
CS_CH3_Main_20_003,Ça... me semble possible...
CS_CH3_Main_20_004,Pourquoi avez-vous fait ça?!!
CS_CH3_Main_20_005,"Humpf, les orcs sont si naïfs."
CS_CH3_Main_20_006,"Eh bien, c'est la cause de tout ce désordre, de toute façon."
CS_CH3_Main_20_007,Maria!! Pourquoi...
CS_CH3_Main_20_008,"Non seulement les orcs, mais vous aussi, vous êtes tous si naïfs."
CS_CH3_Main_20_009,Pensez-vous vraiment que vous pourrez le persuader?
CS_CH3_Main_20_010,Nous devons au moins essayer!
CS_CH3_Main_20_011,Vous mourrez en essayant.
CS_CH3_Main_20_012,"Je ne veux pas que vous mourriez, pour l'instant."
CS_CH3_Main_20_013,Et pourquoi cela?
CS_CH3_Main_20_014,"Hmm, vous ne vous souvenez pas?"
CS_CH3_Main_20_015,J'ai dit que je voulais vous voir dans une certaine situation.
CS_CH3_Main_20_016,Est-ce que vous voudriez nous voir maudire Lua?
CS_CH3_Main_20_017,"Oui, je voulais vous demander ce que vous vouliez dire par là."
CS_CH3_Main_20_018,"Hehe, vous devrez comprendre ça par vous-même."
CS_CH3_Main_20_019,Il y aurait tant d'autres histoires à vous raconter.
CS_CH3_Main_20_020,"D'accord, alors parlez-moi de ma mère Arlette..."
CS_CH3_Main_20_021,"Hehehe, Arlette... Je n'ai jamais dit qu'Arlette était votre mère..."
CS_CH3_Main_20_022,Quoi?
CS_CH3_Main_20_023,"En parlant de ça, aucun de nous quatre ne connait ses parents."
CS_CH3_Main_20_024,"Connaissez-vous un autre de nos parents, Cleo mise à part?"
CS_CH3_Main_20_025,"Hehe, ne vous précipitez pas. Relax."
CS_CH3_Main_20_026,"Aujourd'hui, je suis venu vous raconter une autre histoire."
CS_CH3_Main_20_027,Une histoire à propos de celui qui a déclenché la haine des orcs contre les humains.
CS_CH3_Main_20_028,Je me demande si vous le connaissez... un certain Malduk.
CS_CH3_Main_20_029,Malduk...!!
CS_CH3_Main_20_030,Le stratège d'Angmund...? Ce Malduk?
CS_CH3_Main_20_031,Oui. Il a commencé à transformer les orcs en morts-vivants il y a un bon moment déjà.
CS_CH3_Main_20_032,"Il a ensuite menti aux orcs, y compris Sieg, en prétendant que les humains étaient responsables pour les orcs qui avaient disparus."
CS_CH3_Main_20_033,C'est moche...
CS_CH3_Main_20_034,Pourquoi vous nous racontez tout ça?
CS_CH3_Main_20_035,N'êtes-vous pas alliée aux Démons?
CS_CH3_Main_20_036,"Pour commencer, je ne l'aime pas."
CS_CH3_Main_20_037,"Ensuite... la raison pour laquelle vous souhaitez un affrontement entre les gobelins et les orcs, aux côtés de Lakrak..."
CS_CH3_Main_20_038,"Oui, Malduk avait profité des orcs."
CS_CH3_Main_20_039,"Donc, j'ai profité des gobelins, étant donné qu'ils avaient une rancune envers les orcs."
CS_CH3_Main_20_040,"Comme Malduk, vous êtes vraiment diabolique."
CS_CH3_Main_20_041,"Les deux parties subiront des pertes terribles lorsqu'elles s'affronteront,"
CS_CH3_Main_20_042,et la haine entre les deux camps ne fera que grandir!
CS_CH3_Main_20_043,"Et alors? En tant que membre de l'Armée Démoniaque, je considère que c'est une victoire si vous tombez, idiots."
CS_CH3_Main_20_044,Quoi?!
CS_CH3_Main_20_045,Bon sang... Essayer de briser l'alliance entre les races de ce monde...
CS_CH3_Main_20_046,Nous devons le signaler à Orvelia.
CS_CH3_Main_20_047,"Eheh, les Orveliens ne feront rien à ce sujet."
CS_CH3_Main_20_048,"La Famille Royale et les aristocrates vont se terrer dans leur petit palais et ne penseront qu'à survivre, même s'ils doivent jeter tout le reste."
CS_CH3_Main_20_049,Pendant ce temps... ils essayeront de vous tuer pour que les nouvelles ne se propagent pas.
CS_CH3_Main_20_050,Comment osez-vous insulter la Royauté Orvelienne!
CS_CH3_Main_20_052,Eheh... Naïf. Naïf comme d'habitude.
CS_CH3_Main_20_053,"Quoi qu'il en soit, vous ne voudriez pas dire tout cela à Orvelia."
CS_CH3_Main_20_054,"Ils ne seraient pas à la hauteur de l'Armée Démoniaque, de toute façon."
CS_CH3_Main_20_055,"Dans la situation actuelle, Orvel est une cible facile - la renverser n'est rien."
CS_CH3_Main_20_056,"Alors, retenez bien mes paroles. Si vous faites ce que je dis, une guerre totale ne se produira pas."
CS_CH3_Main_20_057,Et pourquoi devrions-nous vous faire confiance?
CS_CH3_Main_20_058,Vous n'avez pas besoin.
CS_CH3_Main_20_059,Le choix vous appartient.
CS_CH3_Main_20_060,Alors au revoir. Nous nous reverrons.
CS_CH3_Main_20_061,Vieille sorcière...!
CS_CH3_Main_20_062,Ne partez pas comme ça!
CS_CH3_Main_21_001,"Déesse Lua, s'il vous plait pardonnez Dain..."
CS_CH3_Main_21_002,"qui a fait un choix terrible, dans l'intérêt de son maître."
CS_CH3_Main_21_003,Je vous remercie d'avoir prié pour mon apprenti...
CS_CH3_Main_21_004,Je suppose qu'il serait plus facile de vaincre Sieg plutôt que de le persuader.
CS_CH3_Main_21_005,Je suis certain que les orcs vont essayer de nous arrêter.
CS_CH3_Main_21_006,"Nous n'aurons pas d'autre choix que de les battre pour progresser, Kaulah."
CS_CH3_Main_21_007,Je viendrai avec vous. Je vais essayer de les persuader.
CS_CH3_Main_21_008,Si ça ne marche pas...
CS_CH3_Main_21_009,Je vous aiderai. J'ai déjà du sang de mes semblables sur les mains.
CS_CH3_Main_21_010,"Je suis désolé, Kaulah... de vous impliquer dans cette situation."
CS_CH3_Main_21_011,"Ce n'est pas votre faute, Kasel."
CS_CH3_Main_21_012,Il y aura de plus grandes pertes si nous n'arrêtons pas cette guerre. Nous devons faire de notre mieux.
CS_CH3_Main_21_013,"Kasel, je suis d'accord avec Maria..."
CS_CH3_Main_21_014,Vous devriez attendre avant de signaler cette crise à Orvelia.
CS_CH3_Main_21_015,Je le crois aussi.
CS_CH3_Main_21_016,Les Masques Rieurs... On ne sait pas pour qui ils travaillent...
CS_CH3_Main_21_017,ni qui veut me tuer...
CS_CH3_Main_21_018,Kasel...
CS_CH3_Main_21_019,"Je trouverai un jour, sûrement."
CS_CH3_Main_21_020,Mais ce n'est pas ce qui importe maintenant. Ceci vient en premier.
CS_CH3_Main_22_001,Kaulah!
CS_CH3_Main_22_002,C'est le traître Kaulah!
CS_CH3_Main_22_003,"Camarades, nous avons été trompés par les Démons."
CS_CH3_Main_22_004,"Malduk, le stratège du Démon est celui qui a kidnappé les Orcs en les transformant en morts-vivants..."
CS_CH3_Main_22_005,Qui écouterait les paroles d'un traître!
CS_CH3_Main_22_006,"Payez vos péchés avec la mort, Kaulah!"
CS_CH3_Main_22_007,Je savais que cela se produirait.
CS_CH3_Main_22_008,"Nous ne pouvons pas abandonner. Essayons encore de les persuader, Roi."
CS_CH3_Main_22_009,"Oui, Roi, Nous devons faire de notre mieux!"
CS_CH3_Main_22_010,"*Soupir*... Cleo, Que diriez-vous de réfléchir un peu plus sur vous-même?"
CS_CH3_Main_22_011,Plus tard! Nous devons d'abord battre ces gars!
CS_CH3_Main_22_012,"Ne soyez pas trop durs avec eux, s'il vous plaît."
CS_CH3_Main_23_001,"Hmm, il y a déjà une bataille en cours."
CS_CH3_Main_23_002,Wow... Lakrak dirige tous ces gobelins et golems...
CS_CH3_Main_23_003,Je n'aime pas ça...! Humpf!
CS_CH3_Main_24_001,Mon expérience presque finie! Ach!
CS_CH3_Main_24_002,"Partez maintenant, faire arme plus forte!"
CS_CH3_Main_24_003,Lakrak. Qu'en est-il des gobelins qui vous suivent...
CS_CH3_Main_24_004,Qui s'en soucie!!
CS_CH3_Main_24_005,"Je donne contrôle machine et golem, eux font ce qu'ils veulent! Kyak!"
CS_CH3_Main_24_006,"Je vous suis, j'ai trouvé sujet fort pour test!"
CS_CH3_Main_24_007,"Attendez! Je vais suivre test, kyak !!"
CS_CH3_Main_24_008,"Je suis prêt pour ça, mon ami."
CS_CH3_Main_24_009,Pas moi. Je ne veux pas faire équipe avec des gobelins...
CS_CH3_Main_24_010,"Cleo, vous ne pouvez faire aucune discrimination sans raison."
CS_CH3_Main_24_011,Dé... Désolée... Ne me dites pas de dormir seule à partir de maintenant.
CS_CH3_Main_24_012,Je ne peux plus m'endormir sans Frey...
CS_CH3_Main_24_013,À propos de cet oreiller...
CS_CH3_Main_24_014,"Frey, vous avez un petit problème maintenant, hahaha."
CS_CH3_Main_25_001,Sieg!!
CS_CH3_Main_25_002,Est-ce Malduk à côté de lui?
CS_CH3_Main_25_003,"Je suppose. Regardez, ces crânes!"
CS_CH3_Main_25_004,Sieg!! Il nous a tous trompés!
CS_CH3_Main_25_005,Il a blâmé les humains pour tout ce qu'il avait fait aux orcs! C'est lui qui a capturé les orcs et qui les a transformés en morts-vivants!
CS_CH3_Main_25_006,Quoi?!
CS_CH3_Main_25_007,"Honorable Grand Chef,"
CS_CH3_Main_25_008,"Un grand guerrier comme vous n'aurait pas tué son prédécesseur le plus honoré, Garuk, sur un petit malentendu."
CS_CH3_Main_25_009,Tout ce que vous avez fait était pour vos semblables. Pour le bien de votre tribu.
CS_CH3_Main_25_010,"Ces imbéciles insultent votre décision, votre honneur."
CS_CH3_Main_25_011,Ils doivent le payer leur vie.
CS_CH3_Main_25_012,...Oui.
CS_CH3_Main_25_013,Effectivement! Je suis le chef des orcs. Je ne pardonnerai pas aux humains qui ont asservi les nôtres!
CS_CH3_Main_25_014,"Ça s'applique aussi pour vous, Kaulah! Payez votre trahison!"
CS_CH3_Main_25_015,Quel imbécile...
CS_CH3_Main_25_017,Il ne peut tout simplement pas admettre la vérité.
CS_CH3_Main_25_018,La vérité selon laquelle il a tué Garuk a cause d'un malentendu...
CS_CH3_Main_25_019,Payez vos péchés avec la mort!!!
CS_CH3_Main_26_001,C'est un Grand Chef. Quelle force...
CS_CH3_Main_26_002,"Kasel, Vous ne pouvez pas utiliser le pouvoir de l'Épée Sacrée?"
CS_CH3_Main_26_003,Je suis désolé... Je... Je ne suis pas encore capable de la contrôler...
CS_CH3_Main_26_004,Le pouvoir vient tout seul...
CS_CH3_Main_26_005,"Hey, ne vous excusez pas pour tout!"
CS_CH3_Main_26_006,Nous allons en terminer de toute façon!
CS_CH3_Main_27_001,Argh... Malduk... Malduk!!!
CS_CH3_Main_27_002,Je suis fini...
CS_CH3_Main_27_003,Sauvez ma tribu... de ces perfides humains.
CS_CH3_Main_27_004,Kukukukuku...
CS_CH3_Main_27_005,Kakaka... Ahahahahahaha!!!
CS_CH3_Main_27_006,Idiot d'orc.
CS_CH3_Main_27_007,Qu... Qu'est-ce qui vous fait rire?!
CS_CH3_Main_27_008,Les orcs disparus vont bientôt revenir en morts-vivants
CS_CH3_Main_27_009,et devenir de fidèles membres de l'Armée Démoniaque.
CS_CH3_Main_27_010,Qu... Qu'est-ce que j'ai fait...
CS_CH3_Main_27_011,"Vous avez tué Garuk pour un petit malentendu, c'est tout."
CS_CH3_Main_27_012,Kukukuku...
CS_CH3_Main_27_013,V... Vous...!!!!!
CS_CH3_Main_27_014,Argh...
CS_CH3_Main_27_015,Sieg!!!!
CS_CH3_Main_27_016,... Deviez-vous vraiment...
CS_CH3_Main_27_017,"Deviez-vous rire d'un mourant, insulter ses derniers instants!"
CS_CH3_Main_27_018,Kukuku...
CS_CH3_Main_27_019,Je vois... Porteur de l'Épée Sacrée...
CS_CH3_Main_27_020,"Comment vous sentez-vous, hmm? Ne ressentez-vous pas de la colère à l'intérieur de vous?"
CS_CH3_Main_27_021,Vous... Je ne vous pardonnerai jamais!
CS_CH3_Main_27_022,Oui c'est vrai.
CS_CH3_Main_27_023,Magnifique.
CS_CH3_Main_27_024,Hahahaha!
CS_CH3_Main_27_025,"Rage! Fureur! Haine! Plus, plus, souillez l'Épée Sacrée dans plus de ténèbres encore!!!"
CS_CH3_Main_27_026,"J'espère que la prochaine fois que nos chemins se croiseront, vous me montrerez une haine plus grande encore."
CS_CH3_Main_27_027,"Ne courez pas, lâche!!"
CS_CH3_Main_27_028,"Zut, il nous a semé."
CS_CH3_Main_27_029,Aaaaaaaah!
CS_CH3_Main_27_030,Argh... Kasel!
CS_CH3_Main_27_031,"Kasel, non!!"
CS_CH3_Main_27_032,"Restez fort, s'il vous plait..."
CS_CH3_Main_27_033,Kugh...
CS_CH3_Main_27_034,Grrk... kugh...
CS_CH3_Main_27_035,Frey... M... Merci...
CS_CH3_Main_27_036,Kasel!
CS_CH3_Main_28_001,Kasel... Kasel!!!
CS_CH3_Main_28_002,Ugh...
CS_CH3_Main_28_003,Malduk!!!
CS_CH3_Main_28_004,"Calmez-vous, Kasel. Malduk est parti."
CS_CH3_Main_28_005,Est-ce parce qu'il est parti...
CS_CH3_Main_28_006,Je pense que je suis brièvement devenu fou là...
CS_CH3_Main_28_007,"Oui, mais..."
CS_CH3_Main_28_008,"Merci à Frey, rien n'a mal tourné."
CS_CH3_Main_28_009,"Frey a appelé Kasel, et vous êtes revenu à vous sans problème."
