KEY,Thai
LOADING_TEXT_HERO_SKILL,คุณสามารถเพิ่มสกิลของฮีโร่ได้ด้วยการใช้ Gold\nแต่สกิลเลเวลจะไม่สามารถเพิ่มได้เกินกว่าเลเวลของตัวฮีโร่\n(สูงสุดที่เลเวล 100) ดังนั้นเมื่อฮีโร่เลเวลอัพคุณก็สามารถเข้าไปอัพสกิลเพิ่มได้
LOADING_TEXT_DIFFICULTY,"พื้นที่ต่อสู้ใน World Map ประกอบไปด้วยโหมด Easy, Normal, Hard, Hell"
NONBATTLE_COMMON_LOADING_TIP_1,ทีมเลเวลสามารถเพิ่มขึ้นได้จากการได้รับวีรบุรุษ/วิวัฒนาการ\nการใช้สเตมิน่า การทำเควสต์/ความสำเร็จ เป็นต้น
NONBATTLE_COMMON_LOADING_TIP_2,สามารถรับชิ้นส่วนวัตถุดิบที่จำเป็นต่อการวิวัฒนาการได้ที่ดันเจี้ยนระดับสูง
NONBATTLE_COMMON_LOADING_TIP_3,อุปกรณ์เฉพาะจะมีความสามารถเฉพาะตัวของวีรบุรุษอยู่\nลองทำให้วีรบุรุษแข็งแกร่งขึ้นด้วยอาวุธเฉพาะและสมบัติเฉพาะดู!
NONBATTLE_COMMON_LOADING_TIP_4,สามารถรับรางวัลหลากหลายได้จากการทำเควสต์เนื้อเรื่อง
NONBATTLE_COMMON_LOADING_TIP_5,เข้าร่วมกิลด์เพื่อสนุกไปกับคอนเทนต์หลากหลาย เช่น เรดกิลด์ พิชิตกิลด์ สงครามกิลด์\nสมาชิกกิลด์สามารถรับสิทธิพิเศษต่างๆได้!
NONBATTLE_COMMON_LOADING_TIP_6,อยากจะแข็งแกร่งขึ้นไหม\nเพิ่มความสามารถอุปกรณ์ได้ด้วยการอัพเกรดและวิวัฒนาการ
NONBATTLE_COMMON_LOADING_TIP_7,ลองไปที่หอคอยแห่งความท้าทาย!\nเพื่อรับวัตถุดิบที่ใช้สร้างไอเทมวัตถุโบราณ
NONBATTLE_COMMON_LOADING_TIP_8,สามารถรับชิ้นส่วนความทรงจำได้ที่เขาวงกตหลวงใต้ดิน\nหากต้องการสมบัติเฉพาะก็อย่าลืมไปท้าทายดู!
NONBATTLE_COMMON_LOADING_TIP_9,หากต้องการอุปกรณ์ระดับตำนานลองท้าทายเรดดูสิ! มีอุปกรณ์มากมายเพื่อความแข็งแกร่งรออยู่
NONBATTLE_COMMON_LOADING_TIP_10,แก่นแท้เพื่อการจุติไม่เพียงพอใช่ไหม\nลองเคลียร์หอคอยแห่งการพิสูจน์ตน!
NONBATTLE_COMMON_LOADING_TIP_11,สามารถรับวีรบุรุษใหม่ได้จากกระท่อมวีรบุรุษ\nลองสะสมค่าความสนิทของวีรบุรุษที่เข้ามาเยี่ยมเยือนดูสิ!
NONBATTLE_COMMON_LOADING_TIP_12,ท้าทายบอสโลกด้วยการจัดตั้งทีม 8 คน เพื่อสามารถรับรางวัลตามอันดับที่ได้!
NONBATTLE_COMMON_LOADING_TIP_13,สามารถใส่รูนได้ที่ช่องของอุปกรณ์\nเพิ่มความสามารถที่จำเป็นของวีรบุรุษได้จากการใส่รูน!
NONBATTLE_COMMON_LOADING_TIP_14,หากเคลียร์การต่อสู้ในแชปเตอร์โดยที่วีรบุรุษทั้งหมดรอดชีวิตจะได้รับ 3 ดาว\nหากตาย 1 คนจะได้รับ 2 ดาว หากตาย 2 คนขึ้นไปจะได้รับ 1 ดาว
NONBATTLE_COMMON_LOADING_TIP_15,สามารถตรวจสอบอันดับอารีน่า อันดับบอสโลกและอันดับการพิชิตกิลด์ได้ที่บันทึกแห่งเกียรติยศ
CHAPTER1_COMMON_LOADING_STORY_1,Kasel และ Frey ออกเดินทางตามหาพี่ชายที่หายไปจากการสำรวจ
CHAPTER2_COMMON_LOADING_STORY_1,Kasel ผู้เป็นเจ้าของดาบ ต้องข้ามผ่านความกดดันนั้นไปให้ได้
CHAPTER3_COMMON_LOADING_STORY_1,ความขัดแย้งและความไม่ไว้วางใจกำลังขัดขวาง Kasel และผู้ร่วมเดินทาง\nพวกเขาจะต้องเอาชนะมันไปให้ได้
CHAPTER4_COMMON_LOADING_STORY_1,Kasel และผู้ร่วมเดินทางได้เผชิญกับเบื้องลึกของจิตใจ นั่นก็คือความมืดของตนที่ซ่อนอยู่ภายใน
CHAPTER5_COMMON_LOADING_STORY_1,ผู้ร่วมเดินทางได้พบกับ Kasel ที่สิ้นหวังจากความมุ่งมั่นที่เคยอยากจะรักษาไว้
CHAPTER6_COMMON_LOADING_STORY_1,ทะเลทรายที่เต็มไปด้วยความลึกลับจะทำให้ Kasel และเพื่อนร่วมทางเติบโตขึ้น
CHAPTER7_COMMON_LOADING_STORY_1,ความโศกเศร้าที่หายไป ความเจ็บปวด Kasel ไม่สามารถทำอะไรได้เลยกับสถานการณ์ที่เกิดขึ้น
CHAPTER8_COMMON_LOADING_STORY_1,ในฐานะเจ้าของดาบ ต้องมีความแน่วแน่อันแข็งแกร่งมากกว่าใครในทุกย่างก้าว.. และ..
CHAPTER9_COMMON_LOADING_STORY_1,เพื่อรอยยิ้มของคนที่รักและอยากจะปกป้องแล้ว.. Kasel..
ORDEAL_COMMON_LOADING_TIP_1,ลองเอาชนะความมืดภายในจิตใจดู!
ORDEAL_COMMON_LOADING_TIP_2,เมื่อชนะการประลองในห้องแห่งการพิสูจน์ตนจะสามารถวิวัฒนาการวีรบุรุษในห้องแห่งการชำระล้างได้
ROYALDUNGEON_LOADING_TIP_1,ลองใช้บูสเตอร์ทองเมื่อเข้าท้องพระคลังโบราณดูสิ!
ROYALDUNGEON_LOADING_TIP_2,สามารถรับทองจำนวนมากได้ที่ท้องพระคลังโบราณ\nท้าทายในชั้นที่สูงขึ้นเพื่อรับทองมากขึ้น!
ROYALDUNGEON_LOADING_STORY_1,Loman ปกป้องสถานที่แห่งนี้อยู่คนเดียว\nเขาแกะสลักไม้ทุกวัน
ROYALDUNGEON_LOADING_STORY_2,ผู้ที่ซื่อสัตย์และได้รับความไว้วางใจเท่านั้นที่จะสามารถปกป้องท้องพระคลังโบราณแห่ง Orvel ได้
ROYALDUNGEON_LOADING_STORY_3,เรียกได้ว่าเป็นต้นกำเนิดของความยิ่งใหญ่แห่งราชวงศ์\nเพราะสิ่งนี้จึงทำให้หลายๆคนพยายามคุกคามราชวงศ์
ROYALDUNGEON_LOADING_STORY_4,ยังไม่มีใครค้นพบว่าที่นี่ใครเอาสิ่งนี้มาเก็บสะสมไว้ที่นี่\nมีเพียงแค่การคาดเดามากมายเท่านั้น
PRISON_COMMON_LOADING_TIP_1,ต้องเข้าใจความพิเศษของแต่ละพื้นที่จึงจะสามารถเคลียร์ได้\nอย่าลืมตรวจสอบคุณสมบัติของมอนสเตอร์
PRISON_COMMON_LOADING_TIP_2,หากต้องการให้วีรบุรุษแข็งแกร่งขึ้นต้องอัพเกรดคุณสมบัติสกิล!
PRISON_COMMON_LOADING_TIP_3,หากใช้หนังสือสกิลที่ได้จากคุกใต้ดิน\nจะสามารถอัพเกรดสกิลของวีรบุรุษได้
PRISON_COMMON_LOADING_STORY_1,หากอยากรู้ว่าต้องทำยังไงให้พวกนักโทษสงบได้\nลองคุยกับ Nicky ดูสิ
PRISON_COMMON_LOADING_STORY_2,อาวุธของ Nicky กระบองแห่งการดัดนิสัย เป็นสิ่งที่นำความสงบสุขมาสู่คุกใต้ดิน
PRISON_COMMON_LOADING_STORY_3,หากเข้าไปในคุกใต้ดินและยุ่งกับความชั่วร้ายล่ะก็\nลืมความคิดที่จะมีชีวิตรอดไปได้เลย
CONQUEST_COMMON_LOADING_TIP_1,สามารถประลองพิชิตได้แชปเตอร์ละ 3 ครั้งต่อวัน
CONQUEST_COMMON_LOADING_TIP_2,หากต้องการเพิ่มเลเวลวีรบุรุษอย่างรวดเร็ว อย่าลืมเข้าประลองพิชิต!
HIDEOUT_COMMON_LOADING_TIP_1,สามารถเข้าดันเจี้ยนระดับสูงของแต่ละแชปเตอร์ได้ 3 ครั้งต่อวัน
HIDEOUT_COMMON_LOADING_TIP_2,หากชิ้นส่วนไม่เพียงพอ ลองใช้บูสเตอร์รางวัลดูสิ
HIDEOUT_COMMON_LOADING_TIP_3,ชิ้นส่วนและแก่นแท้คือวัตถุดิบสำคัญในวิวัฒนาการ/จุติ\nต้องรวบรวมวัตถุดิบที่จำเป็นอยู่เสมอ!
CHALLENGETOWER_COMMON_LOADING_TIP_1,อย่าลืมว่าหอคอยแห่งความท้าทายจะถูกรีเซ็ตทุกวันที่ 1 ของเดือน!!
CHALLENGETOWER_COMMON_LOADING_TIP_2,จะได้รับลูกบากศ์แห่งความท้าทาย 1 ชิ้นทุก 2 ชั่วโมง\nรับชิ้นส่วนวัตถุโบราณได้จากการประลอง
CHALLENGETOWER_COMMON_LOADING_TIP_3,หากต้องการรับชิ้นส่วนวัตถุโบราณจำนวนมาก ลองใช้บูสเตอร์รางวัลดูสิ
CHALLENGETOWER_COMMON_LOADING_TIP_4,หากรวบรวมชิ้นส่วนวัตถุโบราณครบ 1000 ชิ้นแล้วอย่าลืมรวมศิลาวิญญาณ!\nสามารถรับวัตถุโบราณชั้นดีได้
CHALLENGETOWER_LOADING_TIP_66F_1,โกเลมเวทมนตร์โบราณทำให้ศัตรูตกอยู่ในสถานะไฟช็อตต่อเนื่องและทนความเสียหายเวทรุนแรง\nลองใช้ดีลเลอร์ระยะไกลหรือต้านทานสถานะผิดปกติดู
CHALLENGETOWER_LOADING_TIP_67F_1,โทเทมโครงกระดูกจะเรียกทหารโครงกระดูกออกมาจำนวนมากเป็นระยะๆ\nลองใช้วีรบุรุษที่มีสกิลการโจมตีเป็นบริเวณกว้างดู
CHALLENGETOWER_LOADING_TIP_68F_1,Manticore ใช้สกิลที่สร้างความเสียหายอย่างรุนแรงแก่ศัตรูในบริเวณใกล้เป็นระยะๆ\nลองใช้สกิลยกเลิกความเสียหายดู
CHALLENGETOWER_LOADING_TIP_69F_1,รูปปั้นหินหัวมังกรจะยิงขีปนาวุธที่ทำให้ศัตรูในแนวหน้าของตนเองตายทันทีเป็นระยะๆ\nลองใช้สกิลยกเลิกความเสียหรือสกิลเคลื่อนย้ายดู
CHALLENGETOWER_LOADING_TIP_72F_1,ในสถานะต้านทานสถานะผิดปกติ จะไม่ได้รับความเสียหายจากการโจมตีของบาบาเรียนแห่งดินแดนน้ำแข็ง Gau
CHALLENGETOWER_LOADING_TIP_73F_1,ราชินีฮาร์ปี้จะใช้สกิลที่ทำให้ศัตรูที่อยู่บริเวณใกล้ตายทันทีเป็นระยะๆ\nลองใช้สกิลยกเลิกความเสียหายดู
CHALLENGETOWER_LOADING_TIP_74F_1,หากพวกลาวาที่โกเลมลาวาลุกไหม้เรียกมารวบรวมเกจได้ จะทำให้เกิดความเสียหายเวทรุนแรง\nใช้วีรุบุรษที่มีการโจมตีบริเวณกว้างเพื่อกำจัดพวกลาวาอย่างรวดเร็ว
CHALLENGETOWER_LOADING_TIP_75F_1,เมื่อผ่านเวลาที่กำหนด Infira จะบินลงมากลางอากาศและสร้างความเสียหายบริเวณกว้างต่อเนื่อง\nทำลายพลังของ Infira ด้วยการใช้สกิลสถานะผิดปกติ
CHALLENGETOWER_LOADING_TIP_76F_1,Crow จะใช้สกิลแข็งแกร่งอย่างต่อเนื่อง\nต้องป้องกันสกิลของ Crow ด้วยการใช้ถานะผิดปกติอย่างต่อเนื่อง
CHALLENGETOWER_LOADING_TIP_77F_1,ตะเกียงแห่งนรกจะทำให้เกิดความเสียหายต่อเนื่องรุนแรงในอาณาเขตของตน\nหรือเมื่อถูกโจมตีด้วยสกิลสถานะผิดปกติตามจำนวนที่กำหนดจะต้านทานสถานะผิดปกติชั่วคราว
CHALLENGETOWER_LOADING_TIP_78F_1,สกิลของ Mirianne จะโจมตีเป้าหมายที่มีพลังป้องกันเวทต่ำที่สุด\nลองป้องกันวีรบุรุษตัวดังกล่าวและโจมตีดู
CHALLENGETOWER_LOADING_TIP_79F_1,หัวหน้าพลโล่หนักแห่งกองทัพจักรวรรดิมีพลังการป้องกันสูงมาก และถึงจะไม่โจมตี\nแต่หากถูกโจมตีคริติคอลเป็นเวลาต่อเนื่องจะเดือดดาล
CHALLENGETOWER_LOADING_TIP_80F_1,ยิ่ง Lucikiel ดูดซึมพลังแห่งคริสตัลมากเท่าไหร่จะยิ่งแข็งแกร่งมากขึ้นเท่านั้น\nจะต้องหยุดการดูดซึมอย่างรวดเร็วด้วยการใช้สถานะผิดปกติรุนแรง
CHALLENGETOWER_LOADING_TIP_80F_2,Lucikiel สามารถสามารถฟื้นฟู HP ได้ดี\nลองใช้เอฟเฟคลดการฟื้นฟูดู
CHALLENGETOWER_LOADING_STORY_1,Dosarta อยากจะสร้างวัตถุโบราณล้ำค่าแก่มนุษย์จึงหมั่นฝึกฝนอย่างขยันขันแข็ง\nเพราะงั้นชิ้นส่วนวัตถุโบราณมากมายก็เลย..
CHALLENGETOWER_LOADING_STORY_2,ราชวงศ์เอลฟ์คอยปกป้องหอคอยแห่งความท้าทายจากรุ่นสู่รุ่น
CHALLENGETOWER_LOADING_STORY_3,ในการปกป้องหอคอยคนเดียวก็ดูจะยาวนานมากหากดูตามเวลาของมนุษย์\nคราวหน้าจะส่งไปประลองสองสามคนดีไหมนะ
CHALLENGETOWER_LOADING_STORY_4,Selene ไปเยี่ยม Dosarta ที่หอคอยแห่งความท้าทายบ้างบางครั้ง
CHALLENGETOWER_LOADING_STORY_5,ไม่มีใครรู้ว่าทำไมหอคอยแห่งนี้ถึงได้ชื่อว่าหอคอยแห่งความท้าทาย\nถูกเรียกมามาแบบนั้นตั้งแต่เมื่อใดก็ไม่รู้
ORDEALTOWER_COMMON_LOADING_TIP_1,วีรบุรุษความมืดแห่งการพิสูจน์ตนแข็งแกร่งมาก ระวังให้ดี!
ORDEALTOWER_COMMON_LOADING_TIP_2,รับหินแห่งพลังที่ไม่สิ้นสุดได้ผ่านการสร้างด้วยชิ้นส่วนแห่งพลังที่ไม่สิ้นสุด
ORDEALTOWER_COMMON_LOADING_TIP_3,หอคอยแห่งการพิสูจน์ตนจะถูกรีเซ็ตทุกวันจันทร์
ORDEALTOWER_COMMON_LOADING_STORY_1,ที่จริงแล้วทุกคนสงสัยว่าภายใต้ฮู้ดของ Hillia เป็นยังไง
ORDEALTOWER_COMMON_LOADING_STORY_2,ผู้ที่เอาชนะจิตใจภายในของตนเองได้เท่านั้นถึงจะสามารถรับพลังที่แท้จริงได้
ORDEALTOWER_COMMON_LOADING_STORY_3,บางครั้งจิตใจภายในของตนก็มาในรูปลักษณ์ความสว่าง บางครั้งก็มาในรูปลักษณ์ความมืด
ORDEALTOWER_COMMON_LOADING_STORY_4,หนทางจะปรากฏเมื่อสามารถเอาชนะตนเอง\nและจะทำให้วีรบุรุษแข็งแกร่งขึ้นอีกหนึ่งขั้น
DRAGONRAID_COMMON_LOADING_TIP_1,สามารถรับอุปกรณ์ระดับตำนานได้จากประลองเรด
DRAGONRAID_COMMON_LOADING_TIP_2,อย่าลืมเซ็ตเอฟเฟคเมื่อสวมใส่อุปกรณ์ระดับตำนาน!
DRAGONRAID_COMMON_LOADING_TIP_3,เมื่อใช้สกิลสถานะผิดปกติจะลดเกจสถานะผิดปกติลงทั้งหมดและล้มมังกรลงได้
DRAGONRAID_COMMON_LOADING_TIP_4,เหรียญมังกรที่ได้จากเรดมังกรสามารถใช้ได้ที่โรงตีเหล็ก\nสามารถใช้เหรียญมังกรซื้ออุปกรณ์ระดับตำนานและไอเทมหลากหลายได้!
DRAGONRAID_COMMON_LOADING_STORY_1,เพราะว่านักรบเข้ามาต่อสู้ทุกวัน พวกมังกรก็เลยเหนื่อย
REDDRAGONRAID_COMMON_LOADING_TIP_1,เปลวไฟของ Temeraire จะแผดเผาวีรบุรุษ ระวังความเสียหายต่อเนื่อง
REDDRAGONRAID_COMMON_LOADING_STORY_1,รังของ Temeraire อยู่ ณ ใจกลางของภูเขาไฟ Dragia เป็นมังกรแดงโบราณที่ดูแลปกป้องโลก
REDDRAGONRAID_COMMON_LOADING_STORY_2,Temeraire มีพลังแห่งลาวาและเปลวเพลิง\nบางครั้งก็ไปยังมนุษย์โลกในฐานะช่างตีเหล็กและใช้พลังนั้น
BLUEDRAGONRAID_COMMON_LOADING_TIP_1,Scalaxia สามารถต้านทานความเสียหายเวทได้
BLUEDRAGONRAID_COMMON_LOADING_TIP_2,ทำลายเสาน้ำแข็ง! หากระเบิดจะสามารถสร้างความเสียหายอย่างมาก
BLUEDRAGONRAID_COMMON_LOADING_STORY_1,Scalaxia มีอาณาเขตอยู่ ณ ชายขอบภูเขา Windland ดินแดนเหมันต์ทางเหนือ\nเป็นมังกรน้ำแข็งโบราณที่ทำรังอาศัยอยู่ที่ Turandana อย่างเงียบๆ
BLUEDRAGONRAID_COMMON_LOADING_STORY_2,เป็นเผ่าพันธุ์เดียวกับมังกรน้ำแข็ง ร่างของ Scalaxia เต็มไปด้วยความเยือกเย็น\nทำให้บริเวณรอบข้างกลายเป็นน้ำแข็งไปด้วยพลังความเย็นนี้
GREENDRAGONRAID_COMMON_LOADING_TIP_1,พิษของ Zyrrkinoth จะถูกลบล้างหาก HP เต็ม
GREENDRAGONRAID_COMMON_LOADING_TIP_2,ต้องจัดการหนอนพิษและลูกมังกรพิษอย่างรวดเร็ว
GREENDRAGONRAID_COMMON_LOADING_STORY_1,Zyrrkinoth เป็นมังกรพิษโบราณที่เคยยึดครอง Grimvine\nหนองน้ำแห่งความตายที่ตั้งอยู่ตอนเหนือ ณ ที่ราบ Galluah
GREENDRAGONRAID_COMMON_LOADING_STORY_2,Zyrrkinoth เป็นผู้รักธรรมชาติและอยู่ในรังร่วมกับสิ่งมีชีวิตอื่นอย่างน่ามหัศจรรย์\nโดยเฉพาะสไลม์ ซึ่งได้รับการเลี้ยงดูอย่างทะนุถนอม เป็นมังกรที่แปลกประหลาดมาก
BLACKDRAGONRAID_COMMON_LOADING_TIP_1,Armarta จะพ่นเปลวเพลิงแห่งความมืดทำให้ศัตรูที่อยู่ระยะไกลอ่อนแอลง
BLACKDRAGONRAID_COMMON_LOADING_TIP_2,ระวังสายฟ้าของ Armarta ที่ปล่อยลงมา!
BLACKDRAGONRAID_COMMON_LOADING_STORY_1,Armarta มังกรดำโบราณทรราชแห่ง Ashen Peak\nที่เป็นซากโบราณสถานทางใต้ของชายฝั่ง Arrovina Shore
BLACKDRAGONRAID_COMMON_LOADING_STORY_2,พลังแข็งแกร่งของ Armarta เมื่อเทียบกับมังกรถือว่าอยู่ในระดับที่สูง\nและความโอหังที่มีนั้นก็สูงเทียมฟ้าเช่นกัน
