KEY,"Russian"
Sub1_Rephy_4_4_22,"Тебе нужно... держать свое обещание... проводник душ..."
Sub1_Rephy_4_4_23,"Все темные души... исчезли..."
Sub1_Rephy_4_4_24,"Я больше не чувствую присутствия демонов. Они что, просто взяли и ушли?.."
Sub1_Rephy_4_4_25,"Что ж! Значит, пора осветить Туманные Холмы!"
Sub1_Rephy_4_4_26,"Ты готов? Леви?"
Sub1_Rephy_4_4_27,"Да! Леви всегда готов!"
Sub1_Rephy_4_4_28,"Преемник Якобини – великого стража Синей звезды,"
Sub1_Rephy_4_4_29,"хранитель Светоча богов приказывает, чтобы ты..."
Sub1_Rephy_4_4_30,"(Шепотом) Эй, Одди! Это ритуал или что? А то пока больше похоже на странную песню, от которой уши вянут."
Sub1_Rephy_4_4_31,"(Шепотом) Да откуда ж мне знать... Я никогда раньше при таком не присутствовал..."
Sub1_Rephy_4_4_32,"(Шепотом) Но в одном я уверен наверняка... Он гораздо сильнее, чем я полагал..."
Sub1_Rephy_4_4_33,"Зажглась здесь на Туманных Холмах! И без затухания"
Sub1_Rephy_4_4_34,"указала путь заблудшим душам к Мосту Звездного Сияния!"
Sub1_Rephy_4_4_35,"Светоч богов, весь мир освети сиянием Синей звезды!"
Sub1_Rephy_4_4_36,"Ух ты! Какое волшебное зрелище."
Sub1_Rephy_4_4_37,"Пожалуй, соглашусь. Мы прожили так долго, но..."
Sub1_Rephy_4_4_38,"Я никогда еще не видел ничего подобного... Жизнь полна сюрпризов."
Sub1_Rephy_4_4_39,"Да. Неважно, сколько ты живешь, всегда найдется что-то, что поразит тебя до глубины души."
Sub1_Rephy_4_4_40,"Кстати, ты до сих пор ищешь способ вернуть себе человеческий облик?"
Sub1_Rephy_4_4_41,"Конечно! Мне нужно найти вождя рэдпуров, но... я пока не встречал ни одного рэдпура... Эх."
Sub1_Rephy_4_4_42,"Знаешь, а мне нравится, как ты сейчас выглядишь. Такой милый, пушистый. Правда, дядя Одди?"
Sub1_Rephy_4_4_43,"Из твоих слов я могу сделать вывод, что моя магия времени больше не нужна для твоих исследований."
Sub1_Rephy_4_4_44,"Да шучу я. Не стоит дуться из-за одной ошибки в моих расчетах пространственно-временного прыжка."
Sub1_Rephy_4_4_45,"Ладно, не переживай. Как ни странно, но благодаря ей я встретил Леви. Эм? Точно! Леви! Ты в порядке?"
Sub1_Rephy_4_4_46,"Да, да! Наконец-то Леви удалось наполнить Туманные Холмы ярким светом!"
Sub1_Rephy_4_4_47,"Проводник душ Леви! Ух! Кажется, я потрудился на славу!"
Sub1_Rephy_4_4_48,"Малец... Ты даже не устал. Отличная работа, Леви!"
Sub1_Rephy_4_4_49,"Ага! Надеюсь, теперь заблудших душ будет совсем немного!"
Sub1_Rephy_4_4_50,"Хм-м? Кстати, кажется, это правда... Я вижу, что в мире света стало... меньше хаоса."
Sub1_Rephy_4_4_51,"Так, нам пора оставить это место, так что лучше поторопиться. Одди! Собирайся, мы уходим!"
Sub1_Rephy_4_4_52,"Ладно, ладно. Такой нетерпеливый... Видимо, я единственный, кто будет с этим мириться... Ох."
Sub1_Rephy_4_4_53,"Эй, Леви! Будем прощаться."
Sub1_Rephy_4_4_54,"Благодаря тебе я увидел нечто изумительное. Спасибо!"
Sub1_Rephy_4_4_55,"А я был счастлив с тобой повидаться! Ты замечательный, дядя Одди! И отличный друг!"
Sub1_Rephy_4_4_56,"Ха-ха-ха! У меня еще никогда не было такого друга, как ты, малец! Да! Мы теперь с тобой друзья, Леви."
Sub1_Rephy_4_4_57,"Итак, проводник душ, куда ты направишься теперь?"
Sub1_Rephy_4_4_58,"На гору Огрию! Там есть еще одни Туманные Холмы!"
Sub1_Rephy_4_4_59,"Справишься в одиночку? Там тоже все кишит демонами."
Sub1_Rephy_4_4_60,"Леви не один. У меня много друзей!"
Sub1_Rephy_4_4_61,"Когда я устаю или выбиваюсь из сил, друзья и души всегда приходят мне на помощь!"
Sub1_Rephy_4_4_62,"Разумеется. А если попадешь в беду, зови меня... Нет, зови дядю Одди!"
Sub1_Rephy_4_4_63,"Ну ты идешь, нет? Портал скоро закроется."
Sub1_Rephy_4_4_64,"Что ж! Пора идти, береги себя! Еще увидимся..."
Sub1_Rephy_4_4_65,"Да! Пока, дядя Одди! Увидимся!"
Sub1_Rephy_4_4_66,"Где бы ты ни был... Мы всегда будем друзьями..."
Sub1_Rephy_4_4_67,"Ха-ха... Мы с тобой здорово провели время, Леви!"
Sub1_Rephy_4_5_1,"Проводник Синей звезды"
Sub1_Rephy_4_5_2,"У каждого живого существа есть душа."
Sub1_Rephy_4_5_3,"И души могут становиться друзьями"
Sub1_Rephy_4_5_4,"или врагами!"
Sub1_Rephy_4_5_5,"Но знаете что..."
Sub1_Rephy_4_5_6,"Мы все явились из одного места!"
Sub1_Rephy_4_5_7,"С Синей звезды, дома душ."
Sub1_Rephy_4_5_8,"В отдаленном будущем, когда мы вновь вернемся домой,"
Sub1_Rephy_4_5_9,"давайте петь и танцевать дни напролет в уютном саду!"
Sub1_Rephy_4_5_10,"Когда вам одиноко, и у вас не осталось сил,"
Sub1_Rephy_4_5_11,"поищите на небе Синюю звезду."
Sub1_Rephy_4_5_12,"Кто-то еще под этим небом будет"
Sub1_Rephy_4_5_13,"искать ту же звезду, что и вы."
Sub1_Rephy_4_5_14,"Мы все странники, пришедшие с Синей звезды."
Sub1_Rephy_4_5_15,"Если вы заблудитесь, позовите Леви."
Sub1_Rephy_4_5_16,"Я покажу вам,"
Sub1_Rephy_4_5_17,"где искать Синюю звезду,"
Sub1_Rephy_4_5_18,"и где находятся ваши друзья."
Sub1_Rephy_4_5_19,"Возьмите меня за руку!"
Sub1_Rephy_4_5_20,"Проводник душ Леви будет всегда рядом с вами!"
Sub1_Rephy_4_5_21,"Ну что, нам пора в путь!"
Sub1_Rephy_4_5_22,"Продолжение обязательно последует..."
