KEY,French
CH7_Main_18_006,Je vois. Dites-moi si vous avez besoin de récupérer son pouvoir.
CH7_Main_18_007,Je rendrai le pouvoir que je détiens.
CH7_Main_18_008,Vous avez un fragment de la puissance d'Aea?
CH7_Main_18_009,Musuclow me l'a laissé.
CH7_Main_18_010,Il savait que le royaume barbare serait en danger après sa mort.
CH7_Main_18_011,Le roi Musuclow...
CH7_Main_18_012,Le pouvoir de l'Épée Sacrée était divisé en trois parties.
CH7_Main_18_013,"Lorsque vous vous sentirez capable de contrôler ce pouvoir par vous-même, vous pourrez compléter l'Épée."
CH7_Main_18_014,N'y a-t-il aucun moyen d'arrêter les démons sans faire cela?
CH7_Main_18_015,C'est une question qui n'a pas de sens.
CH7_Main_18_016,"S'ils étaient si faciles à arrêter, ils n'auraient jamais été une menace."
CH7_Main_18_017,...Vous avez raison.
CH7_Main_18_018,"L'épée est la meilleure façon de sauver ce monde, en find de compte..."
CH7_Main_18_019,Il est judicieux de se méfier d'un pouvoir trop puissant à contrôler.
CH7_Main_18_020,"Cependant, sachez que ce n'est pas quelque chose que vous pourrez repousser indéfiniment."
CH7_Main_19_001,"Ça ne m'étonne pas de vous, Gau. J'ai entendu des rumeurs sur votre compte, mais vos compétences sont vraiment impressionantes."
CH7_Main_19_002,"Je voulais vous rencontrer face à face, Tarkas."
CH7_Main_19_003,Pourquoi... pourquoi avez-vous commencé cette guerre contre nous?
CH7_Main_19_004,Parce que la cupidité humaine sera la fin de ce monde.
CH7_Main_19_005,Les barbares n'étaient que le début. Nous prévoyons d'éradiquer complètement l'espèce humaine.
CH7_Main_19_006,Je ne vous laisserai pas!
CH7_Main_19_007,"Hah, c'était un beau combat. Pourtant, c'est fini - vous n'étiez aps au niveau pour moi."
CH7_Main_19_008,"Maintenant, mourez."
CH7_Main_19_009,Gau !!
CH7_Main_19_010,"Grrk... Ce... c'est l'Épée Sacrée, Aea..."
CH7_Main_19_011,Vous êtes donc le fils de Kyle.
CH7_Main_19_012,"Oui. Je suis le fils de votre ami, Kyle - je m'appelle Kasel."
CH7_Main_19_013,Je n'aurais jamais cru rencontrer ici le fils de Kyle. Intéressant...
CH7_Main_19_014,"Je vous verrai plus tard, fils de Kyle."
CH7_Main_20_001,"Bienvenue, fils de Kyle."
CH7_Main_20_002,Ainsi vous nous attendiez.
CH7_Main_20_003,Oui. Je ne peux pas permettre qu'Aea reste entre des mains humaines.
CH7_Main_20_004,"C'est une arme dangereuse. Plus encore si elle est confiée à ces cupides humains, qui ne savent pas se contrôler."
CH7_Main_20_005,Je vais tout détruire. L'humanité et l'Épée Sacrée!
CH7_Main_20_006,Pourquoi étiez-vous après Arlette?
CH7_Main_20_007,"Si vous voulez savoir ça, joignez-vous à moi pour les détruire."
CH7_Main_20_008,Ma curiosité ne vaut pas un tel prix.
CH7_Main_20_009,"Hmmpf, vous aussi, à l'origine vous étiez humain."
CH7_Main_20_010,"Mourez ensemble, avec votre ancienne espèce!"
CH7_Main_21_001,"Le roi des géants de givre, Tarkas... est vraiment fort, comme prévu."
CH7_Main_21_002,"Si faible, fils de Kyle. Vous me décevez."
CH7_Main_21_003,C'est la fin!!
CH7_Main_21_004,"Je ne le permettrais pas, Tarkas !!"
CH7_Main_21_005,Même si ce n'était pas ce que je voulais...
CH7_Main_21_006,Si je tergiverse ici... Je ne pourrais plus sauver personne... Je ne pourrais plus sauver le monde!
CH7_Main_21_007,"Même si je suis envahi par les Ténèbres une fois de plus, je n'ai plus le choix!"
CH7_Main_21_008,"Pavel, l'heure est venue! Rendez-moi le pouvoir de l'Épée Sacrée!"
CH7_Main_21_009,"Je vois. Comme convenu, je rends le pouvoir à son propriétaire légitime."
CH7_Main_21_010,Je le sens... le saint pouvoir qui s'agite à l'intérieur de l'épée...
CH7_Main_21_011,Gugh...
CH7_Main_21_011_00,Alors vous étiez l'héritier de l'Épée Sacrée...
CH7_Main_21_012,"Donc, c'est fini... aussi loin que j'aille..."
CH7_Main_21_013,Lua... pourquoi as-tu donné l'épée aux humains...
CH7_Main_21_014,Si fragiles... si faibles... si instables...
CH7_Main_22_001,Est-ce fini...
CH7_Main_22_002,"Si vous parlez de Tarkas, je dirais oui."
CH7_Main_22_003,"Merci, Pavel. Nous allons tous bien, merci à vous."
CH7_Main_22_004,"Non, c'est parce que vous avez décidé de faire ce qui devait être fait."
CH7_Main_22_005,"Gau, maintenant que Tarkas est tombé, les barbares qui restent doivent être en sécurité, non?"
CH7_Main_22_006,"Je vais quand même essayer de convaincre les autres espèces, de m'assurer de leurs intentions."
CH7_Main_22_007,"Lorsque vous essayerez de parler avec les Harpies, dites-leur ça."
CH7_Main_22_008,"Les Harpies de retour à Elidora, au sud-est d'ici"
CH7_Main_22_009,"ont également eu des accords avec les démons par le passé, donc ells ne devraient pas être si dures avec vous."
CH7_Main_22_010,"Haha, eh bien, je verrai ce que je peux faire."
CH7_Main_22_011,"Maintenant, seul reste le pouvoir avec le talisman d'Aeatola."
CH7_Main_22_012,"Ainsi, l'Épée Sacrée sera de nouveau complète."
CH7_Main_22_013,"Kasel, récupérerez-vous la dernière partie du pouvoir?"
CH7_Main_22_014,"Frey, vous avez essayé de faire votre part même dans la mort."
CH7_Main_22_015,Je devrais... faire ce qui est juste. Même si ça me fait peur.
CH7_Main_22_016,Qu'est-ce qui est si effrayant? Nous sommes tous ici avec vous.
CH7_Main_22_017,"Merci, Cleo."
CH7_Main_22_018,"Avant ça, je suggère d'abord de partir au Volcan Dragia."
CH7_Main_22_019,Avez-vous entendu dire que le volcan est devenu plus actif récemment?
CH7_Main_22_020,Oui.
CH7_Main_22_021,C'est probablement dû à une grande fissure dimensionnelle sur le site.
CH7_Main_22_022,Une fissure dimensionnelle?
CH7_Main_22_023,"Depuis que la Porte Dimensionnelle a été ouverte il y a 100 ans, de petites fissures sont apparues ici et là."
CH7_Main_22_024,Est-ce que... c'est vraiment dangereux.
CH7_Main_22_025,"Jusqu'à présent, seules de petites fissures s'étaient produites... mais cette fois-ci, c'est différent."
CH7_Main_22_026,Étant donné que l'activité volcanique s'est un peu calmée... vous devriez pouvoir entrer dans la zone.
CH7_Main_22_027,"Pour vous protéger, je vous accorderai un bouclier de protection contre la magie du givre."
CH7_Main_22_028,"Lorsque tout sera terminé, j'irai rencontrer Lewisia et vous aiderai pour votre voyage."
CH7_Main_22_029,Je vous remercie. Nous partirons donc d'abord pour Dragia.
CH7_Lei_1_001,"Huh, pourquoi un enfant se promène-t-il ici en pleine nature?"
CH7_Lei_1_002,Quelque chose ne va pas?
CH7_Lei_1_003,"C'est dangereux. L'ennemi cible tous les humains, vous vous rappelez?"
CH7_Lei_1_004,Je ne pense pas qu'elle soit particulièrement en danger.
CH7_Lei_1_005,"Eh bien, elle est jeune et seule... ça pourrait être potentiellement dangereux."
CH7_Lei_1_006,"Pourtant, après Miruru et Rodina... Je ne pense pas qu'elle soit en difficulté."
CH7_Lei_1_007,"Hé, c'est dangereux par ici."
CH7_Lei_1_008,Eh? Vous êtes...
CH7_Lei_1_009,Attends... est-ce que je t'ai déjà vu quelque part?
CH7_Lei_1_010,"Ça fait longtemps, Gau."
CH7_Lei_1_011,Tu es... Lei?
CH7_Lei_1_012,"Hmm, je suppose qu'ils se connaissent."
CH7_Lei_1_013,Vu que tu es ici... l'orphelinat a-t-il été fermé?
CH7_Lei_1_014,Irin s'en occupe.
CH7_Lei_1_015,Attends... tu n'as pas grandi du tout!
CH7_Lei_1_016,En effet.
CH7_Lei_1_017,"Je veux dire... avec tout ce temps passé, c'est un peu..."
CH7_Lei_1_018,Lei... nest-ce pas? Êtes-vous aussi... maudit?
CH7_Lei_1_019,Qu'entendez-vous par maudit?
CH7_Lei_1_020,"Eh bien, nous avons rencontré cet enfant, Miruru, dans le désert d'Aegina."
CH7_Lei_1_021,C'était apparemment une malédiction qui avait transformé son corps en celui d'un enfant.
CH7_Lei_1_023,"Hahaha, non, ce n'est pas une malédiction."
CH7_Lei_1_024,"Hmm... Eh bien, ça semble différent."
CH7_Lei_1_025,"Je jure que l'esprit de Miruru est aussi celui d'un enfant, mais... ce..."
CH7_Lei_1_026,"Lei... était différente des autres enfants. Elle était calme, plus mature... elle sortait du lot."
CH7_Lei_1_027,"J'étais inquiet, Lei. Tu n'avais rien laissé d'autre qu'une lettre."
CH7_Lei_1_028,C'est un soulagement de savoir que tu es saine et sauve.
CH7_Lei_1_029,Vous avez mentionné un orphelinat?
CH7_Lei_1_030,Gau l'a construit pour les enfants orphelins de guerre.
CH7_Lei_1_031,"Ça peut sembler difficile à croire, mais c'est un homme attentionné."
CH7_Lei_1_032,Les orphelins de guerre...
CH7_Lei_1_033,Beaucoup d'enfants sont devenus orphelins dans la guerre avec les géants de givre.
CH7_Lei_1_034,Je ne pouvais pas les laisser voués à eux-mêmes.
CH7_Lei_1_035,"Donc, vous étiez loin du champ de bataille pour vous occuper des enfants."
CH7_Lei_1_036,Mais... ça a peut-être causé encore plus de morts...
CH7_Lei_1_037,"Ce n'est pas vrai, Gau."
CH7_Lei_1_038,"Même si tu t'étais battu en première ligne, ça n'aurait rien changé."
CH7_Lei_1_039,"Je suppose que oui, Lei. Merci."
CH7_Lei_1_040,"C'est dangereux ici, alors allons-y."
CH7_Lei_1_041,"Haha, bien, Gau. J'ai des affaires à régler."
CH7_Lei_1_042,À plus tard alors.
CH7_Lei_1_043,Lei!!
CH7_Lei_1_044,"Oh cet enfant, quest-ce qu'il est têtu..."
CH7_Lei_1_045,"Je ne pense pas que vous devez vous inquiéter autant, Gau."
CH7_Lei_1_046,"Vu sa croissance et tout le reste, je ne pense pas que ce soit une personne normale."
CH7_Lei_2_001,Lei?
CH7_Lei_2_002,"Ah, c'est vous."
CH7_Lei_2_003,Vous êtes donc avec le Dragon de Glace.
CH7_Lei_2_004,Dragon de Glace?
CH7_Lei_2_005,Qui êtes-vous? Je crois vous avoir déjà vue...
CH7_Lei_2_006,"Hmm, je vois. Vous ne reconnaîtriez pas grand chose, apparemment."
CH7_Lei_2_007,Dragon de glace... Je suppose que vous parlez de Pavel?
CH7_Lei_2_008,"Hmm... Dragon de glace, vous ne leur avez pas encore parlé de votre identité?"
CH7_Lei_2_009,Je n'ai parlé que de ce qui était nécessaire.
CH7_Lei_2_010,Il semble que je ne sois pas le seul à ne pas avoir révélé mon identité.
CH7_Lei_2_011,"Haha, pas besoin d'être si prudent."
CH7_Lei_2_012,Bon... nous devons nous dépêcher.
CH7_Lei_2_013,Gau ne peut pas battre Tarkas tout seul.
CH7_Lei_2_014,Vous connaissez même Tarkas... mais qui êtes-vous?
CH7_Lei_2_015,"Ça peut attendre. Pour l'instant, nous devons nous dépêcher."
CH7_Lei_2_016,Vous le saurez en temps voulu.
CH7_Lei_3_001,Non!!
CH7_Lei_3_003,"Désolé, mais je dois vous arrêter maintenant, Tarkas. C'est un de mes amis."
CH7_Lei_3_004,Vous... Lewisia !!
CH7_Lei_3_005,"Hmm, pas mal."
CH7_Lei_3_006,J'étais inquiète pendant une seconde de ce qui se passerait si je ne pouvais pas débloquer mon pouvoir.
CH7_Lei_3_007,"Hmm, c'était donc Lewisia. Pas étonnant que je pu penser que vous aviez un air familier."
CH7_Lei_3_008,Lewisia... n'était-elle pas un autre des compagnons du roi Kyle?
CH7_Lei_3_009,"Oui... Lewisia, la vampiresse."
CH7_Lei_3_010,Comment êtes-vous soudainement devenu adulte?
CH7_Lei_3_011,C'est sa véritable forme. J'aimerais plutôt savoir pourquoi elle s'était transformée en enfant.
CH7_Lei_3_012,"Lewisia, vous..."
CH7_Lei_3_013,"Je comprends pourquoi vous détestez les humains, Tarkas..."
CH7_Lei_3_014,"Mais le monde est en danger, et ce n'est pas le moment de vous en prendre aux humains."
CH7_Lei_3_015,"Vous ne comprenez rien, Lewisia. Tout ce qui a mal tourné est de leur faute!!"
CH7_Lei_3_016,"Et pourtant, ce sont aussi les humains qui ont été chargés de mettre fin au conflit."
CH7_Lei_3_017,"Lua l'a choisi ainsi, Tarkas."
CH7_Lei_3_018,...Vous marquez un point.
CH7_Lei_3_019,Quand bien même...
CH7_Lei_3_020,"Non, ça peut attendre. Je vais me retirer, pour l'instant."
CH7_Lei_4_001,...Gau?
CH7_Lei_4_002,Ah... quoi... qu'est-ce qui se passe...
CH7_Lei_4_003,Es-tu vraiment... Lei?
CH7_Lei_4_004,J'utilisais un faux nom juste au cas où.
CH7_Lei_4_005,Mon vrai nom est Lewisia.
CH7_Lei_4_006,"J'ai trop utilisé mon pouvoir il y a 100 ans, et ma forme s'était réduite à celle d'un enfant."
CH7_Lei_4_007,"J'ai débloqué temporairement mon pouvoir pour vous sauver,"
CH7_Lei_4_008,mais je reviendrai bientôt dans ma forme plus jeune.
CH7_Lei_4_009,...Alors tu étais un Héros. Un des sauveurs de ce monde.
CH7_Lei_4_010,"Je ne voulais pas que les gens le sachent, ça aurait été un fardeau de plus."
CH7_Lei_4_011,Je voulais simplement me mêler normalement aux gens.
CH7_Lei_4_012,Pourquoi?
CH7_Lei_4_013,"Alors, vous pourriez... boire leur sang?"
CH7_Lei_4_014,"*Soupir*... Eh bien, les vampires ne boivent pas seulement du sang."
CH7_Lei_4_015,"C'est vrai que le sang nous rend forts, mais nous n'en sommes pas assoiffés."
CH7_Lei_4_016,"Quoi qu'il en soit, je souhaitais seulement observer les humains, en toute insouciance."
CH7_Lei_4_017,Je voulais les voir reconstruire ce monde après tout ce qui s'était passé.
CH7_Lei_4_018,Mais ces temps insouciants sont maintenant terminés.
CH7_Lei_4_019,"N'est-ce pas le cas, enfant de la Lame Sacrée."
CH7_Lei_4_020,Je suppose que vous l'auriez su.
CH7_Lei_4_021,Savez-vous qui dirige les démons cette fois-ci?
CH7_Lei_4_022,"Non... mais, nous avons une certaine avance."
CH7_Lei_4_023,"Apparemment, ce n'est pas un démon, ni même quelqu'un de ce monde."
CH7_Lei_4_024,Quelqu'un l'a appelé le Chevalier Noir.
CH7_Lei_4_025,Oui. Il semble que Tarkas aide le Chevalier Noir.
CH7_Lei_4_026,Quoi?! Ça signifie qu'il a fait un pacte avec les démons!
CH7_Lei_4_027,"Quel hypocrite, blâmer les humains pour tout alors que lui...!!"
CH7_Lei_4_028,Bien que...
CH7_Lei_4_029,il semblerait que les démons ne soient pas impliqués dans cette situation.
CH7_Lei_4_030,On dirait qu'ils ont quelques problèmes... internes.
CH7_Lei_4_031,C'est pour ça qu'il était après Arlette.
CH7_Lei_4_032,Arlette? Comment une humaine comme elle pourrait-elle encore être en vie après tout ce temps...
CH7_Lei_4_033,"Attendez, Pavel. Avez-vous fait quelque chose?"
CH7_Lei_4_034,Je parlerai de ça... plus tard.
CH7_Lei_4_035,J'ai expliqué tout cela à ces gens il y a un instant.
CH7_Lei_4_036,"Donc, le fait que ma mère ait été endormie n'était pas connu de tous les Héros..."
CH7_Lei_4_037,Hmm? Elle était votre mère?
CH7_Lei_4_038,Je vois... alors elle était vraiment en vie.
CH7_Lei_4_039,Plus... maintenant.
CH7_Lei_4_040,"Quoi qu'il en soit, nous devons arrêter Tarkas maintenant."
CH7_Lei_4_041,"Ce serait bien que tout se termine après une bonne conversation, mais ça n'a pas l'air possible."
CH7_Lei_4_042,"Eh bien, ça a toujours été ainsi, n'est-ca pas Frey?"
CH7_Lei_4_043,"Malheureusement, oui."
CH7_Lei_4_044,"Je ne serais plus très utile. Toute ma force a disparue, et je redeviendrai bientôt un enfant."
CH7_Lei_4_045,"J'ai besoin de temps pour récupérer, puis je vous rejoindrai tous."
CH7_Lei_4_046,"Après, j'aurai besoin de votre aide pour rentrer."
CH7_Lei_5_001,"Ainsi, vous voici."
CH7_Lei_5_002,J'entends que vous êtes allié au Chevalier noir.
CH7_Lei_5_003,"Vous savez qu'il dirige les démons, n'est-ce pas?"
CH7_Lei_5_004,Vous le connaissez?
CH7_Lei_5_005,Pas tant que ça.
CH7_Lei_5_006,"Tout ce que nous savons, c'est qu'il est dirige les démons."
CH7_Lei_5_007,Et vous avez l'air de dire que les humains sont la cause de tous ces conflits?
CH7_Lei_5_008,"Hmmpf, vous ne comprenez rien."
CH7_Lei_5_009,Maintenant... mourez avant d'en savoir plus.
CH7_Lei_5_010,Laissez-moi poser une dernière question avant de nous battre.
CH1_TutorialR_1_001,"Pas mal pour un écuyer. Cependant, je ne peux m'empêcher de remarquer..."
CH1_TutorialR_1_002,"Um, est-ce que quelque chose ne va pas?"
CH1_TutorialR_1_003,Votre épée. Elle est trop usée pour être utilisée en combat.
CH1_TutorialR_1_004,"Oh, je... ne m'en étais pas rendu compte."
CH1_TutorialR_1_005,Je me demande si je peux en obtenir une nouvelle à la Boutique.
CH1_TutorialR_1_006,Pas besoin de rentrer. Prenez la mienne.
CH1_TutorialR_1_007,"Merci, mais... Je ne sais pas comment utiliser les dagues."
CH1_TutorialR_1_008,"Tss, tss. Vous ne saviez pas que vous pouviez gagner du butin pendant l'aventure?"
CH1_TutorialR_1_009,"Même si vous n'en avez pas besoin, vous pouvez toujours le vendre pour gagner un peu plus d'OR!"
CH1_TutorialR_1_010,"Cleo a raison. Ici, je pense que ces épées pourraient vous être utiles."
CH1_TutorialR_2_001,"Wow, deux épées? Merci, Roi."
CH1_TutorialR_2_002,"Ce n'est pas de la grande qualité, mais ça ira pour l'instant."
CH1_TutorialR_2_003,"Ne vous inquiétez pas, nous pouvons améliorer l'équipement."
CH1_TutorialR_2_004,À la Forge? Je suppose que nous rentrerons à Orvel finalement.
CH1_TutorialR_2_005,"Roi, vous êtes un idiot!"
CH1_TutorialR_2_006,J'ai déjà entendu parler de l'amélioration de l'équipement.
CH1_TutorialR_2_007,"C'est quand les prêtres améliorent l'équipement avec d'autres pièces d'équipement comme composants, c'est ça?"
CH1_TutorialR_2_008,Oui c'est ça.
CH1_TutorialR_2_009,"Ooh, j'ai toujours voulu essayer ça! Apprenez-moi!"
CH1_TutorialR_2_010,Um... C'est une sorte de magie différente de celle des sorts que vous utilisez habituellement.
CH1_TutorialR_2_011,Pouvez-vous au moins me dire comment ça marche? S'il vous plaît?
CH1_TutorialR_2_012,C'est mon devoir en tant que grande archimage d'apprendre au moins la théorie.
CH1_TutorialR_2_013,Lua est la déesse de la lumière et créatrice de tout.
CH1_TutorialR_2_014,Bien que la creation soit au-delà de nos possibilités...
CH1_TutorialR_2_015,"En tant que disciplines de Lua, nous sommes capables de fusionner l'équipement avec des flux de mana similaires."
CH1_TutorialR_2_016,"Bien, et les équipements utilisés dans les batailles ont des flux de mana similaires."
CH1_TutorialR_2_017,Mais j'ai entendu dire qu'il y a une chance d'échec si votre flux de conscience glisse.
CH1_TutorialR_2_018,"Ne vous inquiétez pas. Même si je ne suis qu'un apprenti, je n'ai jamais raté une amélioration d'équipement."
CH1_TutorialR_2_019,Je suppose que devenir une prêtresse est ma vocation.
CH1_TutorialR_2_1_001,"Oh, cette épée est bien mieux que la précédente. Merci infiniment, Roi."
CH1_TutorialR_2_1_002,"Ah ah ah, ne me remercie pas."
CH1_TutorialR_2_1_003,Ce n'est pas la meilleure épée du monde. Je me demande même si sa qualité ne laisse pas à désirer.
CH1_TutorialR_2_1_004,"Ne t'en fais pas, je peux toujours l'améliorer."
CH1_TutorialR_2_1_005,"En fin de compte, nous devrions aller à la forge."
CH1_TutorialR_2_1_006,"Mais non, gros bêta !"
CH1_TutorialR_2_1_007,Il existe un moyen d'améliorer les armes sans passer par la forge.
CH1_TutorialR_2_1_008,"Si mes souvenirs sont bons, un prêtre peut procéder à une telle amélioration par une simple prière à la déesse."
CH1_TutorialR_2_1_009,"Oui, c'est exact."
CH1_TutorialR_2_1_010,Ça m'intrigue depuis longtemps. Quel est le principe magique de l'Amélioration ?
CH1_TutorialR_2_1_011,Hum... Cela n'a rien à voir avec les sorts que tu utilises habituellement...
CH1_TutorialR_2_1_012,Tu peux au moins me dire comment ça fonctionne ?
CH1_TutorialR_2_1_013,"On me considère comme une archimage, ça serait dommage que je n'aie pas la moindre connaissance théorique sur le sujet."
CH1_TutorialR_2_1_014,Lua est la déesse de la lumière et la créatrice de tout.
CH1_TutorialR_2_1_015,"Ses fidèles, prêtres ou prêtresses, ne peuvent rien créer à partir du néant,"
CH1_TutorialR_2_1_016,mais ils peuvent bénir les choses grâce au pouvoir de Lua et les imprégner d'une force supérieure.
CH1_TutorialR_2_1_017,"C'est une prière simple, même pour une apprentie prêtresse telle que moi."
CH1_TutorialR_2_1_018,"Ça ressemble à de l'alchimie, mais ça n'est pas tout à fait pareil."
CH1_TutorialR_2_1_019,"L'alchimie nécessite de consommer des matériaux, et augmente ou modifie les attributs d'un objet plutôt que de l'améliorer vraiment."
CH1_TutorialR_2_1_020,Les prêtres ont-ils besoin de matériaux pour procéder à l'Amélioration ?
CH1_TutorialR_2_1_021,"Non, mais il faut tout de même s'acquitter d'un peu d'or envers Lua."
CH1_TutorialR_2_1_022,"D'après le grand prêtre, c'est ainsi que nous exprimons notre gratitude à Lua."
CH1_TutorialR_2_1_023,"... Hum, ça me paraît terriblement concret et réaliste."
CH1_TutorialR_3_001,Faire l'expérience d'une vraie bataille m'aide vraiment avec mes compétences de combat.
CH1_TutorialR_3_002,"Malgré tout, vous ne devez pas négliger vos études."
CH1_TutorialR_3_003,"Haha, bien sûr."
CH1_TutorialR_3_004,J'avais l'intention d'apprendre les attributs avec un livre de compétence de Guerrier juste à l'instant.
CH1_TutorialR_4_001,"Hmm, il n'y a aucun butin utile par ici."
CH1_TutorialR_4_002,"Tu as raison. Tout ce que j'ai trouvé, c'était ce déchet scintillant."
CH1_TutorialR_4_003,"Oh, Cleo, ceci est une... !!"
CH1_TutorialR_4_004,"Huh ? Quoi ? Quelque chose ne va pas, Frey ?"
CH1_TutorialR_4_005,"Ce n'est pas un déchet, c'est une pierre d'invocation !"
CH1_TutorialR_4_006,"Avec l'aide de Lua, Nous pouvons invoquer de puissants équipements avec ceci."
CH1_TutorialR_4_007,"Je le savais ! Je suis une grande archimage, destinée à attirer de super objets !"
CH1_TutorialR_4_008,Une grande archimage reconnaîtrait probablement une pierre d'invocation.
CH1_TutorialR_4_009,"T-Tais-toi, Roi ! C'est la première fois que je vois une pierre d'invocation !"
CH1_TutorialR_4_010,"Cleo n'est pas une prêtresse, c'est naturel pour elle de ne pas en savoir."
CH1_TutorialR_4_011,"Puisque Cleo est celle qui a trouvé la pierre d'invocation, je vais essayer d'invoquer de l'équipement de mage."
CH1_TutorialR_5_001,Bienvenue dans la Boutique de May !
CH1_TutorialR_5_002,"Nous mettons à votre disposition non seulement des armes et des armures qui conviendront parfaitement à un beau et jeune chevalier,"
CH1_TutorialR_5_003,mais nous avons également des Runes et autres Poudres Magiques très rares et prisés.
CH1_TutorialR_5_004,"Cependant, si vous ne trouvez pas ce dont vous avez besoin..."
CH1_TutorialR_5_005,Et... Vous... Vous partez sans rien acheter...
CH1_TutorialR_5_006,May sera très déçue !
CH1_TutorialR_5_007,"Hé, on dirait bien que vous n'avez pas le choix, monsieur le beau et jeune chevalier."
CH1_TutorialR_5_008,Ahahaha...
Tutorial0308_1_001,"Roi, est-ce que quelque chose ne va pas?"
Tutorial0308_1_002,Je ne comprends pas.
Tutorial0308_1_003,"Il y a des Démons dans la nature, mais les gens ne semblent s'intéresser qu'à la Crypte Royale Antique."
Tutorial0308_1_004,Peut-être que la Royauté Orvelienne n'a pas encore connaissance des Démons?
Tutorial0308_1_005,Probablement pas. L'expédition serait revenu et aurait fait un rapport sur les Démons maintenant.
Tutorial0308_1_006,Pourtant la Garge Royale recherche de l'OR dans un tel calme.
Tutorial0308_1_007,"On s'en fout! Grâce à la Crypte Royale, nos poches seront remplies d'OR."
Tutorial0308_1_008,"Je suppose que le royaume a également besoin de ressources, surtout dans une période comme celle-ci."
Tutorial0308_1_009,Peut-être...
Tutorial0308_1_010,"Et bien, ce n'est pas mon rôle d'intervenir. Ce n'est même pas mon pays."
Tutorial0308_1_011,Pourtant... Je ne peux pas m'empêcher de me demander. Serions-nous capable de vaincre les démons sans aucune aide?
Tutorial0308_1_012,"Pas d'inquiétude! Cleo, la grande archimage l'est..."
Tutorial0308_1_013,Nous pouvons toujours demander de l'aide ailleurs.
Tutorial0308_1_014,"Roi ! Ne m'interrompez pas! Occupez-vous de votre travail, me protéger!"
Tutorial0308_1_015,Interrupting un discours inutile ne gêne en rien mon travail.
Tutorial0308_1_016,Qu'est-ce que vous avez dit?! Pourquoi vous...
Tutorial0308_1_017,"Cleo, peut-être que nous pouvons laisser Roi finir?"
Tutorial0308_1_018,"Hum-hum? Um... bien sûr, si vous voulez."
Tutorial0308_1_019,Merci.
Tutorial0308_1_020,Je vous laisse parler uniquement parce que Frey souhaite entendre la suite!
Tutorial0308_1_021,Je n'étais pas en train de vous remercier.
Tutorial0308_1_022,Stop! Arrêtez vous deux!
Tutorial0308_1_023,"Roi, qui d'autre peut nous aider?"
Tutorial0308_1_024,Je ne parlais de personne en particulier.
Tutorial0308_1_025,Avez-vous déjà entendu parler d'une chose appelée 'Guilde'?
Tutorial0308_1_026,Ça me semble familier... Je pense que c'est ce que vous appelez un groupe de personnes réunies dans le même but.
Tutorial0308_1_027,Correct.
Tutorial0308_1_028,Nous pourrions aussi visiter le Centre de Guildes pour voir s'il y a des Guildes de Mercenaires.
Tutorial0308_1_029,Oh! Une Guilde de Mercenaires c'est une grande idée!
Tutorial0308_1_030,J'ai seulement entendu parler de guildes de marchands ou de production.
Tutorial0308_1_031,"Rien d'étonnant. D'habitude, nous ne travaillons pas avec des membres de Guilde."
Tutorial0308_1_032,Savez-vous où est le Centre de Guildes?
Tutorial0308_1_033,"Bien sûr. Je n'y suis jamais allé auparavant, mais c'est très proche."
Tutorial0308_2_001,Excusez-moi.
Tutorial0308_2_002,Bienvenue. Quel est l'objectif de votre visite ?
Tutorial0308_2_003,Nous souhaitons obtenir l'aide de la Guilde des Mercenaires !
Tutorial0308_2_004,Euh... ? Vous n'êtes pas... Cleo ?
Tutorial0308_2_005,Hein ? Tu me connais ?
Tutorial0308_2_006,C'est bien vous. Qu'est-ce que vous avez grandi !
Tutorial0308_2_007,Comment la connaissez-vous ?
Tutorial0308_2_008,"Tous les habitants de la Tour des Sages connaissent Cleo, la célèbre fauteuse de trouble."
Tutorial0308_2_008_1,Je me présente. Je m'appelle Veronica et je suis actuellement le Quartier-Maître Général du Centre des Guildes.
Tutorial0308_2_009,Arg. Vous êtes de la Tour des Sages?
Tutorial0308_2_010,J'ai quitté la Tour il y a... 5 ans.
Tutorial0308_2_011,Déjà connue il y a 5 ans pour créer des problèmes?
