KEY,Thai
CH7_Main_22_019,เคยได้ยินเกี่ยวกับภูเขาไฟที่มีทีท่าว่าจะระอุขึ้นบ้างมั้ย?
CH7_Main_22_020,เคยๆ
CH7_Main_22_021,สาเหตุน่าจะมาจากคลื่นมิติขนาดใหญ่
CH7_Main_22_022,คลื่นมิติงั้นหรอ?
CH7_Main_22_023,หลังจากที่ประตูมิติเปิดขึ้นเมื่อ 100 ปีก่อน ก็เกิดคลื่นมิติเล็กๆขึ้นมาตลอด
CH7_Main_22_024,จะ...จริงหรอ? เรื่องแบบนั้น...มันอันตรายมากเลยนะ
CH7_Main_22_025,ปกติแล้วเพราะมันเป็นแค่คลื่นเล็กๆก็เลยไม่อันตราย แต่ครั้งนี้ไม่ใช่
CH7_Main_22_026,ตอนนี้ภูเขาไฟดูเหมือนจะสงบลงบ้างแล้ว น่าจะเข้าไปแถวนั้นได้
CH7_Main_22_027,ข้าจะใช้พลังไอเย็นช่วยป้องกันความร้อนจากลาวาบางส่วน
CH7_Main_22_028,หลังจากที่ข้ากับ Lewisia จัดการที่นี่เรียบร้อยแล้ว เราจะช่วยพวกเจ้า
CH7_Main_22_029,เข้าใจแล้ว เราจะไปสำรวจภูเขาไฟ Dragia กัน!
CH7_Lei_1_001,ว่าแต่ ทำไมเด็กนี่ถึงได้มาอยู่ที่นี่...
CH7_Lei_1_002,มันน่าตกใจมากขนาดนั้นเลยหรอ?
CH7_Lei_1_003,มันอันตรายมากนะ พวกศัตรูเพ่งเล็งมนุษย์อยู่
CH7_Lei_1_004,แต่ข้าไม่เห็นว่าจะอันตรายตรงไหนเลย
CH7_Lei_1_005,เอ่อ แต่เขายังเด็กและ อยู่ที่นี่คนเดียวยังไงก็อันตราย
CH7_Lei_1_006,ไม่รู้เพราะว่าเจอกับ Miruru กับ Rodina ข้าไม่ได้คิดแบบนั้นเลย
CH7_Lei_1_007,นี่ ที่นี่อันตรายนะ
CH7_Lei_1_008,ห้ะ? เจ้าคือ...
CH7_Lei_1_009,เดี๋ยวนะ เหมือนข้าจะเคยเจอเจ้าที่ไหนสักแห่ง
CH7_Lei_1_010,ไม่เจอกันนานเลยนะ Gau
CH7_Lei_1_011,เจ้า...Lei งั้นหรอ?
CH7_Lei_1_012,เอ่อ ดูเหมือนว่าสองคนนี้จะรู้จักกันสินะ
CH7_Lei_1_013,จัดการบ้านเด็กกำพร้าเรียบร้อยแล้วสินะ ถึงได้มาอยู่ที่นี่ได้
CH7_Lei_1_014,ตอนนี้ให้ไอรีนเป็นคนดูแลแทนหนะ
CH7_Lei_1_015,เดี๋ยวก่อน ว่าแต่ เจ้านี่ไม่โตขึ้นเลยนะ
CH7_Lei_1_016,งั้นหรอ
CH7_Lei_1_017,เวลาก็ผ่านไปพอสมควร โตขึ้นมาแค่นิดเดียวเอง
CH7_Lei_1_018,ชื่อ Lei งั้นสินะ? ว่าแต่เจ้าก็โดนคำสาปเหมือนกันรึป่าว?
CH7_Lei_1_019,คำสาปงั้นหรอ?
CH7_Lei_1_020,ข้าเจอเด็กที่ชื่อ Miruru ที่ทะเลสาบ Aegina
CH7_Lei_1_021,เหมือนว่าจะโดนคำสาปที่ทำให้เป็นเด็กอะนะ
CH7_Lei_1_023,ฮ่าๆๆ นั่นไม่ใช่คำสาปหรอก
CH7_Lei_1_024,เอ่อ จะว่าไปมันก็ไม่เหมือนกับคำสาปในความหมายนั้น
CH7_Lei_1_025,อายุสมองของเจ้าเด็ก Miruru นั่นก็ดูเหมือนจะลดลงตามไปด้วย
CH7_Lei_1_026,Lei ไม่เหมือนกับคนอื่น เธอใจเย็น และมีความเป็นผู้ใหญ่มาก ข้าจึงจำเธอได้ดี
CH7_Lei_1_027,เจ้าทิ้งจดหมายแค่ฉบับเดียวไว้แล้วก็จากไปเลย
CH7_Lei_1_028,ข้าเป็นห่วงมากนะ แต่ไม่เป็นไรก็ดีแล้วหละ
CH7_Lei_1_029,เมื่อกี้พูดว่าบ้านเด็กกำพร้างั้นหรอ?
CH7_Lei_1_030,Gau สร้างบ้านเด็กกำพร้าขึ้นมาไว้สำหรับพวกเด็กกำพร้าพ่อแม่จากสงคราม
CH7_Lei_1_031,เพราะเขามีจิตใจดีมากผิดกับหน้าตาลิบลับ ก็เลยทำให้ข้าจำได้
CH7_Lei_1_032,เด็กกำพร้าจากสงคราม
CH7_Lei_1_033,ก็หมายความว่าเป็นลูกของคนที่ตายไประหว่างสงครามกับยักษ์น้ำแข็ง
CH7_Lei_1_034,เห็นแล้วข้าก็สงสารจับใจ จะปล่อยไปก็ทำใจไม่ได้
CH7_Lei_1_035,ก็เลยตัดสินใจออกจากสงครามมาดูแลเด็กสินะ
CH7_Lei_1_036,แต่แล้ว...เพราะเหตุนั้นทำให้ต้องมีคนล้มตายมากขึ้นไปอีก
CH7_Lei_1_037,มันไม่ใช่อย่างนั้นหรอก Gau
CH7_Lei_1_038,ถึงแม้ว่าเจ้าจะสู้ในตอนนั้นก็คงไม่มีอะไรเปลี่ยนไปหรอก
CH7_Lei_1_039,ขอบใจนะ Lei
CH7_Lei_1_040,ที่นี่มันอันตราย เราไปด้วยกันเถอะ
CH7_Lei_1_041,หุหุ ไม่เป็นไรหรอก Gau ข้ามีเรื่องต้องทำนิดหน่อย
CH7_Lei_1_042,ไปล่ะ แล้วเจอกันนะ
CH7_Lei_1_043,Lei!
CH7_Lei_1_044,ยังดื้อเหมือนเดิมไม่เปลี่ยนเลย...
CH7_Lei_1_045,ไม่ต้องเป็นห่วงขนาดนั้นก็ได้ Gau
CH7_Lei_1_046,ดูจากรูปร่างที่ไม่โตขึ้นเลยแล้ว เขาไม่น่าจะเป็นคนธรรมดาหรอก
CH7_Lei_2_001,Lei งั้นหรอ?
CH7_Lei_2_002,อ่ะ คนที่เพิ่งเจอมาเมื่อกี้นี้
CH7_Lei_2_003,เจ้าอยู่กับมังกรน้ำแข็งสินะ
CH7_Lei_2_004,มังกรน้ำแข็งงั้นหรอ?
CH7_Lei_2_005,เจ้าเป็นใคร? เหมือนข้าจะเคยเห็นเจ้าที่ไหนมาก่อน...
CH7_Lei_2_006,จริงสินะ อยู่ในสภาพนี้คงจะจำไม่ได้
CH7_Lei_2_007,มังกรน้ำแข็ง...เจ้ากำลังพูดถึง Pavel งั้นหรอ?
CH7_Lei_2_008,เอ่อ...มังกรน้ำแข็ง เจ้าคงยังไม่ได้เปิดเผยตัวจริงสินะ
CH7_Lei_2_009,ข้าพูดเท่าที่จำเป็น
CH7_Lei_2_010,เจ้าเองก็ไม่เปิดเผยตัวจริงเหมือนกันนั่นแหละ
CH7_Lei_2_011,หุหุุ อย่ากังวลเกินไป
CH7_Lei_2_012,ยังไง...เราก็ยังต้องรีบอยู่
CH7_Lei_2_013,เพราะลำพังแค่ Gau คนเดียวคงไม่ใช่คู่ต่อสู้ของ Tarkas แน่ๆ
CH7_Lei_2_014,เจ้ารู้จัก Tarkas ด้วยงั้นหรอ? เจ้าเป็นใครกันแน่....
CH7_Lei_2_015,รีบไปกันเถอะ เรื่องอื่นเอาไว้ก่อน
CH7_Lei_2_016,เจ้าจะรู้เองเมื่อถึงเวลา
CH7_Lei_3_001,ไม่ได้!
CH7_Lei_3_003,ขอโทษนะ แต่ข้าต้องหยุดเจ้า Tarkas เขาเป็นเพื่อนที่ดีของข้า
CH7_Lei_3_004,เจ้าคือ...Lewisia!!
CH7_Lei_3_005,เห้อ สำเร็จ
CH7_Lei_3_006,ข้าละกังวลว่ามันจะเป็นยังไงถ้าเราไม่สามารถปลดปล่อยพลังได้
CH7_Lei_3_007,คิดอยู่แล้วเชียวว่าเหมือนเคยเจอกันที่ไหน ที่แท้ก็ Lewisia เอง
CH7_Lei_3_008,Lewisia...เพื่อนของท่านกษัตริย์ไคล์อย่างงั้นหรอ
CH7_Lei_3_009,ใช่แล้ว...เขาคือ แวมไพร์ Lewisia
CH7_Lei_3_010,ว่าแต่ทำไมถึงได้กลายเป็นผู้ใหญ่ไปได้หละ?
CH7_Lei_3_011,นี่แหละคือร่างที่แท้จริงของเธอ ข้าสงสัยว่าทำไมเธอถึงกลายเป็นเด็กมากกว่า
CH7_Lei_3_012,Lewisia เจ้า...
CH7_Lei_3_013,ข้าเข้าใจทำไมเจ้าถึงเกลียดมนุษย์ แต่ Tarkas...
CH7_Lei_3_014,โลกกำลังถูกข่มขู่ และมันไม่ใช่เวลามาล้างแค้นมนุษย์ในตอนนี้
CH7_Lei_3_015,เจ้าไม่รู้อะไร Lewisia ทั้งหมดเป็นความผิดของมนุษย์
CH7_Lei_3_016,ถึงแม้จะเป็นอย่างนั้นแต่สุดท้ายแล้วมนุษย์ก็จะต้องเป็นคนที่จบความขัดแย้งที่เกิดขึ้น
CH7_Lei_3_017,มันคือการตัดสินใจของ Lua
CH7_Lei_3_018,ก็อาจจะใช่ ความรับผิดชอบนั้นอาจจะตกที่มนุษย์
CH7_Lei_3_019,แต่ว่า...
CH7_Lei_3_020,ไม่ ข้าจะต้องจัดการในครั้งนี้
CH7_Lei_4_001,...Gau?
CH7_Lei_4_002,นี่มันเรื่องอะไรกัน...
CH7_Lei_4_003,เจ้าคือ Lei จริงๆรึเปล่า
CH7_Lei_4_004,ข้าใช้ชื่อปลอมเพราะกลัวจะมีเรื่องทำให้รำคาญ
CH7_Lei_4_005,ชื่อจริงๆของข้าคือ Lewisia
CH7_Lei_4_006,ข้าใช้พลังมากไปใน 100 ปีก่อนหน้านี้ ทำให้สภาพข้ากลายเป็นแบบนี้
CH7_Lei_4_007,ตอนนี้ข้าปลดปล่อยพลังชั่วคราวเพื่อช่วยเจ้า
CH7_Lei_4_008,แต่อีกไม่นานข้าก็จะกลับไปเป็นเด็กเหมือนเดิม
CH7_Lei_4_009,...เจ้าคือคนที่ช่วยโลกเอาไว้งั้นหรอ
CH7_Lei_4_010,ข้าไม่ได้อยากให้คนพูดกันแบบนั้นเลย
CH7_Lei_4_011,ข้าอยากใช้ชีวิตธรรมดาๆเป็นมนุษย์คนนึง
CH7_Lei_4_012,ทำไมหละ?
CH7_Lei_4_013,หรือว่า...เจ้าแอบแฝงเข้ามาอยู่กับมนุษย์...เพราะต้องการกินเลือดงั้นหรอ?
CH7_Lei_4_014,หึ แวมไพร์ไม่ได้กินได้แต่เลือดเท่านั้นนะ
CH7_Lei_4_015,ถ้าได้กินเลือดแล้วจะแข็งแกร่งขึ้นก็จริง แต่เราไม่ได้กระหายเลือดเหมือนในตำนานหรอกนะ
CH7_Lei_4_016,ข้าก็แค่อยากอยู่ดูโลกที่มนุษย์ฟื้นฟูขึ้นมาเท่านั้นเอง
CH7_Lei_4_017,เดินทางท่องเที่ยวไปทั่ว
CH7_Lei_4_018,แต่ตอนนี้ดูเหมือนจะไม่มีเวลาทำแบบนั้นแล้ว
CH7_Lei_4_019,จริงมั้ย? เด็กผู้ครอบครองดาบศักสิทธิ์
CH7_Lei_4_020,ท่านดูออกจริงๆด้วย
CH7_Lei_4_021,เจ้ารู้มั้ยว่าใครเป็นผู้นำพวกปีศาจอยู่ตอนนี้?
CH7_Lei_4_022,ก็ไม่รู้เหมือนกัน แต่มีคนนึงที่น่าสงสัย
CH7_Lei_4_023,มีบางสิ่งที่ไม่ใช่ทั้งปีศาจและคนบนโลกนี้
CH7_Lei_4_024,บางคนที่ถูกเรียกว่า นักรบแห่งความมืด
CH7_Lei_4_025,ใช่แล้ว ดูเหมือนว่า Tarkas จะให้ความช่วยเหลืออัศวินมืดนั่น
CH7_Lei_4_026,ห้ะ? ก็หมายความว่าไปเข้าร่วมกับพวกปีศาจงั้นหละสิ
CH7_Lei_4_027,เอาแต่โทษมนุษย์ ที่แท้ตัวเอง ไปคบคิดกับพวกปีศาจงั้นหรอ?
CH7_Lei_4_028,แต่ว่านั่นมัน...
CH7_Lei_4_029,เรื่องนี้มันไม่เกี่ยวกับพวกปีศาจหนะสิ
CH7_Lei_4_030,ดูเหมือนว่าจะมีปัญหาอะไรบางอย่างภายใน
CH7_Lei_4_031,ก็เลยเป็นเหตุผลให้ไล่ล่าอาร์เล็ตเต้รึป่าวนะ
CH7_Lei_4_032,อาร์เล็ตเต้งั้นหรอ? มนุษย์คนนั้นยังมีชีวิตอยู่อีก...
CH7_Lei_4_033,เดี่ยวนะ Pavel เจ้าทำอะไรผู้หญิงคนนั้นหรึป่าว?
CH7_Lei_4_034,เรื่องนั้น เอาไว้คุยวันหลัง
CH7_Lei_4_035,ข้าเพิ่งจะอธิบายไป ถ้าเล่าอีกเดี๋ยวพวกนั้นจะเบื่อซะก่อน
CH7_Lei_4_036,เรื่องที่แม่หลับไปดูเหมือนจะไม่ได้รู้กันทุกคนสินะ...
CH7_Lei_4_037,ห้ะ? แม่งั้นหรอ?
CH7_Lei_4_038,ผู้หญิงคนนั้นมีชีวิตอยู่จริงๆ
CH7_Lei_4_039,แต่ตอนนี้...ไม่แล้ว
CH7_Lei_4_040,ยังไงก็แล้วแต่ ตอนนี้เราต้องหยุด Tarkas ก่อน
CH7_Lei_4_041,ถ้าพูดคุยกันดีๆได้ก็คงจะดี แต่ดูเหมือนว่าคงจะเป็นไปไม่ได้
CH7_Lei_4_042,เป็นแบบนี้ตลอด จริงมั้ย? Frey
CH7_Lei_4_043,นั่นสิ
CH7_Lei_4_044,ข้าช่วยไม่ได้แล้วนะ อีกไม่นานข้าจะกลับเป็นเด็กเหมือนเดิม
CH7_Lei_4_045,ข้าขอเวลาฟื้นพลังก่อน แล้วข้าจะไปกับพวกเจ้า
CH7_Lei_4_046,ถึงตอนนั้นเจ้าจะต้องช่วยข้าฟื้นพลังกลับมา
CH7_Lei_5_001,มาหาข้าหรอ?
CH7_Lei_5_002,ข้าได้ยินว่าเจ้าร่วมมือกับอัศวินมืด
CH7_Lei_5_003,และเขาก็กำลังนำเหล่าปีศาจ ใช่มั้ย?
CH7_Lei_5_004,เจ้ารูู้จักเขาหรอ?
CH7_Lei_5_005,เราจะไปรู้จักได้ยังไง
CH7_Lei_5_006,เรารู้แค่ว่าเป็นพวกเดียวกับปีศาจ
CH7_Lei_5_007,แล้วเราจะเป็นพันธมิตรกับคนแบบนั้นได้ยังไง? ที่โลกอันตรายอยู่ทุกวันนี้ก็เพราะมนุษย์งั้นหรอ?
CH7_Lei_5_008,หึ เจ้าไม่รู้อะไรเลยสินะ
CH7_Lei_5_009,งั้น...เจ้าก็คงต้องตายก่อนจะได้รู้แล้วหละ
CH7_Lei_5_010,ก่อนที่จะสู้กัน ข้าขอถามอย่างนึง
CH1_TutorialR_1_001,ในฐานะพรรคพวกกันก็ถือว่าฝีมือไม่แย่นะ แต่มีอะไรที่ข้าตะขิดตะขวงใจอยู่นิดหน่อย
CH1_TutorialR_1_002,มีอะไรผิดปกติงั้นหรอ...
CH1_TutorialR_1_003,ดาบของเจ้า มันเก่าเกินไปที่จะเอามาใช้สู้รบแล้ว
CH1_TutorialR_1_004,อ่า...ข้าไม่ทันได้สังเกตเลย
CH1_TutorialR_1_005,จะมีดาบอะไรที่ข้าพอจะใช้ได้ในร้านค้ามั้ยนะ
CH1_TutorialR_1_006,ไม่ต้องไปถึงร้านค้าหรอก เอาของข้าไปใช้สิ
CH1_TutorialR_1_007,ขอบใจนะ แต่ว่าข้าไม่ถนัดใช้ดาบสั้น
CH1_TutorialR_1_008,จึ๊ๆ ถ้าเราเดินทางไปเรื่อยๆเราก็จะได้อาวุธเพิ่มมาเองน่ะแหละ
CH1_TutorialR_1_009,ถึงจะไม่ได้ใช้เอง แต่เก็บไว้ขายก็ได้ทองเล็กๆน้อยๆได้นะ
CH1_TutorialR_1_010,Cleo พูดถูกแล้ว ข้าจะให้ดาบที่เจ้าพอจะใช้ได้ละกัน เอาไปใช้ซะ
CH1_TutorialR_2_001,ให้คาบคู่ข้าเลยหรอ ขอบใจนะ Roi
CH1_TutorialR_2_002,ไม่ใช่ของดีอะไรหรอกแต่ก็พอใช้ได้แหละ
CH1_TutorialR_2_003,ไม่ต้องกังวลหรอกค่ะ เราเอาไปอัพเกรดทีหลังก็ได้
CH1_TutorialR_2_004,ต้องไปโรงตีเหล็กรึเปล่านะ ยังไงก็ต้องกลับไปในเมืองงั้นหรอ
CH1_TutorialR_2_005,ไม่ต้องหรอก Roi เจ้าคนซื่อบื้อ
CH1_TutorialR_2_006,ข้าเคยได้ยินมา
CH1_TutorialR_2_007,พวกนักบวชสามารถใช้อุปกรณ์อื่นเป็นวัตถุดิบในการอัพเกรดอุปกรณ์ได้ใช่มั้ย?
CH1_TutorialR_2_008,ค่ะ ถูกต้องแล้ว
CH1_TutorialR_2_009,ข้าอยากลองทำมาตั้งนานแล้ว! สอนข้าหน่อยสิ!
CH1_TutorialR_2_010,อืม...คือว่า..เวทย์มนต์ที่ใช้มันต่างจากที่ Cleo ใช้มากก็เลย...
CH1_TutorialR_2_011,ถ้างั้นสอนข้าว่าทำยังไงก็พอนะ ได้โปรดดด
CH1_TutorialR_2_012,ถึงจะลองทำเองไม่ได้แต่นักเวทย์อย่างข้าก็ควรรู้ทฤษฎีเอาไว้นะ
CH1_TutorialR_2_013,Lua เป็นเทพธิดาแห่งแสงและผู้ให้กำเนิดทุกสรรพสิ่ง
CH1_TutorialR_2_014,ถึงแม้ว่าความสามารถของพวกเรานักบวชจะไม่สามารถทำได้เหมือน Lua
CH1_TutorialR_2_015,เราสามารถใช้วัสดุที่มีพลังเวทย์เหมือนกันในการหลอมแล้วสร้างเป็นอุปกรณ์ที่แข็งแกร่งขึ้นได้นะ
CH1_TutorialR_2_016,อาวุธที่ใช้ในการต่อสู้ก็มักจะมีพลังเวทย์เหมือนๆกันอยู่ด้วย
CH1_TutorialR_2_017,แต่ข้าเคยได้ยินว่าถ้ากระแสแห่งความหยั่งรู้ไม่นิ่งพอก็มีโอกาสที่จะหลอมไม่สำเร็จได้นะ
CH1_TutorialR_2_018,ไม่ต้องกังวลหรอกค่ะ ถึงข้าจะยังอยู่ในช่วงฝึกหัดแต่ก็ไม่เคยอัพเกรดอาวุธพลาดแม้แต่ครั้งเดียว
CH1_TutorialR_2_019,ข้าคงจะเกิดมาเพื่อเป็นนักบวชจริง
CH1_TutorialR_2_1_001,โห เจ้านี่มันดีกว่าดาบเล่มก่อนเยอะเลย ขอบใจนะ Roi
CH1_TutorialR_2_1_002,ฮ่าฮ่าฮ่า ไม่ต้องขอบคุณข้าหรอก
CH1_TutorialR_2_1_003,มันไม่ใช่ดาบที่ดีที่สุดในโลก ข้าต่างหากที่กังวลว่าคุณภาพของมันจะไม่ถึงขั้นน่ะสิ
CH1_TutorialR_2_1_004,อย่าห่วงเลย ข้าสามารถเสริมพลังให้กับดาบเล่มนี้ได้ตลอดเวลา
CH1_TutorialR_2_1_005,ข้าว่าท้ายสุดคงไม่พ้นโรงตีเหล็กอยู่ดี
CH1_TutorialR_2_1_006,ไม่นะเจ้าทึ่ม!
CH1_TutorialR_2_1_007,ข้าได้ยินมาว่า มีวิธีที่เราสามารถเสริมพลังให้กับอาวุธได้โดยไม่ต้องพึ่งโรงตีเหล็ก
CH1_TutorialR_2_1_008,ถ้าข้าจำไม่ผิด นักบวชนี่สามารถสวดขอพรต่อเทพธิดาและเสริมพลังให้กับอาวุธต่างๆ ได้สินะ
CH1_TutorialR_2_1_009,ใช่แล้วค่ะ
CH1_TutorialR_2_1_010,ข้าสงสัยมานานแล้วว่ามันมีตรรกะหรือหลักการทางเวทมนตร์อะไร ในการเสริมพลังอาวุธด้วยวิธีนี้
CH1_TutorialR_2_1_011,อืม... วิธีการมันออกจะต่างจากพวกมนตราที่นางใช้ตามปกตินะ...
CH1_TutorialR_2_1_012,อย่างน้อยก็บอกทีสิว่าทำยังไง
CH1_TutorialR_2_1_013,ข้าคนนี้ที่ผู้คนทั้งหลายเรียกขานว่า Archmage แต่กลับไม่รู้หลักการอะไรเลยเกี่ยวกับวิธีเสริมพลังอาวุธของพวกนักบวช ช่างน่าอายสิ้นดี
CH1_TutorialR_2_1_014,เทพี Lua คือเทพธิดาแห่งแสงสว่างและผู้ให้กำเนิดทุกสรรพสิ่ง
