KEY,Vietnamese
E_C19_May_Lucias_01,"Ngài Ricardo, ngài cho tìm tôi?"
E_C19_May_Lucias_02,Dường như dạo này cậu thường xuyên rời khỏi vị trí.
E_C19_May_Lucias_03,"Trận chiến vừa qua với lũ ác quỷ đã khiến nhiều dân thường thương vong, cùng với các chiến binh thần thánh."
E_C19_May_Lucias_04,Tôi mải mê với những người cần giúp đỡ nên bị chậm trễ. Cho tôi xin lỗi.
E_C19_May_Lucias_05,Ha ha ha! Cậu không cần phải xin lỗi!
E_C19_May_Lucias_06,Ta biết từ lâu là cậu không thể ngó lơ những ai đang cần được giúp đỡ mà.
E_C19_May_Lucias_07,"Mà thôi, Lucias này, ta mới biết hôm nay là sinh nhật cậu!"
E_C19_May_Lucias_08,"Lẽ ra ta nên chuẩn bị một buổi tiệc mừng từ trước,"
E_C19_May_Lucias_09,"nhưng càng già thì ta càng dễ quên mấy chuyện kiểu ấy, ha ha ha!"
E_C19_May_Lucias_10,Xin lỗi cậu là ta không nhớ ra sớm hơn.
E_C19_May_Lucias_11,"Ta có món quà nhỏ cho cậu, cũng không nhiều nhặn gì."
E_C19_May_Lucias_12,Cảm ơn ngài.
E_C19_May_Lucias_13,...Nhưng sao ngài biết hôm nay là sinh nhật tôi?
E_C19_May_Lucias_14,Hôm nay ta nhận được thư của Nhà ảo thuật Stardust.
E_C19_May_Lucias_15,Cậu ta nhớ được sinh nhật cậu thì hẳn là bạn tốt của cậu rồi. Chàng trai đó có vẻ thú vị đấy.
E_C19_May_Lucias_16,Ha ha... phải... có lẽ vậy.
E_C19_May_Lucias_17,"Tiện đây ta hỏi, cậu đã về nhà lần nào chưa?"
E_C19_May_Lucias_18,"Chưa, thưa ngài, tôi chưa có cơ hội."
E_C19_May_Lucias_19,Cha mẹ nào cũng trông ngóng con cái khi chúng tự bước đi trên đường đời của mình.
E_C19_May_Lucias_20,Họ luôn lo lắng cho sức khỏe và sự an nguy của con cái.
E_C19_May_Lucias_21,Chính điều đó đã khiến họ thao thức đêm hôm.
E_C19_May_Lucias_22,Mà hôm nay lại là một ngày quan trọng với cậu.
E_C19_May_Lucias_23,Sao cậu không nghỉ ngơi và về nhà một chuyến đi?
E_C19_May_Lucias_24,"Lucias, hãy mang thứ này về cho cha mẹ cậu."
E_C19_May_Lucias_25,Cảm ơn ngài đã luôn san sẻ sản lượng thu hoạch.
E_C19_May_Lucias_26,"Ha ha ha, không cần phải cảm ơn ta. Cậu mới là người duy trì sự bình yên cho ngôi làng này."
E_C19_May_Lucias_27,Ta luôn biết ơn Nữ thần vì điều đó.
E_C19_May_Lucias_28,Người đã gửi cho chúng ta một đứa trẻ được ban phước...
E_C19_May_Lucias_29,Ai cũng nói thế làm tôi thấy ngại quá...
E_C19_May_Lucias_30,Thế giới bên ngoài ngôi làng này toàn là nỗi buồn đau.
E_C19_May_Lucias_31,Chúng ta cũng phải chịu cảnh khó nhọc tương tự cho đến khi cậu ra đời.
E_C19_May_Lucias_32,Cậu chính là lý do giúp chúng ta hôm nay có thể nở nụ cười.
E_C19_May_Lucias_33,Tôi cũng thấy nhẹ lòng... khi biết mọi người đều hạnh phúc...
E_C19_May_Lucias_34,(Nếu chỉ bằng một chút sức mạnh hiện có là mình đã có thể giúp mọi người trong làng...)
E_C19_May_Lucias_35,(Liệu mình có thể cứu vớt cả những người ngoài làng không?)
E_C19_May_Lucias_36,(Để tạo ra một thế giới... nơi ai cũng được hạnh phúc... không có khổ đau...)
E_C19_May_Lucias_37,Có những người mà ta không thể cứu vớt trên thế giới này.
E_C19_May_Lucias_38,Đến giờ ta vẫn còn như nghe thấy những tiếng la hét vang lên từ cung điện chìm trong hỗn loạn và kinh hoàng.
E_C19_May_Lucias_39,Tôi thấy vẫn chưa thể về nhà được.
E_C19_May_Lucias_40,(Cho đến khi mình hoàn thành nhiệm vụ...)
E_C19_May_Lucias_41,(Mình phải cứu những người đang chịu đau khổ... và mang yên bình đến cho họ.)
E_C19_May_Lucias_42,Rất tiếc là tôi phải khước từ đề nghị tử tế ấy của ngài.
E_C19_May_Lucias_43,"Ha ha ha, không cần phải thế!"
E_C19_May_Lucias_44,Cậu đã muốn vậy thì ta cũng không ép cậu đâu.
E_C19_May_Lucias_45,Trong lá thư này không viết gì nhiều...
E_C19_May_Lucias_46,Ta chỉ gợi ý thế vì cảm thấy người đó muốn cậu nghỉ ngơi một chút.
E_C19_May_Lucias_47,"Có lẽ giờ chưa phải là lúc thích hợp để làm thế, ha ha."
E_C19_May_Lucias_48,"Oa ha ha, hôm nay ta luyên thuyên thế là đủ rồi. Cậu cứ thong thả làm việc đi nhé."
E_C19_May_Lucias_49,...Tôi sẽ cố gắng hết sức. Cầu mong Nữ thần ban phước lành cho ngài.
E_C19_May_Lucias_50,Phù...
E_C19_May_Lucias_51,Hả? Đây là...?
E_C19_May_Lucias_52,Tôi biết là cậu sẽ có phản ứng như thế mà. Chúc mừng sinh nhật nhé.
E_C19_May_Lucias_53,"Ha ha ha, cảm ơn..."
E_C19_May_Lavril_01,……
E_C19_May_Lavril_02,Oa! Bánh to quá! Tuyệt cú mèo! Sinh nhật vui thật!
E_C19_May_Lavril_03,"Chúc mừng sinh nhật! Quà của cậu đây! Tôi thích cái này lắm, nhưng sẽ tặng nó cho cậu nhân dịp sinh nhật!"
E_C19_May_Lavril_04,Cảm ơn nhé! Vào đây đi! Nhìn này! Mẹ mình đã làm món bánh mình thích đấy!
E_C19_May_Lavril_05,Từ từ đã! Đừng ăn bánh vội! Cậu đã hát mừng chưa? Còn pháo hoa đâu!?
E_C19_May_Lavril_06,Thế thì hát nhanh đi rồi còn ăn bánh!
E_C19_May_Lavril_07,"Chúc mừng sinh nhật của bạn, chúc mừng sinh nhật đáng nhớ!"
E_C19_May_Lavril_08,Sinh nhật à...?
E_C19_May_Lavril_09,A? Chào cô Lavril.
E_C19_May_Lavril_10,Có chuyện gì vậy?
E_C19_May_Lavril_11,"Xin chào... à, tôi có một câu hỏi."
E_C19_May_Lavril_12,"Ờ, vậy... trong làng đang diễn ra lễ hội gì vậy?"
E_C19_May_Lavril_13,Lễ hội à?
E_C19_May_Lavril_14,"Phải, rất nhiều người đang bàn tán về... sinh nhật."
E_C19_May_Lavril_15,Ai cũng tỏ ra rất hạnh phúc...
E_C19_May_Lavril_16,"Có bánh, có quà... và mọi người còn hát mừng nữa..."
E_C19_May_Lavril_17,"Nhưng nếu cô cũng không biết thì... Ophelia, không phải là lễ hội gì hả?"
E_C19_May_Lavril_18,"A, cô đang nói đến tiệc sinh nhật à...?"
E_C19_May_Lavril_19,Tiệc? Sinh nhật...?
E_C19_May_Lavril_20,"Đúng rồi! Khi đến dịp sinh nhật, gia đình và bạn bè sẽ tụ họp để ăn mừng."
E_C19_May_Lavril_21,"Cô sẽ nhận quà của mọi người, ước một điều và thổi nến trên bánh..."
E_C19_May_Lavril_22,A! Và cô còn được ăn đủ thứ đồ ăn ưa thích nữa.
E_C19_May_Lavril_23,"Ra thế... Ophelia, cô cũng có sinh nhật chứ?"
E_C19_May_Lavril_24,"He, sinh nhật tôi là vào mùa hè. Không còn lâu lắm đâu."
E_C19_May_Lavril_25,Chúng tôi... không có sinh nhật. Vì chúng tôi là... chính mình....
E_C19_May_Lavril_26,Chúng tôi... cũng muốn làm tiệc...
E_C19_May_Lavril_27,Trông vui quá... được ăn mừng với bạn bè...
E_C19_May_Lavril_28,"Ưm... à, sinh nhật không nhất thiết phải đúng vào ngày cô ra đời đâu."
E_C19_May_Lavril_29,T-Thật sao?
E_C19_May_Lavril_30,Ai không biết sinh nhật mình thì chọn một ngày khác...
E_C19_May_Lavril_31,hoặc một ngày đặc biệt nào đó để tổ chức mừng sinh nhật.
E_C19_May_Lavril_32,"Vậy sao ta không chọn hôm nay là sinh nhật cô chứ, Lavril?"
E_C19_May_Lavril_33,Hôm nay...?
E_C19_May_Lavril_34,Phải. Vì hôm nay là ngày cô được biết về sinh nhật mà! Cô nghĩ sao?
E_C19_May_Lavril_35,Đ-được...!
E_C19_May_Lavril_36,Vậy thì chuẩn bị tiệc thôi nào! Cô có muốn mời bạn nào đến không?
E_C19_May_Lavril_37,"Bạn à... Ophelia, Rephy, Shea... và... ta có thể mời cả Lucias không...?"
E_C19_May_Lavril_38,"Anh ấy sẽ đến mừng cô, tôi chắc chắn đấy."
E_C19_May_Lavril_39,"Đúng là anh ấy rất bận, nhưng ghé qua một lát thì chắc là được thôi."
E_C19_May_Lavril_40,"...He he, tốt quá rồi..."
E_C19_May_Lavril_41,"OK, vậy ta cùng viết thiếp mời đi!"
E_C19_May_Lavril_42,...Phải rồi!
E_C19_May_Kara01_01,Kara! Chào buổi sáng!
E_C19_May_Kara01_02,Đêm qua chủ nhân ngủ ngon chứ?
E_C19_May_Kara01_03,Chuyện vừa xảy ra cứ như mặt trời mọc đằng Tây ấy.
E_C19_May_Kara01_04,Đây là lần đầu tiên chủ nhân thức dậy mà không cần tôi gọi.
E_C19_May_Kara01_05,Ha ha ha! Vì hôm nay là sinh nhật của Kara mà! Ngày quan trọng thế này thì ta phải dậy sớm chứ!
E_C19_May_Kara01_06,Cô nghĩ sao? Có ngạc nhiên không? Hả?
E_C19_May_Kara01_07,"Đêm qua, khi tôi bắt mạch của cô, thì cô đã ngủ từ lúc hoàng hôn."
E_C19_May_Kara01_08,Dù xác suất khá thấp nhưng tôi có thể dự đoán được việc đó.
E_C19_May_Kara01_09,"...Hừm, nghe chừng không thuyết phục lắm."
E_C19_May_Kara01_10,Đợi đã! Cô lúc nào cũng bắt mạch cho tôi à?
E_C19_May_Kara01_11,Đó là vì sự an toàn của chủ nhân thôi.
E_C19_May_Kara01_12,"...Xì, ta chẳng còn được riêng tư gì nữa rồi... ha ha."
E_C19_May_Kara01_13,*Lầm bầm* Lần này không được thì lần sau chắc chắn sẽ được!
E_C19_May_Kara01_14,"Đi nào, Kara! Chúng ta cần đi đâu đó."
E_C19_May_Kara01_15,"Chủ nhân, giờ là lúc làm việc."
E_C19_May_Kara01_16,Cần gì phải làm việc vào một ngày thế này! Ta còn nhiều ngày nghỉ phép lắm! Đi thôi!
E_C19_May_Kara01_17,"Vâng, thưa chủ nhân."
E_C19_May_Kara01_18,Đến lúc rồi. Chúng... tới đấy!
E_C19_May_Kara01_19,Bắt đầu chuẩn bị chiến đấu.
E_C19_May_Kara01_20,Meooo!
E_C19_May_Kara01_21,Nya? Meo!
E_C19_May_Kara01_22,Meo! Gừ... gừ...
E_C19_May_Kara01_23,"Số 1, 2, 3! Xông tới chỗ Kara!"
E_C19_May_Kara01_24,Ta-da! Cô thấy Quân đoàn mèo của tôi thế nào!?
E_C19_May_Kara01_25,Có thấy tim rộn lên không? À... ý tôi là động cơ ấy? Ngạc nhiên chứ?
E_C19_May_Kara01_26,Tôi đã sớm nhận ra sự bất thường trong kiểu hình hoạt động của cô dù cô chẳng mấy khi tập tành.
E_C19_May_Kara01_27,Tôi phát hiện ra cô chăm lũ mèo từ lúc tôi đi theo cô năm tháng trước.
E_C19_May_Kara01_28,"Độ thân hữu của số 1, 2 và 3 với ta đã đến mức tối đa rồi."
E_C19_May_Kara01_29,"...Cô đi theo ta sao, Kara? Thật à?"
E_C19_May_Kara01_30,He! Nhưng chắc chắn là sự vụ cuối cùng này sẽ thành công!
E_C19_May_Kara01_31,Nào! Màn cuối cho dịp sinh nhật của cô!
E_C19_May_Kara01_32,"Vâng, thưa chủ nhân."
E_C19_May_Kara01_33,"Chủ nhân, chúng ta đang ở đâu vậy? Những tọa độ này không xuất hiện trong dữ liệu bản đồ của tôi."
E_C19_May_Kara01_34,A ha ha ha! Ta đã giữ bí mật về nơi này đến tận hôm nay đấy!
E_C19_May_Kara01_35,"Đợi một chút và... Oa! Kia rồi! Kara, nhìn kìa!"
E_C19_May_Kara01_36,Tôi không ngờ đến chuyện này. Hôm nay mặt trăng trông thật là lớn.
E_C19_May_Kara01_37,"Nhưng mặt trăng không thực sự to ra, đây chỉ là ảo ảnh thôi..."
E_C19_May_Kara01_38,"Thôi nào, Kara. Mấy khi được ngắm trăng đẹp như thế này đâu."
E_C19_May_Kara01_39,"Vâng, thưa chủ nhân."
E_C19_May_Kara01_40,Cô cảm thấy thế nào?
E_C19_May_Kara01_41,Động cơ quay nhanh dần. Các mạch thần kinh luân chuyển nhanh chóng.
E_C19_May_Kara01_42,Tôi cảm thấy như có một dòng điện chạy đến tận đầu ngón tay ngón chân.
E_C19_May_Kara01_43,Đây là cảm giác ngạc nhiên mà cô hay nhắc đến à?
E_C19_May_Kara01_44,"Xem ra cô không quá ngạc nhiên, nhưng ít nhất thì cũng đã biết được một cảm xúc mới. He."
E_C19_May_Kara01_45,"Đây! Món quà cuối cùng của tôi dành cho cô! Chúc mừng sinh nhật, Kara!"
E_C19_May_Kara01_46,Cảm ơn chủ nhân.
E_C19_May_Kara01_47,Nhưng cô lấy tiền đâu ra mua chỗ pháo hoa này?
E_C19_May_Kara01_48,Hử? Dĩ nhiên là bằng tiền lương tháng này rồi...
E_C19_May_Kara01_49,"Đã hiểu, thưa chủ nhân. Tôi sẽ trừ khoản phí mua pháo hoa vào ngân quỹ chi tiêu cá nhân của cô tháng này."
E_C19_May_Kara01_50,"Oa! Cô ác quá, Kara!"
E_C19_May_Miruru_01,Khai hỏa chào mừng!
E_C19_May_Miruru_02,Chúc mừng sinh nhật Hải tặc vĩ đại Miruru!
E_C19_May_Miruru_03,"Thuyền trưởng, chúc ngài sinh nhật vui vẻ!"
E_C19_May_Miruru_04,"Ừ, được rồi! Tiếp tục thôi nào!"
E_C19_May_Miruru_05,Hả? Ngài nói gì vậy?
E_C19_May_Miruru_06,Rõ thế rồi còn gì? Đến dịp sinh nhật thì các ngươi phải chuẩn bị món đó chứ!
E_C19_May_Miruru_07,"Đúng thế, tôi ngu quá! Đây là thứ phải có trong dịp sinh nhật! Xin mời Thuyền trưởng!"
E_C19_May_Miruru_08,.........
E_C19_May_Miruru_09,Không phải cái này!
E_C19_May_Miruru_10,Hử? Tôi tưởng sinh nhật thì phải có bánh là đúng rồi chứ.
E_C19_May_Miruru_11,Ha ha ha! Ngươi đúng là ngố!
E_C19_May_Miruru_12,"A, có bánh thì tốt."
E_C19_May_Miruru_13,Nhưng đến sinh nhật thì ngươi phải được nhận quà!
E_C19_May_Miruru_14,Phải rồi!
E_C19_May_Miruru_15,"Nào, mang chúng ra đi."
E_C19_May_Miruru_16,Của ngài đây!
E_C19_May_Miruru_17,...Cái gì đây?
E_C19_May_Miruru_18,Không phải báu vật à?
E_C19_May_Miruru_19,"Thuyền trưởng, đây là thứ thuốc súng đặc biệt tôi kiếm được từ người bạn Lakrak của ngài!"
E_C19_May_Miruru_20,Tôi còn có một thông điệp cho ngài nữa!
E_C19_May_Miruru_21,Sinh nhật à? Ta còn bận nghiên cứu! Nhưng ít nhất thì ta cũng chúc cô ta một dịp sinh nhật vui vẻ!
E_C19_May_Miruru_22,"A, ta cũng đưa thứ này vì đây là một dịp đặc biệt!"
E_C19_May_Miruru_23,"Hừm... hừm! Vì đây là loại thuốc súng đặc biệt nên ta sẽ nhận, dù nó không phải là báu vật!"
E_C19_May_Miruru_24,"Bởi ta là một hải tặc danh giá, biết tôn trọng bạn bè!"
E_C19_May_Miruru_25,"Được rồi, vậy sao ta không khai hỏa một phát"
E_C19_May_Miruru_26,để chúc mừng sinh nhật của Hải tặc vĩ đại Miruru nhỉ?
E_C19_May_Miruru_27,Hừm...
E_C19_May_Miruru_28,Cái gì?
E_C19_May_Miruru_29,Hình như tôi quên điều gì đó.
E_C19_May_Miruru_30,Một điều rất quan trọng...
E_C19_May_Miruru_31,A!
E_C19_May_Miruru_32,Lakrak bảo tôi...
E_C19_May_Miruru_33,Ta chưa thử nghiệm món thuốc súng đó đâu.
E_C19_May_Miruru_34,"Nhớ cẩn thận khi ngươi sử dụng,"
E_C19_May_Miruru_35,rồi báo lại kết quả cho ta.
E_C19_May_Miruru_36,......
E_C19_May_Miruru_37,......
E_C19_May_Miruru_38,Ta có nên chạy ra xa trước không?
E_C19_May_Miruru_39,Nghe hợp lý đấy.
E_C19_May_Lakrak_1,Ừm...
E_C19_May_Lakrak_1_1,Có vẻ bấc đèn đã đủ dài.
E_C19_May_Lakrak_2,"Chuyện lấy công thức hơi rầy rà một chút, nhưng rồi cũng ổn."
E_C19_May_Lakrak_3,Giờ chỉ cần cậu ấy đến nữa thôi...
E_C19_May_Lakrak_4,Cậu là người gọi tôi ra đây muộn thế này à?
E_C19_May_Lakrak_5,Tôi thức trắng ba ngày nghiên cứu vũ khí rồi đấy!
E_C19_May_Lakrak_6,Tôi buồn ngủ lắm! Nên nếu không phải chuyện gì quan trọng thì đừng trách tôi nổi nóng!
E_C19_May_Lakrak_7,"Ha, lại nữa rồi..."
E_C19_May_Lakrak_8,"Này, Lakrak. Cậu quên hôm nay là ngày gì hả?"
E_C19_May_Lakrak_9,"Hôm nay à? Chịu, tôi chỉ biết là đã không ngủ ba ngày rồi."
E_C19_May_Lakrak_10,Mà cậu là ai? Trả lời tôi trước đã!
E_C19_May_Lakrak_11,Cậu vẫn có cái kiểu phá hoại không khí vui vẻ như thế.
E_C19_May_Lakrak_12,"Nhìn đây, giờ cậu nhớ ra khuôn mặt tôi rồi chứ?"
E_C19_May_Lakrak_13,Thứ vũ khí cậu đang cầm kia. Vậy cậu là...
E_C19_May_Lakrak_14,Quên người đã giúp cậu hoàn thành cái đó rồi hả?
E_C19_May_Lakrak_15,Cứ nhớ lại những lúc cậu bắt tôi chạy hết chỗ nọ đến chỗ kia để kiếm thứ thuốc súng đặc biệt ngớ ngẩn ấy...
E_C19_May_Lakrak_16,"Thuốc súng đặc biệt... A, tôi nhớ rồi! Đã lâu không gặp, Roi!"
E_C19_May_Lakrak_17,Thế mà tôi coi cậu ta là bạn cơ đấy...
E_C19_May_Lakrak_18,Cậu thực sự không nhớ hôm nay là ngày gì với cậu hả?
E_C19_May_Lakrak_19,Ít ra thì sinh nhật mình cũng phải nhớ chứ.
E_C19_May_Lakrak_20,Á! Nay là sinh nhật tôi à?
E_C19_May_Lakrak_21,Mà cái đó quan trọng gì đâu!
E_C19_May_Lakrak_22,Tôi cần tập trung chế tạo vũ khí mạnh hơn!
E_C19_May_Lakrak_23,Tôi chả thấy ngạc nhiên tẹo nào nữa.
E_C19_May_Lakrak_24,Dẫu sao thì tôi đã chuẩn bị một thứ đặc biệt cho cậu đây.
E_C19_May_Lakrak_25,"Ồ, cây gậy đẹp quá!"
E_C19_May_Lakrak_26,Chẳng trách Cleo luôn sử dụng những món đồ thượng hạng.
E_C19_May_Lakrak_27,G-Gì thế này?
E_C19_May_Lakrak_28,"Cậu thấy đấy, chúng là pháo hoa. Tôi đã chuẩn bị mấy quả thật bự cho sinh nhật cậu."
E_C19_May_Lakrak_29,Cậu nghĩ sao? Chúng khá quá chứ hả?
E_C19_May_Lakrak_30,T-thế... này...!
E_C19_May_Lakrak_31,"Ha ha, khóc rồi cơ à? Đợi đến lúc cậu thấy món quà của tôi đi..."
E_C19_May_Lakrak_32,Cậu làm cái quái gì thế hả!?
E_C19_May_Lakrak_33,Sao cậu dám dùng món thuốc súng quý giá ấy cho một thứ vô dụng như này chứ!?
E_C19_May_Lakrak_34,Cậu có đúng là người không thế!?
E_C19_May_Lakrak_35,C-Cái gì?
E_C19_May_Lakrak_36,Thuốc súng là thứ chất tôn quý nhất từng có!
E_C19_May_Lakrak_37,Thật là báng bổ! Cậu không phải là anh em của tôi nữa!
E_C19_May_Lakrak_38,......
E_C19_May_Lakrak_39,Cậu... nói thật đấy à?
E_C19_May_Lakrak_40,Vô dụng? Cậu có biết tôi phải trải qua những gì để chuẩn bị thứ này không hả?
E_C19_May_Lakrak_41,Chả nghĩa lý gì! Điều quan trọng là cậu đã lãng phí chỗ thuốc súng đó!
E_C19_May_Lakrak_42,Tôi sẽ không bao giờ tha thứ cho cậu! Thuốc súng là thứ quý giá!
E_C19_May_Lakrak_43,Ô hô... vậy sao?
E_C19_May_Lakrak_44,Thực ra tôi đã chuẩn bị một món quà tuyệt vời cho dịp sinh nhật cậu...
E_C19_May_Lakrak_45,Nó gọi là gì ấy nhỉ?
E_C19_May_Lakrak_46,Hình như là phát minh mới Thuốc súng đặc biệt siêu khủng à?
E_C19_May_Lakrak_47,Nó được coi là thứ tốt nhất trong Đế quốc. Khó lắm tôi mới kiếm được nó qua chợ đen đấy...
E_C19_May_Lakrak_48,"Chà, nhưng chắc chẳng có ích gì vì cậu không cần nó."
E_C19_May_Lakrak_49,Chà chà... tôi vứt bỏ thứ này đi kiểu gì đây?
E_C19_May_Lakrak_50,Nếu bán đi thì tôi sẽ kiếm được bộn tiền đây. Có lẽ sẽ không cần phải lo lắng chuyện tiền bạc được khá lâu đấy.
E_C19_May_Lakrak_51,Hoặc tôi có thể gói chúng lại và tặng cho Cleo nhân dịp sinh nhật.
E_C19_May_Lakrak_52,"Ha ha, chỉ nói thế thôi là tôi đã nhìn thấy nụ cười rạng rỡ trên mặt cô ấy rồi."
E_C19_May_Lakrak_53,Đứng yên đó! Chúng ta cần nói chuyện!
E_C19_May_Lakrak_54,Hử? Cậu thì có chuyện gì với một tên báng bổ như tôi chứ?
E_C19_May_Lakrak_55,Ầy...!
E_C19_May_Lakrak_56,Cậu không có gì để nói thì tránh ra đi. Tôi còn phải nghĩ xem nên xử lý mớ này thế nào...
E_C19_May_Lakrak_57,T-tôi...
E_C19_May_Lakrak_58,Tôi xin lỗi! Tôi đã quá lời!
E_C19_May_Lakrak_59,Tôi muốn nhận món quà của cậu! Món Thuốc súng đặc biệt siêu khủng đó! Tôi muốn có nó!
E_C19_May_Lakrak_60,*Thở dài...* Chơi với cậu mệt quá đấy.
E_C19_May_Lakrak_61,Oa! Oaaa! Oaaaaaa!
E_C19_May_Lakrak_62,"Này, Lakrak. Tôi biết là cậu vui, nhưng cũng vừa vừa thôi chứ."
E_C19_May_Lakrak_63,Cậu nói gì thế!? Món thuốc súng này còn hơn cả báu vật đấy!
E_C19_May_Lakrak_64,Tôi muốn nghiên cứu nó càng sớm càng tốt! Tôi sẽ chế tạo vũ khí hủy diệt tối thượng!
E_C19_May_Lakrak_65,*Thở dài...* Đồ thô lỗ.
E_C19_May_Lakrak_66,"Mà thôi, tôi đi đây. Đừng gắng sức quá nhé."
E_C19_May_Lakrak_67,Được rồi! Cậu bảo trọng đấy!
E_C19_May_Lakrak_68,Oa ha ha! Roi là người duy nhất quan tâm đến mình! Cậu ấy là tuyệt nhất!
E_C19_May_Lakrak_69,Oái... nhưng mình không nhớ nổi mặt cậu ấy. Sao có thể...! Mình phải nhớ chứ!
E_C19_May_Lakrak_70,......
E_C19_May_Lakrak_71,Mình hoàn toàn không nhớ gì cả.
E_C19_May_Lakrak_72,"Thôi kệ, cứ mở quà đi đã."
E_C19_May_Glenwys01_01,...Ưm...
E_C19_May_Glenwys01_02,Ha ha.
E_C19_May_Glenwys01_03,...Đội bảo vệ Hoàng gia làm quái gì ở một chốn như thế này hả...?
E_C19_May_Glenwys01_04,"Ta đến đây để gặp cô, dĩ nhiên rồi."
E_C19_May_Glenwys01_05,"Ngài Fluss, tôi tưởng ngài bận rộn lắm mà?"
E_C19_May_Glenwys01_06,Ngài không nên phí thời gian vì một hiệp sĩ tầm thường như tôi...
E_C19_May_Glenwys01_07,"Ha ha, nhưng vị hiệp sĩ tầm thường ấy lại có vẻ rất cao quý và tài năng."
E_C19_May_Glenwys01_08,Sao tôi có thể phớt lờ một người như thế được.
E_C19_May_Glenwys01_09,Thậm chí còn thắng giải đầu ba lần liên tiếp nữa chứ.
E_C19_May_Glenwys01_10,Ngài là đối thủ cuối cùng của tôi.
E_C19_May_Glenwys01_11,Nếu chúng ta chiến đấu hết sức thì tôi thua chắc.
E_C19_May_Glenwys01_12,Vậy thì làm gì có ba chiến thắng liên tiếp...
E_C19_May_Glenwys01_13,"Ha ha, ta không hiểu cô đang nói gì cả."
E_C19_May_Glenwys01_14,Người đàn ông cầm song kiếm chiến đấu kịch liệt với cô ấy hả?
E_C19_May_Glenwys01_15,"Ta thực sự muốn tự thân đấu với anh ta, nhưng không thể nào lần ra xuất xứ của hắn."
E_C19_May_Glenwys01_16,…
E_C19_May_Glenwys01_17,"Hơn nữa, hôm nay ta đến đây để giới thiệu với cô một người bạn mới."
E_C19_May_Glenwys01_18,"Hân hạnh được gặp mặt, tôi là Chrisha, Thống lĩnh của Hiệp sĩ phép thuật Velchia."
E_C19_May_Glenwys01_19,Hiện tôi đang đảm nhiệm vị trí phán quan của Hoàng đế.
E_C19_May_Glenwys01_20,"A, Thống lĩnh Chrisha!?"
E_C19_May_Glenwys01_21,Ngọn gió nào đưa cô tới đây...?
E_C19_May_Glenwys01_22,"(Hừm, mình cứ thắc mắc là ngài Fluss thấy hứng thú với ai..."
E_C19_May_Glenwys01_23,"Chắc là cô ấy rồi, Khiên đế quốc lừng danh...)"
E_C19_May_Glenwys01_24,…???
E_C19_May_Glenwys01_25,"A, xin thứ lỗi."
E_C19_May_Glenwys01_26,Hôm nay tôi đến đây với một mục đích rất đơn giản.
E_C19_May_Glenwys01_27,"Chúc mừng sinh nhật, Glenwys."
E_C19_May_Glenwys01_28,Đây là món quà mà ngài Fluss và tôi đã chuẩn bị. Xin hãy nhận lấy.
E_C19_May_Glenwys01_29,...A! Tôi... cảm ơn.
E_C19_May_Glenwys01_30,Nhưng sao hai vị biết hôm nay là sinh nhật tôi...?
E_C19_May_Glenwys01_31,Dĩ nhiên là qua thư tín bình thường... a hem! Không phải vậy.
E_C19_May_Glenwys01_32,Là Thống lĩnh của Hiệp sĩ bảo vệ kinh thành nói cho ta biết.
E_C19_May_Glenwys01_33,Ta còn nghe nói năm ngoái cô đón sinh nhật chỉ có một mình.
E_C19_May_Glenwys01_34,A...
E_C19_May_Glenwys01_35,"...Cảm ơn ngài, ngài thật là tử tế."
E_C19_May_Glenwys01_36,Nhưng thế này... là quá nhiều.
E_C19_May_Glenwys01_37,Không có lý do gì để ngài quan tâm tới tôi đến vậy...
E_C19_May_Glenwys01_38,"Ha ha, cứ cho là bọn ta đang đầu tư cho một nhân tài kiệt xuất trong tương lai đi."
E_C19_May_Glenwys01_39,Nếu cô cảm thấy ngại quá thì sao không mời bọn ta ăn trưa nhỉ?
E_C19_May_Glenwys01_40,Ta thấy hơi đói rồi đấy.
E_C19_May_Glenwys01_41,"Chà, ý kiến hay đấy."
E_C19_May_Glenwys01_42,"Nhưng có những món tôi không biết tí gì, nên chuyện gọi đồ ăn xin giao cả cho cô nhé."
E_C19_May_Glenwys01_43,...Ha ha ha ha.
E_C19_May_Glenwys01_44,Thế nào?
E_C19_May_Glenwys01_45,"Ôi, được các vị đánh giá cao nên tôi vui quá."
E_C19_May_Glenwys01_46,Đây chỉ là mấy món bình thường thôi... nhưng tôi hi vọng hai vị sẽ thấy ngon miệng.
E_C19_May_Glenwys01_47,…
E_C19_May_Lorraine01_01,"Đại triết gia của khu rừng, chúng tôi xin được chúc mừng sinh nhật ngài!"
E_C19_May_Lorraine01_02,Cầu chúc Tiên rừng Lorraine được yên bình và được ban phước!
E_C19_May_Lorraine01_03,"Năm nào cũng nhận được những lời tán dương tốt lành thế này, tôi thấy thật vinh hạnh."
E_C19_May_Lorraine01_04,"Có gì đâu mà. Lorraine, cô đúng là Đại triết gia kiêu hãnh của tộc Tiên đấy."
