KEY,ChineseSimplified
E_S2_Main_15_59,偷走的入场券快还给我们！！
E_S2_Main_16_1,哈哈哈哈！对嘛，就是这个！！
E_S2_Main_16_2,难得如此兴奋！！这…这明明是…！！
E_S2_Main_16_3,呃…吵死了！吵得我无法集中！
E_S2_Main_16_4,这次你也阻止不了我，伯伦海姆！
E_S2_Main_16_5,我可以感觉得到…！我感觉到了！
E_S2_Main_16_6,这肯定是！！
E_S2_Main_16_7,是命运！！
E_S2_Main_16_8,命运！？
E_S2_Main_16_9,修特先生终于也有恋人了…！
E_S2_Main_16_10,啊啊啊…！这个不是重点！
E_S2_Main_16_11,你说得没错，精灵！
E_S2_Main_16_12,跟这种家伙才不需要什么命运！！上吧，希娅！
E_S2_Main_17_1,总觉得…这场战斗比平时更费力…
E_S2_Main_17_2,呼…呼…我也是…
E_S2_Main_17_3,呼…呼…比精怪们乱窜的时候还要累…
E_S2_Main_17_4,对…有种…精神上受到攻击的感觉…？
E_S2_Main_17_5,修特先生，今天的音乐特别激昂…
E_S2_Main_17_6,因为收到告白所以害羞了吗～～？
E_S2_Main_17_7,不是！！
E_S2_Main_17_8,该死…只是想赚下零花钱而已，怎么会变成这样？
E_S2_Main_17_9,但是这么轻易就放弃的话可不是我！
E_S2_Main_17_10,大哥们！你们再考虑下我的提议吧！低于原价卖给你们！怎么样？
E_S2_Main_17_11,真的是最后的机会…
E_S2_Main_17_12,咳！
E_S2_Main_17_13,就说怎么没看见你人影…
E_S2_Main_17_14,原来是忙于做这种事情？巴．杜．因．兄．弟？
E_S2_Main_17_15,鲁西亚司！！
E_S2_Main_17_16,竟敢卖黄牛票，有没有搞错？从听到黄牛党的衣着相貌的时候就觉得不对劲…
E_S2_Main_17_17,兄弟，你好像需要露亚大人的教诲。
E_S2_Main_17_18,这是我替露亚大人转达给你的教诲。
E_S2_Main_17_19,等、等一下！你不是说要管理形象吗！
E_S2_Main_17_20,在损坏露亚教团的名字和荣誉的人面前…
E_S2_Main_17_21,还要管理什么形象呢？对这种人只有惩罚！！
E_S2_Main_17_22,咳！！
E_S2_Main_17_23,真对不起，没想到我的兄弟会做出这么失礼的事…
E_S2_Main_17_24,金钱方面得怎么补偿你呢？请尽管开口。
E_S2_Main_17_25,不，不用！我们只要找回入场券就好！
E_S2_Main_17_26,嘿嘿，您是鲁西亚司大人吧？是我，欧菲莉亚！
E_S2_Main_17_27,我记得您常来看表演呢～
E_S2_Main_17_28,啊啊，你这样一说就想起来了，刚刚太激动了一时没认出来。
E_S2_Main_17_29,嗯，嗯…还让你看见难堪的一面…
E_S2_Main_17_30,嘿嘿，但是幸好抓到黄牛党，事情顺利解决了！
E_S2_Main_17_31,现在就可以高高兴兴地去看表演…
E_S2_Main_17_32,朵莎尔妲！！
E_S2_Main_17_33,啊啊！瑟琳姐姐！！
E_S2_Main_17_34,你…！你知道我等你多久了吗？是不是又忘记和我的约定？
E_S2_Main_17_35,（啊，哎哟…！！说好和姐姐一起去海边玩的…！）
E_S2_Main_17_36,对…对、对不起，姐姐…！！
E_S2_Main_17_37,生气的姐姐好可怕！！我错了！！
E_S2_Main_17_38,啊啊！给我站住，朵莎尔妲～！
E_S2_Main_17_39,呵呵，虽然状况有点混乱…但事情也算整理得差不多了吧？
E_S2_Main_17_40,好像是～～呵呵。
E_S2_Main_17_41,啊，对了！
E_S2_Main_17_42,来，请收下这个！
E_S2_Main_17_43,这是…星尘入场券？
E_S2_Main_17_44,这个给我们真的可以吗？
E_S2_Main_17_45,嗯！让你们无端卷入这件事，我觉得很抱歉。
E_S2_Main_17_46,所以送这个聊表歉意，也当作我们成为朋友的纪念！嘿嘿。
E_S2_Main_17_47,那么一定要来看唷！
E_S2_Main_17_48,啊啊…谢谢，托你的福，露儿应该会很开心的。
E_S2_Main_17_49,…我也谢谢你。
E_S2_Main_17_50,所以说，这果真是命运！我的灵魂是这样说的！
E_S2_Main_17_51,你叫什么名字来着！？拥有优美旋律的乐器啊！
E_S2_Main_17_52,我没必要…
E_S2_Main_17_53,回答你！！
E_S2_Main_18_1,…三、四、五…！用这个把遗失的入场券都找回来了！
E_S2_Main_18_2,但这些入场券，真的很奇怪，总是随意乱动，到处乱飞…就像我的卡一样。
E_S2_Main_18_3,以前从来没发生过这种事，为什么会这样呢？
E_S2_Main_18_4,天呐？一闪一闪的…
E_S2_Main_18_5,这、这是…！！
E_S2_Main_18_6,这里是…
E_S2_Main_18_7,星尘的表演场地？我们怎么会来到这里呢？
E_S2_Main_18_8,这声音是…欧菲莉亚吗？
E_S2_Main_18_9,…哦？…咦咦咦！？
E_S2_Main_18_10,哥哥！！
E_S2_Main_18_11,哈哈，没想到我们会在这里见面。
E_S2_Main_18_12,我也是！嘿嘿，好神奇！
E_S2_Main_18_13,啊，这位是希娅！
E_S2_Main_18_14,你好～见到你很高兴。
E_S2_Main_18_15,啊哈，交了很可爱的朋友嘛。
E_S2_Main_18_16,好不容易才遇见，我也想和你悠哉地聊聊天…
E_S2_Main_18_17,但正如你所见，我现在被困在这种空间里。
E_S2_Main_18_18,那么哥哥你是一直被困在这里吗？
E_S2_Main_18_19,算是吧，感觉时间没过多久。
E_S2_Main_18_20,可能是因为我的骰子。
E_S2_Main_18_21,啊？难道这入场券也是…？
E_S2_Main_18_22,入场券？
E_S2_Main_18_23,原来如此，和骰子的力量连接在一起。
E_S2_Main_18_24,我嘛，因为是这骰子的主人，变成这样子也就算了，
E_S2_Main_18_25,你们好像是因为携带入场券所以被邀请了。
E_S2_Main_18_26,那么，这所有事情的原因是…
E_S2_Main_18_27,女士们、先生们，衷心欢迎你们的到来。
E_S2_Main_18_28,为了报答你们对我的热爱和支持，
E_S2_Main_18_29,这次准备了更加特别的表演。
E_S2_Main_18_30,我，赫西波利亚，今天也会尽最大的努力。
E_S2_Main_18_31,赫西波利亚？不过他的模样怎么会是哥哥的样子……！？
E_S2_Main_18_32,嗯…大概是因为目前骰子的主人是我的关系吧。
E_S2_Main_18_33,不过对我来说，自己的样子被人夺走是还挺让人不开心的。
E_S2_Main_18_34,看来要离开这空间的话得打倒他才行了，
E_S2_Main_18_35,难得来发挥一下实力好了。欧菲莉亚，你可以吗？
E_S2_Main_18_36,当然啊！我要找回哥哥你的样貌！
E_S2_Main_18_37,哇～看来是最后一场表演了，我会加油的～
E_S2_Main_19_1,啊啊…这美丽的光芒…如此灿烂夺目…
E_S2_Main_19_2,真的称得上是最棒的表演了，我也很满足。
E_S2_Main_19_3,今天不需要再表演了…谢谢…大家都，来看我的表演…
E_S2_Main_19_4,哇～表演结束了！修特先生也辛苦了～
E_S2_Main_19_5,呼，没想到会这么棘手。
E_S2_Main_19_5_1,虽然击退他了，但也不能大意。
E_S2_Main_19_5_2,他很可能又会在入场券上耍什么花样。
E_S2_Main_19_5_3,嘿嘿，应该不会像这次一样闹得这么大吧？
E_S2_Main_19_5_4,赫西波利亚先生似乎也对此感到满足了！
E_S2_Main_19_5_5,没错，修特先生也说不用担心呢。
E_S2_Main_19_5_6,但他说为了以防万一，最好还是把假的入场券都确实回收比较好。
E_S2_Main_19_5_7,虽然我不清楚你在跟谁说话，但是我也赞同，小心点也没什么坏处。
E_S2_Main_19_6,嗯！如果能再看到哥哥大显身手，我当然赞成！
E_S2_Main_19_7,哇，那这次表演您会跟我们一起是吗？大家肯定会很开心的！
E_S2_Main_19_8,嗯…我还有事要做，现在可能不行。
E_S2_Main_19_9,总之，看你过得还不错，我就放心了。
E_S2_Main_19_10,哼，每次都只会对我恶作剧还敢说？
E_S2_Main_19_11,哎呀，哈哈。真是说不过你。
E_S2_Main_19_11_1,要是能多跟你聊聊就好了…
E_S2_Main_19_12,但我得走了。
E_S2_Main_19_12_1,下次再一起行动吧，欧菲莉亚。
E_S2_Main_19_13,啊，哥哥，等等我！
E_S2_Main_19_14,…走掉了…
E_S2_Main_19_15,好不容易才见到一面…
E_S2_Main_19_15_1,不过幸好看起来还是很健康，嘿嘿。
E_S2_Main_19_16,希娅，真的很感谢你！
E_S2_Main_19_16_1,多亏了你才能找回所有入场券。
E_S2_Main_19_17,对我来说可是个有趣的经验呢，呵呵。
E_S2_Main_19_18,明天就是表演的日子了，大家应该都做好享受表演的准备了吧？
E_S2_Main_19_19,当然！希望我们邀请的人都能来看！
E_S2_Main_19_20,你说表演结束你觉得很可惜吗？
E_S2_Main_19_21,请千万不要担心或难过，
E_S2_Main_19_22,只要各位想要观赏表演，
E_S2_Main_19_23,就算再怎么累，再怎么想结束，
E_S2_Main_19_24,我这小丑也会在此为各位献上表演的。
E_H2_Main_1_1_1,别、别走啊。
E_H2_Main_1_1_2,大家都去哪儿呢？
E_H2_Main_1_1_3,呜呜…为什么要离开我们？
E_H2_Main_1_1_4,我害怕…
E_H2_Main_1_1_5,别离开我们…
E_H2_Main_1_1_6,我害怕…回来啊…
E_H2_Main_1_1_7,天啊，是没见过的黑暗的孩子。
E_H2_Main_1_1_8,这么小竟然在这边徘徊，还真危险。
E_H2_Main_1_1_9,小朋友，在这儿做什么呢？
E_H2_Main_1_1_10,哇，原来万圣节在奥勒贝尔也是规模挺大的活动呢。
E_H2_Main_1_1_11,大家都装扮成幽灵呢。
E_H2_Main_1_1_12,欢迎光临～欢迎光临～
E_H2_Main_1_1_13,有人要挑战神秘的幽灵邸宅吗～？
E_H2_Main_1_1_14,这可是让万圣节庆典变得更恐怖的特别活动哦～
E_H2_Main_1_1_15,怎么办…啊…可是…不，还是算了吧…
E_H2_Main_1_1_16,怎么了？
E_H2_Main_1_1_17,幽灵邸宅…我刚好在找恐怖素材 
E_H2_Main_1_1_18,可是我不敢一个人进去…
E_H2_Main_1_1_19,呜哇！你、你是谁？！
E_H2_Main_1_1_20,我？我叫塞西莉亚！
E_H2_Main_1_1_21,我…我叫里欧…
E_H2_Main_1_1_22,好的，幸会里欧！
E_H2_Main_1_1_23,我也对幽灵邸宅有兴趣，
E_H2_Main_1_1_24,如果你不敢一个人进去，要不要我陪你？
E_H2_Main_1_1_25,什么！？不、不用，没必要一起去，
E_H2_Main_1_1_26,但假如你回来以后能够告诉我感想…
E_H2_Main_1_1_27,好的，走吧！
E_H2_Main_1_1_28,我、我在说话，有没有在听我的话呢…！
E_H2_Main_1_1_29,好的，那两位客人入场！
E_H2_Main_1_1_30,简单地说明一下！
E_H2_Main_1_1_31,这宅邸曾经是一个出名的大富豪贵族住过的地方，
E_H2_Main_1_1_32,但女主人突然死去后，发疯的主人开始做了实验。
E_H2_Main_1_1_33,此时一些奇怪的传闻也开始流传，
E_H2_Main_1_1_34,像是有人在宅邸看到了畸形怪物，或是感受到不祥的视线等等，
E_H2_Main_1_1_35,接著从某一天开始宅邸的员工一个个地开始消失！
E_H2_Main_1_1_36,（就是一般恐怖故事的开端，）
E_H2_Main_1_1_37,（看来无法当成小说的素材了。）
E_H2_Main_1_1_38,大家进去宅邸后，找出消失的员工，
E_H2_Main_1_1_39,然后展开一场探索秘密的恐怖冒险吧～
E_H2_Main_1_1_40,除了你们以外，里面也有先进去的客人，跟他们一起进行冒险吧。
E_H2_Main_1_1_41,听起来挺有趣的！
E_H2_Main_1_1_42,我们快进去吧，里欧！
E_H2_Main_2_1_1,妻子的葬礼结束后，我在书房发现了一本旧书。
E_H2_Main_2_1_2,这本旧书上大概写着关于黑暗和光之力量的内容。
E_H2_Main_2_1_3,虽然不知道这本书从什么时候开始在书房里
E_H2_Main_2_1_4,但研究这本书，就可以救活妻子。
E_H2_Main_2_1_5,如果女神从我身边夺走了她，
E_H2_Main_2_1_6,我就一定要亲自把她找回来。
E_H2_Main_2_1_7,虽然光看外观就够阴森了…
E_H2_Main_2_1_8,没想到内部更可怕…
E_H2_Main_2_1_9,嗯！进来之后感觉更强烈。
E_H2_Main_2_1_10,这里又宽又大，但一盏灯也没有，很冷清。
E_H2_Main_2_1_11,听说越有钱房子越大…
E_H2_Main_2_1_12,进来是进来了…现在我们该做什么呢？
E_H2_Main_2_1_13,不清楚诶，看这个房子的构造不觉得会出现什么吗？
E_H2_Main_2_1_14,走到那边的门附近，鬼就跳出来的那种！
E_H2_Main_2_1_15,那，那种吓人的方式 
E_H2_Main_2_1_16,对写作没有帮助，我才不想遇到…！
E_H2_Main_2_1_17,哐！！
E_H2_Main_2_1_18,妈呀！！
E_H2_Main_2_1_19,吓死我了！
E_H2_Main_2_1_20,原来是门关起来的声音…呼…
E_H2_Main_2_1_21,咦？门怎么打不开。
E_H2_Main_2_1_22,什么！？！？我、我们不会是被关在这里了吧？！
E_H2_Main_2_1_23,应该是为了吓我们才故意锁起来的把。
E_H2_Main_2_1_24,或者也许留了可以联系职员的联系方式？
E_H2_Main_2_1_25,根本没看到那种东西！
E_H2_Main_2_1_26,里欧，冷静点！
E_H2_Main_2_1_27,不过是个活动，你会不会太大惊小怪了？
E_H2_Main_2_1_28,到处仔细看看就可以找到逃出的方法！
E_H2_Main_2_1_29,塞西莉亚真乐观…
E_H2_Main_2_1_30,啊啊啊啊！！
E_H2_Main_2_1_31,这不是惨叫声吗？
E_H2_Main_2_1_32,这…这应该也是安排的吧？
E_H2_Main_2_1_33,先去看一下声音传来的地方吧！
E_H2_Main_2_1_34,等、等一下，塞西莉亚…！
E_H2_Main_2_1_35,等等我啊！！
E_H2_Main_2_2_1,惨叫声应该是从这儿传来的…！
E_H2_Main_2_2_2,里欧！怎么走得那么慢！
E_H2_Main_2_2_3,快点来！
E_H2_Main_2_2_4,呼…呼…
E_H2_Main_2_2_5,是您走得太快…！
E_H2_Main_2_2_6,啊啊啊啊～～～
E_H2_Main_2_2_7,看来宅邸大不一定好！！
E_H2_Main_2_2_8,喂！！你没事吧？！
E_H2_Main_2_2_9,……
E_H2_Main_2_2_10,咦？
E_H2_Main_2_2_11,有什么事吗？
E_H2_Main_2_2_12,呃…你在这里没听见惨叫声吗？
E_H2_Main_2_2_13,我以为是你叫的声音…
E_H2_Main_2_2_14,你说惨叫声吗？
E_H2_Main_2_2_15,我没叫过，也没听见。
E_H2_Main_2_2_16,奇怪了…
E_H2_Main_2_2_17,应…应该没有可怕的装置吧？
E_H2_Main_2_2_18,诶！那个玩偶很像在路上看过的孩子们呢。
E_H2_Main_2_2_19,嗯…仔细看看好像是那个玩偶。
E_H2_Main_2_2_20,是你的玩偶吗？
E_H2_Main_2_2_21,一直在这里附近没人捡，所以我捡起来抱着它！不觉得很可爱吗？
E_H2_Main_2_2_22,那个…塞西莉亚…你不觉得她有点奇怪吗？
E_H2_Main_2_2_23,咦？哪里奇怪了？
E_H2_Main_2_2_24,她竟然说她没听见惨叫声…
E_H2_Main_2_2_25,还有一直攻击我们的玩偶们
E_H2_Main_2_2_26,一投入她的怀抱就突然变乖了…
E_H2_Main_2_2_27,反而看起来是想要逃开她。
E_H2_Main_2_2_28,会不会是关系好才这样？
E_H2_Main_2_2_29,在恐怖主题不存在那种…！
E_H2_Main_2_2_30,如果是推理小说，现在这状况是最可疑的！
E_H2_Main_2_2_31,你的意思是在怀疑我是吗？
E_H2_Main_2_2_32,真冤枉！
E_H2_Main_2_2_33,天啊…她是怎么听到的…
E_H2_Main_2_2_34,不要小看精灵的听力！
E_H2_Main_2_2_35,就算悄悄地讲都能听到！
E_H2_Main_2_2_36,因为我反应迟钝而没听到，这不能成为被怀疑的理由吧？！
E_H2_Main_2_2_37,你们两位都太过分了！
E_H2_Main_2_3_1,呜呜～！
E_H2_Main_2_3_2,被大家误会已经够冤枉了~！
E_H2_Main_2_3_3,是不是我们太过分了…
E_H2_Main_2_3_4,我们误会你了，对不起…
E_H2_Main_2_3_5,是啊…我们都误会你了，对不起…
E_H2_Main_2_3_6,可能是因为这地方太像幽灵邸宅了，我们过于投入这气氛。
E_H2_Main_2_3_7,对了，我们还没自我介绍吧？
E_H2_Main_2_3_8,我叫塞西莉亚！旁边的人叫里欧！
E_H2_Main_2_3_9,呜…我是朵莎尔妲…
E_H2_Main_2_3_10,嗯，幸会朵莎尔妲。
E_H2_Main_2_3_11,刚刚虽然有点误会…不过在探险这座宅邸的这段时间就麻烦你了。
E_H2_Main_2_3_12,好的…！一起合力来查清宅邸的秘密吧！
E_H2_Main_2_3_13,话说，这还是我第一次跟精灵打架呢！
E_H2_Main_2_3_14,刚才在庆典广场也感觉到，
E_H2_Main_2_3_15,感觉在奥勒贝尔里种族间的交流真的很活跃。
E_H2_Main_2_3_16,大家不介意跟其他种族一起生活，我觉得很羡慕。
E_H2_Main_2_3_17,如果帝国也这样就好了。
E_H2_Main_2_3_18,塞西莉亚是从帝国来的吗？！
E_H2_Main_2_3_19,嗯，我没说过吗？
E_H2_Main_2_3_20,没说过啊！！
E_H2_Main_2_3_21,如果提早告诉我，我就不会进来这里，
E_H2_Main_2_3_22,听帝国的故事反而是更有意义的时间！
E_H2_Main_2_3_23,哈哈，那些故事等从宅邸出去之后再听也可以吧？
E_H2_Main_2_3_24,那个…因为帝国的现任皇帝希望种族之间保持友好关系，
E_H2_Main_2_3_25,所以大家表面上都装作关系好…
E_H2_Main_2_3_26,可是只要远离首都，就还存在着各种差别待遇和迫害。
E_H2_Main_2_3_27,啊！好像姐姐说过关于帝国精灵的故事。
E_H2_Main_2_3_28,你是说暗影森林的精灵吗？
E_H2_Main_2_3_29,那里的精灵…跟其他种族的关系也不是很好。
E_H2_Main_2_3_30,他们本来就不太想从森林出来。
E_H2_Main_2_3_31,也很讨厌有人进去。
E_H2_Main_2_3_32,我姐姐说过的也差不多。
E_H2_Main_2_3_33,本来没有现在严重，但听说那地方经常被人类侵略。
E_H2_Main_2_3_34,嗯，听说那地方从以前开始经常被帝国侵略。
E_H2_Main_2_3_35,但是皇帝不知道什么时候开始不关心暗影森林了…
E_H2_Main_2_3_36,但不太清楚理由是什么。
E_H2_Main_2_3_37,会不会是认为战斗没有意义？
E_H2_Main_2_3_38,听说，帝国还有反抗军的问题。
E_H2_Main_2_3_39,奥勒贝尔也对反抗军有不好的看法吗？
E_H2_Main_2_3_40,我、我看帝国书籍上是这样写的…
E_H2_Main_2_3_41,他们是为了正义而战斗的好人。
E_H2_Main_2_3_42,如果不用战斗还可以解决问题是最好了，
E_H2_Main_2_3_43,但是现在在帝国用和平示威什么都解决不了。
E_H2_Main_2_3_44,大家都知道，所以才鼓起勇气来反抗。
E_H2_Main_2_3_45,如果反抗军团员听到这句话，肯定会感动的…
E_H2_Main_2_3_46,会、会、会吗？！哈哈哈！
E_H2_Main_2_3_47,（不小心板着脸说话了～～！）
E_H2_Main_2_3_48,（如果看出来我是反抗军，那该怎么办呢？！）
E_H2_Main_2_3_49,我很少听到关于帝国的故事，
E_H2_Main_2_3_50,塞西莉亚的故事很有趣！
E_H2_Main_2_3_51,讲给我听更多故事好不好～
E_H2_Main_2_3_52,嗯！
E_H2_Main_2_3_53,我从那边听到了开门的声音，先走再说吧！
E_H2_Main_2_3_54,哇～好啊！出发～
E_H2_Main_3_1_1,古书上的记录令人惊讶不已。
E_H2_Main_3_1_2,撼动世界的这个魔法到底是什么呢。
E_H2_Main_3_1_3,如果书本上的内容属实，
E_H2_Main_3_1_4,这股力量不但可以救活妻子，还能摆脱女神创造出的荒谬现象。
E_H2_Main_3_1_5,甚至可以制定新规则。
E_H2_Main_3_1_6,好像是妻子给我创造了机会。
E_H2_Main_3_1_7,她的意思会不会是要支持我成为世界的主人，并建设自己的庭院呢？
E_H2_Main_3_1_8,嗯嗯嗯～
E_H2_Main_3_1_9,刚刚送进去的那组就当做最后一组吧。
E_H2_Main_3_1_10,那么，剩下的就看你们了。
E_H2_Main_3_1_11,狩猎已经开始了，进行得很顺利。
E_H2_Main_3_1_12,是吗？带那个孩子一起不是更好吗？
E_H2_Main_3_1_13,虽然我知道你们爱惜那孩子，
E_H2_Main_3_1_14,但总不能一直吃别人喂的食物吧？
E_H2_Main_3_1_15,我们可不是陌生人。
E_H2_Main_3_1_16,我们是一个集体，只是暂时分开而已。
E_H2_Main_3_1_17,如果被分离出来的我们做得到，那留下来的我们也可以。
E_H2_Main_3_1_18,我的意思就是利用分开的情况。
E_H2_Main_3_1_19,两个人一起不是更开心吗？
E_H2_Main_3_1_20,其他的我们不用去狩猎。
E_H2_Main_3_1_21,狩猎只由我们来做。
E_H2_Main_3_1_22,呵呵，真倔强。
E_H2_Main_3_1_23,你想怎么做就怎么做吧。
E_H2_Main_3_1_24,我光是教你们基础就足够了。
E_H2_Main_3_2_1,乓！乓乓！
E_H2_Main_3_2_2,…？门里听见枪声呢？
E_H2_Main_3_2_3,枪声！？
E_H2_Main_3_2_4,在鬼屋里吗！？
E_H2_Main_3_2_5,这、这不是损坏器具吗？！
E_H2_Main_3_2_6,开一点点看一下吧！
E_H2_Main_3_2_7,就一点点！
E_H2_Main_3_2_8,现在听到的不是枪声，比较像是奇怪的声音…
E_H2_Main_3_2_9,我来开一点点。
E_H2_Main_3_2_10,好…好！都藏好了！
E_H2_Main_3_2_11,……
E_H2_Main_3_2_12,呀啊啊啊啊啊啊啊啊！！！！！！
E_H2_Main_3_2_13,哇啊啊。吓死我了。 
E_H2_Main_3_2_14,大家看，这是普通的玩偶…
E_H2_Main_3_2_15,你们是谁？
E_H2_Main_3_2_16,哎呀。
E_H2_Main_3_2_17,原来不是普通的玩偶，嘿嘿…
E_H2_Main_3_2_18,玩偶？这个？
E_H2_Main_3_2_19,诶，是跟朵莎尔妲的一样的玩偶吗！？
E_H2_Main_3_2_20,是不是除了我们以外都有这玩偶啊！？
E_H2_Main_3_2_21,朵莎尔妲的玩偶也是…
E_H2_Main_3_2_22,是的！是个可爱的玩偶～
E_H2_Main_3_2_23,…那个…请问先生…您贵姓…
E_H2_Main_3_2_24,先生？就叫我米特拉吧～
E_H2_Main_3_2_25,好的…米特拉您的…
E_H2_Main_3_2_26,玩偶…是在哪儿捡到的？
E_H2_Main_3_2_27,啊？不。那倒不是…
E_H2_Main_3_2_28,……
E_H2_Main_3_2_29,不对，就当作随便捡到吧。
E_H2_Main_3_2_30,（什么叫就当作随便捡到呢…？）
E_H2_Main_3_2_31,如果你们想要玩偶，就等著轮到自己吧。
E_H2_Main_3_2_32,那自然会有。
E_H2_Main_3_2_33,轮到自己？
E_H2_Main_3_2_34,是像活动商品一样的吗？
E_H2_Main_3_2_35,那种事我可没听过…
E_H2_Main_3_2_36,会不会是调查宅邸秘密的线索？就像推理小说…
E_H2_Main_3_2_37,有可能！
E_H2_Main_3_2_38,叔叔，可以给我看一下玩偶吗？
E_H2_Main_3_2_39,叔叔？！叔叔？！！？ 
E_H2_Main_3_2_40,你是把叫老头的称呼用在我身上吗？！？！？
E_H2_Main_3_2_41,看你被我的子弹洗礼后还叫不叫得出来！！！！
E_H2_Main_3_2_42,怎么办，他好像生气了～！
E_H2_Main_3_2_43,把叔叔叫叔叔，有问题吗～～？！！？
E_H2_Main_3_3_1,如果那样乱攻击，会…会危险的…！！
E_H2_Main_3_3_2,我开心就好！
E_H2_Main_3_3_3,可是你这小家伙，你～挺麻利的嘛？
E_H2_Main_3_3_4,叔叔你也很强！
E_H2_Main_3_3_5,啊，那边有兔子！快逃！
E_H2_Main_3_3_6,什么！？ 
E_H2_Main_3_3_7,这小子！？
E_H2_Main_3_3_8,正义踢腿！
E_H2_Main_3_3_9,一走神就逃走了～
E_H2_Main_3_3_10,给我乖乖待着，好吗～？啊？
E_H2_Main_3_3_11,（嗯？刚才好像看见人？）
E_H2_Main_3_3_12,（不是米特拉叔叔吗…？是什么呀？？？）
E_H2_Main_3_3_13,（是我看错了吗？）
E_H2_Main_3_3_14,塞西莉亚！看看这个吧！！
E_H2_Main_3_3_15,嗯？什么东西呢？
E_H2_Main_3_3_16,发现了神奇的物品～
E_H2_Main_3_3_17,啊…这些道具我在书本上看过…
E_H2_Main_3_3_18,好像是在使用黑暗的魔法时候使用的道具。
E_H2_Main_3_3_19,还有…还感觉得到更邪恶的不知名的气息。
E_H2_Main_3_3_20,里欧对黑暗魔法很了解吗？
E_H2_Main_3_3_21,我也不是很了解…
E_H2_Main_3_3_22,若是黑暗魔法，跟魔族有关吗？
E_H2_Main_3_3_23,最近魔族在大陆各地引起很多是非不是吗？
E_H2_Main_3_3_24,那…那个…听说魔族最终也是跟黑暗一样的性质…
E_H2_Main_3_3_25,但是…在这里感觉到的好像有点不一样。
E_H2_Main_3_3_26,真的吗？我对这种方面反应很迟钝，所以没感觉到…
E_H2_Main_3_3_27,叔叔跟朵莎尔妲呢？
E_H2_Main_3_3_28,我可不太清楚。
E_H2_Main_3_3_29,我也是啊～
E_H2_Main_3_3_30,？
E_H2_Main_3_3_31,嗯嗯嗯…
E_H2_Main_3_3_32,如果没什么特别的，先继续走怎么样？
E_H2_Main_3_3_33,这里面有通往楼上的楼梯！
E_H2_Main_3_3_34,我也想去二楼探险看看～
E_H2_Main_3_3_35,可能会危险，所以一起走吧！
E_H2_Main_3_3_36,叔叔也要一起走吗？
E_H2_Main_3_3_37,嗯，好的。
E_H2_Main_3_3_38,这本书就你来看吧，我看不懂。
E_H2_Main_3_3_39,…好的…
E_H2_Main_4_1_1,虽然一开始很顺利，但时间过越久越艰难。
E_H2_Main_4_1_2,是因为缺乏实验体，还是因为达到智慧的极限呢。
E_H2_Main_4_1_3,书越看越无法理解，
E_H2_Main_4_1_4,这样下去只会一天一天地过却没什么进展。
E_H2_Main_4_1_5,不能这样耽误时间。
E_H2_Main_4_1_6,好像员工们也开始发现我在做实验。
E_H2_Main_4_1_7,需要更多更多的黑暗力量。
E_H2_Main_4_1_8,因为这一带受到神圣和光的庇护，
E_H2_Main_4_1_9,说不定就是因为这样黑暗才不足。
E_H2_Main_4_1_10,还是得实行从其他地方吸收黑暗的方法。
E_H2_Main_4_1_11,那个…这有可能是多余的担心…
E_H2_Main_4_1_12,担心什么？
E_H2_Main_4_1_13,这宅邸好像真的很奇怪…
E_H2_Main_4_1_14,是因为刚才说的黑暗气息吗？
E_H2_Main_4_1_15,…是的。不管怎么说，这是恐怖体验活动而已嘛。
E_H2_Main_4_1_16,在这种活动里放了真的有黑暗气息的东西…
E_H2_Main_4_1_17,我…那个…
E_H2_Main_4_1_18,无法理解，是吧？
E_H2_Main_4_1_19,塞西莉亚也觉得奇怪吗…？
E_H2_Main_4_1_20,如果里欧觉得奇怪，我认为那是对的！
E_H2_Main_4_1_21,所以里欧你就有自信一点，大声说出来吧！
E_H2_Main_4_1_22,我们当中，只有你才能感觉到黑暗气息，不是吗？
E_H2_Main_4_1_23,那…那个…
E_H2_Main_4_1_24,其实，除此之外还有一个…
E_H2_Main_4_1_25,有另外的问题吗？
E_H2_Main_4_1_26,虽然无法确定…虽然不知道要不要说…
