KEY,Thai
CS_CH3_Main_19_004,เพราะอย่างนั้น...พวกเราจึงต้องมาเพื่อช่วยโลกใบนี้จากความมืดไง!
CS_CH3_Main_19_005,โอ้...ยังมีชีวิตอยู่
CS_CH3_Main_19_006,กรอด...พวกเจ้าจะยังมีชีวิตอยู่ไม่ได้!!
CS_CH3_Main_19_007,ตายซะ!!
CS_CH3_Main_19_008,ไม่นะ ไม่ได้นะ Dain!!
CS_CH3_Main_19_009,ขอโทษนะ Kaulah เมื่อกลายเป็นแบบนี้พวกเราก็ต้องปกป้องตัวเองเหมือนกัน!
CS_CH3_Main_20_001,อึก แข็งแกร่งกันมากจริงๆ...
CS_CH3_Main_20_002,พอเถอะ Dain ถ้าเป็นคนพวกนี้ก็คงจะล้ม Sieg ลงได้
CS_CH3_Main_20_003,นั่นก็เป็นไปได้...
CS_CH3_Main_20_004,นี่มันอะไรกัน!
CS_CH3_Main_20_005,ฮึ บอกแล้วว่า ออร์คน่ะอ่อนต่อโลก
CS_CH3_Main_20_006,อันที่จริงแล้ว เพราะอย่างนั้นสถานการณ์จึงได้กลายมาเป็นเช่นนี้
CS_CH3_Main_20_007,Maria!! ทำไมกัน...
CS_CH3_Main_20_008,อ่อนต่อโลก เช่นเดียวกันกับพวกเจ้านั่นล่ะ
CS_CH3_Main_20_009,คิดว่าจะโน้มน้าวคนผู้นั้นได้งั้นสินะ
CS_CH3_Main_20_010,เราควรจะพยายามจนวินาทีสุดท้ายเลย ไม่ใช่เหรอ
CS_CH3_Main_20_011,อย่างนั้นแล้วพวกเจ้าก็จะตาย เหมือนอย่างเมื่อครู่
CS_CH3_Main_20_012,พวกเจ้ายังตายไม่ได้
CS_CH3_Main_20_013,เหตุผลที่พวกเรายังตายไม่ได้คืออะไรกันแน่
CS_CH3_Main_20_014,หืม ก่อนหน้านี้พูดไปแล้วนะ
CS_CH3_Main_20_015,ว่ามีสิ่งที่ข้าต้องการเห็นจากพวกเจ้าให้ได้
CS_CH3_Main_20_016,จะต้องคับแค้นใจเพราะ Lua ...เรื่องนั้นรึเปล่า
CS_CH3_Main_20_017,ข้ากำลังอยากถามเลยว่านั่นมันหมายความว่าอะไร
CS_CH3_Main_20_018,หุหุหุ เรื่องเช่นนั้นพวกเจ้าต้องรู้แจ้งด้วยตัวเอง
CS_CH3_Main_20_019,เรื่องที่อยากเล่าให้พวกเจ้าฟัง นอกจากเรื่องนั้นแล้วยังมีอีกมากนัก
CS_CH3_Main_20_020,ได้ ถ้าอย่างนั้น อาร์เล็ตเต้...เล่าเรื่องอาร์เล็ตเต้ แม่ของข้าให้ฟังที!
CS_CH3_Main_20_021,หุหุ อาร์เล็ตเต้.. ข้าไม่เคยพูดเลยนะว่ามารดาเจ้าชื่อ อาร์เล็ตเต้...
CS_CH3_Main_20_022,อะไรนะ?
CS_CH3_Main_20_023,ลองคิดดูแล้ว...เราทั้ง 4 ต่างไม่รู้จักพ่อแม่
CS_CH3_Main_20_024,ถึงไม่ใช่แม่ของ Cleo แต่เจ้ารู้จักพ่อแม่ของเราคนใดคนหนึ่งอยู่งั้นเหรอ?
CS_CH3_Main_20_025,ฮุฮุ อย่ารีบร้อนเลย ค่อยๆ สนุกไปทีละน้อยเถอะ
CS_CH3_Main_20_026,วันนี้ข้ามาเพื่อบอกเรื่องอื่น
CS_CH3_Main_20_027,ใครกันที่เป็นสาเหตุทำให้ออร์คเกลียดชังมนุษย์
CS_CH3_Main_20_028,Malduk.. เคยได้ยินชื่อนี้ไหม?
CS_CH3_Main_20_029,Malduk..!!
CS_CH3_Main_20_030,หมายถึง Malduk ตัวแทนของ Angmund นั่นน่ะเหรอ?
CS_CH3_Main_20_031,ใช่แล้ว Malduk ผู้นั้นจับออร์คและทำให้เป็นผีดิบมาตั้งนานแล้ว
CS_CH3_Main_20_032,แล้วใส่ร้ายว่ามนุษย์จับพวกออร์คไปทำให้บรรดาพวกออร์ค โดยเฉพาะ Sieg เข้าใจผิดน่ะสิ
CS_CH3_Main_20_033,ชั่วร้าย...
CS_CH3_Main_20_034,ทำไมถึงเล่าเรื่องแบบนี้ให้พวกเราฟัง?
CS_CH3_Main_20_035,เจ้าอยู่ฝ่ายปีศาจไม่ใช่หรือ
CS_CH3_Main_20_036,ข้าไม่ชอบโครงกระดูกนั้นมาตั้งนานแล้ว
CS_CH3_Main_20_037,ถ้าอย่างนั้น เรื่องที่ใช้ Lakrak เป็นเครื่องมือทำให้ ก๊อบลินเกิดความขัดแย้งกับออร์คก็..
CS_CH3_Main_20_038,ใช่แล้ว Malduk ใช้ออร์คเป็นเครื่องมือ
CS_CH3_Main_20_039,เพราะอย่างนั้นข้าจึงใช้ก๊อบลินที่ปกติก็ไม่ชอบใจพวกออคอยู่แล้วบ้างน่ะสิ
CS_CH3_Main_20_040,เจ้าก็ต่ำช้าไม่ต่างกับ Malduk หรอก
CS_CH3_Main_20_041,ถ้าทำให้การต่อสู้นั้นลุกลามขึ้น ทั้งสองชนเผ่าก็มีแต่จะได้รับความเสียหาย
CS_CH3_Main_20_042,และทำให้ยิ่งเข้าใจกันและกันผิดมากขึ้นเท่านั้น
CS_CH3_Main_20_043,ทำเช่นนั้นแล้วเกิดรอยร้าวที่ไม่สามารถประสานได้ขึ้นระหว่างพวกเจ้า ก็เป็นเรื่องดีต่อพวกเราปีศาจไม่ใช่เหรอ
CS_CH3_Main_20_044,ว่ายังไงนะ
CS_CH3_Main_20_045,ชั่วร้าย...ตั้งใจจะให้ชนเผ่าในโลกนี้แตกแยกกันงั้นเหรอ
CS_CH3_Main_20_046,ต้องบอกความจริงนี้ให้ที่ Orvelia รับรู้
CS_CH3_Main_20_047,หุหุหุ ลองบอกดูเถอะ Orvelia ไม่คิดจะทำอะไรหรอก
CS_CH3_Main_20_048,คงจะคิดถึงการมีชีวิตอยู่ของราชาและชนชั้นสูงทั้งหลายที่อยู่ในพระราชวังที่เมืองหลวง Orvel เท่านั้น
CS_CH3_Main_20_049,แล้วก็...ฆ่าพวกเจ้าเพื่อไม่ให้เปิดเผยความจริงนั้นได้
CS_CH3_Main_20_050,ว่าไงนะ? อย่าใส่ร้ายราชวงค์ Orvelian
CS_CH3_Main_20_052,หุหุ ช่างอ่อนต่อโลกจริงๆ
CS_CH3_Main_20_053,ยังไงก็ตาม ไม่บอกให้ Orvelia รู้จะเป็นการดีกว่า
CS_CH3_Main_20_054,ถึงจะไม่คิดว่าพวกเขาจะมาสู้กับพวกเรา
CS_CH3_Main_20_055,ถ้าหากว่าสงครามรอบด้านแผ่ขยายออกไป แค่การทำให้ Orvel ล้มสลายก็ไม่ใช่เรื่องยากเลย
CS_CH3_Main_20_056,ฟังคำข้าให้ดี เช่นนั้นแล้วจึงสามารถเลี่ยงสงครามได้
CS_CH3_Main_20_057,เราจะเชื่อคำพูดของท่านได้ยังไง
CS_CH3_Main_20_058,ข้าจะไม่ขอร้องให้เชื่อ
CS_CH3_Main_20_059,เพราะการเลือกคือหน้าที่ของพวกเจ้า
CS_CH3_Main_20_060,ไว้พบกันใหม่
CS_CH3_Main_20_061,ยัยป้านี่เอาอีกแล้ว...
CS_CH3_Main_20_062,บอกว่าอย่าหายตัวไปตามใจไง! 
CS_CH3_Main_21_001,Dain ที่เลือกทางที่หลีกเลี่ยงไม่ได้เพื่ออาจารย์...
CS_CH3_Main_21_002,ท่านเทพี Lua ได้โปรดยกโทษให้เขาด้วย
CS_CH3_Main_21_003,ขอบใจที่สวดภาวนาเพื่อ Dain
CS_CH3_Main_21_004,คงไม่ง่ายที่จะโน้มน้าวใจ Sieg และสุดท้ายก็คงมีแต่ต้องล้มเขาลง
CS_CH3_Main_21_005,พวกพ้องของท่านคงจะขัดขวางเรา
CS_CH3_Main_21_006,ถ้าเป็นเช่นนั้นเราก็ได้แต่ต้องล้มพวกเขาลงแล้วเดินหน้าต่อไป ท่านเข้าใจใช่ไหม Kaulah
CS_CH3_Main_21_007,ไปด้วยกันเถิด จะอย่างไร...ก็จะลองโน้มน้าวดู
CS_CH3_Main_21_008,ถ้าไม่ได้ผล...
CS_CH3_Main_21_009,ตอนนั้นคงมีแต่ต้องล้มพวกเขา มือข้าก็เปื้อนเลือดของพวกพ้องไปแล้วไม่ใช่หรือ
CS_CH3_Main_21_010,ขอโทษนะ Kaulah ที่ทำให้ท่านเข้ามาเกี่ยวข้องกับเรื่องนี้
CS_CH3_Main_21_011,ไม่ใช่ความผิดของเจ้า Kasel
CS_CH3_Main_21_012,หากไม่ยับยั้งสงครามคงต้องมีการเสียชีวิตมากกว่านี้ พวกเราทำอะไรไม่ได้นอกจากต้องพยายามให้เต็มที่
CS_CH3_Main_21_013,Kasel เรื่องที่จะแจ้งสถานการณ์ตอนนี้ไปยัง Orvelia
CS_CH3_Main_21_014,ข้าว่าเราน่าจะเชื่อคำพูดของ Maria..
CS_CH3_Main_21_015,ข้าก็คิดอย่างนั้น
CS_CH3_Main_21_016,กลุ่มหน้ากากหัวเราะ...พวกเขารับคำสั่งจากใครบางคน
CS_CH3_Main_21_017,และอาจจะกำลังพยายามฆ่าข้า
CS_CH3_Main_21_018,Kasel...
CS_CH3_Main_21_019,คงมีสักวันที่รู้ได้ว่าใครกันแน่ที่พยายามจะฆ่าข้า
CS_CH3_Main_21_020,ตอนนี้นั่นไม่ใช่เรื่องสำคัญ เราต้องทำสิ่งที่เราสามารถทำได้ก่อน
CS_CH3_Main_22_001,Kaulah!
CS_CH3_Main_22_002,นั่น Kaulah คนทรยศ!
CS_CH3_Main_22_003,พี่น้องทั้งหลาย พวกเราถูกพวกปีศาจหลอก
CS_CH3_Main_22_004,Malduk ทูตของพวกปีศาจเป็นผู้จับออร์คไปทำให้กลายเป็นผีดิบ
CS_CH3_Main_22_005,เราไม่เชื่อคำพูดของคนทรยศ
CS_CH3_Main_22_006,ชดใช้ความผิดของเจ้าด้วยความตายซะเถอะ Kaulah!
CS_CH3_Main_22_007,ข้าคิดแล้วว่าต้องเป็นอย่างนี้
CS_CH3_Main_22_008,แต่จะว่าอย่างนั้นแล้วล้มเลิกการเกลี้ยกล่อมไปไม่ได้นะ Roi
CS_CH3_Main_22_009,ใช่แล้ว ต้องลองทำเท่าที่ทำได้สิ!
CS_CH3_Main_22_010,เฮ้อ..Cleo เจ้าลองหันกลับไปดูตัวเองหน่อยไหม
CS_CH3_Main_22_011,เอาไว้ทีหลัง ตอนนี้ต้องจัดการเจ้าพวกนี้ก่อน
CS_CH3_Main_22_012,ได้โปรดอย่าทำรุนแรง
CS_CH3_Main_23_001,การต่อสู้ที่นี่ได้เริ่มขึ้นแล้ว
CS_CH3_Main_23_002,ว้าว ยอดไปเลย ด้วยการนำของ Lakrak พวกก๊อบลินพาโกเลม....
CS_CH3_Main_23_003,ไม่ชอบเลยจริงๆ
CS_CH3_Main_24_001,การทดสอบที่นี่ใกล้จะจบแล้ว!
CS_CH3_Main_24_002,ข้าจะไปจากที่นี่เพื่อสร้างอาวุธที่แข็งแกร่งยิ่งขึ้น
CS_CH3_Main_24_003,Lakrak ถ้าอย่างนั้นพวกก๊อบลินที่ติดตามท่านที่นี่จะทำอย่างไร
CS_CH3_Main_24_004,ไม่รู้!
CS_CH3_Main_24_005,ข้าจะมอบเครื่องควบคุมโกเลมกับอาวุธนั่นนี่ให้ แล้วก็ไปจัดการกันเอง!
CS_CH3_Main_24_006,ถ้าตามพวกเจ้าไปน่าจะได้พบเป้าหมายการทดสอบที่แข็งแกร่งยิ่งขึ้นได้
CS_CH3_Main_24_007,รอก่อนเถอะ! ถ้าจัดการการทดสอบที่นี่เรียบร้อยกว่านี้อีกนิด ข้าจะเข้าร่วมกับพวกเจ้า
CS_CH3_Main_24_008,ข้าที่เป็นเพื่อนเจ้าต้องยินดีอยู่แล้วสิ
CS_CH3_Main_24_009,ข้าไม่พอใจเลย ให้เป็นทีมเดียวกับก๊อบลินเนี่ยนะ
CS_CH3_Main_24_010,Cleo เจ้าจะเกลียดชังเผ่าอื่นโดยไม่มีเหตุผลไม่ได้นะ..
CS_CH3_Main_24_011,ขอ ขอโทษ ได้โปรดอย่าบอกให้นอนแยกกันก็พอ
CS_CH3_Main_24_012,ตอนนี้ถ้าไม่มี Frey ข้านอนไม่ได้อีกแล้ว
CS_CH3_Main_24_013,เพราะ...หมอนงั้นหรือ...
CS_CH3_Main_24_014,เรื่องใหญ่แล้วล่ะ Frey
CS_CH3_Main_25_001,Sieg!!
CS_CH3_Main_25_002,ที่อยู่ด้วยกันน่ะ Malduk รึเปล่า
CS_CH3_Main_25_003,เหมือนจะใช่นะ เจ้าโครงกระดูก
CS_CH3_Main_25_004,Sieg!! พวกเราถูกเจ้านั่นหลอก!
CS_CH3_Main_25_005,คนผู้นั้นจับพี่น้องของเราไปทำเป็นพวกอมตะแล้วป้ายความผิดไปให้พวกมนุษย์!
CS_CH3_Main_25_006,อะไร?
CS_CH3_Main_25_007,ท่านหัวหน้าเผ่าออร์คผู้ยิ่งใหญ่
CS_CH3_Main_25_008,ท่านไม่มีทางฆ่า Garuk ที่ท่านเคารพด้วยเพียงเพราะความเข้าใจผิดไม่ใช่หรือ
CS_CH3_Main_25_009,สิ่งที่ท่านทำทุกอย่างล้วนทำเพื่อออร์ค เพื่อความสุขสงบของชนเผ่ามิใช่หรือ
CS_CH3_Main_25_010,ตอนนี้คนเหล่านั้นกำลังดูถูกดูหมิ่นการตัดสินใจของท่านอยู่
CS_CH3_Main_25_011,ควจจะต้องชดใช้ความผิดนั้นด้วยความตายมิใช่หรือ
CS_CH3_Main_25_012,ใช่แล้ว...
CS_CH3_Main_25_013,ใช่แล้ว! ข้าคือผู้นำเหล่าออร์ค จะไม่มีวันยกโทษให้มนุษย์ที่จับพี่น้องของข้าไปเป็นทาสโดยเด็ดขาด
CS_CH3_Main_25_014,อย่างที่คิดเลย เจ้าคนทรยศ Kaulah!
CS_CH3_Main_25_015,เฮ้อ หัวแข็งจริงๆ
CS_CH3_Main_25_017,มาถึงขนาดนี้แล้วก็ยังไม่ยอมรับ...
CS_CH3_Main_25_018,ความจริงที่ฆ่า Garuk ไปเพราะความเข้าใจผิด
CS_CH3_Main_25_019,ชดใช้ความผิดของเจ้ามา!
CS_CH3_Main_26_001,สมเป็นหัวหน้าเผ่า ไม่ธรรมดาเลยนี่
CS_CH3_Main_26_002,Kasel เจ้าปลดผนึกพลังของดาบศักดิ์สิทธิ์ไม่ได้เหรอ!?
CS_CH3_Main_26_003,อึอ ขอโทษนะ เหมือนข้าจะยัง...ควบคุมดาบไม่ได้
CS_CH3_Main_26_004,พลังจะออกมาตามใจของดาบ....
CS_CH3_Main_26_005,เฮ้อ...บอกว่าไม่ใช่เรื่องต้องขอโทษไง
CS_CH3_Main_26_006,จะยังไงก็เถอะ!!
CS_CH3_Main_27_001,กร๊อด... Malduk.... Malduk!!!
CS_CH3_Main_27_002,คราวนี้ข้าคงทำผิดไป
CS_CH3_Main_27_003,ปกป้อง...พวกเราจากมนุษย์ที่ชั่วช้าพวกนั้นด้วย
CS_CH3_Main_27_004,คึคึคึคึคึคึ
CS_CH3_Main_27_005,วะฮ่าฮ่าฮ่าฮ่าฮ่า!!!!
CS_CH3_Main_27_006,เจ้าออร์คโง่งม
CS_CH3_Main_27_007,อะ..อะไร...ทำไม่ถึงหัวเราะอย่างนั้น!?
CS_CH3_Main_27_008,พวกออร์คที่หายไปจาก Ogria ไม่นานจะถูกคืนชีพเป็นพวกผีดิบ
CS_CH3_Main_27_009,และกลายเป็นเหล่าปีศาจโดยสมบูรณ์
CS_CH3_Main_27_010,เรื่อง...เรื่องนั้น..อย่างนั้น ข้า..
CS_CH3_Main_27_011,เจ้าฆ่า Garuk หัวหน้าเผ่าคนก่อนด้วยความเข้าใจผิดไงล่ะ
CS_CH3_Main_27_012,คึคึคึ
CS_CH3_Main_27_013,จะ...เจ้า!!!!
CS_CH3_Main_27_014,อ๊อค..
CS_CH3_Main_27_015,Sieg!!!!
CS_CH3_Main_27_016,จำเป็น...ต้องทำอย่างนั้นด้วยเหรอ
CS_CH3_Main_27_017,ต้องยิ้มเยาะและดูหมิ่นคนที่กำลังจะตายด้วยเหรอ!
CS_CH3_Main_27_018,คึคึคึ...
CS_CH3_Main_27_019,ใช่แล้ว เจ้าผู้ถือครองดาบศักดิ์สิทธิ์
CS_CH3_Main_27_020,เป็นอย่างไร ไม่รู้สึกถึงความความโกรธแค้นหรือ
CS_CH3_Main_27_021,เจ้า...ข้าไม่มีวันอภัยให้เจ้าเด็ดขาด
CS_CH3_Main_27_022,ใช่แล้ว สิ่งนี้ล่ะ
CS_CH3_Main_27_023,ช่างงดงามจริงๆ
CS_CH3_Main_27_024,วะฮ่าฮ่าฮ่าฮ่าฮ่า!!!!
CS_CH3_Main_27_025,จงโกรธแค้นให้มากกว่านี้ ทำให้ดาบศักดิ์สิทธิ์ถูกย้อมไปด้วยความมืด
CS_CH3_Main_27_026,หวังว่าพบกันครั้งหน้า จะได้เห็นเจ้าที่เต็มไปด้วยความเคียดแค้นมากยิ้งกว่านี้
CS_CH3_Main_27_027,เจ้านี่ อย่าหนีนะ!
CS_CH3_Main_27_028,โธ่เอ๊ย หนีไปซะแล้ว
CS_CH3_Main_27_029,อ๊ากกกกก!!!
CS_CH3_Main_27_030,ฮึก... Kasel!
CS_CH3_Main_27_031,ไม่นะ Kasel!
CS_CH3_Main_27_032,ได้โปรดตั้งสติไว้ ได้โปรด...
CS_CH3_Main_27_033,ฮึก...
CS_CH3_Main_27_034,แฮ่ก..แฮ่ก..
CS_CH3_Main_27_035,Frey.. ขอบ..ขอบใจ..
CS_CH3_Main_27_036,Kasel! 
CS_CH3_Main_28_001,Kasel... Kasel!!!
CS_CH3_Main_28_002,อือ...
CS_CH3_Main_28_003,Malduk!!!
CS_CH3_Main_28_004,ใจเย็นนะ Kasel เจ้า Malduk หนีไปแล้ว
CS_CH3_Main_28_005,อึก...เพราะต้นเหตุของความเดือดดาลหายไปอย่างงั้นเหรอ...
CS_CH3_Main_28_006,เหมือนจะขาดสติอย่างหนักไปเลย
CS_CH3_Main_28_007,ก็ใช่ แต่...
CS_CH3_Main_28_008,อย่างที่คิดเลย เพราะมี Frey อยู่ก็ไม่ต้องกังวลอะไรแล้ว
CS_CH3_Main_28_009,เพราะ Frey เรียก Kasel ก็เลยได้สติกลับมาทันทีเลยนี่
CS_CH3_Main_28_011,ขอบใจนะ Frey
CS_CH3_Main_28_012,ไม่เป็นไร... ไม่เป็นไรหรอก Kasel
CS_CH3_Main_28_013,Sieg ล่ะ... แล้วพวกออคใน Ogria แห่งนี้ละจะเป็นอย่างไร
CS_CH3_Main_28_014,จนกว่าหัวหน้าเผ่าคนใหม่จะปรากฏตัวออกมา 
CS_CH3_Main_28_015,อย่าห่วงพวกเราเลย
CS_CH3_Main_28_016,พวกเราได้รับเครื่องรางแห่งเออาโทล่าแล้ว จะต้องย้ายพลังที่ถูกแบ่งออกมากลับคืนสู่ดาบศักดิ์สิทธิ์...
CS_CH3_Main_28_017,ไม่ครับ ตอนนี้น่ะ..
CS_CH3_Main_28_018,ได้โปรดเก็บรักษาเครื่องรางแห่งเออาโทล่าไว้ให้ดีด้วยเถิดครับ
CS_CH3_Main_28_019,แต่..ทำไม..
CS_CH3_Main_28_020,คงจะคืนพลังของดาบศักดิ์สิทธิ์ไปทั้งอย่างนี้ไม่ได้น่ะครับ
CS_CH3_Main_28_021,หากไม่สามารถควบคุมดาบศักดิ์สิทธิ์ได้ด้วยตัวเอง
CS_CH3_Main_28_022,ทิศทางของปลายดาบจะกลายเป็นมุ่งไปทางใดก็ไม่รู้
CS_CH3_Main_28_023,Kasel...
CS_CH3_Main_28_024,แต่ถึงจะบอกว่าจะไม่คืนพลังของดาบศักดิ์สิทธิ์กลับไปโดยทันที
CS_CH3_Main_28_025,ก็ยังคงต้องตามหาสถานที่ที่เก็บพลังส่วนที่เหลือไว้
CS_CH3_Main_28_026,นั่นสินะ
CS_CH3_Main_28_027,เหมือนบาบาเรี่ยนเหนือจะครอบครองพลังนั้นส่วนหนึ่งอยู่
CS_CH3_Main_28_028,อืม..หมายถึงอาณาจักรบาบาเรี่ยนหลังกำแพงเหล็กที่แม้แต่นกก็ข้าไปไม่ได้งั้นหรือ
CS_CH3_Main_28_029,ใช่แล้ว เราไม่มีทางเลือกนอกจากผ่านทาง Galluah และ Aegina
CS_CH3_Main_28_030,Galluah อยู่ที่ไหนหรือครับ?
CS_CH3_Main_28_031,ต้องลงไปทางทิศใต้
CS_CH3_Main_28_032,คงเป็นการเดินทางที่ยาวไกล
