KEY,Japanese
CS_CH3_Main_8_027,それから仲間のゴブリンが、お前を襲うかもしれないだギャ！\n先に俺が謝っておくから、手加減してやってほしいだギャ......。
CS_CH3_Main_9_001,進めだギャ！
CS_CH3_Main_9_002,ギャギャ～！　ゴーレム、動いただギャ！
CS_CH3_Main_9_003,来いだギャ！
CS_CH3_Main_9_004,ゴーレムを操れてるだギャ！\nやっぱり「あの方」はすごいだギャ～！
CS_CH3_Main_9_005,......。
CS_CH3_Main_9_006,クレオ？　大丈夫ですか？
CS_CH3_Main_9_007,おーおー、ゴブリンがゴーレムを操ってるのを見て、\nプライドが粉砕されたみたいだな。
CS_CH3_Main_9_008,何せ天才大魔法師が失敗したことを、ゴブリンが成功させてるんだからな。
CS_CH3_Main_9_009,ロ～イ～！！！
CS_CH3_Main_9_010,ギャッ！？　人間だギャ！
CS_CH3_Main_9_011,俺たちを見てるだギャ！\nさてはオークが人間のスパイを送り込んできただギャ！
CS_CH3_Main_9_012,スパイじゃないんですけど......。
CS_CH3_Main_9_013,聞いちゃいないな。こりゃ力ずくで分からせるしかないようだ。
CS_CH3_Main_9_014,上等だわ！！
CS_CH3_Main_9_015,かかってきなさい、バカゴブリン！\n私に恥をかかせた罪は重いわよ！！
CS_CH3_Main_10_001,フフン。こんなの楽勝ね。
CS_CH3_Main_10_002,そんなこと言って、息切れしてるじゃないか。
CS_CH3_Main_10_003,息なんか、切れて、ないわよ！　本当よ！？
CS_CH3_Main_10_004,クレオめ、「バカゴブリン」に先を越されたもんで怒り狂ってるな。
CS_CH3_Main_10_005,そんなことないったら！　バカロイ！！
CS_CH3_Main_11_001,ギャギャ～！　ロイ、やめるだギャ！　ラクラックだギャ～！
CS_CH3_Main_11_002,ラクラック？
CS_CH3_Main_11_003,アンタは――！
CS_CH3_Main_11_004,あら、まだ生きていたのね。運の強い子たちだこと。
CS_CH3_Main_11_005,そう簡単に死んでたまるもんですか！\nこっちはアンタに聞きたいことがあるんだから！
CS_CH3_Main_11_006,前に話してたアンタの旧友について、今日こそ洗いざらい話してもらうわよ！
CS_CH3_Main_11_007,フフ、元気なお嬢ちゃんだこと。
CS_CH3_Main_11_008,そうね。私を見逃してくれるなら、昔話を聞かせてあげてもいいけど。
CS_CH3_Main_11_009,魔族を見逃す？　この私が！？
CS_CH3_Main_11_010,いいじゃない、１度くらい。文字通り、目をつぶっていれば済む話よ。
CS_CH3_Main_11_011,どうやらラクラックはアンタと組んでるみたいだな。
CS_CH3_Main_11_012,だがどうして魔族なんかと――？
CS_CH3_Main_11_013,ギャ？　こいつ魔族だギャ？
CS_CH3_Main_11_014,もしそうだとして......私と手を切るつもりかしら、白いゴブリンさん？
CS_CH3_Main_11_015,......。
CS_CH3_Main_11_016,魔族でもなんでも関係ないギャ！
CS_CH3_Main_11_017,強い武器を作る手伝いをしてくれるなら、ラクラックの仲間だギャ！
CS_CH3_Main_11_018,ああ、光の女神ルア様......。
CS_CH3_Main_11_019,どうかこの哀れなゴブリンを、魔の手からお救いください......。
CS_CH3_Main_11_020,馬鹿な子ね。ルアはもう、誰も救ったりはしないわ。
CS_CH3_Main_11_021,祈りたいなら好きなだけ祈ればいいけど、\nそれはもう、どこにも届かないわよ。
CS_CH3_Main_11_022,ルア......あの忌々しい女神め......！
CS_CH3_Main_11_023,ルア様が誰も救わない......？
CS_CH3_Main_11_024,いいや。女神は――ルア様は今も俺たちを守ってくれている。
CS_CH3_Main_11_025,この聖剣こそが、その証。\n世界を魔族から救うために、ルア様は俺たち人間に聖剣を下されたんだ！
CS_CH3_Main_11_026,フフフ......。
CS_CH3_Main_11_027,あはははははははは！
CS_CH3_Main_11_028,ルアが人間を守っている？　聖剣がその証！？
CS_CH3_Main_11_029,笑わせてくれるわ！
CS_CH3_Main_11_030,でも......そうね。信じたいのなら信じればいい。\nけれど貴方はきっと絶望し、ルアと聖剣を憎むことになるわ。
CS_CH3_Main_11_031,その時、貴方がどんな顔をするか......とっても楽しみだわ。\nかわいい顔が恐怖と絶望に歪み、憎しみの涙が頬を濡らす......。\nああ、想像するだけでゾクゾクしちゃうわね......。
CS_CH3_Main_11_032,お前......何を言ってるんだ？
CS_CH3_Main_11_033,フフフ......今に分かるわ。
CS_CH3_Main_11_034,また会いましょう。――アルレッテの子よ。
CS_CH3_Main_11_035,待て！　魔女め！！
CS_CH3_Main_11_036,アイツ、私をアルレッテの子と呼んだ......。
CS_CH3_Main_11_037,アルレッテ......それが私の母さんの名前......？
CS_CH3_Main_12_001,よお、ラクラック。
CS_CH3_Main_12_002,お前が魔女なんかと組んだせいで、お互いひどい目に遭ったな。
CS_CH3_Main_12_003,それでもまだ、アイツらとつるむつもりか？
CS_CH3_Main_12_004,魔族とつるむのは、もうやめだギャ！
CS_CH3_Main_12_005,あの魔族の女のこと、よく知らないだギャ！\nだからラクラックのこと、責めないでほしいだギャ！
CS_CH3_Main_12_006,彼女は......魔族ではないと思います。
CS_CH3_Main_12_007,おそらく人間だとは思うんですが、\nそれならどうして魔族の側についているのか......。
CS_CH3_Main_12_008,そんなことはどうでもいい。
CS_CH3_Main_12_009,あの女は俺たちにとって危険だ。
CS_CH3_Main_12_010,ラクラック、どうしてあの女と行動を共にしていたんだ？
CS_CH3_Main_12_011,ギャギャ！　ラクラック、強い武器を作る旅をしてるギャ。
CS_CH3_Main_12_012,その旅の途中で、あの女と会っただギャ。
CS_CH3_Main_12_013,ラクラック、仲間は必要ないギャ。\nでもあの女、強い武器を作るのを手伝ってくれるって言ったギャ！
CS_CH3_Main_12_014,ラクラックの技術だけじゃ作れない、魔法の武器だギャ！\nそんなの作ってみたいだギャ！
CS_CH3_Main_12_015,そしたら試しにって、ゴーレムコントローラーを作ってくれたギャ！\nすごいギャ！　すごすぎるギャ！
CS_CH3_Main_12_016,やっぱり！
CS_CH3_Main_12_017,ゴブリンなんかがゴーレムを操れるはずはないって思ってたのよね！
CS_CH3_Main_12_018,安心したみたいだな、クレオ。
CS_CH3_Main_12_019,別に～。最初から何かウラがあるに違いないって、分かってたもの。
CS_CH3_Main_12_020,そんなことより、アイツ、母さんの名前を知ってたわ。
CS_CH3_Main_12_021,でも仲間を求めてるわけじゃないラクラックが、\nどうしてオグリアのゴブリンと一緒にいたんだ？
CS_CH3_Main_12_022,世の中、タダより高いものはないだギャ！
CS_CH3_Main_12_023,あの女、ラクラックの武器作りを手伝う代わりに、\nラクラックにもオークからゴブリンを救う手伝いをしろって言ったんだギャ。
CS_CH3_Main_12_024,じゃあまさか、ゴブリンたちの言ってた「あの方」って......。
CS_CH3_Main_12_025,ラクラックってことになるな。
CS_CH3_Main_12_026,それにしても、ゴブリンはみーんなバカで困るギャ！\nラクラック、うんざりだギャ！
CS_CH3_Main_12_027,でもどうして彼女はゴブリンを助けようとしていたんでしょう？
CS_CH3_Main_12_028,それは知らないギャ！　興味ないギャ！
CS_CH3_Main_12_029,ラクラックは、強い武器のことしか考えてないギャ！
CS_CH3_Main_12_030,――あの女、また会おうって言ってたな。\nその時には、どうしてゴブリンを助けたのか聞き出さないと。
CS_CH3_Main_12_031,聞きたいのはそれだけじゃないわ。
CS_CH3_Main_12_032,アイツは母さんのことを知っている。\nもっと詳しいことを吐かせないと......！
CS_CH3_Main_12_033,それに......俺がルア様と聖剣を憎むようになるってのも気になるな......。
CS_CH3_Main_12_034,......。
CS_CH3_Main_13_001,ラクラックさん、よかったら私たちと一緒に来ませんか？
CS_CH3_Main_13_002,一緒に行けば、新作のラクラックＭｋ３の試し打ちもできそうだギャ。\n......決めた！　ラクラック、一緒に行くギャ！
CS_CH3_Main_13_003,試し打ちだけなら、自分１人でもできるんじゃないの？
CS_CH3_Main_13_004,ギャ......ギャギャ......。
CS_CH3_Main_13_005,そ、それはもう済んでるギャ！　ホントだギャ！
CS_CH3_Main_13_006,今必要なのは、集団戦における性能テストだギャ！
CS_CH3_Main_13_007,はいはい。要するに１人じゃおっかなくて試し打ちもできないってことね。
CS_CH3_Main_14_001,スローン様、それは誤解です。\nどうか自分の話をお聞きください......！
CS_CH3_Main_14_002,テメェの話は何度も聞いただろうが。
CS_CH3_Main_14_003,もう飽き飽きだ。何度聞いても結論は変わらねぇ。
CS_CH3_Main_14_004,結論が変わらないのではなく、\n変えるつもりがないのではありませんか？
CS_CH3_Main_14_005,なんだかオークたちも揉めてるみたいだな。
CS_CH3_Main_14_006,む......貴殿はまさか......。
CS_CH3_Main_14_007,新たなる聖剣の使い手か。
CS_CH3_Main_14_008,えっ、どうしてそれを......。
CS_CH3_Main_14_009,スローン様、こちらが先ほどお話しした、聖剣の継承者殿であらせられます。
CS_CH3_Main_14_010,新たな聖剣の使い手だと？\n青臭いガキが１人増えたところで、なんの足しにもなるとも思えねぇな。
CS_CH3_Main_14_011,しかし聖剣が再び世に現れたということは、\n世界に危機が訪れたことを意味しているのですよ。
CS_CH3_Main_14_012,世界どころか、オレたちオークは常に危機にさらされてるだろ。
CS_CH3_Main_14_013,そこにいる人間どものせいでな！！
CS_CH3_Main_14_014,いったいなんの話なんだ？
CS_CH3_Main_14_015,行け、カウラ！　人間どもの首をはねてやれ！\n――それともテメェの素っ首を切り落とされてぇか？
CS_CH3_Main_14_016,............。
CS_CH3_Main_14_017,お許しください、スローン様。
CS_CH3_Main_15_001,カウラァ！！
CS_CH3_Main_15_002,テメェ、裏切ったな！！
CS_CH3_Main_15_003,なんで人間なんかの......肩を持つ......。
CS_CH3_Main_15_004,最期までご理解いただけなくて残念です、スローン様。
CS_CH3_Main_15_005,テメェ......許さねぇぞ......。
CS_CH3_Main_15_006,オレが死んでも......オークの同胞たちがテメェを付け狙う......。\n地の果てまでもな......。
CS_CH3_Main_15_007,同族を裏切った......罪は重い......ぜ......。
CS_CH3_Main_15_008,......ごふっ......。
CS_CH3_Main_15_009,ああ......スローン様......。
CS_CH3_Main_15_010,それでも自分は、聖剣の騎士をこの手にかけることはできない......。\nお許しください......。
CS_CH3_Main_15_011,死者の魂に、ルア様のご加護があらんことを――。
CS_CH3_Main_15_012,......すまない。俺のせいであなたに同族殺しの汚名を着せてしまった......。
CS_CH3_Main_15_013,しかしどうしてカーセルが聖剣の使い手だって分かったんだ？
CS_CH3_Main_15_014,カーセルというのが、貴殿の名か。
CS_CH3_Main_15_015,自分は予知夢を見たのだ。聖剣を手にした貴殿の夢をな。
CS_CH3_Main_15_016,予知夢ですって？
CS_CH3_Main_15_017,そう言えば、聞いたことがあります。
CS_CH3_Main_15_018,オークの呪術師の中には、\n夢を通じて未来を知る者がいるんだそうです。\nそしてその予知夢で、一族の未来を正しいほうへと導くのだとか。
CS_CH3_Main_15_019,さっき、人間のせいでオークが危機に瀕していると言っていたけど......\nこのオグリアでは何が起きているんだ？
CS_CH3_Main_15_020,......最近、行方をくらますオークたちが増えているのだ。
CS_CH3_Main_15_021,そして姿を消した者は、１人としてオグリアに戻ってはいない。
CS_CH3_Main_15_022,なぜなら人間たちの奴隷となって、逃げることもできないからだと――\nそんな噂が一族の中では流れている。
CS_CH3_Main_15_023,そんな馬鹿な！
CS_CH3_Main_15_024,人間がオークを奴隷にするだなんて、ありえません！
CS_CH3_Main_15_025,絶対にです！
CS_CH3_Main_15_026,ああ、自分も貴殿らを――人間のことを信じている。
CS_CH3_Main_15_027,だがすべてのオークがそうとは限らない。\n現に噂を信じる仲間の数は、日に日に増すばかりだ。
CS_CH3_Main_15_028,中でも大部族長シーグ様はいたくご立腹で、\n人間に対して殺意にも近い憎しみを抱いておられるようだ。
CS_CH3_Main_15_029,シーグ？　そいつが今の大部族長なのか。\nこりゃあ厄介だな......。
CS_CH3_Main_15_030,ガルックとかいう大部族長はどうしたんだ？\n代替わりしたのか？
CS_CH3_Main_15_031,ガルック様が大部族長として一族をまとめていた頃にはまだ、\n人間を信じるオークのほうが多かった。
CS_CH3_Main_15_032,そんな中でわずかにいた人間を疑う者たちの支持を受け、\nシーグ様が次の大部族長に名乗りを上げたのだ。\nそして決闘を申し込んでガルック様を殺し、新たな大部族長となった。
CS_CH3_Main_15_033,相手を殺して、自分が新しい大部族長なるなんて、\nそんなの反逆じゃないか。
CS_CH3_Main_15_034,いいや。オークはそうやって一族のリーダーを決めるものなのさ。
CS_CH3_Main_15_035,野蛮な習慣ね。
CS_CH3_Main_15_036,古い習慣だ。今はもう、そんな形で大部族長の代替わりは起こらない。\n――起こらないはずだったのだ。
CS_CH3_Main_15_037,確かにオークたちの中に、人間に対する不信感が芽生えてはいた。\nしかしだからと言って、賢明なる指導者であるガルック様を殺してまで、\n一族の方針を転換しようとは彼らも考えていなかったはずだ。
CS_CH3_Main_15_038,結局のところ、すべてシーグ様の計画だったのだろう......。\nあの方は以前から人間を敵視していたから、\n彼らを擁護するガルック様が目障りだったのだ。
CS_CH3_Main_15_039,代替わりのための決闘など、ただの大義名分でしかない。\nシーグ様は自分が大部族長となり、\n人間に対して強攻策を執りたかったに違いなかろう。
CS_CH3_Main_15_040,人間がオークを奴隷にしているという噂が、真実だという可能性は？
CS_CH3_Main_15_041,オルベルリアではそんな非道な行いはないのかもしれない。\n――だが帝国ではどうだ？
CS_CH3_Main_15_042,べスピア帝国か？
CS_CH3_Main_15_043,それはなかろう。彼の地はあまりに遠すぎる。
CS_CH3_Main_15_044,他に目当てのものがあるならまだしも、\n奴隷を捕まえるためだけに、オグリアまで遠征してくるとは考えにくい。
CS_CH3_Main_15_045,ふむ......なるほどな。
CS_CH3_Main_15_046,とにかく一度大部族長に会ってみよう。\n今のうちに誤解を解いておかないと、\nこのままじゃ人間とオークで戦争になりかねない。
CS_CH3_Main_15_047,ならば自分も供をしよう。\nついでにシーグ様に会う前に、自分の弟子とも会っておきたい。\n彼なら――デインならきっと貴殿らの力になってくれるはずだ。
CS_CH3_Main_16_001,ところでカウラ、100年前に聖剣から抜き出された力について、\n何か知ってるか？
CS_CH3_Main_16_002,伝説の大部族長、エアトラ様の時代の話だな。
CS_CH3_Main_16_003,カイル王と共に魔王アングムンドを討ったオークの英雄・エアトラ様は、\n聖剣を世界樹に封印するにあたり、その力の一部を預かった。
CS_CH3_Main_16_004,その力は彼が身につけていたタリスマンへと封じられ、\nタリスマンは代々の大部族長へと引き継がれているという。
CS_CH3_Main_16_005,つまり、今はシーグが持ってるってことか。
CS_CH3_Main_16_006,そういうことになるな。
CS_CH3_Main_16_007,はぁ......。そりゃ面倒そうだ。
CS_CH3_Main_17_001,ここから北へと進めば、デインと会えるだろう。
CS_CH3_Main_17_002,自分が仲間を裏切ったせいで、\nデインにまで被害が及んでいないといいのだが......。
CS_CH3_Main_17_003,ルア様、カウラさんと、\nそしてカウラさんの弟子であるデインさんを、どうぞお守りください――。
CS_CH3_Main_17_004,女神のご加護を疑うわけじゃないが、俺たちも急いだほうがいいだろうな。
CS_CH3_Main_18_001,師匠！　ご無事でしたか！
CS_CH3_Main_18_002,おお、デイン。よかった、きみも無事だったんだな。\n自分のせいで、きみにもしものことがあったらと心配していたのだ。
CS_CH3_Main_18_003,オレも師匠のことをずっと心配してましたよ。
CS_CH3_Main_18_004,――しかし、人間への敵意が高まっているこの危険な時期に、\nどうして人間と一緒に行動されてるんです？
CS_CH3_Main_18_005,俺たちのせいで、カウラは裏切り者の烙印を押されてしまったんだ。\nけど、人間がオークを奴隷にしてるって噂も、カウラが仲間を裏切ったっていうのも、\n全部誤解だ。その誤解は必ず俺たちが解いてみせる。
CS_CH3_Main_18_006,......分かったよ。オレは師匠と話したいから、\nあなたたちはそこで待っててくれないか？
CS_CH3_Main_18_007,分かった。
CS_CH3_Main_18_008,なんだっ！？
CS_CH3_Main_18_009,チッ、罠か！？
CS_CH3_Main_18_010,どういうことだね、デイン！？
CS_CH3_Main_18_011,人間たちを始末するんですよ。
CS_CH3_Main_18_012,だってそうしないと、師匠のことを守れませんから。
CS_CH3_Main_18_013,この愚か者め......！　カーセル殿は聖剣の騎士なのだぞ！\n世界が再び闇に呑まれようかという時に、なんということを......！
CS_CH3_Main_18_014,オーク以外にも守るべきものがあると、なぜ分からぬ！！
CS_CH3_Main_18_015,気をつけろ、落ちるぞ！
CS_CH3_Main_18_016,フレイ！
CS_CH3_Main_18_017,カーセル！！
CS_CH3_Main_18_018,くそっ――！
CS_CH3_Main_18_019,ルア様、俺は死んだっていい――どうかフレイを守ってくれ！
CS_CH3_Main_18_020,フレイ！
CS_CH3_Main_18_021,ぐ......っ。
CS_CH3_Main_18_022,諦めるもんですか！
CS_CH3_Main_18_023,手を伸ばせ、カーセル！
CS_CH3_Main_18_024,つかまえた！　クレオ、引き上げろ！
CS_CH3_Main_18_025,任せて！
CS_CH3_Main_18_026,地上最速の大魔法師とは、私のことよ！
CS_CH3_Main_18_027,おいおい、安全運転で頼むよ......。
CS_CH3_Main_19_001,デインよ。何を企んでいるのだ。
CS_CH3_Main_19_002,オレの個人的な企みではありません。すべては大部族長シーグ様のお導き。\n聖剣を持った人間たちを始末せねば、彼らがあなたを殺すだろうと。\nだからオレはあなたのために――。
CS_CH3_Main_19_003,なんと愚かな......。\n私１人の命を救うために、世界を闇に捧げようと言うのか？
CS_CH3_Main_19_004,そんなことにはさせないわ！\nだって私たちは闇から世界を救うために、ここへ来たんだから！
CS_CH3_Main_19_005,おお......無事だったか。
CS_CH3_Main_19_006,くそ！　まさか無事とは計算違いだ......。
CS_CH3_Main_19_007,まあいい。ならばオレが殺す！
CS_CH3_Main_19_008,待て！　デイン、やめるのだ！
CS_CH3_Main_19_009,やれやれ。好き好んで戦いたい相手じゃないが、\nだからと言って大人しく殺されてやるわけにはいかないからな。
CS_CH3_Main_20_001,くっ......なんて強いやつらだ......。
CS_CH3_Main_20_002,もうやめるのだ、デイン。\n彼らなら、シーグ様の誤った思い込みも正せるはずだ。
CS_CH3_Main_20_003,そう......でしょうね......。
CS_CH3_Main_20_004,デイン！！\nなぜこんなことをする！？
CS_CH3_Main_20_005,オークって本当に騙されやすいのね。
CS_CH3_Main_20_006,だからオグリアは、こんな騒ぎになっているんだけど。
CS_CH3_Main_20_007,マリア！　どうしてあなたがここに！？
CS_CH3_Main_20_008,そんなことはどうでもいいでしょう。
CS_CH3_Main_20_009,それより、貴方たちはどうなの？\n本気でシーグの誤解を解けると思っているのかしら？
CS_CH3_Main_20_010,もちろんです！
CS_CH3_Main_20_011,やる気があるのは結構だけど、無策で突っ込んで行っても犬死するだけよ。
CS_CH3_Main_20_012,だけどここは貴方たちの死に場所じゃない。
CS_CH3_Main_20_013,どういうことだ？
CS_CH3_Main_20_014,あら、分からないの？
CS_CH3_Main_20_015,私はまだ、貴方たちに死んでほしくないってこと。\n少なくとも「あの時」が訪れるまではね。
CS_CH3_Main_20_016,――俺たちがルア様を憎む時が訪れるまで、か？
CS_CH3_Main_20_017,ちょうどいい。その言葉の意味を聞きたかったんだ。
CS_CH3_Main_20_018,ふふ......どういう意味かしらね。\nそれは自分たちで突き止めるといいわ。
CS_CH3_Main_20_019,ヒントぐらいはあげるから。
CS_CH3_Main_20_020,じゃあ私の母さん――アルレッテのことを、もっと教えて。
CS_CH3_Main_20_021,ふふ......そうね。教えてあげてもいいけど、\n私、アルレッテが貴方の母親だなんて言った覚えはないわよ？
CS_CH3_Main_20_022,えっ――？
CS_CH3_Main_20_023,クレオも俺も、親の名前を知らない。
CS_CH3_Main_20_024,アンタ、それを知っててわざとクレオに勘違いさせたな？
CS_CH3_Main_20_025,ふふっ、どうかしらね？
CS_CH3_Main_20_026,それよりも、今はもっと貴方たちの役に立つ話をしてあげるわ。
CS_CH3_Main_20_027,オークが人間たちを憎むようになった、そのきっかけについて。
CS_CH3_Main_20_028,マルドゥク――という名前に聞き覚えはある？
CS_CH3_Main_20_029,マルドゥク！
CS_CH3_Main_20_030,魔王アングムンドの参謀役を務めた、あのマルドゥクのことですか？
CS_CH3_Main_20_031,そう。そのマルドゥクが少し前から、オークをアンデッドにしているの。\nその一方でシーグを含む反人間派のオークたちには、\n行方不明になった仲間は人間たちの国で奴隷にされていると吹き込んだ。
CS_CH3_Main_20_032,そのせいで近頃オグリアの内部では人間に対する反感が高まり、\n貴方たちも敵視されているってわけ。
CS_CH3_Main_20_033,マルドゥク......なんてやつだ！
CS_CH3_Main_20_034,......それが事実だとして、どうして俺たちにそれを教えてくれるんだ？
CS_CH3_Main_20_035,アンタは魔族の仲間だろう？
CS_CH3_Main_20_036,――マルドゥクが嫌いだからよ。
CS_CH3_Main_20_037,だから俺たちには情報を与え、\nゴブリンにはラクラックを通じて力と手を貸して、\nオークと戦わせようとしていたってわけか。
CS_CH3_Main_20_038,そうよ。マルドゥクはオークを利用していた。
CS_CH3_Main_20_039,だから私は、オークに恨みのあるゴブリンを利用してやったの。
CS_CH3_Main_20_040,マルドゥクももちろんですが......あなたも恐ろしい人です、マリア。
CS_CH3_Main_20_041,理由はどうあれ、ゴブリンとオークが戦えば多大な犠牲が出る。
CS_CH3_Main_20_042,そしてどちらが勝ったとしても、\n彼らの間には何世代にも渡る憎しみが残されるんですよ？
CS_CH3_Main_20_043,それの何が問題なのかしら？\n勘違いしないでほしいんだけど、私は魔王軍の一員よ？\nオークやエルフ、人間たちの同盟が破棄されるのは喜ばしいことだわ。
CS_CH3_Main_20_044,なんてことを――！
CS_CH3_Main_20_045,くそっ！　魔王軍がこの世界の同盟を打ち壊そうとしてるだなんて......！
CS_CH3_Main_20_046,これはオルベルリアにも報告しないと！
CS_CH3_Main_20_047,そんなことしたって無駄よ。オルベルリアは動かないわ。
