KEY,Portuguese
CH9_Main_27_7,O lugar...profanado...
CH9_Main_27_8,O lugar que não pode mais ser alcançado...
CH9_Main_27_9,Ah... Ah... Ahhh...
CH9_Main_27_10,Essa marca... É do Sr. Bonitão?
CH9_Main_27_11,Hã!? Jane! O Sr. Bonitão deve estar aqui!
CH9_Main_27_12,Sr. Bonitão?
CH9_Main_27_13,"Isso, aquele cara lindo que a gente queria reencontrar!"
CH9_Main_27_14,"Ohh! Até me empolguei! Ei, vamos ver quem chega lá primeiro... hã?"
CH9_Main_27_15,"Ei, senhorita!"
CH9_Main_29_1,Esse lugar é protegido por uma barreira poderosa.
CH9_Main_29_2,"Finalmente chegamos, mas não podemos entrar?"
CH9_Main_29_3,"Cleo, não há outro jeito?"
CH9_Main_29_4,"Só um instante, deixe-me concentrar."
CH9_Main_29_5,"Espere, sinto uma energia demoníaca por trás disso."
CH9_Main_29_6,"E é muito forte... Não, é incrivelmente forte!"
CH9_Main_29_7,"Cuidado, pessoal!"
CH9_Main_29_8,O quê?
CH9_Main_29_9,Q-quê!?
CH9_Main_29_10,Epis!?
CH9_Main_29_11,Jane!?
CH9_Main_29_12,"Ah, hah, hah. É o Guerreiro da Espada Sagrada e seu grupo desorganizado."
CH9_Main_29_13,Que surpresa encontrar todos vocês aqui. Como têm passado?
CH9_Main_29_14,"Dizemos o mesmo. Hah, hah... O que traz vocês aqui?"
CH9_Main_29_15,!?
CH9_Main_29_16,Hã? A Espada Sagrada recuperou os poderes!
CH9_Main_29_17,Ah! Eu sabia que ficar com esse grupo teria sido mais divertido!
CH9_Main_29_18,Maria?
CH9_Main_29_19,Já faz um tempo. Sua personalidade melhorou desde então?
CH9_Main_29_20,...Cai fora.
CH9_Main_29_21,"Olá, Epis."
CH9_Main_29_22,"Morrah, vejo que você ainda não desgrudou da Maria."
CH9_Main_29_23,Maria é a razão de minha existência.
CH9_Main_29_24,"Hah, hah. Você é muito fofa, Morrah. Parece até que tem um dom natural para dizer esse tipo de coisa."
CH9_Main_29_25,...Eu ouvi direito?
CH9_Main_29_26,...Vou ficar quieto.
CH9_Main_29_27,"Calma aí, hum..."
CH9_Main_29_28,...?
CH9_Main_29_29,Você mudou muito.
CH9_Main_29_30,Hã?
CH9_Main_29_31,Seu rosto está mais bonito.
CH9_Main_29_32,"Hah, hah, hah..."
CH9_Main_29_33,"Certo, para dar uma aquecida antes de entrar nos sonhos do Sr. Bonitão..."
CH9_Main_29_34,Eu escolho você!
CH9_Main_29_35,Epis!
CH9_Main_29_36,"Ah, hah, hah. É brincadeirinha!"
CH9_Main_29_37,"Mas, você realmente está com uma cara ótima agora."
CH9_Main_29_38,Obrigado.
CH9_Main_29_39,"Acho que alguma coisa bem divertida está prestes a acontecer, já que está todo mundo reunido aqui!"
CH9_Main_29_40,Mas aquela encrenqueira está estranhamente quieta.
CH9_Main_29_41,Olá!
CH9_Main_29_42,Pronto!
CH9_Main_29_43,Eu removi a barreira!
CH9_Main_29_44,"Barreira? Vocês acabaram de romper a barreira dessa torre? Impressionante, deve ter sido muito difícil!"
CH9_Main_29_45,Hem-hem! Barreira nenhuma é páreo para esta Arquimaga!
CH9_Main_29_46,...
CH9_Main_29_47,...
CH9_Main_29_48,Está vindo... Ahh... Machuca... Meu coração...
CH9_Main_29_49,Você está me ouvindo?
CH9_Main_29_50,O q-que é isso!?
CH9_Main_29_51,Essa energia... É do mesmo tipo de antes?
CH9_Main_29_52,...Eu não consigo respirar...
CH9_Main_29_53,Maria!
CH9_Main_29_54,"Morrah, proteja-os."
CH9_Main_29_55,Mas...
CH9_Main_29_56,Depressa!
CH9_Main_29_57,A Espada Sagrada está vibrando... Não é como antes...
CH9_Main_29_58,O que está acontecendo?
CH9_Main_29_59,Eu pensei que... ele havia desaparecido. Por que assim tão de repente?
CH9_Main_29_60,Por que ele está vindo aqui?
CH9_Main_29_61,Pessoal... corram...
CH9_Main_29_62,"Epis, você conhece essa energia?"
CH9_Main_29_63,Vocês não vão conseguir derrotá-lo... Apenas corram...
CH9_Main_29_64,O quê?
CH9_Main_29_65,Corram!
CH9_Main_29_66,...
CH9_Main_29_67,Alguém rompeu a barreira do Espaço/Tempo?
CH9_Main_29_68,Lucikiel...
CH9_Main_29_69,"Jane, atrás de mim!"
CH9_Main_29_70,Jane?
CH9_Main_29_71,Sinto muito...
CH9_Main_29_72,Mas... Eu não vou recuar...
CH9_Main_29_73,...
CH9_Main_29_74,...Você tem um péssimo gosto.
CH9_Main_29_75,"Hah, hah... O que achou da minha obra-prima?"
CH9_Main_29_76,!!
CH9_Main_29_77,"Seja bem-vinda, minha filha."
CH9_Main_29_78,Malduk!?
CH9_Main_29_79,O que está acontecendo aqui!?
CH9_Main_29_80,Você conseguiu entrar... e...
CH9_Main_29_81,Completou a Espada Sagrada.
CH9_Main_29_82,"Isso é bom... Agora, tomarei aquela Espada Sagrada e a aperfeiçoarei."
CH9_Main_29_83,Tsc.
CH9_Main_29_84,Isso não é nada bom...
CH9_Main_29_85,"No momento, Malduk não é o problema."
CH9_Main_29_86,"Hah, Hah. Finalmente poderei me livrar de todas essas pestes. Vou aproveitar para dar um jeito nesse traidor também. Heh."
CH9_Main_29_87,...
CH9_Main_29_88,"Venha, Lucikiel. Vamos matar o Guerreiro da Espada Sagrada e levar a espada para o Senhor das Trevas."
CH9_Main_29_89,"E já que aquele sobrevivente da República Gray está atrás de mim, cuide dele também."
CH9_Main_29_90,...
CH9_Main_29_91,...?
CH9_Main_29_92,Por que devo dar ouvidos a você?
CH9_Main_29_93,O q-quê?
CH9_Main_29_94,"Se eles são pestes ou lixo, você que cuide deles. Isso é problema seu."
CH9_Main_29_95,"O-ora, seu...!"
CH9_Main_29_96,Está bem! Eu vou derrotar todos vocês com o meu verdadeiro poder!
CH9_Main_29_97,"Mantenha os olhos abertos, Lucikiel! E vislumbre meu poder!"
CH9_Main_30_1,(Ele está aqui!)
CH9_Main_30_2,"Rápido, rápido! Mate aquele que está conjurando o relâmpago, Lucikiel!"
CH9_Main_30_3,...
CH9_Main_30_1_1,"Ora, seu...!"
CH9_Main_30_1_2,Rááá!
CH9_Main_30_1_3,Guerreiro da Espada Sagrada!
CH9_Main_30_1_4,(O quê? Por que o poder das trevas não funciona contra ele?)
CH9_Main_30_1_5,(Não pode ser só o poder da Espada Sagrada...)
CH9_Main_30_1_6,"(Se ele enfrentar o Senhor das Trevas com tamanho poder, pode ser perigoso...)"
CH9_Main_30_1_7,É sério que ele não está se dando ao trabalho de nos enfrentar?
CH9_Main_30_1_8,Não abaixe a guarda. Nunca se sabe o que pode acontecer.
CH9_Main_30_1_9,Né!?
CH9_Main_30_1_10,"Lucikiel, rápido! Detenha aquilo! Aja como o oficial da Força Sombria que é!"
CH9_Main_30_1_11,Eu já cumpri o meu contrato ao eliminar o seu país.
CH9_Main_30_1_12,"Agora, estou livre para fazer o que quiser."
CH9_Main_30_2_1,!!
CH9_Main_30_2_2,Não posso acabar assim!
CH9_Main_30_2_3,Pelo Senhor das Trevas...
CH9_Main_30_2_4,"Levarei você comigo, Guerreiro da Espada Sagrada!"
CH9_Main_30_2_5,Autodestruição!?
CH9_Main_30_2_6,Kasel!
CH9_Main_30_2_7,Ele está tentando se autodestruir! Saiam!
CH9_Main_30_2_8,Frey!
CH9_Main_30_2_9,...Lamente...
CH9_Main_30_2_10,Legios!
CH9_Main_30_2_11,Aaaaaah!
CH9_Main_30_2_12,Ugh... Você...
CH9_Main_30_2_13,Morra... Malduk.
CH9_Main_30_2_14,Não desistirei até o fim... Hah...
CH9_Main_30_2_15,Você realmente não mudou... até o final... Theo Phil Grayum.
CH9_Main_30_2_16,Mas... é tarde demais...
CH9_Main_30_2_17,Descanse por toda a eternidade... meu Mestre...
CH9_Main_30_2_18,Uh!
CH9_Main_30_2_19,"Kasel, você está bem!?"
CH9_Main_30_2_20,"Sim, estou."
CH9_Main_30_2_21,Malduk agiu por puro desespero...
CH9_Main_30_2_22,Maria!
CH9_Main_30_2_23,Você não parece muito bem.
CH9_Main_30_2_24,Estou bem sim.
CH9_Main_30_2_25,"E quanto a você, Kasel?"
CH9_Main_30_2_26,Aquela explosão estava repleta de energia demoníaca... Se algo der errado...
CH9_Main_30_2_27,O homem com o relâmpago vermelho...
CH9_Main_30_2_28,Ele está vindo aqui...
CH9_Main_30_2_29,Ah... Ahh...
CH9_Main_30_2_30,"Sua lança, Theo Phil Grayum, finalmente veio lhe servir."
CH9_Main_30_2_31,Ahh... Theo.
CH9_Main_30_2_32,"Por favor, aguente só mais um pouco. Voltarei logo."
CH9_Main_30_2_33,...!?
CH9_Main_30_2_34,Sim... Agora me lembro de você...
CH9_Main_30_2_35,"Sr. Bonitão, você vai lutar?"
CH9_Main_30_2_36,Nós vamos ajudar. Vai ser uma luta bem difícil pra você.
CH9_Main_30_2_37,Apesar de que as coisas podem ser diferentes se aquela criança acordar.
CH9_Main_30_2_38,Nós ajudaremos também.
CH9_Main_30_2_39,...
CH9_Main_30_2_40,Você deve ser... Kasel.
CH9_Main_30_2_41,Como você me conhece?
CH9_Main_30_2_42,Um amigo me contou sobre você.
CH9_Main_30_2_43,Imagino que você tenha vindo até aqui com algum objetivo a cumprir.
CH9_Main_30_2_44,"Então, pode continuar a cumpri-lo."
CH9_Main_30_2_45,Mas...
CH9_Main_30_2_46,"Essa luta, que há 100 anos não tivemos a chance de concluir, é somente entre eu e ele."
CH9_Main_30_2_47,Mas agradeço a oferta de ajuda.
CH9_Main_30_2_48,...
CH9_Main_30_2_49,...
CH9_Main_30_2_50,... Compreendo.
CH9_Main_30_2_51,"Poderia, por favor, nos dizer o seu nome?"
CH9_Main_30_2_52,Theo.
CH9_Main_30_2_53,Eu sou Theo Phil Grayum. Um Cavaleiro da República Gray.
CH9_Main_30_2_54,Estamos dentro da torre de transmissão agora...
CH9_Main_30_2_55,E esse é o dispositivo...
CH9_Main_30_2_56,Que pode ser capaz de nos enviar para onde meu pai está...
CH9_Main_30_2_57,Estão prontos?
CH9_Main_30_2_58,Sim.
CH9_Main_30_2_59,Não importa o que aconteça depois daqui...
CH9_Main_30_2_60,Vamos dar um fim nisso.
CH9_SUB_T_2_1_1,"Theo, um bom amigo seu chamado Ezekiel"
CH9_SUB_T_2_1_2,pediu para contar a você sobre o próximo destino.
CH9_SUB_T_2_1_3,Esses são os Pântanos de Gargoss.
CH9_SUB_T_2_1_4,Vestígios de guerra... esse cheiro de... sangue que paira no ar...
CH9_SUB_T_2_1_5,Esse lugar está repleto de tristeza.
CH9_SUB_T_2_1_6,"Minha Senhora, a República Gray precisa da senhora."
CH9_SUB_T_10_1_1_1,Quem são eles? Por que eles estão bloqueando a estrada?
CH9_SUB_T_10_1_1_2,Ughh...
CH9_SUB_T_10_1_1_3,Uhh...
CH9_SUB_T_10_1_1_4,"Julgando pelos olhos deles, estão completamente alucinados."
CH9_SUB_T_10_1_1_5,É o...
CH9_SUB_T_10_1_1_6,É o poder dele.
CH9_SUB_T_10_1_1_7,Dele?
CH9_SUB_T_10_1_1_8,O traidor da República Gray.
CH9_SUB_T_10_1_1_9,Aquele que abriu o Portão do Demônio para que pudesse se tornar um demônio.
CH9_SUB_T_10_1_1_10,Aquele que arruinou o próprio país e o ofereceu ao Senhor das Trevas.
CH9_SUB_T_10_1_1_11,"Malduk, o feiticeiro chefe da corte..."
CH9_SUB_T_10_1_1_12,Jamais o perdoarei.
CH9_SUB_T_10_1_1_13,Não serei misericordioso com aquele traidor.
CH9_SUB_T_10_1_1_14,E isso também se aplica aos restos que ele deixou para trás.
CH9_SUB_T_10_1_2_1,Uau... O seu relâmpago parece ter ficado mais forte.
CH9_SUB_T_10_1_2_2,Eu pude recuperar uma parte do poder de Legios na batalha no Deserto.
CH9_SUB_T_10_1_2_3,"Espere, ele ainda não está tão forte quanto deveria?"
CH9_SUB_T_20_1_1,Ei! Acorde!
CH9_SUB_T_20_1_2,Ei!
CH9_SUB_T_20_1_3,Gah!
CH9_SUB_T_20_1_4,O que diabos é isso!? O que você fez para o seu corpo esquentar desse jeito!?
CH9_SUB_T_20_1_5,Argh!
CH9_SUB_T_20_1_6,"Fique comigo, Theo!"
CH9_SUB_T_20_1_7,Você se tornará minha lança... e o pilar que guiará meu caminho...
CH9_SUB_T_20_1_8,"Eu, Theo Phil Grayum, juro tornar-me seu cavaleiro e sua lança."
CH9_SUB_T_20_1_9,"Para proteger o seu reino, como um pilar que o suporta."
CH9_SUB_T_20_1_10,Ah...
CH9_SUB_T_20_1_11,Você finalmente acordou.
CH9_SUB_T_20_1_12,Parece que... o poder de Legios foi ativado.
CH9_SUB_T_20_1_13,"Sim, você ficou muito forte."
CH9_SUB_T_20_1_14,Mas não o use se não for capaz de controlá-lo.
CH9_SUB_T_20_1_15,...
CH9_SUB_T_20_1_16,Entendo... Eu não pude controlá-lo... Ainda tenho um longo caminho a seguir...
CH9_SUB_T_20_1_17,"Enfim, você pode ficar aqui por enquanto."
CH9_SUB_T_20_1_18,"Não, eu não tenho tempo a perder."
CH9_SUB_T_20_1_19,"Preste atenção, você pode lidar com isso agora."
CH9_SUB_T_20_1_20,O que você vai fazer se continuar falhando daquele jeito?
CH9_SUB_T_20_1_21,"Como você mesmo viu, usar o Legios desgasta muito o meu corpo..."
CH9_SUB_T_20_1_22,"Sim, eu sei. Então, só fique quieto."
CH9_SUB_T_20_1_23,Eu vou procurar por aquele esqueleto ou seja lá o que ele for.
CH9_SUB_T_20_1_24,Junto com aquela sua Senhora.
CH9_SUB_T_20_1_25,...
CH9_SUB_T_20_1_26,Ei.
CH9_SUB_T_20_1_27,Pode me chamar se algo acontecer.
CH9_SUB_T_20_1_28,"... Hah, hah... Pode deixar..."
CH9_SUB_T_20_1_29,Por 100 anos... venho procurando pelos seus rastros.
CH9_SUB_T_20_1_30,"Tudo o que eu queria fazer era voltar a estar a seu lado, para cumprir meu dever como sua lança..."
CH9_SUB_T_20_1_31,"Mas, mesmo só tendo olhos para você, eu acabei tomando posse de muitas coisas."
CH9_SUB_T_20_1_32,Quero mostrá-las a você.
CH9_SUB_T_20_1_33,Um pilar negro?
CH9_SUB_T_20_1_34,Aquilo é...
CH9_SUB_T_20_1_35,"Minha lança, as pessoas estão em perigo. Por favor, vá deter o Golem Furioso."
CH9_SUB_T_20_1_36,"Minha Senhora!\nNão se preocupe comigo, vou proteger este lugar."
CH9_SUB_T_20_1_37,Estarei aqui quando voltar.
CH9_SUB_T_20_1_38,Aquilo é o pilar negro que destruiu a República Gray...
CH9_SUB_T_21_1_1_1,...Ele deve estar aqui.
CH9_SUB_T_21_1_1_2,"Você desapareceu, antes mesmo do Senhor Angmund ser derrotado. O que traz você aqui agora?"
CH9_SUB_T_21_1_1_3,E é aqui onde ele descansa...
CH9_SUB_T_21_1_1_4,Eu vou usar todos os cadáveres daqueles humanos irritantes para os meus experimentos...
CH9_SUB_T_21_1_1_5,"Não, você não poderá mais fazer isso."
CH9_SUB_T_21_1_1_6,!?
CH9_SUB_T_21_1_1_7,"Uh, isso é loucura..."
CH9_SUB_T_21_1_1_8,Malduk...
CH9_SUB_T_21_1_1_9,Eu vou garantir que você morra hoje.
CH9_SUB_T_21_1_1_10,Por que você está aqui!?
CH9_SUB_T_21_1_1_11,O pilar negro... Você ousa trazê-lo outra vez...?
CH9_SUB_T_21_1_1_12,É como daquela vez...
CH9_SUB_T_21_1_1_13,"Você é persistente, sobrevivente de Gray!"
CH9_SUB_T_21_1_1_14,É como quando você trouxe todos aqueles demônios abrindo o portão!
CH9_SUB_T_21_1_1_15,Morra!
CH9_SUB_T_21_1_1_16,Legios!
CH9_SUB_T_21_1_2_1,Uh!
CH9_SUB_T_21_1_2_2,Droga! Por quê!? Por que você está aqui outra vez!?
CH9_SUB_T_21_1_2_3,...!?
CH9_SUB_T_21_1_2_4,Não... É melhor assim...
CH9_SUB_T_21_1_2_5,"Hah, hah, hah! Hah, hah, hah, hah!"
CH9_SUB_T_21_1_2_6,"Sim, sobrevivente de Gray... Eu vou me livrar de você hoje mesmo!"
CH9_SUB_T_21_1_2_7,Pare agora!
CH9_SUB_T_21_1_2_8,"Isso, siga-me! Vou lhe levar até aquele que acabará com você."
CH9_Sub_T_30_1_1_1,Sim...
CH9_Sub_T_30_1_1_2,Legios... Ainda tenho uma cicatriz em meu braço esquerdo.
CH9_Sub_T_30_1_1_3,"Mesmo após 100 anos, essa cicatriz causada pela fera divina permanece..."
CH9_Sub_T_30_1_1_4,"Venha, hospedeiro do transcendente."
CH9_Sub_T_30_1_1_5,Ele é mesmo muito assustador...
CH9_Sub_T_30_1_1_6,"Sr. Bonitão, você realmente lutou contra ele há 100 anos!?"
CH9_Sub_T_30_1_1_7,Haviam alguns mais.
CH9_Sub_T_30_1_1_8,(Hã? Ele está insinuando que era um monstro ainda pior? Mas com seus poderes atuais...)
CH9_Sub_T_30_1_1_9,Enfim! Onde está aquele Mestiço numa hora dessas!?
CH9_Sub_T_30_1_1_10,...Eu vou acabar com isso antes dele chegar.
CH9_Sub_T_30_1_1_11,"Heh... Você finge que não se importa, mas na verdade se importa?"
CH9_Sub_T_30_1_1_12,Sabia que você tem um filho?
CH9_Sub_T_30_1_1_13,"Hum, eu já sei sobre ele e o outro também."
CH9_Sub_T_30_1_1_14,"Então, qual o problema?"
CH9_Sub_T_30_1_1_15,Eu não esperava mesmo que você ficasse chocado...
CH9_Sub_T_30_1_1_16,Acho que é isso o que faz de você um demônio!
CH9_Sub_T_30_1_1_17,...Aí vou eu.
CH9_Sub_T_30_1_2_1,Essa emoção! Esse ferimento! Esse poder!
CH9_Sub_T_30_1_2_2,"Ah, hah, hah, hah! Massacre, Barbatos!"
CH9_Sub_T_30_1_3_1,O q-que está acontecendo!?
CH9_Sub_T_30_1_3_2,*Hamf* *Hamf*
CH9_Sub_T_30_1_3_3,Isso não é o bastante...
CH9_Sub_T_30_1_3_4,"Venha, Demônio..."
CH9_Sub_T_30_1_3_5,Isso é tudo?
CH9_Sub_T_30_1_3_6,"Onde é que está o Deus do Relâmpago com sua força assustadora,"
CH9_Sub_T_30_1_3_7,"que não tinha medo de brandir sua lança, mesmo estando ferido?"
CH9_Sub_T_30_1_3_8,...
CH9_Sub_T_30_1_3_9,"Eu já encontrei quem deveria ter encontrado aqui... Então, isso já basta."
CH9_Sub_T_30_1_3_10,Eu vou lhe dar tempo. Aguardarei até que você seja capaz de me entreter de verdade.
CH9_Sub_T_30_1_4_1,Ufa... Ele se foi...
CH9_Sub_T_30_1_4_2,...A pessoa assustadora... se foi...
CH9_Sub_T_30_1_4_3,Minha Senhora...
CH9_Sub_T_30_1_4_4,Theo...
CH9_Sub_T_30_1_4_5,Você se lembra de mim?
CH9_Sub_T_30_1_4_6,Theo... Meu querido Theo...
CH9_Sub_T_30_1_4_7,"Sim, sou eu. Sua lança... Você parece tão fraca..."
CH9_Sub_T_30_1_4_8,Pode-se dizer que ela tem pouquíssimas lembranças. Apenas alguns fragmentos delas.
CH9_Sub_T_30_1_4_9,Malduk a trouxe de volta dos mortos.
CH9_Sub_T_30_1_4_10,"Mas mesmo sendo uma morta-viva, ela ainda reteve algumas de suas memórias e é capaz de se comunicar."
CH9_Sub_T_30_1_4_11,"Acho que você era mesmo muito importante para ser chamado assim, Sr. Bonitão."
CH9_Sub_T_30_1_4_12,Minha Senhora...
CH9_Sub_T_30_1_4_13,Eu vou protegê-la de agora em diante.
CH9_Sub_T_30_1_4_14,...Meu guardião... minha lança.
CH9_Sub_T_30_1_4_15,"Você realmente não mudou nada... Isso já não é mais ingenuidade, é quase estupidez..."
CH9_Sub_T_30_1_4_16,"Se possível, eu quero muito bater no Sr. Bonitão!"
CH9_Sub_T_30_1_4_17,...
CH9_Sub_T_30_1_4_18,"Jane, você pelo menos entende o que eu estou falando?"
CH9_Sub_T_30_1_4_19,Ah! Encontrei vocês!
CH9_Sub_T_30_1_4_20,"Uau! Você me assustou! Você finalmente chegou, Mestiço."
CH9_Sub_T_30_1_4_21,Pare de dizer isso!
CH9_Sub_T_30_1_4_22,Ahh!
CH9_Sub_T_30_1_4_23,Que clima é esse aqui?
CH9_Sub_T_30_1_4_24,E essa energia demoníaca... É bem familiar.
CH9_Sub_T_30_1_4_25,É o Legios.
CH9_Sub_T_30_1_4_26,"Como assim, Legios?"
CH9_Sub_T_30_1_4_27,Você está escondendo alguma coisa?
CH9_Sub_T_30_1_4_28,"Não, eu... De verdade... Não."
CH9_Sub_T_30_1_4_29,Hã? O que foi isso? Você gaguejou!
CH9_Sub_T_30_1_4_30,Você é um péssimo mentiroso!
CH9_Sub_T_30_1_4_31,"Não, foi um mal-entendido."
CH9_Sub_T_30_1_4_32,"Digo, Legios lamentou."
CH9_Sub_T_30_1_4_33,...
CH9_Sub_T_30_1_4_34,...
CH9_Sub_T_30_1_4_35,...
CH9_Sub_T_30_1_4_36,"Pare de importuná-lo, demônio."
CH9_Sub_T_30_1_4_37,Hein? O quê?
CH9_Sub_T_30_1_4_38,"Minha Senhora, é tudo um mal-entendido. Ele é..."
CH9_Sub_T_30_1_4_39,Hã? Você...
CH9_Sub_T_30_1_4_40,Uma morta-viva? De cabelos brancos?
CH9_Sub_T_30_1_4_41,"Entendo, você deve ser Jane."
CH9_Sub_T_30_1_4_42,"Então, o que você fará agora?"
CH9_Sub_T_30_1_4_43,Eu vou trazê-la de volta.
CH9_Sub_T_30_1_4_44,O quê?
CH9_Sub_T_30_1_4_45,Do que você está falando?
CH9_Sub_T_30_1_4_46,E vou reviver a República Gray para cumprir meu dever como sua lança.
CH9_Sub_T_30_1_4_47,O quê? Seu dever?
CH9_Sub_T_30_1_4_48,Eu pensei que tudo terminaria com “e então eles viveram felizes para sempre”.
CH9_Sub_T_30_1_4_49,Não era isso o que você queria?
CH9_Sub_T_30_1_4_50,...?
CH9_Sub_T_30_1_4_51,Minha Senhora é a Princesa da República Gray. Farei com que ela reconquiste seu devido lugar.
CH9_Sub_T_30_1_4_52,Logo é óbvio que ficarei ao lado dela
CH9_Sub_T_30_1_4_53,para ajudar no renascimento da República Gray.
CH9_Sub_T_30_1_4_54,O quê? Renascimento? Você veio atrás dela para trazer aquele reino perdido de volta?
CH9_Sub_T_30_1_4_55,"Bom, esse não é o único motivo..."
CH9_Sub_T_30_1_4_56,Nossa... Você é mais ambicioso do que eu imaginava.
CH9_Sub_T_30_1_4_57,"Hah, hah. Por que você quer tanto entrar em detalhes, Mestiço? Você nem é do tipo inteligente!"
CH9_Sub_T_30_1_4_58,Ei!
CH9_Sub_T_30_1_4_59,"Falando nisso, Ezekiel, você virá comigo?"
CH9_Sub_T_30_1_4_60,"Se você puder ajudar, tenho certeza que tiraremos grandes proveitos disso."
CH9_Sub_T_30_1_4_61,Hã? Como assim? O que você vai conseguir fazer sozinho com esse seu corpo tão fraco?
CH9_Sub_T_30_1_4_62,É claro que vou.
CH9_Sub_T_30_1_4_63,Eu também! Parece bem divertido! Isso aí! Somos uma equipe!
CH9_Sub_T_30_1_4_64,Você pode ir embora!
CH9_Sub_T_30_1_4_65,Rááá!
CH9_Sub_S_3_1_1,Estamos nos pântanos.
CH9_Sub_S_3_1_2,E esse lugar é conhecido por ser a região proibida de Orvelia.
CH9_Sub_S_3_1_3,Perdemos mais tempo do que esperávamos.
CH9_Sub_S_3_1_4,"Estou atualizando nosso contato a cada seção, só para o caso de alguma coisa acontecer."
CH9_Sub_S_3_1_5,"Mas se não os encontrarmos aqui, deveríamos considerar retornar à capital."
CH9_Sub_S_3_1_6,Sinto muito por fazer você passar por isso.
CH9_Sub_S_3_1_7,Não é nada.
CH9_Sub_S_3_1_8,"Princesa, encontrei rastros deles."
CH9_Sub_S_3_1_9,"Eles estiveram aqui há pouco, com certeza."
CH9_Sub_S_3_1_10,E não faz muito tempo que partiram.
CH9_Sub_S_3_1_11,Já passou da hora de nos encontrarmos com eles.
CH9_Sub_S_3_1_12,Mas o que faremos com ele quando voltarmos à capital?
CH9_Sub_S_3_1_13,Você fala do Chase?
CH9_Sub_S_3_1_14,"...Honestamente, eu não confio nele."
CH9_Sub_S_3_1_15,"Mesmo que estejamos lutando juntos no momento, originalmente, ele foi enviado para assassinar você."
CH9_Sub_S_3_1_16,"Ele está quieto por ora, mas se ele começar a ficar violento outra vez..."
CH9_Sub_S_3_1_17,Eu já dei um nome a ele e o apontei como um de meus cavaleiros.
CH9_Sub_S_3_1_18,Mas...
CH9_Sub_S_3_1_19,Quero que você e Clause cuidem bem dele.
CH9_Sub_S_3_1_20,Eu só fui capaz de acolhê-lo porque vocês dois estão a meu lado.
CH9_Sub_S_3_1_21,...Vossa Alteza.
CH9_Sub_S_3_1_22,Capitã Demia.
CH9_Sub_S_3_1_23,Tem horas que eu simplesmente não consigo entender o que se passa na cabeça da Princesa.
CH9_Sub_S_3_1_24,"Por que ela insiste em manter esse homem por perto, sabendo que ele é um perigo para todos nós?"
CH9_Sub_S_3_1_25,Quero que você fique sempre de olho nele.
CH9_Sub_S_3_1_26,"Ele pode ser meio desajeitado, mas parece estar bem."
CH9_Sub_S_3_1_27,"Ora, mas é claro. Ele não se lembra de nada no momento."
CH9_Sub_S_3_1_28,A maneira como ele fala... e fica tentando agir por instinto...
CH9_Sub_S_3_1_29,*Suspiro* Como foi que essa jornada acabou nisso?
CH9_Sub_S_3_1_30,"Hah, hah. De alguma forma, tudo dará certo."
CH9_Sub_S_3_1_31,Todos nós nos sentimos assim ao fazer nosso caminho até aqui.
CH9_Sub_S_3_1_32,"...Sim, parece que o Guerreiro da Espada Sagrada progrediu consideravelmente."
CH9_Sub_S_3_1_33,Posso compreender o porquê de a Princesa querer se encontrar com ele.
CH9_Sub_S_17_1_1,A Princesa voltou.
CH9_Sub_S_17_1_2,É a Capitã Demia.
CH9_Sub_S_17_1_3,E o Clause... Ele finalmente decidiu servir à Princesa?
CH9_Sub_S_17_1_4,Quem é aquele homem que está o tempo todo ao lado da Princesa?
CH9_Sub_S_17_1_5,Ele tem uma presença bem opressiva...
CH9_Sub_S_17_1_6,Deixem-me a par de tudo.
CH9_Sub_S_17_1_7,"No momento, o Rei está sendo tratado por todos os médicos reais, após sofrer uma convulsão."
CH9_Sub_S_17_1_8,"E o Chanceler de Orvelia, Sir El Moriham, deixou a capital."
CH9_Sub_S_17_1_9,Você está aqui.
CH9_Sub_S_17_1_10,Sir Ricardo.
CH9_Sub_S_17_1_11,Vovô?
CH9_Sub_S_17_1_12,"Ricardo, Comandante dos Cavaleiros Sagrados."
CH9_Sub_S_17_1_13,"Vim pessoalmente, pois a situação é grave."
CH9_Sub_S_17_1_14,Como meu pai está?
CH9_Sub_S_17_1_15,"Felizmente, ele já se recuperou um pouco."
CH9_Sub_S_17_1_16,É bom... saber disso...
CH9_Sub_S_17_1_17,Mas a doença do meu pai não era severa o bastante para derrubá-lo dessa forma.
CH9_Sub_S_17_1_18,"E mesmo que tivesse piorado, ele não deveria ter se recuperado tão rapidamente."
CH9_Sub_S_17_1_19,"Parece que foi uma desculpa para trazê-la de volta, Princesa."
CH9_Sub_S_17_1_20,"Mas, por quê? Por qual razão ele se arriscaria dessa forma?"
CH9_Sub_S_17_1_21,Nem mesmo eu consigo prever as ações dele com tanta antecedência. Ninguém sabe o que ele fará a seguir.
CH9_Sub_S_17_1_22,"Sir Ricardo, então você sabe sobre o paradeiro de El Moriham?"
CH9_Sub_S_17_1_23,"Hum, nós confirmamos que ele contatou a alta nobreza do Império."
CH9_Sub_S_17_1_24,"Ele está publicamente mostrando ao povo que tem o apoio do Império,"
CH9_Sub_S_17_1_25,"e agora, ele até se mudou para lá?"
CH9_Sub_S_17_1_26,Isso é exatamente o oposto do que ele deveria fazer para ganhar a confiança dos nobres... mas por quê?
CH9_Sub_S_17_1_27,...
CH9_Sub_S_17_1_28,"Definitivamente, tem algo acontecendo. E parece que ele partiu às pressas."
CH9_Sub_S_17_1_29,É como se... ele estivesse fugindo de uma guerra iminente...
CH9_Sub_S_30_2_1,V-Vossa Alteza! Notícias urgentes!
CH9_Sub_S_30_2_2,Loman veio com você?
CH9_Sub_S_30_2_3,"Sim, Vossa Alteza."
CH9_Sub_S_30_2_4,"Se você veio até aqui pessoalmente, deve ser algo sério."
CH9_Sub_S_30_2_5,Nós detectamos um tremor gigantesco nas profundezas do palácio.
CH9_Sub_S_30_2_6,"Aqui, no Palácio de Orvelia!?"
CH9_Sub_S_30_2_7,"Definitivamente, há algo de errado."
CH9_Sub_S_30_2_8,!?
CH9_Sub_S_30_2_9,Se está dizendo que foi nas profundezas...
CH9_Sub_S_30_2_10,Então fala das... ruínas que havia relatado?
CH9_Sub_S_30_2_11,Não. Está vindo de um lugar muito mais profundo.
CH9_Sub_S_30_2_12,...Tem algo acontecendo.
CH9_Sub_S_30_2_13,Sir Ricardo.
CH9_Sub_S_30_2_14,"Sim, Vossa Alteza."
CH9_Sub_S_30_2_15,Reúna os Cavaleiros Sagrados e prepare para evacuar todos os cidadãos para um local seguro.
CH9_Sub_S_30_2_16,"Sim, agora mesmo."
CH9_Sub_S_30_2_17,"E se algo vier a acontecer, certifique-se de tirar todos do castelo imediatamente."
CH9_Sub_S_30_2_18,Como queira.
CH9_Sub_S_30_2_19,"Demia, Clause, Chase e eu acompanharemos Loman até a origem do tremor."
CH9_Sub_S_30_2_20,"Sim, Vossa Alteza!"
CH9_Sub_Cr_19_3_1_1,O que você está fazendo aqui fora?
CH9_Sub_Cr_19_3_1_2,"Não está vendo? Estou fazendo todo o trabalho, já que você e o velhote não estão aqui."
CH9_Sub_Cr_19_3_1_3,Trabalhando duro?
CH9_Sub_Cr_19_3_1_4,"Você só está aqui, tentando colocar fogo em tudo."
CH9_Sub_Cr_19_3_1_5,"Ah, hah, hah! Droga, você me pegou."
CH9_Sub_Cr_19_3_1_6,Eu deveria ter queimado esse vira-lata também...
CH9_Sub_Cr_19_3_1_7,Você? Me Queimar?
CH9_Sub_Cr_19_3_1_8,"Iá, hah, hah! Parece que você precisa de uma boa dose de chumbo pra cair na real."
