KEY,Thai
ECLIPSE_COMMON_LOADING_TIP_1,สามารถรับอีเทอร์ได้ที่อีคลิปส์
ECLIPSE_COMMON_LOADING_TIP_2,อีคลิปส์เป็นดันเจี้ยนที่มีระลอกอย่างไม่มีที่สิ้นสุด จึงต้องใช้ทีมจำนวนมากในการเล่น
ECLIPSE_COMMON_LOADING_TIP_3,ในอีคลิปส์ยิ่งมีระลอกมากเท่าไหร่ วีรบุรุษก็จะยิ่งมีอัตราการรักษาต่ำลง
ECLIPSE_COMMON_LOADING_STORY_1,ที่เกราะคุ้มกันของพระจันทร์สีเลือดนั้น ไม่มีทางอื่นนอกจากต้องสู้จนตาย\nหรือหาศูนย์กลางแห่งความมืดเพื่อทำลาย
ECLIPSE_COMMON_LOADING_STORY_2,หากสิ่งมีชีวิตแห่งความมืดที่อ่อนแอกว่าศูนย์กลางแห่งความมืดเข้าใกล้ศูนย์กลาง จะมีโอกาสถูกดูดกลืนสูง
ECLIPSE_COMMON_LOADING_STORY_3,Lewisia ชำระล้างศูนย์กลางแห่งความมืดตั้งแต่อดีตแล้ว
ECLIPSE_COMMON_LOADING_STORY_4,ความมืดนั้นมีมาตั้งแต่การกำเนิดโลก
ECLIPSE_COMMON_LOADING_STORY_5,พลังที่แวมไพร์ใช้ต่างจากพลังที่ปีศาจใช้
ECLIPSE_COMMON_LOADING_STORY_6,พระจันทร์ที่เห็นในเกราะคุ้มกันของพระจันทร์สีเลือดนั้นไม่ใช่พระจันทร์จริงๆ
ASCENSION_COMMON_LOADING_TIP_1,ลองนำชิ้นส่วนวิญญาณปริศนาไปยัง Cain และรับการประเมินวิญญาณดูสิ สามารถรับหินวิญญาณได้
ASCENSION_COMMON_LOADING_TIP_2,หากรวมชิ้นส่วนตั๋วเลือกวิญญาณของแต่ละอาชีพจะสามารถรับหินวิญญาณของอาชีพนั้นๆได้
ASCENSION_COMMON_LOADING_TIP_3,หินวิญญาณเป็นวัตถุดิบจำเป็นในการปลดปล่อยและพัฒนาอาวุธแห่งวิญญาณ 
ASCENSION_COMMON_LOADING_STORY_1,สถานที่ศักดิ์สิทธิ์แห่งราชาเป็นที่ศักดิ์สิทธิ์เพื่อขอพรจากเหล่าราชาแห่งทะเลทรายในอดีต\nมีเพียงนักรบพิเศษที่ได้รับเลือกจากราชาเท่านั้นที่จะได้ย่างกรายเข้าสู่สถานที่ศักดิ์สิทธิ์ร่วมกับราชาได้ 
ASCENSION_COMMON_LOADING_STORY_2,ความกล้าแห่งทะเลทราย Imet มักจะลืมว่าขนถูกเปลี่ยนให้เป็นหินแล้วและมักจะคอยดูแลขนแผงคออยู่เสมอ
ASCENSION_COMMON_LOADING_STORY_3,ถึงแม้ว่าขนของ Musama ดวงตาแห่งพระอาทิตย์จะดูนุ่มนวล แต่แท้จริงแล้วกลับแหลมคม จงระวังให้ดี
ASCENSION_COMMON_LOADING_STORY_4,ยมทูตแห่งพลังไหลเวียน Sekmaha ถูกพบเห็นขณะว่ายน้ำอยู่ภายนอกสถานที่ศักดิ์สิทธิ์ที่โอเอซิส
ASCENSION_COMMON_LOADING_STORY_5,ถึงแท่นบูชาของ Cain จะหลับใหลอยู่ภายใต้พายุทรายแห่งทะเลทราย\nแต่ Cain จะตอบรับเสียงเรียกร้องของผู้สืบทอดแห่งทะเลทรายที่ได้รับการยอมรับจาก Cain\nและปรากฎกายขึ้น
ASCENSION_IMET_LOADING_TIP_1,พันธมิตรที่มีพลังป้องกันกายภาพต่ำ ต้องระวังสกิล [ตายสถานเดียว]
ASCENSION_IMET_LOADING_TIP_2,หากเกจสถานะผิดปกติของ Imet ลดลงทั้งหมดจะสามารถฟื้นฟู HP ได้
ASCENSION_MSAMA_LOADING_TIP_1,สิ่งศักดิ์สิทธิ์แห่งสวรรค์นั้น เมื่อเกิดเกราะคุ้มกันฟื้นฟูจะไม่ได้รับความเสียหายและเอฟเฟคลบ
ASCENSION_MSAMA_LOADING_TIP_2,[พายุทราย] ของ Musama จะสะท้อนความเสียหายสกิล โปรดระวัง
ASCENSION_SEKMAHA_LOADING_TIP_1,เอฟเฟคสกิลจะต่างกันออกไปขึ้นอยู่กับสถานะของพลังไหลเวียน\nแต่ก็มีวิธีการควบคุมพลังไหลเวียน เพราะฉะนั้นต้องใช้ให้ดี
ASCENSION_SEKMAHA_LOADING_TIP_2,รักษาปริมาณ MP ให้สูงเข้าไว้! จะช่วยได้มาก
ECLIPSE_COMMON_LOADING_TIP_4,ในแต่ละช่วงของการต่อสู้อีคลิปส์จะมีดีบัฟที่ต่างกัน
ECLIPSE_COMMON_LOADING_TIP_5,ในการต่อสู้อีคลิปส์ เอฟเฟคคำสาปที่ได้รับจากบอสจะมีผลตลอดกาล
