KEY,Thai
RESULT_TYPE.TRANSCEND_ITEM_INDEX_ERROR,ไอเทมจุติไม่ถูกต้อง
RESULT_TYPE.NOT_ENOUGH_TRANSCEND_ITEM,จำนวนไอเทมจุติไม่เพียงพอ
RESULT_TYPE.CANNOT_TRANSCEND_MORE,ไม่สามารถจุติได้อีก
RESULT_TYPE.NOT_ENOUGH_PURIFIED,ยังไม่ได้รับการชำระ
RESULT_TYPE.WRONG_SLOT_INDEX,หมายเลขช่องไม่ถูกต้อง
RESULT_TYPE.NOT_SELECTABLE_SLOT_INDEX,ไม่สามารถเลือกช่องนี้ได้
RESULT_TYPE.CRAFT_SLOT_PRICE_DATA_NOT_FOUND,ไม่พบข้อมูลราคาของช่องสร้างไอเทม
RESULT_TYPE.INVALID_PRICE,ราคาไม่ถูกต้อง
RESULT_TYPE.NO_FLASK_ITEM,ไม่พบขวด EXP เปล่า
RESULT_TYPE.FLASK_DATA_NOT_FOUND,ไม่พบข้อมูลขวด EXP เปล่า
RESULT_TYPE.CRAFT_DATA_NOT_FOUND,ไม่พบข้อมูลการสร้างไอเทม
RESULT_TYPE.NOT_CRAFT_SLOT_INDEX,ไม่ใช่หมายเลขช่องสร้างไอเทม
RESULT_TYPE.NOT_YET_CRAFTED,การสร้างยังไม่เสร็จสมบูรณ์
RESULT_TYPE.ALREADY_USING_FLASK,ขณะนี้กำลังใส่ขวด EXP เปล่าอยู่
RESULT_TYPE.HERO_NOT_SELECTABLE,ไม่สามารถเลือกฮีโร่ได้
RESULT_TYPE.HERO_FRAGMENT_DATA_ERROR,ข้อมูล Fragment ของฮีโร่ไม่ถูกต้อง
RESULT_TYPE.NO_HEROES,ไม่พบฮีโร่ดังกล่าว
RESULT_TYPE.INVALID_HERO,ฮีโร่ไม่ถูกต้อง
RESULT_TYPE.MATCHING_BLOCKED,ไม่สามารถจับคู่ได้ชั่วคราว
RESULT_TYPE.ALREADY_RESET,ถูกรีเซตแล้ว
RESULT_TYPE.INVALID_RESET_COST,ราคารีเซตไม่ถูกต้อง
RESULT_TYPE.NOT_ENOUGH_RESET_COST,ค่าใช้จ่ายในการรีเซตไม่เพียงพอ
RESULT_TYPE.SCENARIO_QUEST_DATA_NOT_FOUND,ไม่พบข้อมูลเควสเนื้อเรื่อง
RESULT_TYPE.NOT_ENOUGH_PROGRESS,ขั้นตอนการดำเนินการไม่เพียงพอ
RESULT_TYPE.NOT_CLIENT_ONLY,ไม่สามารถใช้กับตัวเกมเวอร์ชั่นนี้ได้
RESULT_TYPE.INVALID_PAY_SHOP_TYPE,ชนิดของร้านค้าไม่ถูกต้อง
RESULT_TYPE.INVALID_SHOP_ITEM_DATA,ข้อมูลไอเทมร้านค้าไม่ถูกต้อง
RESULT_TYPE.SHOP_RESTOCK_INFO_NOT_FOUND,ข้อมูลสินค้าใหม่ไม่ถูกต้อง
RESULT_TYPE.SIGNED_OUT,ออกเรียบร้อย
RESULT_TYPE.NO_CACHE,ไม่มีแคช
RESULT_TYPE.BLOCKED,บัญชีนี้ถูกแบน
RESULT_TYPE.LOW_VERSION,เวอร์ชั่นต่ำ
RESULT_TYPE.INVALID_STAMINA_TYPE,Stamina ไม่ถูกต้อง
RESULT_TYPE.MAX_STAMINA,Stamina สูงสุด
RESULT_TYPE.GUILD_MASTER_CANNOT_SIGN_OUT,หัวหน้ากิลด์ไม่สามารถออกจากกิลด์ 
RESULT_TYPE.DBSELECT_ERROR,ฐานข้อมูลผิดพลาด
RESULT_TYPE.DBUPDATE_ERROR,ฐานข้อมูลผิดพลาด
RESULT_TYPE.INVALID_GIVE_ITEM_RESULT,ไม่สามารถส่งไอเทมได้
RESULT_TYPE.ALREADY_PASSED_ORDER_ID,หมายเลขใบเสร็จนี้ถูกส่งแล้ว
RESULT_TYPE.SERVER_BUSY,การซื้อที่ต้องการอยู่ระหว่างการตรวจสอบ
RESULT_TYPE.ALREADY_FINISHED,หมายเลขใบเสร็จนี้ดำเนินการส่งแล้ว
RESULT_TYPE.PRODUCT_ID_NOT_EXIST,ไม่มี ID ของไอเทมนี้
RESULT_TYPE.DBINSERT_ERROR,ฐานข้อมูลผิดพลาด
RESULT_TYPE.IAPINFO_NOT_FOUND,ไม่พบข้อมูลการซื้อ
RESULT_TYPE.AWAKE_DATA_NOT_FOUND,ไม่พบข้อมูลจุุติ
RESULT_TYPE.ALREADY_COMPLETED_CRAFT_ITEM,ไอเทมนี้สร้างเสร็จเรียบร้อยแล้ว
RESULT_TYPE.DUPLICATED_HERO,ฮีโร่ซ้ำ
RESULT_TYPE.NOT_COMPLETED_DUNGEON,ดันเจียนนี้ยังไม่สำเร็จ
RESULT_TYPE.GOOGLE_RETRY_NEEDED,จำเป็นต้องเริ่ม Google ใหม่
RESULT_TYPE.APPLE_RETRY_NEEDED,จำเป็นต้องเริ่ม IOS ใหม่
RESULT_TYPE.NOT_HERO_TANSCENDED,ฮีโร่นี่ี้ยังไม่จุติ
RESULT_TYPE.NOT_ENOUGH_TRANSCEND,ขั้นของการจุติไม่เพียงพอ
RESULT_TYPE.WRONG_REMAIN_TIME,เวลาที่เหลืออยู่ไม่ถูกต้อง
RESULT_TYPE.HERO_TRIAL_ALREADY_COMPLETED,การทดสอบสำเร็จไปเรียบร้อยแล้ว
RESULT_TYPE.ALREADY_HAVE_COSTUME,มีคอสตูมนี้ในครอบครองอยู่แล้ว
RESULT_TYPE.COSTUME_DATA_NOT_FOUND,ไม่พบข้อมูลคอสตูม
RESULT_TYPE.COSTUME_NOT_OPENED,คอสตูมนี้ยังไม่เปิดตัว
RESULT_TYPE.HERO_AWAKE_DATA_NOT_FOUND,ไม่พบข้อมูลจุติ
RESULT_TYPE.COSTUME_IS_DEFAULT,มีคอสตูมนี้อยู่แล้ว
RESULT_TYPE.NOT_CORRECT_HERO,ฮีโร่นี่ยังไม่สามารถสวมคอสตูมได้
RESULT_TYPE.COSTUME_NOT_OWNED,ไม่มีคอสตูมนี้
RESULT_TYPE.CANNOT_SET_COSTUME,ไม่สามารถสวมใส่คอสตูมได้
RESULT_TYPE.ALREADY_COSTUMED,สวมใส่คอสตูมอยู่แล้ว
RESULT_TYPE.NOT_EQUIP_COSTUME,ไม่ได้สวมใส่คอสตูมอยู่
RESULT_TYPE.LOCKED_EQUIP_ITEM_EXISTS,อุปกรณ์บางชิ้นถูกล็อคอยู่
RESULT_TYPE.ALREADY_LOCKED,ไอเทมนี้ถูกล็อคอยู่
RESULT_TYPE.ALREADY_UN_LOCKED,ไอเทมนี้ี้ถูกปลดล็อคแล้ว
RESULT_TYPE.NOT_ENOUGH_RAID_POINT,แต้มเรดไม่เพียงพอ
RESULT_TYPE.MULTIPLAY_NOT_ENDED,การต่อสู้ยังไม่จบ
RESULT_TYPE.NOT_BREAKABLE_ITEM_EXISTS,ไอเทมบางชิ้นไม่สามารถย่อยได้
RESULT_TYPE.LOCKED_ITEM_EXISTS,ไอเทมบางชิ้นถูกล็อค
RESULT_TYPE.NOT_FREE_KEEP_RUNE,ตอนนี้จำเป็นต้องใช้รูบี้เพื่อรักษารูน
RESULT_TYPE.FREE_KEEP_RUNE,ตอนนี้ไม่จำเป็นต้องใช้รูบี้เพื่อรักษารูน
RESULT_TYPE.CANNOT_RESTOCK,ไม่สามารถโหลดข้อมูลรายชื่อไอเทมได้
RESULT_TYPE.ALREADY_COMPLETED_GUILD_RAID,บอสกิลด์นี้ถูกเคลียร์แล้ว
RESULT_TYPE.NOT_CURRENT_GUILD_RAID_DUNGEON,เขตนี้ถูกเคลียร์แล้ว
RESULT_TYPE.PLAYING_GUILD_RAID_EXIST,สมาชิกกิลด์คนอื่นกำลังต่อสู้อยู่
RESULT_TYPE.GUILD_RAID_NOT_OPENED,บอสกิลด์นี้ยังไม่เปิด
RESULT_TYPE.GUILD_RAID_DUNGEON_DATA_NOT_FOUND,ไม่พบดันเจียน
RESULT_TYPE.GUILD_RAID_INFO_NOT_FOUND,การต่อสู้ไม่ได้ดำเนินการตามปกติ โปรดลองใหม่อีกครั้ง
RESULT_TYPE.GUILD_RAID_CANCELED,บอสกิลด์ถูกยกเลิก
RESULT_TYPE.NOT_RENEW_EQUIP_ITEM,ยังไม่ได้เลือกไอเทมที่จะเปลี่ยนออปชั่น
RESULT_TYPE.NO_RENEW_OPTION_SLOT,ไอเทมนี้ไม่สามารถเปลี่ยนออปชั่นได้
RESULT_TYPE.GUILD_RAID_CHAPTER_DATA_NOT_FOUND,ไม่พบแชปเตอร์บอสกิลด์
RESULT_TYPE.NOT_GUILD_MASTER,คุณไม่ใช่หัวหน้ากิลด์
RESULT_TYPE.ALREADY_OPEN,บอสกิลด์นี้ถููกเปิดแล้ว
RESULT_TYPE.NOT_OPENABLE_TIME,ไม่สามารถใช้งานได้ในขณะนี้
RESULT_TYPE.INVALID_GUILD_RAID_OPEN_DURATION,เวลาเปิดบอสกิลด์ไม่ถูกต้อง
RESULT_TYPE.PARSING_CREATURE_INFO_ERROR,พาสซิ่งข้อมูลฮีโร่ล้มเหลว
RESULT_TYPE.NOT_GUILD_RAID_PLAYING_ACCOUNT,ไม่ได้กำลังต่อสู้บอสกิลด์อยู่
RESULT_TYPE.INVALID_CREATURE_WAVE_SLOT_INDEX,สล็อตฮีโร่ไม่ถูกต้อง
RESULT_TYPE.ALIVE_ENEMY_EXIST,มีศัตรูที่ยังเหลืออยู่
RESULT_TYPE.ALL_HEROES_DIED,ฮีโร่ทุกตัวตายหมดแล้ว
RESULT_TYPE.ONE_STORE_RETRY_NEEDED,จำเป็นต้องลอง OneStore ใหม่
RESULT_TYPE.NO_OLD_OPTION_INDEX,ไม่พบออปชั่นเดิม
RESULT_TYPE.NO_RENEW_OPTION_RESULT_INDEX,ไม่พบผลของออปชั่นใหม่
RESULT_TYPE.INVALID_CONFIRM_OPTION_INDEX,หมายเลขออปชั่นไม่ถูกต้อง
RESULT_TYPE.OPTION_SLOT_MISMATCH,สล็อตออปชั่นไม่ตรง
RESULT_TYPE.EMPTY_PRICE,ไม่พบราคาดังกล่าว
RESULT_TYPE.INVAID_PRICE,ราคาไม่ถูกต้อง
RESULT_TYPE.NO_AVAILABLE_OPTION,ไม่มีออปชั่นที่สามารถใช้ได้
RESULT_TYPE.SAME_EVENT_CALENDAR,ปฏิทินกิจกรรมเดียวกัน
RESULT_TYPE.ITEM_DESTROYED,ไอเทมถูกทำลายแล้ว
RESULT_TYPE.ITEM_NOT_FOUND,ไม่พบไอเทม
RESULT_TYPE.WRONG_ITEM_COUNT,จำนวนไอเทมไม่ถูกต้อง
RESULT_TYPE.INVALID_OPEN_DURATION,เวลาเปิดไม่ถูกต้อง
RESULT_TYPE.ADDED_GUILD_RAID_INFO_IS_NULL,ไม่พบข้อมูลบอสกิลด์
RESULT_TYPE.INVALID_DIFFICULTY,ระดับความยากไม่ถูกต้อง
RESULT_TYPE.CAMPAIGN_INFO_NOT_FOUND,เนื่องจากข้อผิดพลาดของเครือข่าย เซิร์ฟเวอร์จึงมีความล่าช้าในการประมวลผลสถิติการสู้ โปรดลองใหม่อีกครั้งในภายหลัง
RESULT_TYPE.NOT_GUILD_RAID,นี่ไม่ใช่บอสกิลด์
RESULT_TYPE.NOT_PLAYING_ACCOUNT,ไม่ใช่บัญชีที่เล่นอยู่
RESULT_TYPE.INVALID_ACTION_VALUE,ค่าไม่ถูกต้อง
RESULT_TYPE.INVALID_CHAPTER_DUNGEON,แชปเตอร์หรือดันเจี้ยนไม่ถูกต้อง
RESULT_TYPE.INVALID_SELECT_ITEM_COUNT,จำนวนไอเท็มที่ไม่ถูกต้อง
RESULT_TYPE.ITEM_NOT_EXIST,ไอเท็มที่เลือกไม่ปรากฏ
RESULT_TYPE.ITEM_NOT_SELECTED,ไม่มีไอเท็มที่ถูกเลือก
RESULT_TYPE.ALREADY_HAS_HERO,คุณมีฮีโร่นี้ในครอบครองแล้ว
RESULT_TYPE.INVALID_ROOM_INFO,ข้อมูลห้องผิดพลาด
RESULT_TYPE.ROOM_NOT_EXIST,ห้องนี้ไม่มีอยู่
RESULT_TYPE.NOT_DELEGATE_ACCOUNT_ID,ไม่มีผู้เล่นได้รับมอบหมาย
RESULT_TYPE.ROOM_FULL,ห้องเต็มแล้ว
RESULT_TYPE.ROOM_IN_BATTLE,ห้องนี้อยู่ระหว่างต่อสู้
RESULT_TYPE.NOT_JOINED_RAID_ROOM,คุณไม่ได้เข้าร่วมห้อง
RESULT_TYPE.INVALID_ROOM_NO,หมายเลขห้องผิดพลาด
RESULT_TYPE.ALREADY_JOINED_BROADCAST_ROOM,คุณเข้าร่วมการออกอากาศแล้ว
RESULT_TYPE.NOT_JOINED_BROADCAST_ROOM,คุุณไม่ได้อยู่ในระหว่างออกอากาศ
RESULT_TYPE.WORLD_BOSS_RANK_ERROR,เกิดข้อผิดพลาดในอันดับบอสโลก
RESULT_TYPE.WORLD_BOSS_CANCELED,การต่อสู้สิ้นสุดลงเนื่องจากมีค่าความเสียหายที่สูงผิดปกติ
RESULT_TYPE.WORLD_BOSS_SEASON_CHANGED,บอสโลกตัวอื่นปรากฏตัวแล้ว
RESULT_TYPE.STARTED_WORLD_BOSS_NOT_FOUND,ไม่สามารถเริ่มบอสโลกได้
RESULT_TYPE.WORLD_BOSS_DATA_NOT_FOUND,ไม่่สามารถหาข้อมูลบอสโลกได้
RESULT_TYPE.CANNOT_SEARCH_MY_FRIEND,ไม่สามารถหาเพื่อนได้
RESULT_TYPE.BOOSTER_DATA_NOT_FOUND,ไม่มีข้อมูลบูสเตอร์
RESULT_TYPE.PATCH_NOTE_NOT_FOUND,ไม่มีโน๊ตอัพเดทแพทช์
RESULT_TYPE.SAME_PATCH_NOTE,อัพเดทโน๊ตเดียวกัน
RESULT_TYPE.HP_NOT_FOUND,ไม่สามารถโหลด HP ของมอนสเตอร์ได้
RESULT_TYPE.KICKED_FROM_ROOM,ผู้ใช้คนนี้ถูกบังคับออกจากห้อง
RESULT_TYPE.MASTER_BANNED,ผูู้ใช้คนนี้ถูกแบนโดยหัวหน้าห้อง
RESULT_TYPE.KICK_MEMBER_NOT_EXIST,ไม่มีผู้ใช้ที่ถูกบังคับออก
RESULT_TYPE.INTERNAL_ERROR,ผิดพลาดภายใน
RESULT_TYPE.BAN_ACCOUNT_FULL,จำนวนผู้ใช้ที่ถูกแบนที่มากที่สุด
RESULT_TYPE.ALREADY_ADDED_ACCOUNT,เพิ่มผู้ใช้นี้แล้ว
RESULT_TYPE.BAN_ACCOUNT_NOT_EXIST,ผู้ใช้นี้ไม่มีอยู่
RESULT_TYPE.FAVORITE_ACCOUNT_FULL,ลิสต์เพื่อนสนิทเต็มแล้ว
RESULT_TYPE.FAVORITE_ACCOUNT_NOT_EXIST,ผู้ใช้นี้ไม่มีอยู่
RESULT_TYPE.NOT_ENOUGH_WORLD_BOSS_POINT,คะแนนบอสโลกไม่พอ
RESULT_TYPE.NOT_ENOUGH_EVENT_POINT,คะแนนกิจกรรมไม่พอ
RESULT_TYPE.ROOM_SERVER_INTERNAL_ERROR,ข้อมูลเซิฟเวอร์ของห้องผิดพลาด
RESULT_TYPE.ALREADY_EXIST_GUILD_NAME,ชื่อกิลด์นี้มีอยู่แล้ว
RESULT_TYPE.MAX_FRIENDLY_POINT,ความสัมพันธ์เต็มแล้ว
RESULT_TYPE.CANNOT_GIVE_GIFT_NPC,ไม่สามารถให้ของขวัญได้
RESULT_TYPE.FRIENDLY_POINT_INFO_NOT_FOUND,ไม่พบข่าวสารความสัมพันธ์
RESULT_TYPE.FRIENDLY_POINT_DATA_NOT_FOUND,ไม่พบข้อมูลความสัมพันธ์
RESULT_TYPE.INVALID_FRIENDLY_POINT_STEP,ระดับความสัมพันธ์ผิดพลาด
RESULT_TYPE.NOT_ENOUGH_FRIENDLY_POINT,ความสัมพันธ์มีไม่พอ
RESULT_TYPE.NEXT_TIER_EQUIP_ITEM_NOT_FOUND,ไม่มีข้อมูลไอเท็มที่จะอัพเกรด
RESULT_TYPE.INVALID_NEXT_TIER_STEP,เป็นข้อมูลไอเท็มอัพเกรดที่ผิดพลาด
RESULT_TYPE.MAX_TIER_ITEM,ไอเท็มที่จะอัพเกรดเป็นระดับที่สูงสุดอยู่แล้ว
RESULT_TYPE.MATERIAL_ITEM_DATA_NOT_FOUND,ไม่มีข้อมููลของไอเท็มวัตถุดิบที่จะอัพเกรดไอเท็ม
RESULT_TYPE.UPGRADE_TIER_NOT_FOUND,ไม่มีข้อมูลของอุปกรณ์ที่จะอัพเกรด
RESULT_TYPE.NOT_EQUIP_MAX_STAR,จำนวนดาวของอุปกรณ์ที่จะอัพเกรดไม่สูงสุด
RESULT_TYPE.WORLD_BOSS_DAILY_REWARDING,กำลังสรุปอันดับประจำวัน
RESULT_TYPE.CANNOT_BUY_NO_EVENT,ไม่ได้อยู่ในช่วงกิจกรรม
RESULT_TYPE.CANNOT_RESTOCK_NO_EVENT,ไม่ได้อยู่ในช่วงกิจกรรม
RESULT_TYPE.EVENT_DUNGEON_DATA_NOT_FOUND,ไม่มีข้อมูลดันเจี้ยนพิเศษ
RESULT_TYPE.EVENT_DUNGEON_CLOSED,ดันเจี้ยนพิเศษจบลงแล้ว
RESULT_TYPE.WITHDRAW_PENALTY,ไม่สามารถใช้ได้ในระหว่างที่ถูกแบนกิลด์
RESULT_TYPE.EQUIP_ENCHANT_OPTION_ITEM_DATA_NOT_FOUND,ไม่มีข้อมูลออฟชั่นมนตรา
RESULT_TYPE.NOT_ENOUGH_EVENT_DUNGEON_POINT,คะแนนกิจกรรมไม่พอ
RESULT_TYPE.GUILD_CONTENTS_RESTRICTED,ไม่สามารถซื้อได้ในขณะที่โดนแบนกิลด์
RESULT_TYPE.ITEM_EXPIRED,ไอเทมหมดอายุแล้ว
RESULT_TYPE.WRONG_WORLD_BOSS_CHAPTER,ไม่มีบอสโลกในขณะนี้
RESULT_TYPE.WRONG_WORLD_BOSS_DUNGEON,ไม่มีบอสโลกในขณะนี้
RESULT_TYPE.CREATURE_STAR_DATA_NOT_FOUND,ไม่มีข้อมูลวิวัฒนาการของฮีโร่
RESULT_TYPE.RANK_ERROR,อันดับที่มีไม่ถูกต้อง
RESULT_TYPE.CANCELED,ถูกยกเลิกแล้ว
RESULT_TYPE.NOT_ENOUGH_EVENT_DUNGEON_POINT2,คะแนนกิจกรรมไม่เพียงพอ
RESULT_TYPE.NOT_ENOUGH_EVENT_DUNGEON_POINT3,คะแนนกิจกรรมไม่พอ
RESULT_TYPE.NOT_ENOUGH_GLORY_POINT,เหรียญรางวัลแห่งเกียรติยศไม่พอ
RESULT_TYPE.NOT_AVAILABLE_HERO,ไม่สามารถใช้ฮีโร่ตัวนี้ได้
RESULT_TYPE.INVAILD_ACHIEVEMENT_INDEX,ไม่สามารถรับรางวัลนี้ได้
RESULT_TYPE.CHALLENGE_RAID_NOT_OPENED,เวลาเข้าเรดแห่งความท้าทายได้หมดลงแล้วจึงไม่สามารถดำเนินการต่อได้
RESULT_TYPE.CENSORED_WORD_NAME,เป็นชื่อที่ไม่สามารถใช้ได้
RESULT_TYPE.NOT_OPENED_ROOM,ห้องนี้เป็นห้องส่วนตัวจึงไม่สามารถเข้าร่วมได้
RESULT_TYPE.ROOM_LEFT,ห้องหายไปเนื่องจากการเชื่อมต่ออินเทอร์เน็ตล้มเหลว
RESULT_TYPE.CHALLENGE_RAID_DATA_NOT_FOUND,ไม่มีข้อมูลเรดแห่งความท้าทาย
RESULT_TYPE.NO_EVENT_DUNGEON_DATA,ไม่มีข้อมูลดันเจี้ยนกิจกรรม
RESULT_TYPE.NO_RESET_COUNT,ไม่มีจำนวนครั้งที่รีเซท
RESULT_TYPE.NO_RESET_CURRENCY_TYPE,ไม่มีไอเทมที่รีเซท
RESULT_TYPE.NO_RESET_AMOUNT,ไม่มีค่าใช้จ่ายที่รีเซท
RESULT_TYPE.INVALID_ACHIEVEMENT_INDEX,ตัวเลขความสำเร็จที่ไม่ถูกต้อง
RESULT_TYPE.NOT_ENOUGH_EVENT_GIFT,ของขวัญกิจกรรมไม่เพียงพอ
RESULT_TYPE.MISSING_EVENT_WORLD_BOSS_INDEX,ไม่มีเบอร์บอสโลกกิจกรรม
RESULT_TYPE.EVENT_WORLD_BOSS_NOT_EXIST,ไม่มีบอสโลกกิจกรรม
RESULT_TYPE.EVENT_WORLD_BOSS_NOT_ACTIVE,บอสโลกกิจกรรมปิดอยู่
RESULT_TYPE.EVENT_WORLD_BOSS_DATA_NOT_FOUND,ไม่มีข้อมูลบอสโลกกิจกรรม
RESULT_TYPE.WRONG_EVENT_WORLD_BOSS_CHAPTER,ไม่ได้อยู่ช่วงที่สามารถเข้าร่วมต่อสู้กิจกรรมบอสโลก
RESULT_TYPE.WRONG_EVENT_WORLD_BOSS_DUNGEON,ไม่ได้อยู่ช่วงที่สามารถเข้าร่วมต่อสู้กิจกรรมบอสโลก
RESULT_TYPE.EVENT_WORLD_BOSS_CANCELED,บอสโลกกิจกรรมถูกยกเลิกแล้ว
RESULT_TYPE.EVENT_WORLD_BOSS_SEASON_CHANGED,ซีซั่นของบอสโลกกิจกรรมถูกเปลี่ยนแล้ว
RESULT_TYPE.STARTED_EVENT_WORLD_BOSS_NOT_FOUND,ไม่มีข้อมูลของบอสโลกกิจกรรมที่เริ่ม
RESULT_TYPE.EVENT_WORLD_BOSS_HP_ERROR,HP ของบอสโลกกิจกรรมไม่ถูกต้อง
RESULT_TYPE.EVENT_WORLD_BOSS_NOT_PLAYABLE_TIME,ไม่ได้อยู่ช่วงที่สามารถเข้าร่วมต่อสู้กิจกรรมบอสโลก
RESULT_TYPE.CHALLENGE_RAID_SCORE_ERROR,คะแนนเรดแห่งความท้าทายผิดพลาด
RESULT_TYPE.EVENT_WORLD_BOSS_LEVEL_CHANGED,เลเวลของกิจกรรมบอสโลกเปลี่ยนแปลงแล้ว
RESULT_TYPE.CRAFT_DATA_NOT_OPENED,ไม่มีข้อมูลสร้างไอเทม
RESULT_TYPE.NOT_ENOUGH_SKILL_POINT,คะแนนจุติไม่เพียงพอ
RESULT_TYPE.IS_NOT_UNEQUIP_TYPE,ไอเทมนี้ไม่สามารถถอดได้
RESULT_TYPE.NOT_OPEN_PAGE,หน้าเพจสกิลไม่ได้เปิดอยู่
RESULT_TYPE.PAGE_NOT_FOUND,ไม่ปรากฏหน้าดังกล่าว
RESULT_TYPE.ALREADY_HAVE_PAGE,มีซื้อเพจดังกล่าวไปแล้ว
RESULT_TYPE.SKILL_TYPE_ALREADY_LEARNED,ได้รับทักษะสกิลประเภทเดียวกันไปแล้ว
RESULT_TYPE.NOT_CORRECT_OPTION_COUNT,จำนวนออฟชั่นไม่ถูกต้อง
RESULT_TYPE.NOT_ENOUGH_HIDEOUT_DUNGEON_COUNT,กุญแจเข้าดันเจี้ยนระดับสูงไม่เพียงพอ
RESULT_TYPE.CHAPTER_INDEX_NOT_FOUND,แชปเตอร์ไม่ปรากฏ
RESULT_TYPE.RESET_GEM_NOT_FOUND,ไม่สามารถหาข้อมูลค่าใช้จ่ายในการรีเซทได้
RESULT_TYPE.INVAID_RESET_GEM,ข้อมูลค่าใช้จ่ายในการรีเซทไม่ปรากฏ
RESULT_TYPE.SELECT_ITEM_DATA_NOT_FOUND,ไม่สามารถหาข้อมูลตั๋วเลือกได้
RESULT_TYPE.IMPOSSIBLE_SELECT_ITEM,ได้เลือกไอเทมที่ไม่ปรากฏในรายการเลือก
RESULT_TYPE.PURCHASE_MARKETING_DATA_NOT_FOUND,ไม่สามารถหาข้อมูลสินค้าที่ต้องการซื้อได้
RESULT_TYPE.PURCHASE_MARKETING_NOT_OPENED,สินค้าที่ต้องการซื้อไม่ใช่สินค้าที่กำลังเปิดขาย
RESULT_TYPE.NOT_AVAILABLE_REPEAT_COOLTIME,เป็นสินค้าที่ไม่สามารถขายอีกได้
RESULT_TYPE.REMAIN_REPEAT_COOLTIME,ไม่อยู่ในระยะเวลาการเปิดขายใหม่ของสินค้าที่ต้องการซื้อ
RESULT_TYPE.NOT_ENOUGH_LUA_POINT,สัญลักษณ์ของ Lua ไม่เพียงพอ
RESULT_TYPE.BAN_PICK_PENALTY_USER_BLOCKED,เพิ่มบทลงโทษที่ปริมาณการเข้าร่วมต่ำ\nไม่สามารถแมทช์ได้{1}นาที
RESULT_TYPE.SENSITIVE_WORD,This name is already in use.
RESULT_TYPE.INVALID_BROADCAST_NAME_IN_THIS_SERVER,สามารถใช้ได้แค่ภาษาญี่ปุ่น/ตัวอักษรโรมัน/และตัวเลขเท่านั้น
RESULT_TYPE.INVALID_GUILD_NAME_IN_THIS_SERVER,สามารถใช้ได้แค่ภาษาญี่ปุ่น/ตัวอักษรโรมัน/และตัวเลขเท่านั้น
RESULT_TYPE.INVALID_NICK_IN_THIS_SERVER,สามารถใช้ได้แค่ภาษาญี่ปุ่น/ตัวอักษรโรมัน/และตัวเลขเท่านั้น
RESULT_TYPE.SENSITIVE_WORD_NAME,เป็นชื่อที่มีผู้ใช้แล้ว
